"title","doi","altmetric_jid","score","X1d","X3d","X1w","X1m","authors","author_corresponding","author_corresponding_institution","date","version","type","license","category","jatsxml","abstract","published","server","upupdate_time"
"A new structural paradigm for outer membrane protein biogenesis in the Bacteroidota","10.1101/2025.02.17.638638","biorxiv",9.7,9.7,9.7,9.7,9.7,"Liu, X.; Tapia, L. O.; Deme, J. C.; Lea, S. M.; Berks, B. C.","Ben C Berks","University of Oxford","2025-02-17","1","new results","cc_by","microbiology","https://www.biorxiv.org/content/early/2025/02/17/2025.02.17.638638.source.xml","In Gram negative bacteria the outer membrane (OM) is the first line of defence against antimicrobial agents and immunological attacks. A key part of OM biogenesis is insertion of OM proteins (OMPs) by the beta barrel assembly machinery (BAM). Here we report the cryo-electron microscopy (cryoEM) structure of a BAM complex isolated from Flavobacterium johnsoniae, a member of the phylum Bacteroidota that includes key human commensals and major anaerobic pathogens. This BAM complex is radically different from the canonical Escherichia coli system and includes an extensive extracellular canopy that overhangs the substrate folding site and a subunit that inserts into the BAM pore. We find that two of the novel subunits involved in forming the extracellular canopy are essential for BAM function. For one of these subunits isolation of a suppressor mutation allows the separation of their essential and non-essential functions. The need for a highly remodelled and enhanced BAM complex reflects the unusually complex membrane proteins found in the OM of the Bacteroidota.","NA","biorxiv",1739916494184
"Non-invasive imaging of salicylic and jasmonic acid activities in planta","10.1101/2025.02.17.636591","biorxiv",9.7,9.7,9.7,9.7,9.7,"Balakireva, A. V.; Karataeva, T. A.; Karampelias, M.; Mitiouchkina, T. Y.; Machacek, J.; Shakhova, E. S.; Perfilov, M. M.; Belozerova, O. A.; Palkina, K. A.; Drazna, N.; Vondrakova, Z.; Fleiss, A.; Fakhranurova, L. I.; Markina, N. M.; Morozov, V. V.; Bugaeva, E. N.; Delnova, G. M.; Choob, V. V.; Yampolsky, I. V.; Petrasek, J.; Mishin, A. S.; Sarkisyan, K. S.","Karen S Sarkisyan","Planta LLC, 121205 Moscow, Russia, Shemyakin-Ovchinnikov Institute of Bioorganic Chemistry, Russian Academy of Sciences, 117997 Moscow, Russia, Synthetic Biolog","2025-02-17","1","new results","cc_no","plant biology","https://www.biorxiv.org/content/early/2025/02/17/2025.02.17.636591.source.xml","Jasmonic and salicylic acids are the major hormones involved in plant response to pests and pathogens. Here, we engineered autoluminescent plants that report activity of these hormones with up to 53-fold contrast. Using consumer-grade cameras, we imaged reporter Arabidopsis thaliana and Nicotiana benthamiana plants throughout normal development, and in response to attacks of pests and pathogens.","NA","biorxiv",1739916494184
"Beyond the Hype: The Complexity of Automated Cell Type Annotations with GPT-4","10.1101/2025.02.11.637659","biorxiv",14.95,9.249999999999998,14.95,14.95,14.95,"Kazmi, A.; Singh, D.; Jatav, S.; Luthra, S.","Arman Kazmi","SoulBio","2025-02-16","2","new results","cc_by_nc","bioinformatics","https://www.biorxiv.org/content/early/2025/02/16/2025.02.11.637659.source.xml","Recent research has shown the impressive capability of large language models like GPT-4 in various downstream tasks in single-cell data analysis. Among these tasks, cell type annotation remains particularly challenging, with researchers exploring various methods to improve accuracy and efficiency. While recent studies on GPT-like models have demonstrated annotation performance comparable to manual annotations, a significant gap remains in understanding their limitations and generalizability. In this work, we compare and evaluate the annotation performance of the GPT-4 model against traditional methods on nine randomly selected public single-cell RNA seq datasets from cellxgene, covering diverse tissue types. Our evaluation highlights the complexity of annotating cell types in single-cell data, revealing key differences between automated and manual approaches. We found specific cases where GPT-4 underperforms, demonstrating its limitations in certain contexts. We further introduce an automated approach to incorporate literature search using a RAG approach which enhances and outperforms GPT-4 cell type annotation when compared to traditional methods. We also introduce metrics based on taxonomic distance in the ontology tree to evaluate the granularity of the cell type annotations. To support future research, we also release an open-source Python package 1 that enables fully automated cell-type annotation of single-cell data using GPT-4 alongside other methods. The pipeline can take paper as an input and do cell type annotations on its own.","NA","biorxiv",1739916494184
"Covalent Destabilizing Degrader of AR and AR-V7 in Androgen-Independent Prostate Cancer Cells","10.1101/2025.02.12.637117","biorxiv",17.25,7.8999999999999995,17.25,17.25,17.25,"Zammit, C. M.; Nadel, C.; Lin, Y.; Koirala, S.; Potts, P. R.; Nomura, D. K.","Daniel K Nomura","University of California, Berkeley","2025-02-16","1","new results","cc_by_nc_nd","cancer biology","https://www.biorxiv.org/content/early/2025/02/16/2025.02.12.637117.source.xml","Androgen-independent prostate cancers, correlated with heightened aggressiveness and poor prognosis, are caused by mutations or deletions in the androgen receptor (AR) or expression of truncated variants of AR that are constitutively activated. Currently, drugs and drug candidates against AR target the steroid-binding domain to antagonize or degrade AR. However, these compounds cannot therapeutically access largely intrinsically disordered truncated splice variants of AR, such as AR-V7, that only possess the DNA binding domain and are missing the ligand binding domain. Targeting intrinsically disordered regions within transcription factors has remained challenging and is considered ""undruggable"". Herein, we leveraged a cysteine-reactive covalent ligand library in a cellular screen to identify degraders of AR and AR-V7 in androgen-independent prostate cancer cells. We identified a covalent compound EN1441 that selectively degrades AR and AR-V7 in a proteasome-dependent manner through direct covalent targeting of an intrinsically disordered cysteine C125 in AR and AR-V7. EN1441 causes significant and selective destabilization of AR and AR-V7, leading to aggregation of AR/AR-V7 and subsequent proteasome-mediated degradation. Consistent with targeting both AR and AR-V7, we find that EN1441 completely inhibits total AR transcriptional activity in androgen-independent prostate cancer cells expressing both AR and AR-V7 compared to AR antagonists or degraders that only target the ligand binding domain of full-length AR, such as enzalutamide and ARV-110. Our results put forth a pathfinder molecule EN1441 that targets an intrinsically disordered cysteine within AR to destabilize, degrade, and inhibit both AR and AR-V7 in androgen-independent prostate cancer cells and highlights the utility of covalent ligand discovery approaches in directly targeting, destabilizing, inhibiting, and degrading classically undruggable transcription factor targets.","NA","biorxiv",1739916494184
"A General Framework for Branch Length Estimation in Ancestral Recombination Graphs","10.1101/2025.02.14.638385","biorxiv",7.9,7.9,7.9,7.9,7.9,"Deng, Y.; Song, Y. S.; Nielsen, R.","Rasmus Nielsen","University of California, Berkeley","2025-02-15","1","new results","cc_by_nc_nd","evolutionary biology","https://www.biorxiv.org/content/early/2025/02/15/2025.02.14.638385.source.xml","Inference of Ancestral Recombination Graphs (ARGs) is of central interest in the analysis of genomic variation. ARGs can be specified in terms of topologies and coalescence times. The coalescence times are usually estimated using an informative prior derived from coalescent theory, but this may generate biased estimates and can also complicate downstream inferences based on ARGs. Here we introduce, POLEGON, a novel approach for estimating branch lengths for ARGs which uses an uninformative prior. Using extensive simulations, we show that this method provides improved estimates of coalescence times and lead to more accurate inferences of effective population sizes under a wide range of demographic assumptions. It also improves other downstream inferences including estimates of mutation rates. We apply the method to data from the 1000 Genomes Project to investigate population size histories and differential mutation signatures across populations. We also estimate coalescence times in the HLA region, and show that they exceed 30 million years in multiple segments.","NA","biorxiv",1739916494184
"Mrx6 binds the Lon protease Pim1 N-terminal domain to confer selective substrate specificity and regulate mtDNA copy number","10.1101/2025.02.14.638270","biorxiv",19.599999999999998,7.85,19.599999999999998,19.599999999999998,19.599999999999998,"Schrott, S.; Gerle, C.; Bibinger, S.; Bertgen, L.; Marino, G.; Schwenkert, S.; Rathberger, R.; Herrmann, J.; Osman, C.","Christof Osman","Ludwig-Maximilians-University, Munich","2025-02-17","2","new results","cc_by_nc_nd","cell biology","https://www.biorxiv.org/content/early/2025/02/17/2025.02.14.638270.source.xml","Mitochondrial DNA (mtDNA) copy number regulation remains incompletely understood, despite its importance in cellular function. In Saccharomyces cerevisiae, Mrx6 belongs to the Pet20-domain-containing protein family, consisting of Mrx6, Pet20, and Sue1. Notably, absence of Mrx6 leads to increased mtDNA copy number. Here, we identify the C-terminus of Mrx6 as essential for its stability and interaction with the mitochondrial matrix protein Mam33. Deletion of Mam33 mimics the effect of Mrx6 loss, resulting in elevated mtDNA copy number. Bioinformatics, mutational analyses, and immunoprecipitation studies reveal that a subcomplex of Mam33 and Mrx6 trimers interacts with the substrate recognition domain of the conserved mitochondrial Lon protease Pim1 through a bipartite motif in the Pet20 domain of Mrx6. Loss of Mrx6, its paralog Pet20, Mam33, or mutations disrupting the interaction between Mrx6 and Pim1 stabilize key proteins required for mtDNA maintenance, the RNA polymerase Rpo41 and the HMG-box-containing protein Cim1. We propose that Mrx6, alongside Pet20 and Mam33, regulates mtDNA copy number by modulating substrate degradation through Pim1. Additionally, Mrx6 loss alters Cim1's function, preventing the detrimental effect on mtDNA maintenance observed upon Cim1 overexpression. The presence of three Pet20-domain proteins in yeast implies broader roles of Lon protease substrate recognition beyond mtDNA regulation.","NA","biorxiv",1739916494184
"Loss of a morph is associated with asymmetric character release in a radiation of woodland salamanders","10.1101/2025.02.12.637668","biorxiv",8.45,7.699999999999999,8.45,8.45,8.45,"Waldron, B. P.; Hantak, M. M.; Watts, E. F.; Uyeda, J. C.; Lemmon, A. R.; Lemmon, E. M.; Guralnick, R. P.; Blackburn, D. C.; Kuchta, S. R.","Brian P Waldron","Virginia Tech","2025-02-17","1","new results","cc_by_nc","evolutionary biology","https://www.biorxiv.org/content/early/2025/02/17/2025.02.12.637668.source.xml","Color polymorphism, the occurrence of multiple discrete color morphs with co-adapted sets of traits within the same population, may provide the raw materials for rapid species formation. It has been hypothesized that fixation of a single morph can result in character release, whereby the monomorphic form evolves without the constraint of accommodating multiple adaptive peaks. However, the rates of evolution between populations fixed for different morphs likely depend on the specific adaptive zones occupied by each morph. We studied the evolution of dorsal color polymorphism (striped and unstriped morphs) in woodland salamanders (Plethodon), a North American radiation in which the polymorphism can be found in even the most distantly related species (~44 Ma divergence). We estimated a phylogenomic tree of Plethodon, representing all extant taxa with multiple samples for most species. Morphometric data suggest that between-species variation exists predominantly along an axis of relative body elongation, likely corresponding to a terrestrial-fossorial continuum. Polymorphic species occupy an intermediate phenotypic space between the evolutionary optima of striped and unstriped species, although polymorphic species did not have elevated speciation rates. Faster rates of body shape evolution were observed in unstriped species, suggesting that body elongation, which is co-adapted with the unstriped morph, is constrained by the polymorphism. Striped species had slower rates of evolution than polymorphic species, despite lacking the genetic constraints often associated with polymorphism. Our results demonstrate that rates of phenotypic evolution and speciation following character release can be asymmetric and idiosyncratic depending on the alternative adaptations of each morph.","NA","biorxiv",1739916494184
"Cholesterol depletion activates trafficking-coupled sphingolipid synthesis","10.1101/2025.02.12.637879","biorxiv",8.2,7.699999999999999,8.2,8.2,8.2,"Kim, Y.; Parolek, J.; Burd, C. G.","Christopher G Burd","Yale School of Medicine","2025-02-16","1","new results","cc_no","cell biology","https://www.biorxiv.org/content/early/2025/02/16/2025.02.12.637879.source.xml","Within cellular membranes, sphingomyelin is associated with cholesterol and this complex facilitates homeostatic regulation of membrane viscosity. Acute cholesterol depletion increases the synthesis of very-long-chain (VLC) sphingomyelin, but a link between lipid sensing and sphingolipid synthesis is lacking. Using sphingolipid metabolic flux analysis, we observed that VLC-ceramide, the precursor to VLC complex sphingolipids that are produced in the Golgi apparatus, was rapidly consumed after cholesterol depletion, while synthesis of long-chain sphingolipids was unaffected. Sphingolipid trafficking assays showed that cholesterol depletion enhances VLC-Ceramide trafficking from the endoplasmic reticulum to the Golgi apparatus. Changes in the sizes of coatomer II ER exit sites were correlated with increased VLC-Ceramide trafficking and concomitant increase in sphingomyelin. Depletion of Sec16A, a component of the COPII network, abolished VLC-SM synthesis. This study reveals ER-to-Golgi trafficking of VLC-Ceramide as a key regulatory node in organelle membrane homeostasis pathways.

SummaryIn cellular membranes, sphingomyelin is associated with cholesterol. Metabolic flux analysis of sphingolipid metabolism showed that synthesis rate of sphingomyelin, but not ceramide, was increased after depletion of cholesterol due increased rate of COPII-dependent ER-to-Golgi transport of ceramide.","NA","biorxiv",1739916494184
"Hierarchical encoding of natural sounds mixtures in ferret auditory cortex","10.1101/2025.02.15.637892","biorxiv",10.1,7.65,10.1,10.1,10.1,"Landemard, A.; Bimbard, C.; Boubenec, Y.","Yves Boubenec","Ecole Normale Superieure","2025-02-17","2","new results","cc_by_nc","neuroscience","https://www.biorxiv.org/content/early/2025/02/17/2025.02.15.637892.source.xml","Extracting relevant auditory signals from complex natural scenes is a fundamental challenge for the auditory system. Sounds from multiple sources overlap in time and frequency. In particular, dynamic ""fore-ground"" sounds are often masked by more stationary ""background"" sounds. Human auditory cortex exhibits a hierarchical organization where background-invariant representations are progressively enhanced along the processing stream, from primary to non-primary regions. However, we do not know whether this organizational principle is conserved across species and which neural mechanisms drive this invariance. To address these questions, we investigated background invariance in ferret auditory cortex using functional ultrasound imaging (fUSI), which enables large-scale, high-resolution recordings of hemodynamic responses. We measured responses across primary, secondary, and tertiary auditory cortical regions as ferrets passively listened to mixtures of natural sounds and their components in isolation. We found a hierarchical gradient of background invariance, mirroring findings in humans: responses in primary auditory cortex reflected contributions from both foreground and background sounds, while background invariance increased in higher-order auditory regions. Using a spectrotemporal filter-bank model, we found that in ferrets, this hierarchical structure could be largely explained by tuning to low-order acoustic features. However, this model failed to fully account for background invariance in human non-primary auditory cortex, suggesting that additional, higher-order mechanisms are crucial for background segregation in humans.","NA","biorxiv",1739916494184
"Selective State Space Models Outperform Transformers at Predicting RNA-Seq Read Coverage","10.1101/2025.02.13.638190","biorxiv",7.5,7.5,7.5,7.5,7.5,"Holmes, I. H.; Linder, J.; Kelley, D. R.","Ian H Holmes","University of California at Berkeley","2025-02-17","1","new results","cc_by","genomics","https://www.biorxiv.org/content/early/2025/02/17/2025.02.13.638190.source.xml","Transformers are the basis for many state-of-the-art machine learning tools, including those for predicting gene expression data from DNA sequence. The considerable time and cost of training transformer models has motivated development of alternative approaches inspired by ideas from the signal-processing literature, such as state-space models (Mamba), Fourier transforms (Hyena), and wavelet transforms (MultiResNet). To evaluate these methods as potential replacements (or complements) for attention, we developed a software library bilby, implemented using Python and Jax/Flax, providing convolutional, attention, bidirectional Hyena, bidirectional Mamba, and striped-architecture models for supervised multi-task learning in functional genomics. We report a comparison of these architectures, testing several hyperparameters and variations, and reporting performance statistics for the withheld test set as well as downstream SNP classifiers. Relative to models comprising convolution and attention layers (implemented in Python and TensorFlow via the Baskerville library used by the Borzoi software), models comprising convolutional, bidirectional Mamba, and (optionally) attention layers achieve small but consistent improvements in prediction accuracy, for roughly comparable training times and parameter counts, when averaged across all output tracks and data splits (a proportional increase of 3-4% in Pearson R, and 1-2% in r2, with the highest gains achieved when Mamba and attention layers were combined in a striped architecture). In contrast, Hyena (when reimplemented as described in the literature) was not competitive with attention-based models at these tasks, while MultiResNet proved too slow to be practical. The gains in prediction accuracy of the Mamba-based models do not yet translate to significantly improved performance on downstream SNP classification tasks: benchmarks using a GTEx eQTL dataset yield roughly similar results for Mamba- and attention-based classifiers, with attention marginally outperforming Mamba in one metric (a difference of +0.007 in area under ROC) and slightly underperforming by another metric (a difference of -0.006 in Spearman rank correlation). We argue that these results suggest selective state-space models (such as Mamba and Striped Mamba) warrant further exploration for functional genomics tasks. Our code and trained models are publicly available at https://github.com/ihh/bilby.","NA","biorxiv",1739916494184
"A prioritized medium-throughput screen on human stem cell derived insulin secreting beta cells identifies FGF4, FGF5, FGF8F, FGF19 and FGF21 as protective factors","10.1101/2025.02.12.637990","biorxiv",7.95,7.2,7.95,7.95,7.95,"Chu, C. M. J.; Kamal, S.; Huang, H.; Bayly, C. L.; Chen, S.-y.; Omur, M. E.; Wasserman, W. W.; Lynn, F. C.; Johnson, J. D.","James D Johnson","University of British Columbia","2025-02-16","1","new results","cc_by_nc","molecular biology","https://www.biorxiv.org/content/early/2025/02/16/2025.02.12.637990.source.xml","Insulin is produced by pancreatic {beta} cells, whose dysfunction and death are hallmarks of diabetes. Stem cell-derived {beta}-like cells (SC{beta} cells) are a potential alternative to cadaveric islets for replacement therapy. However, SC{beta} cells face a multitude of stresses, including hypoxia, hyperglycemia, ER stress, inflammation, and autoimmunity that must be overcome for this treatment to cure diabetes. Pancreatic {beta} cells and SC{beta} cells reside in complex microtissues (islets or spheroids) and can therefore be potentially modulated by hundreds of autocrine and paracrine signals. Here, we leveraged scRNAseq, bulk RNAseq, and bulk proteomics data from late stage SC{beta} cells and human islets to map potential ligand-receptor pairs in these tissues and generate a prioritized list of ligands for high-content SC{beta} cell survival screening. We tracked cell number with Hoechst 33342, cell death using propidium iodide incorporation, and INS activity from INS-EGFP knock-in reporter human embryonic stem cells over several days using high throughput imaging. Members of the fibroblast growth factor (FGF) family significantly prevented cytokine induced cell death, with the top validated hits being FGF4, FGF5, FGF19, FGF21, and FGF8F. These results have the potential to improve SC{beta} cell survival with pathways that are readily targetable and translatable to the clinic.","NA","biorxiv",1739916494184
"Minimizing detection bias of somatic mutations in a highly heterozygous oak genome","10.1101/2025.02.13.638107","biorxiv",7.8999999999999995,7.15,7.8999999999999995,7.8999999999999995,7.8999999999999995,"Xian, W.; Carbonell-Bejerano, P.; Rabanal, F. A.; Bezrukov, I.; Reymond, P.; Weigel, D.","Detlef Weigel","Max Planck Institute for Biology Tuebingen","2025-02-16","1","new results","cc_by","genomics","https://www.biorxiv.org/content/early/2025/02/16/2025.02.13.638107.source.xml","Somatic mutations are particularly relevant for long-lived organisms. Sources of somatic mutations include imperfect DNA repair, replication errors, and exogenous damage such as ultraviolet radiation. A previous study estimated a surprisingly low number of somatic mutations in a 234-year-old individual of the pedunculate oak (Quercus robur), known as the Napoleon Oak. It has been suggested that the true number of somatic mutations was underestimated due to gaps in the reference genome and too conservative filtering of potential mutations. We therefore generated new high-fidelity long-read data for the Napoleon Oak (n = 12) to produce both a pseudo-haploid genome assembly and a partially phased diploid assembly. The high heterozygosity allowed for complete reconstruction of phased and gapless centromeres for 22 of the 24 chromosomes. On the other hand, the high heterozygosity posed challenges for short-read alignments. Use of only the pseudo-haploid assembly as a reference led to potential misalignments, while use of only the diploid assembly reduced variant detection sensitivity. Since most somatic mutations are layer-specific, the observed frequency is expected relatively low, even where all cells in a single layer contain a specific mutation. To address this challenge, we employed a read assignment strategy, selecting the appropriate reference sequence (pseudo-haploid or diploid) based on alignment score and mapping quality. Ultimately, we identified 198 high-confidence somatic mutations, compared with 17 somatic mutations identified before with the same set of short reads. Our approach thus increased the total estimated annual mutation rate by a factor of five.","NA","biorxiv",1739916494184
