"title","doi","altmetric_jid","score","X1d","X3d","X1w","X1m","authors","author_corresponding","author_corresponding_institution","date","version","type","license","category","jatsxml","abstract","published","server","upupdate_time"
"Mitotic transcription ensures ecDNA inheritance through chromosomal tethering","10.1101/2025.02.12.637945","biorxiv",15.899999999999997,7.1,15.899999999999997,15.899999999999997,15.899999999999997,"Nichols, A.; Norman, R. X.; Chen, Y.; Choi, Y.; Striepen, J.; Salataj, E.; Toufektchan, E.; Koche, R. P. X.; Maciejowski, J.","John Maciejowski","Memorial Sloan Kettering Cancer Center","2025-02-16","1","new results","cc_no","molecular biology","https://www.biorxiv.org/content/early/2025/02/16/2025.02.12.637945.source.xml","Extrachromosomal DNA (ecDNA) are circular DNA bodies that play critical roles in tumor progression and treatment resistance by amplifying oncogenes across a wide range of cancer types. ecDNA lack centromeres and are thus not constrained by typical Mendelian segregation, enabling their unequal accumulation within daughter cells and associated increases in copy number. Despite intrinsic links to their oncogenic potential, the fidelity and mechanisms of ecDNA inheritance are poorly understood. Here, we show that ecDNA are protected against cytosolic mis-segregation through mitotic clustering and by tethering to the telomeric and subtelomeric regions of mitotic chromosomes. ecDNA-chromosome tethering depends on BRD4 transcriptional co-activation and mitotic transcription of the long non-coding RNA PVT1, which is co-amplified with MYC in colorectal and prostate cancer cell lines. Disruption of ecDNA-chromosome tethering through BRD4 inhibition, PVT1 depletion, or inhibiting mitotic transcription results in cytosolic mis-segregation, ecDNA reintegration, and the formation of homogeneously staining regions (HSRs). We propose that nuclear inheritance of ecDNA is facilitated by an RNA-mediated physical tether that links ecDNA to mitotic chromosomes and thus protects against cytosolic mis-segregation and chromosomal integration.","NA","biorxiv",1739916494184
"Keep the hospital clean: diagnostic performance of ten different molecular and culture-based methods to detect Candidozyma auris.","10.1101/2025.01.18.25320756","medrxiv",16.65,7,7,9.85,16.65,"Korsten, K.; Gerrits van den Ende, B.; Pique, R. D.; Hagen, F.; van Dijk, K.","Koos Korsten","Department of Medical Microbiology and Infection Prevention, Amsterdam University Medical Center, location AMC, Amsterdam, the Netherlands","2025-01-19","1","PUBLISHAHEADOFPRINT","cc_by_nd","infectious diseases","https://www.medrxiv.org/content/early/2025/01/19/2025.01.18.25320756.source.xml","RationaleCandidozyma auris (formerly Candida auris) is a globally emerging potentially multi-drug resistant human pathogenic yeast. To detect C. auris we aimed to compare different culture-, and molecular-based methods.

MethodsRectal swabs routinely collected in clinical care were spiked with different concentrations of C. auris. Co-infection/colonization was mimicked by spiking part of these samples with other pathogenic Candida species. Spiked materials were cultured at 37{degrees}C or 42{degrees}C using CHROMagar Candida and CHROMagar CandidaPlus plates. In parallel, samples were incubated in a dulcitol salt enrichment broth. Additionally, we compared seven in-house and commercial molecular tests on the direct material and from the broth one day after inoculation.

ResultsCulture-based methods showed sensitivities up to 100% within 48 hours of incubation, although sensitivity decreased as low as 44% at lower concentrations ([&le;]50 CFU per inoculum), in the presence of an abundance of other species and at higher temperature (42{degrees}C). Incubation at 42{degrees}C made visual identification possible since other species with similar colony morphologies did not grow at this temperature. No added value of using the dulcitol salt enrichment broth was found. qPCR on direct materials was highly sensitive and specific (both up to 100%) but major differences between various molecular tests were observed.

ConclusionWe showed that both culture-based and molecular methods are sensitive for diagnosing C. auris. The clinical setting (routine screening versus an outbreak), local prevalence and the load in those that carry or are infected by C. auris are important factors to consider when determining which diagnostic tests should be employed.","NA","medrxiv",1739916494184
"Inhibition of acute lung inflammation by a neuroimmune circuit induced by vagal nerve stimulation.","10.1101/2025.02.12.637880","biorxiv",6.9,6.9,6.9,6.9,6.9,"Murray, K.; Cremin, M.; Tay, E. X. Y.; Sanchez, K. R.; Schreiber, S.; Brust-Mascher, I.; Leigh, W.; Ashfaq, J.; Gareau, M. G.; Reardon, C.","Colin Reardon","University of California Davis School of Veterinary Medicine","2025-02-17","1","new results","cc_by_nc_nd","immunology","https://www.biorxiv.org/content/early/2025/02/17/2025.02.12.637880.source.xml","Vagus nerve stimulation (VNS) has been shown to limit immune cell activity across several pathologies ranging from sepsis to auto-immune diseases. While stimulation of vagal efferent neurons has been previously demonstrated to reduce maladaptive host responses during endotoxemia, only selective stimulation of vagal afferent neurons was able to inhibit TLR7-induced macrophage activation and neutrophil recruitment in the lung. These anti-inflammatory actions are facilitated by systemic increases in epinephrine, as VNS significantly increased epinephrine in the serum and bronchoalveolar lavage fluid, and inhibition of epinephrine production eliminated the protection afforded by VNS. Selective afferent VNS induced activation in the nucleus tractus solitarius and the rostral ventrolateral medulla. Inhibition of neuronal activity in this brain region that controls peripheral sympathetic nervous system activity rendered VNS ineffective. Activation of the {beta}2-adrenergic receptor ({beta}2AR) is critical for innate immune cell suppression, as the anti-inflammatory effects of VNS were eliminated in {beta}2AR39 knock out mice, and with pharmacological inhibition of the {beta}2AR. Analysis of the immune cells responding to R848 critically identified that plasmacytoid dendritic cells were refractive to inhibition by VNS, and this corresponded to lack of {beta}2AR expression. These findings demonstrate a novel neuro-immune circuit elicited by VNS that can control acute lung inflammation.","NA","biorxiv",1739916494184
"Static morphogen scaling enables proportional growth in tissue growth model inspired by axolotl limb regeneration","10.1101/2025.02.14.638295","biorxiv",6.800000000000001,6.800000000000001,6.800000000000001,6.800000000000001,6.800000000000001,"Lyubaykina, N.; Knapp, D.; Tardivo, P.; Sandoval-Guzman, T.; Friedrich, B. M.","Benjamin M. Friedrich","Cluster of Excellence Physics of life, TU Dresden, Germany","2025-02-17","1","new results","cc_no","biophysics","https://www.biorxiv.org/content/early/2025/02/17/2025.02.14.638295.source.xml","Axolotls can regenerate lost limbs throughout their lives, while they continue to grow. This poses the question of how the size and pattern of a regenerating limb is matched to a widely varying animal size. Two interacting signaling molecules, SHH and FGF8, are produced at opposite sides of the regenerating limb and sustain tissue growth through a pair of oppositely-oriented signaling gradients. As the size of the regrowing tissue can vary more than three-fold depending on the size of the animal, it is unclear how the activities of these mutually dependent morphogens are maintained and subsequently terminated to determine appropriate growth. Scaling of limb regeneration suggests a size-dependent adaptation of morphogen gradient parameters. Inspired by this biological example, we theoretically investigate general mechanisms of morphogen-controlled growth arrest and proportional growth. In the proposed mechanism, tissue growth increases the spatial distance between the two morphogen gradients, thus providing negative feedback that eventually arrests morphogen activity and growth. We put forward two distinct scaling scenarios of morphogen gradients: either dynamic scaling with blastema size, where morphogen gradient parameters change dynamically with the growing tissue, or static scaling with animal size, where morphogen gradient parameters stay constant during blastema growth and only depend on animal size. We show that static scaling ensures proportional growth, but dynamic scaling does not. We compare theory predictions to experimental quantification of SHH and FGF8 morphogen gradient parameters at different time-points of regeneration in different-sized animals, indicating static scaling for some morphogen parameters, which is sufficient to ensure proportional growth in our model.","NA","biorxiv",1739916494184
"Quantifying heat exposure and its related mortality in Rio de Janeiro City: evidence to support Rio's recent heat protocol","10.1101/2025.01.17.25320740","medrxiv",8,6.5,6.5,6.5,7.5,"Araujo Morais, J. H.; Medeiros de Oliveira e Cruz, D.; Saraceni, V.; Dias Ferreira, C.; Mateus Oliveira Aguilar, G.; Goncalves Cruz, O.","Joao Henrique Araujo Morais","Escola Nacional de Saude Publica Sergio Arouca","2025-01-18","1","PUBLISHAHEADOFPRINT","cc_by_nd","epidemiology","https://www.medrxiv.org/content/early/2025/01/18/2025.01.17.25320740.source.xml","Under a climate change scenario, extreme heat episodes show an increase in frequency and intensity, with a scaling impact in Latin American cities. Recently, Rio de Janeiro City developed its heat protocol, using the amount of hours spent over specific heat thresholds as its trigger metric. This study gathers mortality data by 17 different causes in Rio, in a 12.5 year period (2012-2024). We use Distributed Lag Non-Linear Models (DLNM) to assess the relationship between different heat exposure metrics to mortality among the young (< 65) and elderly (>=65y), including a novel metric called Heat Area Above a Threshold (HAAT). In the study period, there were 466,121 deaths in the city from natural causes. Deaths due to diabetes, hypertensive diseases, Alzheimers/dementia, renal failure and even undetermined deaths were strongly associated with extreme heat episodes, especially among the elderly. The proposed HAAT metric showed better performance on explaining mortality for most causes (10 out of the 17), when compared to temperature or heat index, or commonly used heat wave definitions. The results dialogue with Rios heat protocol, evaluating the cut-off points defined and proposing simpler definitions using the HAAT metric. An exposure to a HAAT of 64{degrees}C*h increases mortality by natural causes by 50%, and 91.2{degrees}C*h already doubles the mortality risk. Main strengths of the study lie on the comparison of different heat exposure metrics and the investigation of cause-specific mortality in a period when recent and remarkable heat waves occurred. There is still fragility when considering a compound index such as the Heat Index, and social and spatial differences on heat-related mortality should also be considered in future models. The proposed metric, however, appears as a relevant indicator to distinguish unusually warm days that lead to elevated mortality, and could guide definitions for Heat Warning Systems.","NA","medrxiv",1739916494184
"UB-MBX-46 is a potent and selective antagonist of the human P2X7 receptor developed by structure-based drug design","10.1101/2025.02.12.637899","biorxiv",6.95,6.45,6.95,6.95,6.95,"Oken, A. C.; Turcu, A. L.; Tzortzini, E.; Georgiou, K.; Nagel, J.; Barniol-Xicota, M.; Kim, G.-R.; Lee, S.-D.; Nicke, A.; Kim, Y.-C.; Muller, C. E.; Kolocouris, A.; Vazquez, S.; Mansoor, S. E.","Steven E. Mansoor","Department of Chemical Physiology & Biochemistry, Oregon Health & Science University, Portland, Oregon 97239, USA.","2025-02-16","1","new results","cc_by","biochemistry","https://www.biorxiv.org/content/early/2025/02/16/2025.02.12.637899.source.xml","The P2X7 receptor is an ATP-gated ion channel that activates inflammatory pathways involved in diseases such as cancer, atherosclerosis, and neurodegeneration. However, despite the potential benefits of blocking overactive signaling, no P2X7 receptor antagonists have been approved for clinical use. Interspecies variation among existing antagonists has proven challenging, in part due to the dearth of molecular information on different receptor orthologs. Here, to identify distinct molecular features in the human receptor, we determine high-resolution cryo-EM structures of the full-length wild-type human P2X7 receptor in apo closed and ATP-bound open state conformations and draw comparisons with new and existing structures of other orthologs. We also report a cryo-EM structure of the human receptor in complex with an adamantane-based inhibitor, which we leverage, in conjunction with functional data and molecular dynamics simulations, to design a potent and selective antagonist with a unique polycyclic scaffold. Functional and structural analysis reveal how this optimized ligand, UB-MBX-46, interacts with the classical allosteric pocket of the human P2X7 receptor with picomolar potency and high selectivity, revealing its significant therapeutic potential.","NA","biorxiv",1739916494184
"Age- and Virus-Specific Signatures of In Vitro Reconstituted Human Airway Epithelia in the Presence and Absence of Respiratory Viral Infections","10.1101/2025.02.16.638411","biorxiv",6.249999999999999,6.249999999999999,6.249999999999999,6.249999999999999,6.249999999999999,"Bellon, M.; Alvarez, C.; Buendia, G. R.; Sattonnet-Roche, P.; Dbeissi, D.; Sarmiento, Y.; Kaiser, L.; Didierlaurent, A. M.; Eckerle, I.; Essaidi-Laziosi, M.","Isabella Eckerle","Faculty of Medicine, University of Geneva","2025-02-17","1","new results","cc_no","microbiology","https://www.biorxiv.org/content/early/2025/02/17/2025.02.16.638411.source.xml","While Influenza Virus and Respiratory Syncytial Virus (RSV) are considered as a significant health burden in children, Severe Acute Respiratory Syndrome Coronavirus-2 (SARS-CoV-2) causes milder diseases in this age group compared to adults. To investigate the involvement of the upper respiratory tract human airway epithelium (HAE) in this pattern, we established an in-house model of reconstituted HAE cultured in air-liquid interface from nasal swabs of children and adults and characterised it before and after ex vivo respiratory viral infections using focused and unbiased approaches. Fully differentiated paediatric HAE exhibited an increasing induction level of genes related to mucociliary clearance, while higher expression of innate immune pathways was found in the ones from adults. While similar viral replication kinetics in both age groups were shown for SARS-CoV-2, Influenza A Virus (IAV), RSV and Rhinovirus (RV) infection, transcriptomic analysis showed stronger and earlier induction of IFN-related pathways in SARS-CoV-2-infected HAE from children compared to IAV, RSV and RV. IAV and RSV had the weakest innate immune response increase in HAE from children versus adults. RV infection showed an intermediate pattern, resembling SARS-CoV-2 more than RSV or IAV. Our work demonstrates a distinct sensing of SARS-CoV-2 compared to other respiratory viruses ex vivo, which may contribute to the milder course of disease in SARS-CoV-2 infected children and argues for a role of early virus-HAE interaction in shaping viral pathogenesis. Furthermore, we show that innate immune responses towards respiratory viruses are virus-specific and differ between age groups. Hence, findings on SARS-CoV-2 cannot be extrapolated to other respiratory viruses.","NA","biorxiv",1739916494184
"Delayed transplantation of neural stem cells improves initial graft survival following stroke","10.1101/2025.02.13.638119","biorxiv",5.95,5.95,5.95,5.95,5.95,"Weber, R. Z.; Rentsch, N. H.; Buil, B. A.; Nih, L. R.; Tackenberg, C.; Rust, R.","Ruslan Rust","University of Southern California","2025-02-17","1","new results","cc_by_nc","neuroscience","https://www.biorxiv.org/content/early/2025/02/17/2025.02.13.638119.source.xml","Neural stem cell therapies hold great promise for improving stroke recovery, but the hostile stroke microenvironment can hinder the initial graft survival. It has long been well documented that the microenvironment evolves over time, making it crucial to identify the optimal transplantation window to maximize therapeutic efficacy. However, it remains uncertain whether acute or delayed local cell transplantations better supports graft viability after stroke. Here, we show that delayed intracerebral transplantation of neural progenitor cells (NPCs) derived from human induced pluripotent cells (iPSCs) at 7 days post stroke significantly enhances graft proliferation and survival, compared to acute transplantation at 1 day post stroke, in a mouse model of large cortical stroke. Using in vivo bioluminescence imaging over a 6-week period post-transplantation, we observe a more than 5-fold increase in bioluminescence signal in mice that received delayed NPC therapy, compared to those that underwent acute NPC transplantation. The increased number of cell grafts in mice receiving delayed NPC transplantation was driven by increased proliferation rates early after transplantation, which subsequently declined to similarly low levels in both groups. Notably, we found that the majority of transplanted NPCs differentiated into neurons after 6 weeks, with no significant differences in the neuron-to-glia ratio between acute and delayed transplantation groups. These findings suggest that delayed NPC transplantation improves early graft survival and proliferation, which could help identify the optimal therapeutic window for maximizing the effectiveness of NPC-based therapies in stroke.","NA","biorxiv",1739916494184
"Single-cell multiome and spatial profiling reveals pancreas cell type-specific gene regulatory programs driving type 1 diabetes progression","10.1101/2025.02.13.637721","biorxiv",5.95,5.95,5.95,5.95,5.95,"Melton, R.; Jimenez, S.; Elison, W.; Tucciarone, L.; Howell, A.; Wang, G.; Berti, D.; Beebe, E.; Miller, M.; Zeng, C.; Vanderstel, K.; Korgaonkar, K.; Elgamal, R.; Mummey, H.; Chiou, J.; Griffin, E.; Kusmartseva, I.; Atkinson, M. A.; Preissl, S.; Theis, F.; Sander, M.; Gaulton, K. J.","Kyle J Gaulton","University of California San Diego","2025-02-17","1","new results","cc_by_nc","genomics","https://www.biorxiv.org/content/early/2025/02/17/2025.02.13.637721.source.xml","Cell type-specific regulatory programs that drive type 1 diabetes (T1D) in the pancreas are poorly understood. Here we performed single nucleus multiomics and spatial transcriptomics in up to 32 non-diabetic (ND), autoantibody-positive (AAB+), and T1D pancreas donors. Genomic profiles from 853,005 cells mapped to 12 pancreatic cell types, including multiple exocrine sub-types. Beta, acinar, and other cell types, and related cellular niches, had altered abundance and gene activity in T1D progression, including distinct pathways altered in AAB+ compared to T1D. We identified epigenomic drivers of gene activity in T1D and AAB+ which, combined with genetic association, revealed causal pathways of T1D risk including antigen presentation in beta cells. Finally, single cell and spatial profiles together revealed widespread changes in cell-cell signaling in T1D including signals affecting beta cell regulation. Overall, these results revealed drivers of T1D progression in the pancreas, which form the basis for therapeutic targets for disease prevention.","NA","biorxiv",1739916494184
"Coordinated macrophage and T cell interactions mediate response to checkpoint blockade in colorectal cancer.","10.1101/2025.02.12.637954","biorxiv",5.9,5.9,5.9,5.9,5.9,"Mestrallet, G.; Brown, M.; Vaninov, N.; Cho, N. W.; Velazquez, L.; Ananthanarayanan, A.; Spitzer, M.; Vabret, N.; Cimen Bozkus, C.; Samstein, R. M.; Bhardwaj, N.","Nina Bhardwaj","Icahn School of Medicine at Mount Sinai","2025-02-17","1","new results","cc_by","immunology","https://www.biorxiv.org/content/early/2025/02/17/2025.02.12.637954.source.xml","Mismatch repair deficiency (MMRd), either due to inherited or somatic mutation, is prevalent in colorectal cancer (CRC) and other cancers. While anti-PD-1 therapy is utilized in both local and advanced disease, up to 50% of MMRd CRC fail to respond. Using animal and human models of MMRd, we determined that interactions between MHC+ C1Q+ CXCL9+ macrophages and TCF+ BHLHE40+ PRF1+ T cell subsets are associated with control of MMRd tumor growth, during anti-PD-1 treatment. In contrast, resistance is associated with upregulation of TIM3, LAG3, TIGIT, and PD-1 expression on T cells, and infiltration of the tumor with immunosuppressive TREM2+ macrophages and monocytes. By combining anti-PD-1 with anti-LAG3/CTLA4/TREM2, up to 100% tumor eradication was achieved in MMRd CRC and remarkably, in >70% in MMRp CRC. This study identifies key T cell and macrophage subsets mediating the efficacy of immunotherapy in overcoming immune escape in both MMRd and MMRp CRC settings.","NA","biorxiv",1739916494184
"Morpheus: A fragment-based algorithm to predict metamorphic behaviour in proteins across proteomes","10.1101/2025.02.13.637956","biorxiv",6.949999999999999,5.699999999999999,6.949999999999999,6.949999999999999,6.949999999999999,"Subramanian, V.; Appadurai, R.; Venkatesh, H.; Sekhar, A.; Srivastava, A.","Anand Srivastava","Indian Institute of Science","2025-02-17","1","new results","cc_by_nc_nd","bioinformatics","https://www.biorxiv.org/content/early/2025/02/17/2025.02.13.637956.source.xml","Functionally important ""fold-switching"" proteins, which do not obey the classical folding dogma, are now thought to be widespread. Algorithms that can accurately annotate fold-switching proteins from sequence information can help uncover the true extent of the ""metamorphome"". Here, we present Morpheus, a fragment-based classification approach, that works by analysing the diversity of structures within a query protein sequence. Morpheus exhaustively curates and uses fragment structural data from the protein data bank as well as the AlphaFold Protein Structure Database. We employed our algorithm on 57 different proteomes consisting of a total of 601,218 proteins and identified about 10% of these proteins with the ability to fold switch. Additionally, we provide a web server for Morpheus to test for metamorphic propensities for user-defined sequences (http://mbu.iisc.ac.in/~anand/morpheus). Besides screening for metamorphic behaviour in proteomes, our work will be useful in de novo design and engineering of such proteins through further experimentation.","NA","biorxiv",1739916494184
"Predicting Hybrid Fitness: the Effects of Ploidy and Complex Ancestry","10.1101/2025.02.13.638087","biorxiv",5.65,5.65,5.65,5.65,5.65,"Schneemann, H.; Welch, J. J.","Hilde Schneemann","Institute of Science and Technology Austria","2025-02-17","1","new results","cc_by_nc","evolutionary biology","https://www.biorxiv.org/content/early/2025/02/17/2025.02.13.638087.source.xml","Hybridization between divergent populations places alleles in novel genomic contexts. This can inject adaptive variation - which is useful for breeders and conservationists - or reduce fitness, leading to reproductive isolation. Most theoretical work on hybrids involves haploid or diploid hybrids between two parental lineages, but real-world hybridization is often more complex. We introduce a simple fitness landscape model to predict hybrid fitness with arbitrary ploidy and an arbitrary number of hybridizing lineages. We test our model on published data from maize (Zea mays) and rye (Secale cereale), including hybrids between multiple inbred lines, both as diploids and synthetic tetraploids. Quantitative predictions for the effects of inbreeding, and the strength of progressive heterosis, are well supported. This suggests that the model captures the important properties of dosage and genetic interactions, and may help to unify theories of heterosis and reproductive isolation.","NA","biorxiv",1739916494184
"DNA-PAINT imaging with hydrogel imprinting and clearing","10.1101/2025.02.14.638341","biorxiv",5.55,5.55,5.55,5.55,5.55,"Stein, J.; Magni, L.; Church, G. M.","Johannes Stein","Harvard Medical School / Wyss Institute","2025-02-17","1","new results","cc_by_nc_nd","biophysics","https://www.biorxiv.org/content/early/2025/02/17/2025.02.14.638341.source.xml","Hydrogel-embedding is a versatile technique in fluorescence microscopy, offering stabilization, optical clearing, and the physical expansion of biological specimens. DNA-PAINT is a super-resolution microscopy approach based on the diffusion and transient binding of fluorescently labeled oligos, but its feasibility in hydrogels has not yet been explored. In this study, we demonstrate that polyacrylamide hydrogels support sufficient diffusion for effective DNA-PAINT imaging. Using acrydite-anchored oligonucleotides imprinted from patterned DNA origami nanostructures and microtubule filaments in fixed cells, we find that hydrogel embedding preserves docking strand positioning at the nanoscale. Sample clearing via protease treatment had minor structural effects on the microtubule structure, and enhanced diffusion and accessibility to hydrogel-imprinted docking strands. Our work demonstrates promising potential for diffusion and binding-based fluorescence imaging applications in hydrogel-embedded samples.","NA","biorxiv",1739916494184
