"title","doi","altmetric_jid","score","X1d","X3d","X1w","X1m","authors","author_corresponding","author_corresponding_institution","date","version","type","license","category","jatsxml","abstract","published","server","upupdate_time"
"Epidemiological Parameters of SARS-CoV-2 in the UK during the 2023/2024 Winter: A Cohort Study","10.1101/2024.07.22.24310801","medrxiv",18.25,0,17.75,18.25,18.25,"Overton, C. E.; Fyles, M.; Mellor, J.; Paton, R. S.; Phillips, A. M.; Glaser, A.; Charlett, A.; Ward, T.","Christopher E Overton","University of Liverpool","2024-07-22","1","PUBLISHAHEADOFPRINT","cc_by","infectious diseases","https://www.medrxiv.org/content/early/2024/07/22/2024.07.22.24310801.source.xml","Estimating epidemiological parameters is essential for informing an effective public health response during waves of infectious disease transmission. However, many parameters are challenging to estimate from real-world data, and rely on human challenge studies or mass community testing. During Winter 2023/2024, a community cohort study of SARS-CoV-2 was conducted across households in England and Scotland. From this survey, questionnaire data and follow-up testing protocols provided valuable data into multiple epidemiological parameters: namely, the duration of positivity, test sensitivity, and the incubation period. Here, Bayesian statistical modelling methods are developed and applied to estimate the underlying parameters. The duration of LFD positivity is found to increase with increasing age, with a mean of 8.55 days (95% CrI: 7.65 days, 9.44 days) in the youngest age group compared to 10.27 days (95% CrI: 9.85 days, 10.71 days) in the oldest age group. Similarly, test sensitivity, as a function of time since symptom onset, decays fastest in the youngest age group, reaching a minimum sensitivity of 0.26 (95% CrI: 0.16, 0.37) compared to 0.54 (95% CrI: 0.46, 0.6). Such patterns are expected since younger individuals experience less severe symptoms of COVID-19 and are likely to clear the virus faster. Combining the duration of positivity and test sensitivity, we estimate the probability of returning a positive test. Close to symptom onset date, this probability is approximately 95%. However, this rapidly drops off, dropping below 5% after 11.3 days (95% CrI: 9.7 days, 13 days) for the youngest age group and 16.2 days (95% CrI: 15.4 days, 17.1 days) for the oldest age group. For the incubation period, there is no clear pattern by age. Across all age groups, the mean incubation period is 2.52 days (95% CrI: 2.42 days, 2.62 days). This is shorter than the most recent estimates for Omicron BA.5, which is in line with earlier research that found replacing variants had shorter incubation periods.","NA","medrxiv",1722204574072
"The battle of the sexes in humans is highly polygenic","10.1101/2024.07.23.604850","biorxiv",15.599999999999998,1.35,15.599999999999998,15.599999999999998,15.599999999999998,"Cole, J. M.; Scott, C. B.; Johnson, M. M.; Golightly, P. R.; Carlson, J.; Ming, M. J.; Harpak, A.; Kirkpatrick, M.","Jared M. Cole","University of Texas at Austin","2024-07-24","1","new results","cc_by","evolutionary biology","https://www.biorxiv.org/content/early/2024/07/24/2024.07.23.604850.source.xml","Sex-differential selection (SDS), which occurs when the fitness effects of alleles differ between males and females, can have profound impacts on the maintenance of genetic variation, disease risk, and other key aspects of natural populations. Because the sexes mix their autosomal genomes each generation, quantifying SDS is not possible using conventional population genetic approaches. Here, we introduce a novel method that exploits subtle sex differences in haplotype frequencies resulting from SDS acting in the current generation. Using data from 300K individuals in the UK Biobank, we estimate the strength of SDS throughout the genome. While only a handful of loci under SDS are individually significant, we uncover polygenic signals of genome-wide SDS for both viability and fecundity. An interesting life-history tradeoff emerges: alleles that increase viability more in one sex increase fecundity more in the other sex. Lastly, we find evidence of SDS on fecundity acting on alleles affecting arm fat-free mass. Taken together, our findings connect the long-standing evidence of SDS acting on human phenotypes with its impact on the genome.

Significance statementSelection often acts differently on females and males, as evidenced by the striking sexual dimorphism found in many taxa. As a result, alleles can have different fitness effects in each sex. Consequences can include higher levels of genetic variation and higher disease burdens in populations. This study introduces a novel method to quantify this sex-differential selection (SDS) and reveals that it acts throughout the human genome. We discovered a life history tradeoff between survival and fecundity in females and males and that SDS on fecundity acts on alleles affecting arm fat-free mass.","NA","biorxiv",1722204574072
"A Hypothalamic Circuit that Modulates Feeding and Parenting Behaviors","10.1101/2024.07.22.604437","biorxiv",48.10000000000002,0,15.399999999999999,48.10000000000002,48.10000000000002,"Alcantara, I. C.; Li, C.; Mickelsen, L. E.; Mazzone, C. M.; de Araujo Salgado, I.; Gao, C.; Papas, B. N.; Xiao, C.; Karolczak, E. O.; Goldschmidt, A. I.; Rodriguez Gonzalez, S.; Pinol, R. A.; Li, J.-L.; Cui, G.; Reitman, M. L.; Krashes, M. J.","Michael J. Krashes","Diabetes, Endocrinology, and Obesity Branch, National Institute of Diabetes and Digestive and Kidney Diseases, National Institutes of Health, Bethesda, MD, USA ","2024-07-23","1","new results","cc_by_nc_nd","neuroscience","https://www.biorxiv.org/content/early/2024/07/23/2024.07.22.604437.source.xml","Across mammalian species, new mothers undergo considerable behavioral changes to nurture their offspring and meet the caloric demands of milk production1-5. While many neural circuits underlying feeding and parenting behaviors are well characterized6-9, it is unclear how these different circuits interact and adapt during lactation. Here, we characterized the transcriptomic changes in the arcuate nucleus (ARC) and the medial preoptic area (MPOA) of the mouse hypothalamus in response to lactation and hunger. Furthermore, we showed that heightened appetite in lactating mice was accompanied by increased activity of hunger-promoting agouti-related peptide (AgRP) neurons in the ARC. To assess the strength of hunger versus maternal drives, we designed a conflict assay where female mice chose between a food source or a chamber containing pups and nesting material. Although food-deprived lactating mothers prioritized parenting over feeding, hunger reduced the duration and disrupted the sequences of parenting behaviors in both lactating and virgin females. We discovered that ARCAgRP neurons directly inhibit bombesin receptor subtype-3 (BRS3) neurons in the MPOA, a population that governs both parenting and satiety. Selective activation of this ARCAgRP to MPOABRS3 circuit shifted behaviors from parenting to food-seeking. Thus, hypothalamic networks are modulated by physiological states and work antagonistically during the prioritization of competing motivated behaviors.","NA","biorxiv",1722204574072
"Linking stomatal size and density to water use efficiency and leaf carbon isotope ratio in juvenile and mature trees","10.1101/2024.07.22.604523","biorxiv",32.850000000000016,0,15.099999999999998,32.850000000000016,32.850000000000016,"Petrik, P.; Petek-Petrik, A.; Lamarque, L. J.; Waite, P.-A.; Link, R. M.; Ruehr, N. K.; Schuldt, B.; Maire, V.","Peter Petrik","Technical University of Dresden","2024-07-23","1","new results","cc_no","plant biology","https://www.biorxiv.org/content/early/2024/07/23/2024.07.22.604523.source.xml","Water-use efficiency (WUE) is affected by multiple leaf traits, including stomatal morphology. However, the impact of stomatal morphology on WUE across different ontogenetic stages of tree species is not well-documented. Here, we investigated the relationship between stomatal morphology intrinsic water-use efficiency (iWUE=A/gs) and leaf carbon isotope ratio ({delta}13C). We sampled 190 individuals including juvenile and mature trees belonging to 18 temperate broadleaved tree species and 9 genera. We measured guard cell length (GCL), stomatal density (SD), specific leaf area (SLA), gas-exchange, iWUE and leaf {delta}13C as a proxy for long-term WUE. Leaf {delta}13C correlated positively with iWUE for both juvenile and mature trees. Across species, GCL showed a negative and SD a positive effect on iWUE and leaf {delta}13C of both juvenile and mature trees. Within species, however, only GCL was significantly associated with iWUE and leaf {delta}13C. Pioneer species (Populus, Prunus, Betula) showed a significantly lower leaf {delta}13C than climax forest species (Fagus, Quercus, Tilia), but the differentiation was not clear for iWUE. We conclude that GCL and SD can be considered as functional morphological traits impacting the iWUE and leaf {delta}13C of trees, highlighting their potential for rapid phenotyping approaches in ecological studies.","NA","biorxiv",1722204574072
"Substrate stiffness regulates neuronal maturation via Piezo1-mediated TTR activity","10.1101/2024.07.25.605128","biorxiv",15.049999999999999,1.35,15.049999999999999,15.049999999999999,15.049999999999999,"Kreysing, E.; Gautier, H.; Humphrey, R. J.; Mooslehner, K. A.; Muresan, L. A.; Haarhoff, D.; Mukherjee, S.; Zhao, X. X.; Winkel, A. K.; Dimitracopoulos, A.; Pillai, E. K.; Karadottir, R. T.; Franze, K.","Kristian Franze","University of Cambridge","2024-07-25","1","new results","cc_by_nc","developmental biology","https://www.biorxiv.org/content/early/2024/07/25/2024.07.25.605128.source.xml","During brain development, neurons extend axons to connect to their target cells while initiating a maturation process, during which neurons start expressing voltage-gated ion channels, form synapses, express synaptic transmitters and receptors, and start communicating via action potentials. Little is known about external factors regulating this process. Here, we identified environmental mechanics as an important regulator of neuronal maturation, and a molecular pathway linking tissue stiffness to this process. Using patch clamp electrophysiology, calcium imaging and immunofluorescence, we found that neurons cultured on stiffer substrates showed a delay in voltage-gated ion channel activity, spontaneous and evoked action potentials, and synapse formation. RNA sequencing and CRISPR/Cas9 knockdown strategies revealed that the mechanosensitive ion channel Piezo1 supresses transthyretin (TTR) expression on stiffer substrates, slowing down synaptic receptor expression and consequently electrical maturation. Stiffening of brain tissue in Xenopus laevis embryos also resulted in a significant delay of synaptic activity in vivo. Our data indicate that environmental stiffness represents a fundamental regulator of neuronal maturation, which is important for the development of normal circuitry in the brain, and potentially for neurodevelopmental disorders.","NA","biorxiv",1722204574072
"Simulating 500 million years of evolution with a language model","10.1101/2024.07.01.600583","biorxiv",195.85000000000002,0,15,33.35,195.85000000000002,"Hayes, T.; Rao, R.; Akin, H.; Sofroniew, N. J.; Oktay, D.; Lin, Z.; Verkuil, R.; Tran, V. Q.; Deaton, J.; Wiggert, M.; Badkundri, R.; Shafkat, I.; Gong, J.; Derry, A.; Molina, R. S.; Thomas, N.; Khan, Y. A.; Mishra, C.; Kim, C.; Bartie, L. J.; Nemeth, M.; Hsu, P. D.; Sercu, T.; Candido, S.; Rives, A.","Alexander Rives","EvolutionaryScale PBC","2024-07-02","1","new results","cc_by_nc_nd","synthetic biology","https://www.biorxiv.org/content/early/2024/07/02/2024.07.01.600583.source.xml","More than three billion years of evolution have produced an image of biology encoded into the space of natural proteins. Here we show that language models trained on tokens generated by evolution can act as evolutionary simulators to generate functional proteins that are far away from known proteins. We present ESM3, a frontier multimodal generative language model that reasons over the sequence, structure, and function of proteins. ESM3 can follow complex prompts combining its modalities and is highly responsive to biological alignment. We have prompted ESM3 to generate fluorescent proteins with a chain of thought. Among the generations that we synthesized, we found a bright fluorescent protein at far distance (58% identity) from known fluorescent proteins. Similarly distant natural fluorescent proteins are separated by over five hundred million years of evolution.","NA","biorxiv",1722204574072
"Long-distance gene flow and recombination shape the evolutionary history of a maize pathogen","10.1101/2024.07.22.604531","biorxiv",14.749999999999998,1.5,14.499999999999998,14.749999999999998,14.749999999999998,"Rogerio, F.; Oosterhout, C. V.; De Mita, S.; Cuevas-Fernandez, F. B.; Garcia-Rodriguez, P.; Becerra, S.; Gutierrez-Sanchez, S.; Jacquat, A. G.; Bettiol, W.; Hosaka, G. K.; Ulla, S. B.; Hiltbrunner, J.; Santiago, R.; Revilla, P.; Dambolena, J. S.; Vicente-Villardon, J. L.; Buhinicek, I.; Sukno, S. A.; Thon, M. R.","Flávia Rogério","University of Salamanca, Department of Microbiology and Genetics, Institute for Agribiotechnology Research (CIALE), Villamayor, Salamanca, Spain.","2024-07-23","1","new results","cc_by_nc_nd","genomics","https://www.biorxiv.org/content/early/2024/07/23/2024.07.22.604531.source.xml","The evolutionary history of crop pathogens is shaped by a complex interaction of natural and anthropogenic factors. The ascomycete fungus Colletotrichum graminicola causes maize anthracnose. The disease can result in significant yield losses and is also an important model for genetic studies. We conducted a comprehensive investigation into the evolutionary genomics of C. graminicola using a collection of 212 isolates from 17 countries. Genomic analyses supported the existence of three geographically isolated genetic lineages, with a significant pattern of isolation by distance. We identified two distinct gene flow patterns, driven by short and long-distance dispersion, likely resulting from the natural spread of the pathogen and the exchange of contaminated seeds. We present evidence of genetic introgression between lineages, suggesting a long history of recombination. We identified significant recombination events coalescing at distinct points in time, with the North American lineage displaying evidence of most ancient recombination. Demographic modeling indicated that North America is an intermediate between Brazil, Europe and an ancestral, unsampled source population, hypothesized to be Mesoamerican. Our analyses revealed that the global genomic structure of C. graminicola is shaped by geographic differentiation driven by long-distance migration and a long history of recombination and introgression. We show historical relationships among these lineages, identifying a potential route for fungal spread, with the North American population emerging ancestrally, followed sequentially by the Brazilian and European populations. Our research indicates that the European lineage is more virulent, which has implications for the potential emergence of new outbreaks of maize anthracnose in Europe.","NA","biorxiv",1722204574072
"Uncovering the multivariate genetic architecture of frailty with genomic structural equation modelling","10.1101/2024.07.24.24310923","medrxiv",14.149999999999997,0,13.899999999999997,14.149999999999997,14.149999999999997,"Foote, I. F.; Flint, J. P.; Furtjes, A. E.; Mullin, D. S.; Fisk, J. D.; Karakach, T. K.; Rutenberg, A.; Martin, N. G.; Lupton, M. K.; Llewellyn, D. J.; Ranson, J. M.; Cox, S. R.; Luciano, M.; Rockwood, K.; Grotzinger, A. D.","Isabelle F Foote","University of Colorado Boulder, Boulder, Colorado, USA","2024-07-24","1","PUBLISHAHEADOFPRINT","cc_by_nc_nd","geriatric medicine","https://www.medrxiv.org/content/early/2024/07/24/2024.07.24.24310923.source.xml","Frailty is a multifaceted clinical state associated with accelerated aging and adverse health outcomes. Informed etiological models of frailty hold promise for producing widespread health improvements across the aging population. Frailty is currently measured using aggregate scores, which obscure etiological pathways that are only relevant to subcomponents of frailty. Therefore, we performed the first multivariate genome-wide association study of the latent genetic architecture between 30 frailty deficits, which identified 408 genomic risk loci. Our model included a general factor of genetic overlap across all deficits, plus six novel factors indexing shared genetic signal across specific groups of deficits. Follow-up analyses demonstrated the added clinical and etiological value of the six factors, including predicting frailty in external datasets, divergent genetic correlations with clinically relevant outcomes, and unique underlying biology linked to aging. This suggests nuanced models of frailty are key to understanding its causes and how it relates to worse health.","NA","medrxiv",1722204574072
"Autistic voice: Sharing autistic children's experiences and insights","10.1101/2024.07.22.24310796","medrxiv",13.999999999999998,1.35,13.749999999999998,13.999999999999998,13.999999999999998,"Mullally, S. L.; Wood, A. E.; Edwards, C. C.; Connolly, S. E.; Constable, H.; Watson, S.; Rodgers, J.; Rose, K.; King, N.","Sinéad Louise Mullally","Newcastle University","2024-07-24","1","PUBLISHAHEADOFPRINT","cc_no","psychiatry and clinical psychology","https://www.medrxiv.org/content/early/2024/07/24/2024.07.22.24310796.source.xml","Autism research rarely amplifies the voices of autistic children. Here, we aim to counter this by collating and sharing the first-hand experiences and insights of autistic children. A total of 136 children (8-14 years of age) self-reported their experiences of being autistic via a semi-structured online questionnaire/video call. Both qualitative and quantitative data was gathered, and inductive thematic analysis used to analyse qualitative responses. Four core themes were identified:  Safety and Security,  Conformity, Fitting in and Masking,  Identity, and  Sensory Sensitivity. The initial theme of safety and security permeated the childrens narratives and overwhelmingly, the children spoke of the need for them to be alert to who in their lives is a safe person and who is not. They were also highly attuned to whether specific places are safe for them, as past experiences appear to have taught them that their safety in everyday places cannot be assumed. Teachers, health and social care professionals, and neurotypical peers were frequently singled out as unsafe people and school as an unsafe place, whilst parents, home, and autistic peers were often referred to as safe. This distinction was also evident in the statistical analysis of the quantitative data, whereby autistic children were significantly more likely to report that it is okay for them to be autistic at home, relative to when they are at school or with their friends/peers. Judging a person as safe was closely linked to that persons understanding of the child and of their autistic experiences, and understanding was important in establishing trust. When trust was established, it appeared possible for trusted people to facilitate a sense of safety for the children even within otherwise unsafe places. A sense of belonging within autistic/neurodivergent communities was positively linked to the core theme of safety and security and to having a positive autistic identity, whilst masking and sensory distress were linked to feeling unsafe and insecure. These first-hand accounts provide valuable insights into autistic childrens lives and demand that we urgently explore how places outside of the family home (including places of education) can be transformed into safe spaces for autistic children.","NA","medrxiv",1722204574072
"Dynamics of indirect protection against SARS-CoV-2 infection through vaccine and infection-acquired immunity","10.1101/2024.07.23.24310889","medrxiv",35.000000000000014,0,12.7,35.000000000000014,35.000000000000014,"Tan, S. T.; Rodriguez-Barraquer, I.; Kwan, A. T.; Blumberg, S.; Hutchinson, J.; Leidner, D.; Lewnard, J. A.; Sears, D.; Lo, N. C.","Nathan C Lo","Stanford University","2024-07-24","1","PUBLISHAHEADOFPRINT","cc_no","infectious diseases","https://www.medrxiv.org/content/early/2024/07/24/2024.07.23.24310889.source.xml","Early investigation revealed that COVID-19 vaccines confer indirect protection to fully susceptible and unvaccinated persons, defined as a reduced risk of SARS-CoV-2 infection among social contacts of vaccinated individuals. However, indirect protection from infection-acquired immunity and its comparative strength and durability to vaccine-derived indirect protection in the current epidemiologic context of high levels of vaccination, prior infection, and novel variants are not well characterized. Here, we show that both infection-acquired and vaccine-derived immunity independently yield indirect protection to close social contacts with key differences in their strength and waning. Analyzing anonymized data from a system-wide SARS-CoV-2 surveillance program of 177,319 residents across 35 California state prisons from December 2021 to December 2022, we find that vaccine-derived indirect protection against Omicron SARS-CoV-2 infection is strongest within three months post-vaccination [30% (95% confidence interval: 20-38%)], whereas infection-acquired immunity provides 39% (25-51%) indirect protection to roommates for 6 months after SARS-CoV-2 infection, with moderate indirect protection persisting for over one year. Variant-targeted vaccines (bivalent formulation including Omicron subvariants BA.4/BA.5) confer strong indirect protection for at least three months [51% (18-70%)]. These results have important implications for understanding the long-term transmission dynamics of SARS-CoV-2 and can guide vaccine policy and public health measures, especially in high-risk environments such as prisons.","NA","medrxiv",1722204574072
"Cerebellar output shapes cortical preparatory activity during motor adaptation","10.1101/2024.07.12.603354","biorxiv",14.15,1.85,12.65,13.15,14.15,"Israely, S.; Ninou, H.; Rajchert, O.; Elmaleh, L.; Harel, R.; Mawase, F.; Kadmon, J.; Prut, Y.","Jonathan Kadmon","The Hebrew University","2024-07-16","1","new results","cc_by_nc_nd","neuroscience","https://www.biorxiv.org/content/early/2024/07/16/2024.07.12.603354.source.xml","The cerebellum plays a key role in motor adaptation by driving trial-to-trial recalibration of movements based on previous errors. In primates, this adaptive response is achieved by cerebellar modulation of motor cortical signals, but the nature and timing of this process are unknown. Specifically, cortical correlates of adaptation are encoded already in the pre-movement motor plan, but these early cortical signals could be driven by a cerebellar-to-cortical information flow or evolve independently through intracortical mechanisms. To address this question, we trained monkeys to reach against a viscous force field while blocking cerebellar outflow. During the force field trials, the cerebellar block led to impaired adaptation and a compensatory, re-aiming-like shift in motor cortical preparatory activity. In the null-field conditions, the cerebellar block altered neural preparatory activity by increasing task-representation dimensionality and impeding generalization. A computational model indicated that low-dimensional (cerebellar-like) feedback is sufficient to replicate these findings. We conclude that cerebellar signals carry task structure information that constrains the dimensionality of the cortical preparatory manifold and promotes generalization. In the absence of these signals, cortical mechanisms are harnessed to partially restore adaptation.","NA","biorxiv",1722204574072
"An Orthogonal T7 Replisome for Continuous Hypermutation and Accelerated Evolution in E. coli","10.1101/2024.07.25.605042","biorxiv",12.549999999999999,1.5,12.549999999999999,12.549999999999999,12.549999999999999,"Diercks, C. S.; Sondermann, P.; Rong, C.; Dik, D. A.; Gillis, T. G.; Ban, Y.; Schultz, P. G.","Peter G. Schultz","Scripps Research","2024-07-26","1","new results","cc_no","synthetic biology","https://www.biorxiv.org/content/early/2024/07/26/2024.07.25.605042.source.xml","Systems that perform continuous hypermutation of designated genes without compromising the integrity of the host genome can dramatically accelerate the evolution of new or enhanced protein functions. We describe an orthogonal DNA replication system in E. coli based on the controlled expression of the replisome of bacteriophage T7. The system replicates circular plasmids that enable high transformation efficiencies and seamless integration into standard molecular biology workflows. Engineering of T7 DNA polymerase yielded variant proteins with mutation rates of 1.7 x 10-5 substitutions per base in vivo - 100,000-fold above the genomic mutation rate. Continuous evolution using the mutagenic T7 replisome was demonstrated by expanding the substrate scope of TEM-1 {beta}-lactamase and increase activity 1,000-fold against clinically relevant monobactam and cephalosporin antibiotics in less than one week.","NA","biorxiv",1722204574072
