"title","doi","altmetric_jid","score","X1d","X3d","X1w","X1m","authors","author_corresponding","author_corresponding_institution","date","version","type","license","category","jatsxml","abstract","published","server","upupdate_time"
"A role for fibroblast and mural cell subsets in models of neuropathic pain.","10.1101/2024.12.11.627455","biorxiv",5.8,4.55,5.8,5.8,5.8,"Villa-Hernandez, S.; Walker, J. V.; Hore, Z.; Fedele, L.; Zebochin, I.; Li, Y.; Davis, H.; Kanda, T.; Shimizu, F.; Taams, L.; Denk, F.","Franziska Denk","King\\\'s College London","2024-12-13","1","new results","cc_by","neuroscience","https://www.biorxiv.org/content/early/2024/12/13/2024.12.11.627455.source.xml","Neuropathic pain is a particularly intractable type of chronic pain that can result from physical nerve damage due to surgery or entrapment. Here, we present data which suggest that a particular subclass of fibroblast and mural cells may be implicated in the sensory neuron dysfunction that is characteristic of this pain state.

In a mouse model of traumatic painful neuropathy, we used RNA sequencing, cell sorting and nerve tissue clearing to study mesenchymal lineage cells. We show that Pdgfrb+ fibroblasts and mural cells are increased in number for at least two months post-nerve damage and express high levels of known and putative pro-algesic mediators, which are further upregulated in neuropathy.

We go on to demonstrate that a human nerve pericyte line releases a selection of these pro-algesic mediators at protein level. Moreover, conditioned media from stimulated human pericytes induces intra-cellular changes in human induced pluripotent stem cell derived sensory neurons; these changes (phosphorylation of the transcription factor STAT3) have been previously linked to sensory neuron activation.

In summary, our data indicate that mesenchymal cell abnormalities should be considered when developing novel strategies to tackle neuropathic pain.","NA","biorxiv",1734473302830
"Efficient cell-free translation from diverse human cell types","10.1101/2024.12.16.628677","biorxiv",4.45,4.45,4.45,4.45,4.45,"Ziegelmueller, J.; Kouvelas, N.; Thambythurai, P.; Hofer, A.; Muehlemann, O.; Karousis, E. D.","Evangelos D. Karousis","University of Bern Department of Chemistry Biochemistry and Pharmaceutical Sciences","2024-12-16","1","new results","cc_by_nc_nd","biochemistry","https://www.biorxiv.org/content/early/2024/12/16/2024.12.16.628677.source.xml","Cell-free translation systems are indispensable for studying protein synthesis, enabling researchers to explore translational regulation across different cell types. Here, we present a scalable method for preparing translation-competent lysates from a range of frequently used human cell lines using dual centrifugation. We optimized lysis conditions for adherent and suspension cells, producing high-quality lysates from HEK-293 (adherent and in suspension), HeLa, SH-SY5Y, and U2OS cells. Our results demonstrate that cell-specific factors influence translation efficiency, with adherent HeLa cells showing the highest activity. We also observed that sensitivity to lysis conditions varies between cell lines, underscoring the importance of fine-tuning parameters for efficient protein production. Our method provides a robust and adaptable approach for generating cell-type-specific lysates, broadening the application of in vitro translation systems in studying translational mechanisms.","NA","biorxiv",1734473302830
"Group II Introns in Archaeal Genomes and the Evolutionary Origin of Eukaryotic Spliceosomal Introns","10.1101/2024.12.10.627823","biorxiv",7.249999999999999,4.4,7.249999999999999,7.249999999999999,7.249999999999999,"Mattick, J. S. A.; Malik, S.-B.; Delwiche, C. F.","Charles Francis Delwiche","University of Maryland College Park","2024-12-14","1","new results","cc_by_nc","evolutionary biology","https://www.biorxiv.org/content/early/2024/12/14/2024.12.10.627823.source.xml","A key attribute of eukaryotic genomes is the presence of abundant spliceosomal introns that break up many protein-coding genes into multiple exons and must be spliced out during the process of gene expression. These introns are believed to be evolutionarily derived from group II introns, which are known to be widespread in bacteria. One prominent hypothesis is that the spliceosomal intron arose after the endosymbiotic origin of the mitochondrion, as a consequence of transfer of genes containing group II introns from the organelle to nuclear genome; in this model, transfer of group II introns into the ancestral eukaryotic genome set the stage for evolution of the spliceosomal form. However, the recent discovery and sequencing of asgard archaea -- the closest archaeal relatives of extant eukaryotes -- has shed significant light on the composition of the early eukaryotic genome and calls that model into question. Using sequence analysis and structural modeling, we show here the presence of group II intron maturases in the genomes of Heimdallarchaeia and other asgard archaea, and demonstrate by phylogenetic inference that these are closely related to both eukaryotic mitochondrial group II intron maturases and the spliceosome protein PRP8. This suggests that the first intron-containing eukaryotic common ancestor (FIECA) inherited selfish group II introns from its ancestral archaeal genome - the progenitor of the nuclear genome - rather than from the mitochondrial endosymbiont. These observations suggest that the spread and diversification of introns may have occurred independently of the acquisition of the mitochondrion. To better understand the context for intron evolution, we investigate the broader occurrence of group II introns in archaea, identify archaeal clades enriched in group II introns, and perform structural modeling to examine the relationship between the archaeal group II intron maturase and the eukaryotic spliceosome. We propose a model of intron acquisition and expansion during early eukaryotic evolution that places the spread of introns prior to the acquisition of mitochondria, possibly facilitated by the separation of transcription and translation afforded by the nucleus.","NA","biorxiv",1734473302830
"The genetic architecture of gene expression in individuals of African and European ancestry","10.1101/2024.12.13.24318019","medrxiv",4.15,4.15,4.15,4.15,4.15,"Fletez-Brant, K.; Sauteraud, R.; Liang, Y.; Micheletti, S.; Nandakumar, P.; Sugathan, A.; Song, K.; Cavazos, T. B.; Thomas, A.; Tunney, R. J.; Hicks, B.; O'Connell, J.; Shringarpure, S. S.; Kukar, K.; Moreno, M.; DelloRusso, E.; Wong, C. D.; Petrakovitz, A.; Atla, G.; Cortes, A.; Gormley, P.; Howe, L.; Mishra, R.; Seaton, D.; the 23andMe Research Team,  ; Gentleman, R. C.; Pitts, S. J.; Vacic, V.","Vladimir Vacic","23andMe, Inc.","2024-12-16","1","PUBLISHAHEADOFPRINT","cc_by_nc_nd","genetic and genomic medicine","https://www.medrxiv.org/content/early/2024/12/16/2024.12.13.24318019.source.xml","We conducted two large scale studies of the genetics of gene expression in individuals of African ancestry within a cohort of consented 23andMe research participants and in LCL samples from the 1000 Genomes Project African superpopulation. We discovered nearly four times as many eQTLs, compared to tissue-matched eQTL studies in European cohorts. Additionally, we found that the majority of eQTLs were not detectable across populations; those that were, however, were found to be highly concordant. Performing eQTL studies in African ancestry cohorts resulted in more signals per gene and smaller credible sets of causal variants. We showed that comparisons of heritability of gene expression could be confounded by population substructure, but that variation in local genetic ancestry did not majorly impact eQTL discovery. Finally, we showed improvements in variant-to-gene mapping of African-American GWAS signals when using African compared to European ancestry eQTL studies.","NA","medrxiv",1734473302830
"Histopathological Evaluation of Pulmonary Arterial Remodeling in COVID-19","10.1101/2024.12.12.628253","biorxiv",21.05,0,21.05,21.05,21.05,"Gychka, S. G.; Nikolaienko, S. I.; Shults, N. V.; Vasylyk, V. M.; Pasichnyk, B. O.; Kagan, I. V.; Dibrova, Y. V.; Tuffaha, M.; Suzuki, Y. J.","Yuichiro J. Suzuki","Georgetown University","2024-12-13","1","new results","cc_no","pathology","https://www.biorxiv.org/content/early/2024/12/13/2024.12.12.628253.source.xml","A positive-sense single-stranded RNA virus, severe acute respiratory syndrome coronavirus 2 (SARS-CoV-2), caused the coronavirus disease 2019 (COVID-19) pandemic that devastated the world. While this is a respiratory virus, one feature of the SARS-CoV-2 infection was recognized to cause pathogenesis of other organs. Because the membrane fusion protein of SARS-CoV-2, the spike protein, binds to its major host cell receptor angiotensin-converting enzyme 2 (ACE2) that regulates a critical mediator of cardiovascular diseases, angiotensin II, COVID-19 is largely associated with vascular pathologies. In fact, we have previous reported that postmortem lung tissues collected from patients who died of COVID-19 exhibited thickened pulmonary vascular walls and reduced vascular lumen. The present study extended these findings by further characterizing the pulmonary vasculature of COVID-19 patients using larger sample sizes and providing mechanistic information through histological observations. The examination of 56 autopsy lung samples showed thickened vascular walls of small pulmonary arteries after 14 days of disease compared to H1N1 influenza patients who died before COVID- 19 pandemic started. Pulmonary vascular remodeling in COVID-19 patients was associated with hypertrophy of the smooth muscle layer, perivascular fibrosis, edema and lymphostasis, inflammatory infiltration, perivascular hemosiderosis and neoangiogenesis. We found a correlation between the duration of hospital stay and the thickness of the muscular layer of pulmonary arterial walls. These results further confirm that COVID-19 affects the pulmonary vasculature and warrants an evaluation of patients that survived COVID-19 for possible future development of pulmonary arterial hypertension.","NA","biorxiv",1734473302830
"Deconstruction of a memory engram reveals distinct ensembles recruited at learning","10.1101/2024.12.11.627894","biorxiv",27.849999999999994,0,11.75,27.849999999999994,27.849999999999994,"Pouget, C.; Morier, F.; Treiber, N.; Garcia, P. F.; Mazza, N.; Zhang, R.; Reeves, I.; Winston, S.; Brimble, M. A.; Kim, C. K.; Vetere, G.","Gisella Vetere","Cerebral Codes and Circuits Connectivity team, Brain Plasticity Unit, CNRS, ESPCI Paris, PSL Research University; Paris, France","2024-12-12","1","new results","cc_by_nc_nd","neuroscience","https://www.biorxiv.org/content/early/2024/12/12/2024.12.11.627894.source.xml","How are associative memories formed? Which cells represent a memory, and when are they engaged? By visualizing and tagging cells based on their calcium influx with unparalleled temporal precision, we identified non-overlapping dorsal CA1 neuronal ensembles that are differentially active during associative fear memory acquisition. We dissected the acquisition experience into periods during which salient stimuli were presented or certain mouse behaviors occurred and found that cells associated with specific acquisition periods are sufficient alone to drive memory expression and contribute to fear engram formation. This study delineated the different identities of the cell ensembles active during learning, and revealed, for the first time, which ones form the core engram and are essential for memory formation and recall.","NA","biorxiv",1734473302830
"Within-Family GWAS does not Ameliorate the Decline in Prediction Accuracy across Populations","10.1101/2024.12.12.628188","biorxiv",9.349999999999998,1.85,9.349999999999998,9.349999999999998,9.349999999999998,"Zhang, L.; Conley, D.","Dalton Conley","Princeton University","2024-12-13","1","new results","cc_by_nc_nd","genomics","https://www.biorxiv.org/content/early/2024/12/13/2024.12.12.628188.source.xml","As polygenic prediction extends beyond the research domain to involve clinical applications, the urgency of solving the ""portability problem"" becomes amplified--that is, the fact that polygenic indices (PGI) constructed based on discovery analysis in one population (typically of exclusively continental European descent) predict poorly in other populations. In the present paper we test whether population differences in genetic nurture, assortative mating, or population stratification contribute to the fact that polygenic indices constructed based on GWAS results from European-descent samples predict more poorly in admixed populations with Native American and African ancestry. We do this by comparing the rates of decline in prediction accuracy of classical-GWAS-based PGIs versus within-family-based PGIs, each estimated in a population of European descent, as they are deployed in two samples of Latino Americans and African Americans. Within-family GWAS putatively eliminates the effects of parental genetic nurture, assortative mating, and population stratification; thus, we can determine whether without those confounding factors in the PGI construction, the relative prediction accuracy in the out-groups is ameliorated. Results show that relative prediction accuracy is not improved, suggesting that the differences across groups can be almost entirely explained by variation in genetic architecture (i.e. allele frequencies and short-range LD) rather than the aforementioned factors. Additional analysis of the impact of genetic architecture on the decline in prediction accuracy supports this conclusion. Future researchers should test within-family analysis at the prediction rather than the discovery stage.","NA","biorxiv",1734473302830
"Pan-cancer N-glycoproteomic atlas of patient derived xenografts uncovers FAT2 as a therapeutic target for head and neck cancers","10.1101/2024.12.11.627962","biorxiv",9,0,9,9,9,"Govindarajan, M.; Mejia-Guerrero, S.; Chafe, S. C.; Khan, S.; Shi, W.; Waas, M.; Khoo, A.; Liu, L. Y.; Ignatchenko, V.; Principe, S.; Sepiashvili, L.; Tatari, N.; Venugopal, C.; Miletic, P.; Topley, M.; Grewal, S.; McKenna, D.; Sandi, M.-J.; Pham, N.-A.; Casey, A.; Kim, H.; Karamboulas, C.; Meens, J.; Bergqvist, P.; Silva, B.; Chan, P.; Cerna-Portillo, L.; Chin, J.; Rao-Bhatia, A.; Tsao, M.-S.; Khokha, R.; Su, S.; Xu, W.; Goldstein, D.; Ailles, L.; Stambolic, V.; Liu, F.-F.; Cummins, E.; Samudio, I.; Singh, S. K.; Kislinger, T.","Thomas Kislinger","Department of Medical Biophysics, University of Toronto, Toronto, ON M5G 1L7, Canada","2024-12-14","1","new results","cc_no","cancer biology","https://www.biorxiv.org/content/early/2024/12/14/2024.12.11.627962.source.xml","Cell surface proteins offer significant cancer therapeutic potential attributable to their accessible membrane localization and central role in cellular signaling. Despite this, their promise remains largely untapped due to the technical challenges inherent to profiling cell surface proteins. Here, we employed N-glycoproteomics to analyze 85 patient-derived xenografts (PDX), constructing Glyco PDXplorer - an in vivo pan-cancer atlas of cancer-derived cell surface proteins. We developed a target discovery pipeline to prioritize proteins with favorable expression profiles for immunotherapeutic targeting and validated FAT2 as a head and neck squamous cancer (HNSC) enriched surface protein with limited expression in normal tissue. Functional studies revealed that FAT2 is essential for HNSC growth and adhesion through regulation of surface architecture and integrin-PI3K signaling. Chimeric antigen receptor (CAR) T cells targeting FAT2 demonstrated potent anti-tumor activity in HNSC models. This work lays the foundation for developing FAT2-targeted therapies and represents a pivotal resource to inform therapeutic target discovery for multiple cancers.

HIGHLIGHTSO_LIPan-cancer landscape of cancer-derived cell surface proteins detected in vivo
C_LIO_LIDevelopment of a multi-omic discovery pipeline to prioritize proteins with optimal expression profiles as immunotherapy targets
C_LIO_LIIdentification and validation of FAT2 as a head and neck squamous cancer enriched surface protein with minimal expression in normal tissues
C_LIO_LIFAT2 coordinates cell surface organization, adhesion, growth and survival through the integrin-PI3K-AKT pathway
C_LIO_LIFAT2 CAR T cells demonstrate anti-tumour activity in pre-clinical models
C_LI","NA","biorxiv",1734473302830
"An age-specific burial practice reflected in ancient DNA preservation in Neolithic Catalhoyuk","10.1101/2024.12.13.628343","biorxiv",10.799999999999999,1.7,8.2,10.799999999999999,10.799999999999999,"Kucukakdag Dogu, A.; Kucuk Baloglu, F.; Chylenski, M.; Schotsmans, E. M. J.; Klc, M. S.; Vural, K. B.; Yuncu, E.; Kaptan, D.; Guler, M. N.; Yorulmaz, S.; Karabulut, N. B.; Saglcan, E.; Kazanc, D. D.; Milella, M.; Marciniak, A.; Erdal, Y. S.; Pilloud, M. A.; Larsen, C. S.; Gotherstrom, A.; Hodder, I.; Ozer, F.; Haddow, S. D.; Knusel, C. J.; Somel, M.","Mehmet Somel","Department of Biological Sciences, Middle East Technical University","2024-12-13","1","new results","cc_by_nc_nd","evolutionary biology","https://www.biorxiv.org/content/early/2024/12/13/2024.12.13.628343.source.xml","Selective funerary practices can inform about social relationships in prehistoric societies but are often difficult to discern. Here we present evidence for an age-specific practice at the Neolithic site of Catalhoyuk in Anatolia, dating to the 7th millennium BCE. Among ancient DNA libraries produced from 362 petrous bone samples, those of subadults contained three times higher average human DNA than those of adults. This difference in organic preservation was also confirmed by FTIR analysis. Studying similar datasets from seven prehistoric and historical sites, we found a similar age-related difference in only one cemetery. We propose that the organic preservation difference with age was caused by the special treatment of chosen corpses before interment, such as defleshing or drying, which was more frequently applied to Catalhoyuk adults and promoted organic decay.","NA","biorxiv",1734473302830
"Oropouche Virus Outbreak in Southeast, Brazil: Expanding Beyond the Amazonian Endemic Region","10.1101/2024.12.11.24318883","medrxiv",7.4,0,7.15,7.4,7.4,"Delatorre, E.; de Colombo, G. M.; Gatti, F. D.; Co, A. C. G.; Pereira, J. d. P.; Tavares, E. A.; Nodari, J. Z.; Rossi, A.; de Azevedo, S. S. D.; Sacchi, C. T.; Campos, K. R.; Bugno, A.; Alves, L. N. R.; Bonela, L. A. S.; Goulart, J. P.; Souza, T. d. J.; Naveca, F. G.; Ribeiro-Rodrigues, R.","Edson Delatorre","Laboratorio de Genomica e Ecologia Viral, Centro de Ciencias da Saude, Universidade Federal do Espirito Santo, Vitoria, Espirito Santo, Brazil","2024-12-13","1","PUBLISHAHEADOFPRINT","cc_by","epidemiology","https://www.medrxiv.org/content/early/2024/12/13/2024.12.11.24318883.source.xml","The Oropouche virus (OROV), historically endemic to the Amazon, has spread to nearly all Brazilian states in 2024, with Espirito Santo emerging as a significant transmission hotspot in the Atlantic Forest biome. We characterized the epidemiological factors driving OROV spread in non-endemic Southeast Brazil, analyzing environmental and agricultural conditions contributing to viral transmission. Samples from 29,000 suspected arbovirus-infected patients were tested by RT-qPCR for Dengue, Chikungunya, Zika, Mayaro, and Oropouche virus. Between March and June 2024, OROV cases in the state reached 339, demonstrating successful local transmission.

Spatial analysis revealed that most cases clustered in municipalities with tropical climates and intensive cacao, robusta coffee, coconut, and pepper cultivation. Phylogenetic analysis identified the Espirito Santo OROV strains as part of the 2022-2024 Amazonian lineage. The rapid spread of OROV outside the Amazon highlights its adaptive potential and public health threat, emphasizing the need for enhanced surveillance and targeted control measures.","NA","medrxiv",1734473302830
"Fast simulation of identity-by-descent segments","10.1101/2024.12.13.628449","biorxiv",6.95,2.85,6.95,6.95,6.95,"Temple, S. D.; Browning, S. R.; Thompson, E. A.","Seth D Temple","University of Michigan","2024-12-16","1","new results","cc_by","genetics","https://www.biorxiv.org/content/early/2024/12/16/2024.12.13.628449.source.xml","The worst-case runtime complexity to simulate identity-by-descent segments is quadratic in sample size. We propose two main techniques to reduce the compute time, which are motivated by coalescent and recombination processes. We observe average runtimes to simulate detectable IBD segments around a locus that scale approximately linearly in sample size and take a couple of seconds for sample sizes less than ten thousand. In contrast, we find that existing methods to simulate IBD segments take minutes to hours for sample sizes exceeding a few thousand. When using IBD segments to study recent positive selection around a locus, our efficient algorithm makes feasible statistical inferences that would be otherwise intractable.","NA","biorxiv",1734473302830
"Assessing the impact of variation in diagnostic coding among the three countries in the UK Biobank","10.1101/2024.12.13.24319003","medrxiv",6.65,0,6.65,6.65,6.65,"Clifton, L.; Liu, W.; Collister, J. A.; Littlejohns, T. J.; Goldacre, R. R.; Allen, N.; Hunter, D. J.","Lei Clifton","University of Oxford","2024-12-16","2","PUBLISHAHEADOFPRINT","cc_by_nc_nd","epidemiology","https://www.medrxiv.org/content/early/2024/12/16/2024.12.13.24319003.source.xml","Background: The UK Biobank (UKB) study has linked hospital inpatient data collected from England, Scotland, and Wales, which use different clinical coding systems to record health outcomes. Scotland records up to 6 different diagnostic codes for one inpatient episode, compared with up to 20 in England, and 14 in Wales. We assessed the impact of the variations in diagnostic coding among countries on observed disease incidence rates. Methods: We examined the number of diagnoses coded by each country, and then compared the incidence of three diseases between countries: Parkinson's disease (PD), type 2 diabetes (T2D), and dementia. We constructed Cox models for each disease, adjusting for ""country"". Results: England appears to have the highest risk (hazard ratio, HR) for all three diseases, while Scotland appears to have the lowest risk: HR [95% CI] = 0.62 [0.54, 0.72] for PD, 0.49 [0.45, 0.54] for T2D, and 0.88 [0.78, 0.99] for dementia. Conclusions: The observed incidence of these diseases and the estimated effect of ""country"" in Cox models are likely influenced by the clinical coding variations among countries. Researchers need to be aware of this and account for these variations in their analyses.","NA","medrxiv",1734473302830
"A Time Machine for Taxonomy","10.1101/2024.12.11.627987","biorxiv",19.049999999999997,0,5.5,19.049999999999997,19.049999999999997,"Davis-Richardson, A.; Reynolds, T.","Austin Davis-Richardson","One Codex, Inc.","2024-12-16","2","new results","cc_by","bioinformatics","https://www.biorxiv.org/content/early/2024/12/16/2024.12.11.627987.source.xml","The NCBI Taxonomy Database is the primary resource for linking genomic information to taxonomic relationships, widely used across scientific disciplines and critically important to bioinformatics. This database is continuously changing as researchers discover and refine taxonomic relationships. Yet, tracking and comparing past taxonomic states is challenging due to frequent changes and the need to sift through numerous historical snapshots. To address this, we developed the Taxonomy Time Machine: a datafor storing many snapshots of a taxonomic tree in a space-efficient manner. We have also created a web-based and programmatic (API) interface to make this data more accessible. This tool is capable of accurately reconstructing taxonomic lineages at any point in the history of the NCBI Taxonomy Database. We demonstrate that this tool is both perfectly accurate and significantly more efficient than loading and querying individual taxonomy snapshots, enabling its use on desktop computers as well as commodity web servers. We have made this tool available on the web (taxonomy.onecodex.com) as well as open source under the MIT license (https://github.com/onecodex/taxonomy-time-machine).","NA","biorxiv",1734473302830
