"title","doi","altmetric_jid","score","X1d","X3d","X1w","X1m","authors","author_corresponding","author_corresponding_institution","date","version","type","license","category","jatsxml","abstract","funder","published","server","upupdate_time"
"Music-evoked reactivation during continuous perception is associated with enhanced subsequent recall of naturalistic events","10.1101/2025.07.05.663273","biorxiv",35.650000000000006,0,0,1.7,35.650000000000006,"Williams, J. A.; Margulis, E. H.; Baldassano, C.; Hasson, U.; Chen, J.; Norman, K. A.","Kenneth A. Norman","Princeton University","2025-07-06","1","new results","cc_by","neuroscience","https://www.biorxiv.org/content/early/2025/07/06/2025.07.05.663273.source.xml","Music is a potent cue for recalling personal experiences, yet the neural basis of music-evoked memory remains elusive. We address this question by using the full-length film Eternal Sunshine of the Spotless Mind to examine how repeated musical themes reactivate previously encoded events in cortex and shape next-day recall. Participants in an fMRI study viewed either the original film (with repeated musical themes) or a no-music version. By comparing neural activity patterns between these groups, we found that music-evoked reactivation of neural patterns linked to earlier scenes in the default mode network was associated with improved subsequent recall. This relationship was specific to the music condition and persisted when we controlled for a proxy measure of initial encoding strength (spatial intersubject correlation), suggesting that music-evoked reactivation may play a role in making event memories stick that is distinct from what happens at initial encoding.","[{""name"":""National Institutes of Health"",""id"":""https://ror.org/01cwqze88"",""id-type"":""ROR"",""award"":""F99 NS118740;R01 MH112357;""}]","NA","bioRxiv",1754345412035
"Spatial joint profiling of DNA methylome and transcriptome in mammalian tissues","10.1101/2025.07.01.662607","biorxiv",35.30000000000001,0,0,0,35.30000000000001,"Lee, C. N.; Fu, H.; Cardilla, A.; Zhou, W.; Deng, Y.","Yanxiang Deng","University of Pennsylvania","2025-07-04","1","new results","cc_by_nd","genomics","https://www.biorxiv.org/content/early/2025/07/04/2025.07.01.662607.source.xml","The spatial resolution of omics dynamics is fundamental to understanding tissue biology. Spatial profiling of DNA methylation, which is a canonical epigenetic mark extensively implicated in transcriptional regulation, remains an unmet demand. Here, we introduce a method for whole genome spatial co-profiling of DNA methylation and transcriptome of the same tissue section at near single-cell resolution. Applying this technology to mouse embryogenesis and postnatal brain resulted in rich DNA-RNA bimodal tissue maps. These maps revealed the spatial context of known methylation biology and its interplay with gene expression. The two modalities concordance and distinction in spatial patterns highlighted a synergistic molecular definition of cell identity in spatial programming of mammalian development and brain function. By integrating spatial maps of mouse embryos at two different developmental stages, we reconstructed the dynamics of both epigenome and transcriptome underlying mammalian embryogenesis, revealing details in sequence, cell type, and region-specific methylation-mediated transcriptional regulation. This method extends the scope of spatial omics to DNA cytosine methylation for a more comprehensive understanding of tissue biology over development and disease.","[{""name"":""National Institutes of Health"",""id"":""https://ror.org/01cwqze88"",""id-type"":""ROR"",""award"":""DP2AI177913;R35GM146978;""},{""name"":""Packard Fellowship for Science and Engineering"",""id"":"""",""id-type"":""ROR"",""award"":""""}]","NA","bioRxiv",1754345412035
"Borzoi-informed fine mapping improves causal variant prioritization in complex trait GWAS","10.1101/2025.07.09.663936","biorxiv",34.64999999999999,0,0,0,34.64999999999999,"Srivastava, D.; Korsakova, A.; Wang, Q.; Ruiz, L.; Yuan, H.; Kelley, D. R.","David R Kelley","Calico Life Sciences","2025-07-14","1","new results","cc_by_nc_nd","genetics","https://www.biorxiv.org/content/early/2025/07/14/2025.07.09.663936.source.xml","1Genome-wide association studies (GWAS) have identified thousands of trait-associated loci. Prioritizing causal variants within these loci is critical for characterizing trait biology. Statistical fine mapping identifies causal variants at trait-associated loci, but linkage disequilibrium (LD) and limited GWAS sample sizes prevent the resolution of many associations. Functionally informed approaches augment fine mapping by estimating variant prior causal probabilities based on overlap with trait-relevant functional annotations. However, functional enrichment provides only an indirect proxy for variant functional impact. Sequence-to-function models directly estimate variant effects on molecular phenotypes from underlying sequence context. Borzoi is a long-context model that predicts sequence determinants of transcription, splicing, and polyadenylation across diverse tissues and cell types. Here we present Sniff, a Borzoi-informed fine-mapping approach that integrates broad genomic functional annotations with Borzoi-predicted variant effects via PolyFun to estimate variant prior causal probabilities. Applied to 15 UK Biobank traits, Sniff identifies 9.45% additional fine-mapped variants compared to PolyFun-Baseline at posterior inclusion probability (PIP) > 0.8. Sniff-prioritized variants exhibit allele-specific activity in reporter assays and are predicted to have tissue-specific activity in trait-relevant tissues. For most traits, genes nominated by Sniff receive higher scores from the orthogonal gene prioritization method PoPS compared to genes nominated using functional annotations alone. Because differentially prioritized variants are driven by Borzoi predictions, we leverage attribution techniques to characterize sequence features underlying fine mapping and generate mechanistic hypotheses for GWAS associations.","NA","NA","bioRxiv",1754345412035
"H3K4me3 is a post-transcriptional histone mark","10.1101/2025.07.03.662929","biorxiv",32.95,0,0,0,32.95,"Walvekar, K. P.; Chilaka, S.","Sabarinadh Chilaka","CSIR-Indian Institute of Chemical Technology","2025-07-05","1","new results","cc_no","molecular biology","https://www.biorxiv.org/content/early/2025/07/05/2025.07.03.662929.source.xml","Histone H3 Lysine 4 trimethylation (H3K4me3) is widely recognized as a hallmark of actively transcribed gene promoters, yet its precise role in transcriptional regulation remains unresolved1-4. Here we present the first direct evidence that H3K4me3 is not a cause but a consequence of transcriptional activation, functioning as a downstream epigenetic response. Using inducible gene models to study temporally resolved transcriptional dynamics, we demonstrate that H3K4me3 enrichment significantly lags behind the transcriptional peaks of inflammatory genes such as TNF- and IL-1{beta}, appearing hours after maximal RNA synthesis. This delayed deposition contrasts sharply with the early accumulation of other active histone marks, including H3K27ac and H4K8ac, and with the recruitment of canonical transcriptional regulators such as phosphorylated RNA polymerase II, NF-{kappa}B, and chromatin modifier, histone acetyltransferase p300. Pharmacological inhibition of transcription with Actinomycin D reduces H3K4me3 enrichment, while knockdown of MLL1 abolishes H3K4me3 without affecting gene activation, indicating that H3K4me3 deposition is transcription-dependent but dispensable for transcriptional initiation. Furthermore, analysis of the constitutively active MYC gene suggests that post-transcriptional H3K4me3 deposition may be a general feature of active transcription. Together, these findings redefine H3K4me3 as a post-transcriptional histone mark, revealing an unexpected layer of epigenetic regulation with broad implications for gene expression control.","NA","NA","bioRxiv",1754345412035
"Neural Connectome of the Ctenophore Statocyst","10.1101/2025.06.26.661250","biorxiv",31.750000000000014,0,0,0,31.750000000000014,"Jokura, K.; Jasek, S.; Niederhaus, L.; Burkhardt, P.; Jekely, G.","Gáspár Jékely","Heidelberg University: Heidelberg, Germany","2025-07-11","2","new results","cc_by_nc","animal behavior and cognition","https://www.biorxiv.org/content/early/2025/07/11/2025.06.26.661250.source.xml","Ctenophores possess a unique gravity receptor (statocyst) in their aboral organ formed by four clusters of ciliated balancer cells that collectively support a statolyth. During reorientation, differential load on the balancer cilia leads to altered beating of the ciliated comb rows to elicit turns. To study the neural bases of gravity sensing, we imaged by volume electron microscopy (vEM) the aboral organ of the ctenophore Mnemiopsis leidyi. We reconstructed 972 cells, including syncytial neurons that form a nerve net. The syncytial neurons synapse on the balancer cells and also form reciprocal connection with the bridge cells that span the statocyst. High-speed imaging revealed that balancer cilia beat and arrest in a coordinated manner but with differences between the sagittal and tentacular planes of the animal, reflecting nerve-net organisation. Our results suggest a coordinating rather than sensory-motor function for the nerve net and inform our understanding of the diversity of nervous-system organisation across animals.","[{""name"":""European Research Council"",""id"":""https://ror.org/0472cxd90"",""id-type"":""ROR"",""award"":""101020792;""}]","NA","bioRxiv",1754345412035
"Architecture and Function of Holocentric CENP-A-Independent Kinetochores","10.1101/2025.07.14.664805","biorxiv",31.400000000000006,0,0,4.4,31.400000000000006,"Yu, C.; Sankaranarayanan, S. R.; Cornilleau, G.; Howes, A. C.; Azumaya, C.; Zilberleyb, I.; Brillantes, B.; Cheung, T. K.; Dec, L.; Loew, D.; Tran, P.; Rose, C. M.; Drinnenberg, I. A.; Ciferri, C.; Yatskevich, S.","Stanislau Yatskevich","Genentech","2025-07-15","1","new results","cc_by_nc","cell biology","https://www.biorxiv.org/content/early/2025/07/15/2025.07.14.664805.source.xml","Kinetochores are essential macromolecular complexes that anchor chromosomes to the mitotic spindle to ensure faithful cell division1. Despite their critical role, the structural organization of kinetochores assembled on centromeres with vastly distinct architectures across diverse species remains poorly understood2,3. To address this question, we determined the cryo-EM structures of the inner kinetochore (CCAN) from the silkmoth Bombyx mori, an insect that lacks the canonical centromere-specifying histone variant CENP-A and exhibits chromosome-wide centromeric activity (holocentric). Our analysis reveals that B. mori CCAN assembles via atypical histone-fold protein dimerization into a self-contained, head-to-head dimer that topologically entraps and loops DNA, creating a point-centromere-like architecture. This structure also incorporates four previously uncharacterized Centromeric Subunit proteins that are evolutionarily repurposed from the outer kinetochore Dam1/DASH complex. Our work establishes this self-contained CCAN dimer as a key structural unit that forms the basis of a holocentric organization and suggests that large-scale centromere architectures can emerge from the modular arrangement of such discrete kinetochore units.","[{""name"":""The LabEx DEEP"",""id"":"""",""id-type"":""ROR"",""award"":""ANR-11-LABX-0044;""},{""name"":""Institut Curie ATIP-AVENIR Research grant"",""id"":"""",""id-type"":""ROR"",""award"":""""},{""name"":""Fondation Schlumberger pour l’Education et la Recherche"",""id"":"""",""id-type"":""ROR"",""award"":""FSER202202015420;""},{""name"":""European Research Council"",""id"":""https://ror.org/0472cxd90"",""id-type"":""ROR"",""award"":""CENEVO-758757;""},{""name"":""French National Centre for Scientific Research"",""id"":""https://ror.org/02feahw73"",""id-type"":""ROR"",""award"":""""},{""name"":""EMBO LTF"",""id"":"""",""id-type"":""ROR"",""award"":""505-2021;""}]","NA","bioRxiv",1754345412035
"CF2H: a Cell-Free Two-Hybrid platform for rapid protein binder screening","10.1101/2025.07.16.665152","biorxiv",30.850000000000005,0,0,0,30.850000000000005,"Capin, J.; Mayonove, P.; DeVisch, A.; Becher, A.; Ngo, G.; Courbet, A. P.; Ragotte, R. J.; Cohen-Gonsaud, M.; Espeut, J.; Bonnet, J.","Jerome Bonnet","Centre de Biochimie Structurale (CBS)","2025-07-16","1","new results","cc_by_nc_nd","synthetic biology","https://www.biorxiv.org/content/early/2025/07/16/2025.07.16.665152.source.xml","Protein binders that detect, activate, inhibit or otherwise modulate their targets are pivotal for biomedical applications. With the increasing accuracy and accessibility of de novo protein design, faster and cheaper experimental screening methods would democratize and accelerate the identification of high-affinity binders. Here we present Cell-Free Two-Hybrid (CF2H), a rapid and sensitive method for detecting high-affinity protein-protein interactions (PPI) that does not require cloning, protein purification nor high-end laboratory equipment. CF2H uses a dimerization-activated DNA binding domain (DBD) fused to prey and bait proteins to trigger transcription upon protein-protein interaction. We demonstrate that CF2H enables the detection of interactions between various types of target and binder proteins such as single-domain antibodies, DARPins and de novo designed binders. We benchmark CF2H as a screening platform by validating previously reported binders for Mdm2 and discover high-affinity binders targeting the checkpoint inhibitor PD-L1 in less than 24 hours. Finally, we show that CF2H can be used to characterize small-molecules modulators of PPI and detect protein biomarkers, opening the door for a new class of cell-free biosensors.","[{""name"":""Inserm"",""id"":""https://ror.org/02vjkv261"",""id-type"":""ROR"",""award"":""""},{""name"":""European Commission"",""id"":""https://ror.org/00k4n6c32"",""id-type"":""ROR"",""award"":""965018;""}]","NA","bioRxiv",1754345412035
"Evolutionary repurposing of a DNA segregation machinery into a cytoskeletal system controlling cyanobacterial cell shape","10.1101/2025.06.27.661541","biorxiv",30.650000000000013,0,0,0,30.650000000000013,"Springstein, B. L.; Javoor, M. G.; Megrian, D.; Hajdu, R.; Hanke, D. M.; Loose, M.; Schur, F. K.","Benjamin Lennart Springstein","Institute of Science and Technology Austria (ISTA)","2025-06-29","1","new results","cc_by_nc_nd","microbiology","https://www.biorxiv.org/content/early/2025/06/29/2025.06.27.661541.source.xml","Bacteria, despite their diversity, use conserved cytoskeletal systems for their intracellular organization. In unicellular bacteria, the ParMRC DNA partitioning apparatus is well known for forming actin-like filaments that push low copy number plasmids to opposite cell poles. In multicellular cyanobacteria such as Anabaena sp. PCC 7120, the presence of a chromosomally encoded ParMR system suggests it may play an analogous role in chromosome segregation. However, we show here that it instead constitutes a novel cytoskeletal system - termed CorMR - whose loss does not impair DNA segregation but leads to severe morphological defects, revealing a role in maintaining cell shape. Using live-cell imaging and in vitro reconstitution experiments, we demonstrate that CorM forms dynamically instable filaments. These filaments are recruited to the membrane by CorR, which has acquired a conserved N-terminal amphipathic helix specific to multicellular cyanobacteria. Cryo-EM analysis reveals that CorM forms antiparallel double-stranded filaments, in contrast to the polar, parallel filament pair seen in ParM. Furthermore, CorMR filaments are excluded from the cell poles and division plane by MinC, via a long N-terminal extension also specific to multicellular cyanobacteria. Comparative genomics suggests that cyanobacterial multicellularity co-evolved with the chromosomal relocation of ParMR genes, acquisition of the amphipathic helix in CorR, and functional extension of MinC, supporting an evolutionary link among these features. Our findings uncover a striking repurposing of ancestral biochemical systems, expanding the known roles of ParMR and Min systems beyond plasmid segregation and division site selection to include regulation of cell shape.

ImportanceThe ParMRC system is a well-characterized machinery for the segregation of low-copy-number plasmids to the cell poles and, until now, was primarily described to be encoded on plasmids. We found that during the emergence of multicellularity in cyanobacteria, a chromosome-encoded ParMR system has undergone extensive evolutionary and functional repurposing, resulting in a previously undescribed bacterial cytoskeletal system that controls cell shape. We also found that this new cytoskeleton, called CorMR, is under the control of the MinCDE system, which has evolved to not only antagonize Z-ring formation, but also to regulate CorM polymerization. Such interplay between different cytoskeletal systems highlights an intricate regulatory mechanism linking cell division and morphology. As this repurposing of existing cytoskeletal system coincided with the emergence of multicellularity in cyanobacteria, it may have played a key role for the evolution of cyanobacteria with distinct cell shapes. Overall, our discovery highlights the plasticity of bacterial polymeric systems and gives insight into the evolution of cellular and multicellular complexity.","[{""name"":""European Union’s Horizon 2020"",""id"":"""",""id-type"":""ROR"",""award"":""Marie Sk&#322;odowska-Curie Grant Agreement No.101034413;""},{""name"":""European Research Council"",""id"":""https://ror.org/0472cxd90"",""id-type"":""ROR"",""award"":""ActinID, 101076260;""}]","NA","bioRxiv",1754345412035
"Methylation dynamics in the decades preceding acute myeloid leukaemia","10.1101/2025.06.26.661643","biorxiv",29.749999999999996,0,0,0,29.749999999999996,"Fonseca, A. V.; Boniface, C. T.; Watson, C.; Hackett, S.; Gabbutt, C.; Ramos-Yamasaki, A. D.; Tan, A. B.; Montoya, J. M.; Strogantsev, R.; Hanssen, L.; Zhang, Y.; Apostolidou, S.; Gentry-Maharaj, A.; Esener, S.; Spellman, P.; Graham, T.; Menon, U.; Mohammed, H.; Blundell, J. R.","Jamie R Blundell","University of Cambridge","2025-06-27","1","new results","cc_by_nc","genomics","https://www.biorxiv.org/content/early/2025/06/27/2025.06.26.661643.source.xml","DNA methylation is emerging as a highly sensitive and specific marker of cancer initiation and progression. How these cancer-specific methylation changes are established in the decades before cancer, however, remains largely unknown. Here, we use a unique collection of longitudinal blood samples collected annually up to 15 years prior to a diagnosis of acute myeloid leukaemia to sensitively track the dynamics of DNA methylation changes at high temporal resolution. We identify thousands of differentially methylated regions (DMRs) that exhibit altered patterns of methylation up to 10 years before acute myeloid leukaemia (AML) diagnosis. Most of these DMRs are strongly associated with expanding clones carrying somatic driver mutations. We identify a subset of  epigenetic driver DMRs characterised by recurrent CpG alterations that are highly shared across pre-AML cases. These are likely to reflect early epigenetic reprogramming associated with AML development. We also reveal large numbers of stochastic  passenger CpGs whose differential methylation results from hitch-hiking with clonal expansions driven by somatically acquired genetic events. These passenger CpGs can be exploited for lineage tracing to discover clonal expansions driven by missing driver mutations. Our findings show widespread changes in methylation patterns during the early stages of cancer development which could be utilised for risk prediction and therapeutic intervention.","NA","NA","bioRxiv",1754345412035
"Structural modeling reveals viral proteins that manipulate host immune signaling","10.1101/2025.07.12.664507","biorxiv",29.150000000000013,0,0,0,29.150000000000013,"Tal, N.; Hadari, R.; Chang, R. B.; Osterman, I.; Jacobson, R.; Yirmiya, E.; Bechon, N.; Hochhauser, D.; Rivera, M. L.; Madhala, B.; Garb, J.; Wein, T.; Kranzusch, P.; Amitai, G.; Sorek, R.","Rotem Sorek","Weizmann Institute of Science","2025-07-12","1","new results","cc_by_nc_nd","microbiology","https://www.biorxiv.org/content/early/2025/07/12/2025.07.12.664507.source.xml","Immune pathways that use intracellular nucleotide signaling are common in animals, plants and bacteria. Viruses can inhibit nucleotide immune signaling by producing proteins that sequester or cleave the immune signals. Here we analyzed evolutionarily unrelated signal-sequestering viral proteins, finding that they share structural and biophysical traits in their genetic organization, ternary structures and binding pocket properties. Based on these traits we developed a structure-guided computational pipeline that can sift through large phage genome databases to unbiasedly predict phage proteins that manipulate bacterial immune signaling. Numerous previously uncharacterized proteins, grouped into three families, were verified to inhibit the bacterial Thoeris and CBASS signaling systems. Proteins of the Sequestin and Lockin families bind and sequester the TIR-produced signaling molecules 3'cADPR and His-ADPR, while proteins of the Acb5 family cleave and inactivate 3'3'-cGAMP and related molecules. X-ray crystallography and structural modeling, combined with mutational analyses, explain the structural basis for sequestration or cleavage of the immune signals. Thousands of these signal-manipulating proteins were detected in phage protein databases, with some instances present in well-studied model phages such as T2, T4 and T6. Our study explains how phages commonly evade bacterial immune signaling, and offers a structure-guided analytical approach for discovery of viral immune-manipulating proteins in any database of choice.","NA","NA","bioRxiv",1754345412035
"Identifying phage proteins that activate the bacterial innate immune system","10.1101/2025.07.02.662641","biorxiv",28.200000000000003,0,0,0,28.200000000000003,"Nagy, T. A.; Gersabeck, G. W.; Conte, A. N.; Whiteley, A. T.","Aaron T. Whiteley","University of Colorado Boulder","2025-07-02","1","new results","cc_by_nc_nd","microbiology","https://www.biorxiv.org/content/early/2025/07/02/2025.07.02.662641.source.xml","Bacteria have evolved sophisticated antiphage systems that halt phage replication upon detecting specific phage triggers. Identifying phage triggers is crucial to our understanding of immune signaling, however, they are challenging to predict. Here we used an expansive plasmid library that expressed 400 phage protein-coding genes from 6 different phages to identify novel triggers of known and undiscovered antiphage systems. We transformed our library into 72 diverse strains of E. coli. Each strain natively harbors a different suite of antiphage systems whose activation typically inhibits growth. By tracking plasmids that were selectively depleted, we identified over 100 candidate phage trigger-E. coli pairs. Two phage trigger proteins were investigated in detail, revealing a novel antiphage system that detects multiple phage tail fiber proteins and identifying major capsid protein as the activating ligand of the antiphage system Avs8. These experiments provide a unique dataset for continued definition of the molecular details of the bacterial immune system.","[{""name"":""National Institutes of Health"",""id"":""https://ror.org/01cwqze88"",""id-type"":""ROR"",""award"":""""},{""name"":""Pew Charitable Trusts"",""id"":""https://ror.org/02xhk2825"",""id-type"":""ROR"",""award"":""""},{""name"":""Boettcher Foundation"",""id"":""https://ror.org/0277pn602"",""id-type"":""ROR"",""award"":""""},{""name"":""Burroughs Wellcome Fund"",""id"":""https://ror.org/01d35cw23"",""id-type"":""ROR"",""award"":""""}]","NA","bioRxiv",1754345412035
