"title","doi","altmetric_jid","score","X1d","X3d","X1w","X1m","authors","author_corresponding","author_corresponding_institution","date","version","type","license","category","jatsxml","abstract","published","server","upupdate_time"
"Conformational asymmetry of replicated human chromosomes","10.1101/2025.07.09.663929","biorxiv",48.55000000000004,35.800000000000026,48.55000000000004,48.55000000000004,48.55000000000004,"Corsi, F.; Kolesnikova, S.; Steinacker, T. L.; Takacs, Z.; Batty, P.; Mitter, M.; Gerlich, D. W.; Goloborodko, A.","Anton Goloborodko","Institute of Molecular Biotechnology of the Austrian Academy of Sciences","2025-07-14","1","new results","cc_by","molecular biology","https://www.biorxiv.org/content/early/2025/07/14/2025.07.09.663929.source.xml","DNA replication creates two sister chromatids that must acquire specific three-dimensional conformations to support genome function and stability. This organization is largely mediated by cohesin complexes, which extrude intra-chromosomal loops and link two chromatids, thus forming ""chromatid cohesion"". Although sister chromatids are genetically identical, the replication process is intrinsically asymmetric: each chromatid inherits a different parental DNA strand, while the new strands are synthesized using distinct ""leading"" and ""lagging"" mechanisms of the replication fork. Whether and how this molecular asymmetry impacts higher-order chromatin organization remains unknown. Using sister-chromatid-sensitive Hi-C, strand-specific FISH, and polymer modeling, we reveal a consistent, genome-wide shift in sister chromatid alignment, biased along the 5'-3' direction of the inherited strands. This shift persists without loop extrusion but is lost upon disruption of cohesion, implicating cohesive cohesins in maintaining the displacement. Polymer simulations indicate that a modest ([~]100 kb) misalignment of ""cohesive"" cohesins is responsible for the observed asymmetry. We propose two mechanistic models that explain how this displacement arises from replication fork asymmetry: either through the dislocation of cohesin during replication or through the asymmetric anchoring and subsequent random sliding of cohesin pairs. These findings reveal a previously unrecognized chromosome-scale asymmetry in sister chromatid organization, which has implications for homology search during DNA repair.","NA","biorxiv",1752703875454
"mamp-ml: A deep learning approach to epitope immunogenicity in plants","10.1101/2025.07.11.664399","biorxiv",33.45000000000001,32.70000000000001,33.45000000000001,33.45000000000001,33.45000000000001,"Stevens, D. M.; Yang, D.; Liang, T. J.; Li, T.; Vega, B.; Coaker, G.; Krasileva, K.","Ksenia Krasileva","University of California, Berkeley","2025-07-15","1","new results","cc_by_nc","immunology","https://www.biorxiv.org/content/early/2025/07/15/2025.07.11.664399.source.xml","Eukaryotes detect biomolecules through surface-localized receptors, key signaling components. A subset of receptors survey for pathogens, induce immunity, and restrict pathogen growth. Comparative genomics of both hosts and pathogens has unveiled vast sequence variation in receptors and potential ligands, creating an experimental bottleneck. We have developed mamp-ml, a machine learning framework for predicting plant receptor-ligand interactions. We leveraged existing functional data from over two decades of foundational research, together with the large protein language model ESM-2, to build a pipeline and model that predicts immunogenic outcomes using a combination of receptor-ligand features. Our model achieves 73% prediction accuracy on a held-out test set, even when an experimental structure is lacking. Our approach enables high-throughput screening of LRR receptor-ligand combinations and provides a computational framework for engineering plant immune systems.","NA","biorxiv",1752703875454
"A plant pathogen effector blocks stepwise assembly of a helper NLR resistosome","10.1101/2025.07.14.664264","biorxiv",32.35000000000001,23.300000000000004,32.35000000000001,32.35000000000001,32.35000000000001,"Seager, B. A.; Harant, A.; Contreras, M. P.; Hou, L.-Y.; Wu, C.-H.; Kamoun, S.; Madhuprakash, J.","Jogi Madhuprakash","University of Hyderabad","2025-07-14","1","new results","cc_by","plant biology","https://www.biorxiv.org/content/early/2025/07/14/2025.07.14.664264.source.xml","Helper NLRs function as central nodes in plant immune networks. Upon activation, they oligomerize into inflammasome-like resistosomes to initiate immune signaling, yet the dynamics of resistosome assembly remain poorly understood. Here, we show that the virulence effector AVRcap1b from the Irish potato famine pathogen Phytophthora infestans suppresses immune activation by directly engaging oligomerization intermediates of the tomato helper NLR SlNRC3. Cryo-EM structures of SlNRC3 in AVRcap1b-bound and unbound states reveal that AVRcap1b bridges multiple protomers, stabilizing a stalled intermediate and preventing formation of a functional resistosome. Leveraging AVRcap1b as a molecular tool, we also capture an additional SlNRC3 resistosome intermediate showing that assembly proceeds in a stepwise manner from dissociated monomers. These findings uncover a previously unrecognized vulnerability in NLR activation and reveal a pathogen strategy that disrupts immune complex assembly. This work advances mechanistic understanding of resistosome formation and uncovers a previously unrecognized facet of pathogen-plant coevolution.","NA","biorxiv",1752703875454
"Effector Innovation in Genome-Reduced Phytoplasmas and Other Host-Dependent Mollicutes","10.1101/2025.07.14.664665","biorxiv",17.9,16.15,17.9,17.9,17.9,"Mirkin, F. G.; Mugford, S. T.; Thole, V.; Marzo, M.; Hogenhout, S. A.","Saskia A. Hogenhout","John Innes Centre","2025-07-14","1","new results","cc_by","microbiology","https://www.biorxiv.org/content/early/2025/07/14/2025.07.14.664665.source.xml","Obligate host-associated bacteria with reduced genomes, such as phytoplasmas, face strong evolutionary constraints, including metabolic dependence on hosts, limited horizontal gene transfer (HGT), and frequent population bottlenecks. Despite these limitations, phytoplasmas, which are parasitic, insect-transmitted plant pathogens maintain a diverse arsenal of secreted effectors that manipulate both plant and insect hosts to promote infection and transmission. These effectors can suppress immunity and reprogram plant development, including witchs broom and leaf-like flowers, through ubiquitin-independent degradation of key transcription factors. However, how phytoplasmas diversify and maintain these effectors in the absence of frequent genetic exchange remains unclear. To address this, we analysed the effectoromes of 239 phytoplasma genomes and identified a diverse set of secreted proteins, which we designated as Phytoplasma-Associated Molecular Effectors (PhAMEs). We found that PhAMEs targeting evolutionarily conserved and structurally constrained surfaces of host proteins are widespread across phytoplasmas. These effectors adopt compact, efficient folds. They often function as molecular scaffolds with dual interaction surfaces capable of linking host proteins or integrating signalling pathways. Such scaffolding PhAMEs have evolved multiple times independently, providing clear evidence of convergent evolution. Despite severe genomic constrains imposed by genome reduction and limited HGT, gene duplications, interface variations, domain fusions, and repeat expansions have helped the shaping effector fold and diversity. While the overall effector repertoire of phytoplasmas appeared largely unique, some PhAME domains share similarities with proteins from other mollicutes and pathogens. Collectively, our findings shed light on how genome-reduced bacteria innovate molecular functions and offer insights into phytoplasma biology, effector evolution, and host-pathogen dynamics. They also lay the groundwork for protein engineering approaches aimed at discovering or designing novel biomolecules with biotechnological potential.","NA","biorxiv",1752703875454
"Principled measures and estimates of trait polygenicity","10.1101/2025.07.10.664154","biorxiv",14.849999999999998,14.849999999999998,14.849999999999998,14.849999999999998,14.849999999999998,"O'Connor, L. J.; Sella, G.","Luke J O'Connor","Harvard Medical School","2025-07-15","1","new results","cc_by_nc","genetics","https://www.biorxiv.org/content/early/2025/07/15/2025.07.10.664154.source.xml","The 'polygenicity' of traits is often invoked and sometimes quantified in quantitative, statistical, and human genetics. What do we mean by the polygenicity of a trait? We propose a principled definition that encompasses a range of polygenicity measures. We show that these measures satisfy certain mathematical properties, we argue that these properties are sensible if not necessary, and we show that, conversely, measures that satisfy these properties also satisfy our definition. We consider four specific measures in greater detail, describe how they differ and show that three of them can be estimated from GWAS summary statistics using an existing method, Fourier Mixture Regression. We estimate these measures for 36 traits in humans. We find a dearth of traits with polygenicity values that fall within the large gap between Mendelian and highly polygenic traits. We discuss the evolutionary and cellular processes underlying trait polygenicity.","NA","biorxiv",1752703875454
"A gradient of complementary learning systems emerges through meta-learning","10.1101/2025.07.10.664201","biorxiv",13.349999999999998,13.349999999999998,13.349999999999998,13.349999999999998,13.349999999999998,"Zhou, Z.; Schapiro, A.","Zhenglong Zhou","University of Pennsylvania","2025-07-16","1","new results","cc_by","neuroscience","https://www.biorxiv.org/content/early/2025/07/16/2025.07.10.664201.source.xml","Long-term learning and memory in the primate brain rely on a series of hierarchically organized subsystems extending from early sensory neocortical areas to the hippocampus. The components differ in their representational attributes and plasticity, with evidence for sparser, more decorrelated activity and faster plasticity in regions higher up in the hierarchy. How and why did the brain arrive at this organization? We explore the principles that allow such an organization to emerge by simulating a hierarchy of learning subsystems in artificial neural networks (ANNs) using a meta-learning approach. As ANNs optimized weights for a series of tasks, they concurrently meta-learned layer-wise plasticity and sparsity parameters. This approach enhanced the computational efficiency of ANNs, promoting hidden activation sparsity while benefitting task performance. Meta-learning also gave rise to a brain-like hierarchical organization, with higher layers displaying faster plasticity and a sparser, more pattern-separated neural code than lower layers. Early layers peaked early in their plasticity and stabilized, whereas higher layers continued to develop and maintained elevated plasticity over time, mirroring empirical developmental trajectories. Moreover, when trained on dual tasks imposing competing demands for item discrimination and categorization, ANNs with parallel pathways developed distinct representational and plasticity profiles, convergent with the distinct properties observed empirically across intra-hippocampal pathways. These results suggest that the macroscale organization and development of heterogeneous learning subsystems in the brain may emerge in part from optimizing biological variables that govern plasticity and sparsity.","NA","biorxiv",1752703875454
"Architecture and Function of Holocentric CENP-A-Independent Kinetochores","10.1101/2025.07.14.664805","biorxiv",18.749999999999996,12.299999999999999,18.749999999999996,18.749999999999996,18.749999999999996,"Yu, C.; Sankaranarayanan, S. R.; Cornilleau, G.; Howes, A. C.; Azumaya, C.; Zilberleyb, I.; Brillantes, B.; Cheung, T. K.; Dec, L.; Loew, D.; Tran, P.; Rose, C. M.; Drinnenberg, I. A.; Ciferri, C.; Yatskevich, S.","Stanislau Yatskevich","Genentech","2025-07-15","1","new results","cc_by_nc","cell biology","https://www.biorxiv.org/content/early/2025/07/15/2025.07.14.664805.source.xml","Kinetochores are essential macromolecular complexes that anchor chromosomes to the mitotic spindle to ensure faithful cell division (1). Despite their critical role, the structural organization of kinetochores assembled on centromeres with vastly distinct architectures across diverse species remains poorly understood (2,3). To address this, we determined the cryo-EM structures of the inner kinetochore (CCAN) from the silkmoth Bombyx mori, an insect that lacks the canonical centromere-specifying histone variant CENP-A and exhibits chromosome-wide centromeric activity (holocentric). Our analysis reveals that B. mori CCAN assembles via atypical histone-fold protein dimerization into a self-contained, head-to-head dimer that topologically entraps and loops DNA, creating a point-centromere-like architecture. This structure also incorporates four previously uncharacterized Centromeric Subunit proteins that are evolutionarily repurposed from the outer kinetochore Dam1/DASH complex. Our work establishes this self-contained CCAN dimer as a key structural unit that forms the basis of a holocentric organization and suggests that large-scale centromere architectures can emerge from the modular arrangement of such discrete kinetochore units.","NA","biorxiv",1752703875454
"Connectomic reconstruction from hippocampal CA3 reveals spatially graded mossy fiber inputs and selective feedforward inhibition to pyramidal cells","10.1101/2025.07.09.663979","biorxiv",16.2,11.1,16.2,16.2,16.2,"Zheng, Z.; Park, C.; Hammerschmith, E. W.; Lu, R.; Yu, S.-C.; Sorek, M.; Silverman, B.; Jordan, C. S.; Sterling, A. R.; Silversmith, W. M.; Collman, F.; Seung, H. S.; Tank, D. W.","David W Tank","Neuroscience Institute, Bezos Center for Neural Circuit Dynamics, and the Department of Molecular Biology, Princeton University, Princeton, NJ, USA","2025-07-15","1","new results","cc_by_nd","neuroscience","https://www.biorxiv.org/content/early/2025/07/15/2025.07.09.663979.source.xml","The mossy fiber (MF) connections to pyramidal cells in hippocampal CA3 are hypothesized to participate in pattern separation and memory encoding, yet no large-scale neuronal wiring diagram exists for these connections. We assembled a 3D electron microscopy volume (~1x1x0.1 mm3) from mouse hippocampal CA3. By proofreading and automated segmentation, we reconstructed and classified all soma-containing neurons--including 1,815 pyramidal cells and 229 inhibitory cells--and over 55,000 MFs. Pyramidal cells receive more numerous MF inputs along a proximodistal gradient. Some distal cells show surprisingly high convergence via relatively small terminals with fewer vesicles. Pyramidal cells share significantly more MF inputs than networks randomized by degree-preserving swap, and are better approximated by networks randomized by proximity-preserving swap. We identify a feedforward inhibitory circuit from MFs via perisomatic interneurons that selectively target a pyramidal subtype. We demonstrated large-scale mapping across levels in the hippocampus--from circuits to cell types to vesicles. The dataset is shared through Pyr, an online platform for hippocampal connectomics.","NA","biorxiv",1752703875454
"Proteome profiling of plant Cajal bodies uncovers kingdom-specific components","10.1101/2025.07.10.664108","biorxiv",10.749999999999998,10.749999999999998,10.749999999999998,10.749999999999998,10.749999999999998,"Zhou, Y.; Tan, H.; Vicente-Luque, A.; Weis, M.; Wehinger, L.; Schreidl, M.; Droste-Borel, I.; Macek, B.; Berendzen, K. W.; Lozano-Duran, R.","Rosa Lozano-Duran","Center for Molecular Plant Biology (ZMBP), University of Tuebingen","2025-07-15","1","new results","cc_by_nc","plant biology","https://www.biorxiv.org/content/early/2025/07/15/2025.07.10.664108.source.xml","Insight into the molecular composition of cellular microenvironments is essential for understanding their function. Membraneless organelles (MLO), such as the nuclear Cajal body (CB), play fundamental roles in eukaryotic cells, but their very nature poses a challenge to biochemical isolation. Despite the relevance of the CB for cell function in plants and animals, its proteome remains to be profiled. Here, we purify plant CBs using a combination of biochemical isolation and fluorescence-activated particle sorting (FAPS) and define their proteome by mass spectrometry. Our work identifies 15 and 95 proteins uniquely localized and enriched in CBs, respectively, of which 22 are also labelled by CB markers in proximity labelling assays. CB proteins are preferentially involved in RNA processing, chromatin organization, and gene expression. While a partial overlap with known animal CB proteins exists, our data reveal a distinct, kingdom-specific CB proteome. These results provide the first comprehensive proteome of CBs and establishes a foundation for dissecting the molecular functions of this organelle across multicellular lineages.","NA","biorxiv",1752703875454
"Observed-to-Expected Fetal Losses Following mRNA COVID-19 Vaccination in Early Pregnancy","10.1101/2025.06.18.25329352","medrxiv",932.2500000000092,9.899999999999999,72.20000000000003,75.40000000000002,932.2500000000092,"Guetzkow, J.; Patalon, T.; Gazit, S.; Hoeg, T. B.; Fraiman, J.; Segal, Y.; Levi, R.","Josh Guetzkow","Hebrew University of Jerusalem","2025-06-20","1","PUBLISHAHEADOFPRINT","cc_by_nc_nd","sexual and reproductive health","https://www.medrxiv.org/content/early/2025/06/20/2025.06.18.25329352.source.xml","BackgroundThe clinical trials used to approve COVID-19 vaccines excluded pregnant women, and existing safety assessments of COVID-19 vaccination, particularly during early stages of pregnancy, are limited to observational studies prone to various types of potential bias, including healthy vaccinee bias.

MethodsThe study includes pregnancies in Israel with last menstruation period (LMP) between March 1, 2016 and February 28, 2022. The main analysis presents observed-to-expected comparisons of the number of eventual fetal losses among pregnant women exposed to mRNA COVID-19 vaccination (almost all Pfizer) during gestational weeks 8-13 and 14-27, respectively. Women vaccinated for influenza during gestational weeks 8-27, as well as women vaccinated prior to pregnancy for COVID-19 or influenza, were used as comparative controls. Cohort-specific expected number of fetal losses are established based on estimates from a regression model trained on historical data from 2016-2018 that incorporates individual-level risk factors and gestational week of each pregnant woman included in the cohort.

ResultsAnalysis of 226,395 singleton pregnancies in Israel from 2016 to 2022 indicates that COVID-19 vaccination with dose 1 during weeks 8-13 was associated with higher-than-expected observed number of fetal losses of approximately 13 versus 9 expected for every 100 exposed pregnancies, i.e., nearly 3.9 (95% CI: [2.55-5.14]) additional fetal losses above expected per 100 pregnancies Most of the excess fetal losses occurred after gestational week 20 and nearly half occurred after gestational week 25. Similarly, women vaccinated with dose 3 during weeks 8-13 exhibited a higher-than-expected number of fetal losses with nearly 1.9 (95% CI: 0.39-3.42]) additional fetal losses above expected per 100 pregnancies. In contrast, pregnant women vaccinated for influenza during weeks 8-27 exhibited a consistently lower-than-expected observed number of fetal losses, likely the result of healthy vaccinee bias. Women vaccinated for COVID-19 or influenza prior to pregnancy exhibited according-to-expected or lower-than-expected numbers of fetal losses.

ConclusionThe results provide evidence for a substantially higher-than-expected number of eventual fetal losses associated with COVID-19 vaccination during gestational weeks 8-13.","NA","medrxiv",1752703875454
"Ribonucleoprotein (RNP) condensates modulate survival in response to Mars-like stress conditions","10.1101/2025.07.09.663920","biorxiv",9.75,7,7,9.75,9.75,"DHAGE, R.; Roy, A.; Sivaraman, B.; Rajyaguru, P. I.","Purusharth I Rajyaguru","Indian Institute of Science","2025-07-11","1","new results","cc_by_nc","cell biology","https://www.biorxiv.org/content/early/2025/07/11/2025.07.09.663920.source.xml","Scientific advances have emboldened human efforts toward exploring the potential of extinct, extant, or future life on Mars. An important aspect of this endeavor is understanding how an organism adapts to stress-inducing environmental conditions on Mars, such as radiation, shock waves, extreme temperatures, and chaotropic stress due to higher levels of perchlorates. A conserved approach used by organisms across evolutionary scales to adapt and overcome stress conditions is the assembly of ribonucleoprotein (RNP) condensates. In this study, we employ a multidisciplinary approach to understand yeast survivability and adaptation under Mars-like stress conditions, specifically shock waves and perchlorate, by focusing on RNP condensates. Our study reveals that yeast survives 5.6 M intensity shock waves. Exposure to either shock waves or sodium perchlorate induces the formation of P-bodies, a conserved stress-induced condensate. Yeast mutants defective in P-body assembly show defective growth in response to perchlorate stress. Transcriptome analysis, followed by validation, identified several relevant transcripts whose levels are perturbed in response to Mars-like conditions. Finally, identification of several transcripts whose abundance is altered in the P-body assembly mutant upon stress highlights a new connection between response to Martian stress conditions and RNP condensates. This study, a first of its kind, highlights the importance of RNP condensates in understanding the impact of Martian conditions on life in general. This study paves the way for using RNP condensates as a biomarker for assessing the health of life forms during space explorations.","NA","biorxiv",1752703875454
"An immunobiliary single-cell atlas resolves crosstalk of type 2 cDCs and γδT cells in cholangitis","10.1101/2025.07.10.664083","biorxiv",6.85,6.85,6.85,6.85,6.85,"Thomann, S.; Hemmer, H.; Agrawal, A.; Basu, S.; Schaf, J.; Sagar, S.; Imdahl, F.; Poth, T.; Toth, M.; Zielinski, C. E.; Poch, T.; Krause, J.; Rosenwald, A.; Breitkopf-Heinlein, K.; Rahbari, N.; Grün, D.","Dominic Grün","Julius-Maximilians-Universität Würzburg, Würzburg, Germany","2025-07-15","1","new results","cc_by_nc_nd","immunology","https://www.biorxiv.org/content/early/2025/07/15/2025.07.10.664083.source.xml","Background and aims The immunobiliary niche serves as a reservoir of tissue-resident immune cells, yet the role of unconventional T cells during cholangitis remains poorly understood. Here, we connect cell state dynamics of type 2 conventional dendritic cells (cDC2) in cholangitis with site-specific {gamma}{delta}T17 responses in liver and draining lymph nodes (LN). Methods The 0.1% Diethoxycarbonyl-1,4-Dihydrocollidine (DDC) diet was used to generate an immunobiliary DC- and {gamma}{delta}T-enriched mouse liver and LN single-cell RNA-sequencing (scRNA-seq) atlas covering temporal disease dynamics, resolution and cDC2B depletion. cDC2 trajectories were inferred using VarID2 and {gamma}{delta}T cell transcription factor (TF) regulon activity was predicted by SCENIC. The human biliary niche was resolved by integrating human liver scRNA-seq data with available spatial transcriptomics data. Functional studies were conducted using Tcrd knockout, Il17a/f knockout and Tcrd reporter mice. Results A disease trajectory of Mgl2+ cDC2B was identified connecting DC maturation, homing and the expression of Il17- inducing genes. Disease progression was associated with numeric exhaustion of mature cDC2B and recruitment of DC precursors. {gamma}{delta}T cells were the main Il17 producers and were subtyped into Il17ahigh Scart1+ V{gamma}6+ and Il17low Scart2+ V{gamma}4+ populations exhibiting cDC2-directed communication and divergent TF regulon activity. Spatial proximity and conserved molecular interactions of cDC2 and {gamma}{delta}T cells were confirmed in human cholangitis. Il17-deficiency resulted in reduced liver fibrosis in mice, while cDC2B depletion attenuated {gamma}{delta}T17 cell states. Conclusions In cholangitis, a profibrogenic function of {gamma}{delta}T cells is contingent on the induction by peribiliary cDC2B, thereby highlighting relevant disease determinants within the immunobiliary and liver-draining LN niche.","NA","biorxiv",1752703875454
