"title","doi","altmetric_jid","score","X1d","X3d","X1w","X1m","authors","author_corresponding","author_corresponding_institution","date","version","type","license","category","jatsxml","abstract","published","server","upupdate_time"
"Rapid Surge of Reassortant A(H1N1) Influenza Viruses in Danish Swine and their Zoonotic Potential","10.1101/2024.12.11.627926","biorxiv",9.742,5.992,8.242,9.742,9.742,"Ryt-Hansen, P.; George, S.; Hjulsager, C. K.; Trebbien, R.; Krog, J. S.; Ciucani, M. M.; Langerhuus, S. N.; DeBeauchamp, J.; Crumpton, J. C.; Hibler, T.; Webby, R.; Larsen, L. E.","Pia Ryt-Hansen","University of Copenhagen, Department of Veterinary and Animal Sciences","2024-12-12","1","new results","cc_by_nc_nd","genomics","https://www.biorxiv.org/content/early/2024/12/12/2024.12.11.627926.source.xml","In 2018, a single detection of a novel reassortant swine influenza A virus (swIAV) was made in Denmark. The hemagglutinin (HA) of the virus was from the H1N1 pandemic 2009 (H1N1pdm09) lineage and the neuraminidase (NA) from the H1N1 Eurasian avian-like swine lineage (H1N1av). By 2022, the novel reassortant virus (H1pdm09N1av) constituted 27 % of swIAVs identified through the Danish passive swIAV surveillance program. Sequencing detected two H1pdm09N1av genotypes; Genotype 1 contained an internal gene cassette of H1N1pdm09 origin, Genotype 2 differed by carrying an NS gene segment of H1N1av origin. The internal gene cassette of Genotype 2 became increasingly dominant, not only in the H1pdm09N1av population, but also in other Danish enzootic swIAV subtypes. Phylogenetic analysis of the HA genes from H1pdm09N1av viruses revealed a monophyletic source, a higher substitution rate compared to other H1N1pdm09 viruses and genetic differences with human seasonal and other swine adapted H1N1pdm09 viruses. Correspondingly, H1pdm09N1av viruses were antigenically distinct from human H1N1pdm09 vaccine viruses. Both H1pdm09N1av genotypes transmitted between ferrets by direct contact, but only Genotype 1 was capable of efficient aerosol transmission. The rapid spread of H1pdm09N1av viruses in Danish swine herds is concerning for swine and human health. Their zoonotic threat is highlighted by the limited pre-existing immunity observed in the human population, aerosol transmission in ferrets and the finding that the internal gene cassette of Genotype 2 was present in the first two zoonotic infections ever detected in Denmark.","NA","biorxiv",1734473302830
"Persistent genomic erosion in whooping cranes despite demographic recovery","10.1101/2024.12.12.628160","biorxiv",5.8999999999999995,5.8999999999999995,5.8999999999999995,5.8999999999999995,5.8999999999999995,"Fontsere, C.; Speak, S. S.; Caven, A. J.; Rodriguez, J. A.; Wang, X.; Pacheco, C.; Cassatt-Johnstone, M.; Femerling, G.; Maloney, B.; Balacco, J.; Collins, J.; Sims, Y.; Abueg, L.; Fedrigo, O.; Jarvis, E. D.; Hartup, B. K.; Shapiro, B.; Gilbert, M. T. P.; van Oosterhout, C.; Morales, H. E.","Hernan E. Morales","Globe Institute, University of Copenhagen, Denmark","2024-12-17","1","new results","cc_by_nc","evolutionary biology","https://www.biorxiv.org/content/early/2024/12/17/2024.12.12.628160.source.xml","Integrating in-situ (wild) and ex-situ (captive) conservation efforts can mitigate genetic diversity loss and help prevent extinction of endangered wild populations. The whooping crane (Grus americana) experienced severe population declines in the 18th century, culminating into a collapse to 16 individuals in 1941. Legal protections and conservation actions have since increased the population to approximately 840 individuals, yet the impact on genomic diversity remains unclear. We analysed the temporal dynamics of genomic erosion by sequencing a high-quality genome reference, and re-sequencing 16 historical and 37 modern genomes, including wild individuals and four generations of captive-bred individuals. Genomic demographic reconstructions reveal a steady decline, accelerating over the past 300 years with the European settlement of North America. Temporal genomic analyses show that despite demographic recovery, the species has lost 70% of its genetic diversity and has increased their inbreeding. Although the modern population bottleneck reduced the ancestral genetic load, modern populations possess more realized load than masked load, possibly resulting in a chronic loss of fitness. Integrating pedigree and genomic data, we underscore the role of breeding management in reducing recent inbreeding. Yet ongoing heterozygosity loss, load accumulation, and background inbreeding argues against the species' downlisting from their current Endangered status on the IUCN Red List and the Endangered Species Act. The presence of private genetic variation in wild and captive populations suggests that wild-captive crosses could enhance genetic diversity and reduce the realized load. Our findings emphasize the role of genomics in informing conservation management and policy","NA","biorxiv",1734473302830
"Prefrontal cortex dopamine responds to the total valence of stimuli","10.1101/2024.12.11.627942","biorxiv",5.9,5.9,5.9,5.9,5.9,"Yang, Y.; Parent, W.; Rice, H. J.; Mark, R.; Desimone, M.; Rahman, M.; Ellwood, I. T.","Ian Thomas Ellwood","Cornell University","2024-12-16","1","new results","cc_by_nc_nd","neuroscience","https://www.biorxiv.org/content/early/2024/12/16/2024.12.11.627942.source.xml","The prefrontal cortex (PFC) dopamine system plays an essential role in cognitive flexibility, working memory and psychiatric disease, but determining the conditions under which dopamine in the PFC is released remains an open problem. Both rewarding and aversive stimuli have been found to trigger release, but studies have disagreed on whether the valence of a stimulus or other variables like novelty and salience are the most important. Here we report on recordings of dopamine-dependent fluorescence using a high-sensitivity dopamine indicator. We deliver an array of rewarding, aversive and mixed valence stimuli, as well as stimuli without any obvious valence. We observe that stimuli without valence, as well as the omission of expected stimuli, do not lead to large changes in fluorescence, even when these stimuli and omissions are both novel and engaging. In contrast, both rewarding and aversive stimuli lead to increases in fluorescence, with the most rewarding and most aversive stimuli leading to the largest increases. We test the effect of adding an aversive component to a rewarding stimulus and find that the increases in fluorescence are consistent with a summation of the rewarding and aversive components. We propose that dopamine release in the PFC responds to the total valence of a stimulus, in contrast with the traditional view of basal ganglia dopamine release that depends on the net valence.","NA","biorxiv",1734473302830
"The Chlamydomonas reinhardtii CLiP2 mutant collection expands genome coverage with high-confidence disrupting alleles","10.1101/2024.12.16.626622","biorxiv",5.75,5.75,5.75,5.75,5.75,"Lunardon, A.; Patena, W.; Pacini, C.; Warren-Williams, M.; Zubak, Y.; Laudon, M.; Silflow, C.; Lefebvre, P.; Jonikas, M. C.","Martin C Jonikas","Princeton University, NJ, USA; Howard Hughes Medical Institute","2024-12-16","1","new results","cc_no","plant biology","https://www.biorxiv.org/content/early/2024/12/16/2024.12.16.626622.source.xml","Chlamydomonas reinhardtii (Chlamydomonas hereafter) is a powerful model organism for studies of photosynthesis, ciliary motility, and other cellular processes [1-4]. The CLiP library of mapped nuclear random insertion mutants [5,6] has accelerated progress for hundreds of laboratories in these fields by providing mutants in genes of interest. However, its value was limited by its modest coverage of the genome with high-confidence disruption alleles (46% of nuclear protein-coding genes with 1+ high-confidence allele in exons/introns; 12% of genes with 3+ alleles in exons/introns). Here we introduce the CLiP2 (Chlamydomonas Library Project 2) library, which greatly expands the number of available mapped high-confidence insertional mutants. The CLiP2 library includes 71,700 strains, covering 79% of nuclear protein-coding genes with 1+ high-confidence allele in exons/introns and 49% of genes with 3+ alleles in exons/introns. The mutants are available to the community via the Chlamydomonas Resource Center.","NA","biorxiv",1734473302830
"Pre-trained protein language model for codon optimization","10.1101/2024.12.12.628267","biorxiv",5.6,5.6,5.6,5.6,5.6,"Pathak, S.; Lin, G.","Shashank Pathak","University of Alberta","2024-12-16","1","new results","cc_by_nd","bioinformatics","https://www.biorxiv.org/content/early/2024/12/16/2024.12.12.628267.source.xml","Motivation: Codon optimization of Open Reading Frame (ORF) sequences is essential for enhancing mRNA stability and expression in applications like mRNA vaccines, where codon choice can significantly impact protein yield which directly impacts immune strength. In this work, we investigate the use of a pre-trained protein language model (PPLM) for getting a rich representation of amino acids which could be utilized for codon optimization. This leaves us with a simpler fine-tuning task over PPLM in optimizing ORF sequences. Results: The ORFs generated by our proposed models outperformed their natural counterparts encoding the same proteins on computational metrics for stability and expression. They also demonstrated enhanced performance against the benchmark ORFs used in mRNA vaccines for the SARS-CoV-2 viral spike protein and the varicella-zoster virus (VZV). These results highlight the potential of adapting PPLM for designing ORFs tailored to encode target antigens in mRNA vaccines.","NA","biorxiv",1734473302830
"Putative neofunctionalization of a Poales-specific EXO70 clade","10.1101/2024.12.13.628418","biorxiv",5.55,5.55,5.55,5.55,5.55,"Bergum, M.; Sklenar, J.; Hernandez-Pinzon, I.; Taylor, J.; Smoker, M.; Samwald, S.; Allen, M.; Thind, A.; Green, P.; Moon, H.; Menke, F. L. H.; Zipfel, C.; Rhodes, J.; Faulkner, C.; Moscou, M. J.","Matthew James Moscou","United States Department of Agriculture","2024-12-17","1","new results","cc0","plant biology","https://www.biorxiv.org/content/early/2024/12/17/2024.12.13.628418.source.xml","EXO70s are uniquely expanded in land plants compared to all other eukaryotic lineages. The functional implications of this expansion and diversification on the conserved role of EXO70 as a subunit of the octameric exocyst complex have remained unresolved. We previously demonstrated barley (Hordeum vulgare) EXO70FX12, a member of the monocot-specific EXO70FX clade, is required for resistance to wheat stripe rust in conjunction with the leucine-rich repeat receptor kinase (LRR-RK) HvPUR1. Through phylogenetic analysis, we identified unique features of the EXO70FX clade, leading us to hypothesize that this clade experienced neofunctionalization. Using structural predictions and protein-protein interaction assays, we demonstrate that HvEXO70FX12 lost the ability to serve as a subunit within the exocyst complex. We predict that the EXO70FX clade has largely lost exocyst association and represents a novel acquisition that emerged during Poales diversification for immunity.","NA","biorxiv",1734473302830
"Targeted KRAS(G12V) degradation elicits efficient and durable lung adenocarcinoma regression in vivo","10.1101/2024.12.13.627539","biorxiv",12.699999999999998,5.4,12.699999999999998,12.699999999999998,12.699999999999998,"Martin, A.; Garcia-Perez, I. M.; San Jose, S.; Rojo, P.; Riego-Mejias, C.; Teodosio, C.; Barbosa, B. M.; Sanchez-Zarzalejo, C.; Folch-I-Casanovas, I.; Odena Caballol, A.; Jario, S.; Entrialgo, R.; Nokin, M.-J.; Loa, D.; Guruceaga, E.; Stephan-Otto Attolini, C.; Ambrogio, C.; Villanueva, A.; Vicent, S.; Riera, A.; Santamaria, D.; Mayor-Ruiz, C.","Cristina Mayor-Ruiz","Institute for Research in Biomedicine (IRB Barcelona), the Barcelona Institute of Science and Technology (BIST), Barcelona, Spain","2024-12-15","1","new results","cc_by_nc_nd","cancer biology","https://www.biorxiv.org/content/early/2024/12/15/2024.12.13.627539.source.xml","Recent drug discovery breakthroughs led to the approval of KRASG12C inhibitors in lung adenocarcinoma (LUAD). Unfortunately, clinical responses remain limited due to rapid resistance onset. Proteolysis-targeting chimeras (PROTACs) have emerged as promising alternatives to traditional inhibition. However, there is limited mechanistic understanding of KRAS degradation in vivo. Here, we developed a preclinical LUAD mouse model and demonstrated that targeted oncogenic KRAS degradation induces rapid tumor regression. Transcriptional, histological, and immunophenotypic analyses revealed a substantial remodeling of the tumor microenvironment. Notably, disease relapse observed during long-term degrader treatment stems from proteolysis machinery dysregulation, indicating resistance mechanisms distinct from those reported upon KRAS inhibition. Our findings highlight the therapeutic potential of KRAS degradation in LUAD, offering insights into cell-intrinsic and extrinsic mechanisms driving durable antitumor responses and supporting further clinical exploration.","NA","biorxiv",1734473302830
"Single neuron diversity supports area functional specialization along the visual cortical pathways","10.1101/2024.12.13.628359","biorxiv",13.95,5.300000000000001,13.95,13.95,13.95,"Feyerabend, M.; Pommer, S.; Jimenez-Sosa, M. S.; Rachel, J.; Sunstrum, J. K.; Preuss, F.; Mestern, S.; Hinkel, R.; Mietsch, M.; Viyajraghavan, S.; Everling, S.; Treue, S.; Arnsten, A. F.; Lewis, D. A.; Tripathy, S.; Gonzalez-Burgos, G.; Inoue, W.; Neef, A.; Staiger, J. F.; Martinez-Trujillo, J. C.","Julio C Martinez-Trujillo","Department of Physiology and Pharmacology, Schulich School of Medicine and Dentistry, Western University, London, Ontario, Canada","2024-12-13","1","new results","cc_by_nc_nd","neuroscience","https://www.biorxiv.org/content/early/2024/12/13/2024.12.13.628359.source.xml","Humans and other primates have specialized visual pathways composed of interconnected cortical areas. The input area V1 contains neurons that encode basic visual features, whereas downstream in the lateral prefrontal cortex (LPFC) neurons acquire tuning for novel complex feature associations. It has been assumed that each cortical area is composed of repeatable neuronal subtypes, and variations in synaptic strength and connectivity patterns underlie functional specialization. Here we test the hypothesis that diversity in the intrinsic make-up of single neurons contributes to area specialization along the visual pathways. We measured morphological and electrophysiological properties of single neurons in areas V1 and LPFC of marmosets. Excitatory neurons in LPFC were larger, less excitable, and fired broader spikes than V1 neurons. Some inhibitory fast spiking interneurons in the LPFC had longer axons and fired spikes with longer latencies and a more depolarized action potential trough than in V1. Intrinsic bursting was found in subpopulations of both excitatory and inhibitory LPFC but not V1 neurons. The latter may favour temporal summation of spikes and therefore enhanced synaptic plasticity in LPFC relative to V1. Our results show that specialization within the primate visual system permeates the most basic processing level, the single neuron.","NA","biorxiv",1734473302830
"Experimental Warming Alters Nitrogen Cycle in a Humid Tropical Forest","10.1101/2024.12.10.627762","biorxiv",5.05,5.05,5.05,5.05,5.05,"Bartz, P. M.; Reed, S. C.; Grullon-Penkova, I. F.; Cavaleri, M. A.; Shahid, S.; Wood, T. E.; Bachelot, B.","Benedicte Bachelot","Oklahoma State University","2024-12-16","1","new results","cc_no","ecology","https://www.biorxiv.org/content/early/2024/12/16/2024.12.10.627762.source.xml","[bullet] Humid tropical forests typically contain high soil nitrogen (N), supporting rapid rates of primary productivity and recovery from disturbances. Nitrogen fixation is regulated by microbial communities, which can be free-living in the soil and leaf litter (asymbiotic) or in symbioses with plants. [bullet] To investigate how warming affects asymbiotic and symbiotic components of the N cycle, we analyzed soil and leaf litter samples as well as annual seedling census data from an experimental warming field site in Puerto Rico. [bullet] 16S and nifH sequencing revealed that warming significantly altered bacterial composition. Asymbiotic N fixation rates were 55% greater in soil (0.004 nmol N2/g/hr) and 525% greater (0.217 nmol N2/g/hr) in leaf litter from warmed compared to ambient plots. This increase in fixation was associated with changes in the N-fixing bacterial community. Under warming, N fixers experienced a 4.4-fold increase in growth rate compared to non-fixers, yet competition with neighboring N fixers eventually reduced N fixer growth. Seedling growth, especially of N fixers, initially increased following hurricane disturbances before declining. [bullet] Together, our findings suggest that warming increases the flux of N from the atmosphere into this tropical forest, driving changes in both microbial and tree dynamics.","NA","biorxiv",1734473302830
"USP1/UAF1 targets polyubiquitinated PCNA with an exo-cleavage mechanism that enriches for monoubiquitinated PCNA","10.1101/2024.12.16.628697","biorxiv",4.6,4.6,4.6,4.6,4.6,"Keijzer, N.; Sakoltchik, J.; Majumder, K.; van Lil, N.; El Oualid, F.; Fish, A.; Sixma, T. K.","Titia K Sixma","Netherlands Cancer Institute","2024-12-16","1","new results","cc_by_nc_nd","biochemistry","https://www.biorxiv.org/content/early/2024/12/16/2024.12.16.628697.source.xml","DNA damage tolerance (DDT) is an important pathway that allows our cells to bypass DNA lesions during replication. DDT is orchestrated by ubiquitination of PCNA: Monoubiquitination (PCNA-Ub) initiates recruitment of TLS polymerases but also serves as substrate for K63-linked polyubiquitination that leads to HR-mediated bypass mechanisms. Recent work on USP1/UAF1 inhibition revealed that K48-linked chains are also formed on PCNA, resulting in its proteasomal degradation. USP1/UAF1 is established as deubiquitinating enzyme (DUB) for PCNA-Ub, but little is known about deubiquitination of chains on PCNA. Here we show that USP1/UAF1 cleaves both K48 and K63-linked ubiquitin chains on PCNA efficiently, using an exo-cleavage mechanism. Kinetic analysis reveals that USP1/UAF1 prefers cleaving the ubiquitin-ubiquitin bond over cleavage of the ubiquitin-PCNA isopeptide bond and therefore treats poly- and monoubiquitinated PCNA as different substrates. A cryo-EM structure of USP1/UAF1 with a K63-diubiquitin and structure-based mutagenesis reveals that its mechanistic preference is maintained in evolution. Its kinetic mechanism results in relative enrichment of monoubiquitinated PCNA that could initially promote TLS over HR-like bypass. Taken together, these results suggest that USP1/UAF1 could be important in temporary protection of PCNA against K48- and K63-linked polyubiquitination and highlight this DUB as a potential regulator of DDT pathway choice.","NA","biorxiv",1734473302830
"The 8-nm spaghetti: well-structured glycans coating linear tetrapeptide repeats discovered from freshwater with CryoSeek","10.1101/2024.12.15.627649","biorxiv",7.2,4.6,7.2,7.2,7.2,"Wang, T.; Sun, Y.; Li, Z.; Yan, N.","Nieng Yan","Tsinghua University","2024-12-15","1","new results","cc_by_nc_nd","biophysics","https://www.biorxiv.org/content/early/2024/12/15/2024.12.15.627649.source.xml","Despite the recent breakthrough in structure determination and prediction of proteins, the structural investigation of carbohydrates remains a challenge. Here we report the cryo-EM analysis of a glycofibril found in the freshwater in the Tsinghua Lotus Pond. The fibril, which we name TLP-4, is made of a linear chain of tetrapeptide repeats coated with thick glycans. In each repeat, two glycans are O-linked to a 3,4-dihydroxyproline, and an additional glycan attaches to the adjacent Ser or Thr. The structure of the fibril is entirely maintained through glycan packing. Bioinformatic analysis confirms the conservation of the TLP-4 repeats across species, suggesting the existence of a large number of glycofibrils to be discovered. Our findings not only provide unprecedented insights into the structural roles of glycans in bio-assemblies, but also demonstrate the potential of our recently formulated research strategy of CryoSeek to discover bio-entities and establish prototypes for structural studies of carbohydrates.","NA","biorxiv",1734473302830
"The Heart Health Yarning Tool: co-designing a shared decision-making tool for cardiovascular disease prevention and risk management","10.1101/2024.11.19.24317586","medrxiv",4.55,4.55,4.55,4.55,4.55,"McKinn, S.; Parnham, J.; Follent, D.; Tracy, M.; Wyber, R.; Freeman, N.; Puranik, R. K.; Bonner, C.","Carissa Bonner","The University of Sydney","2024-11-21","1","PUBLISHAHEADOFPRINT","cc_no","primary care research","https://www.medrxiv.org/content/early/2024/11/21/2024.11.19.24317586.source.xml","Due to the ongoing impact of colonisation, Aboriginal and Torres Strait Islander people live with a greater burden of cardiovascular disease (CVD) than non-Indigenous Australians. Shared decision-making is recognised as an essential component of person-centred care. However, the previous guidelines for CVD risk assessment and prevention did not engage Aboriginal and Torres Strait Islander people. Additionally, there has been a lack of tools to support clinician communication and shared decision-making to address CVD prevention in this important ""at-risk"" population. We developed the Heart Health Yarning Tool, an online shared decision-making resource co-designed with Aboriginal and Torres Strait Islander people, to be implemented alongside the new Australian guidelines for primary CVD risk assessment and management. This was a three phase project: Phase 1 consisted of a stakeholder consultation and co-design process, including consumer yarning workshops (n=21), individual yarning sessions with Aboriginal and Torres Strait Islander Health Workers/Practitioners (n=8), consumers (n=17), and interviews with general practitioners (n=5). Phase 2 involved a mapping process, where qualitative interview data was integrated into the conceptual framework of an existing culturally adapted shared decision-making model,  Finding Your Way, in order to tailor the model to the CVD context. Phase 3 involved developing and testing content for the new tool, based on findings from Phases 1 and 2, using evidence-based shared decision-making formats. The resulting tool supports health professionals to make shared decisions about heart health with Aboriginal and Torres Strait Islander people. It can be used as a conversation guide in primary care consultations or as a training tool for health professionals. Future research will assess whether use of the Heart Health Yarning Tool improves health professionals cultural and shared decision-making competencies as well as cardiovascular outcomes in Aboriginal and Torres Strait Islander people.

KEY MESSAGESO_ST_ABSWhat is already known on this topicC_ST_ABSO_LIDespite the fact that shared decision-making is recognised as an essential component of person-centred care, there are few culturally adapted shared decision-making resources
C_LIO_LICulturally specific resources are needed to support shared decision-making around heart health with Aboriginal and Torres Strait Islander people, a priority group for cardiovascular disease prevention
C_LI

What this study addsO_LIWe developed an online shared decision-making tool to be used by primary care providers with the new Australian guidelines for primary cardiovascular disease prevention
C_LIO_LIThe Heart Health Yarning Tool was co-designed with Aboriginal and Torres Strait Islander people, incorporating culturally relevant content with evidence-based shared-decision making formats.
C_LI

How this study might affect research, practice or policyO_LIThe Heart Health Yarning Tool can be used as a conversation guide, health consumer
C_LIO_LIeducation resource, and as a training tool for health professionals.
C_LIO_LIThe Heart Health Yarning Tool may support health professionals to offer culturally responsive health care to Aboriginal and Torres Strait Islander people
C_LI","NA","medrxiv",1734473302830
