"title","doi","altmetric_jid","score","X1d","X3d","X1w","X1m","authors","author_corresponding","author_corresponding_institution","date","version","type","license","category","jatsxml","abstract","published","server","upupdate_time"
"The Inflation Reduction Act's Impact upon Early-stage Venture Capital Investments","10.1101/2025.01.07.25320113","medrxiv",24.5,8.85,24.5,24.5,24.5,"Schulthess, D.; O'Loughlin, G.; Askeland, M.; Gassull, D.; Bowen, H. P.","Duane Schulthess","Vital Transformation LLC","2025-01-07","1","PUBLISHAHEADOFPRINT","cc_by","health policy","https://www.medrxiv.org/content/early/2025/01/07/2025.01.07.25320113.source.xml","BackgroundThe Congressional Budget Office has stated there is no evidence of a systematic decrease in the percentage of venture capital flowing to pharmaceutical companies since IRAs passage. This was echoed in Prof. Rita Contis September 17, 2024, Senate Finance Committee testimony.

MethodsTo test the IRAs impacts on early-stage investments targeting therapeutics for the Medicare-aged population, a longitudinal dataset of commercially sponsored clinical trials by companies with a market valuation < $2 billion was obtained from the BioMedTracker database from January 1, 2018, to May 6, 2024. These trials were filtered to match early-stage investments to lead assets undergoing clinical development.

ResultsFrom 161 lead assets with 897 investments, we find the aggregated total into large molecules in 2024 was 10 times larger than that for small molecules, which underwent a 70% decline after passage of the IRA. Individual investments made into small molecules decline by minus one-half as exposure to the Medicare-aged population increases after the passage of the IRA (p < 0.0018). Testing large molecule investments by their exposure to Medicare post IRAs passage is statistically inconclusive.

Research ConclusionsThis study presents evidence of a decline in the development of new therapies targeting the Medicare-aged population since the passage of the IRA. If these impacts were due to the economic downturn post-pandemic, we would observe statistically similar results in both large and small molecules. However, the results by molecule type diverge. Investors perceive large molecules to be of a lower investment risk relative to small molecules after IRAs passage.","NA","medrxiv",1736633251837
"Subcontinental Genetic Diversity in the All of Us Research Program: Implications for Biomedical Research","10.1101/2025.01.09.632250","biorxiv",8.649999999999999,8.649999999999999,8.649999999999999,8.649999999999999,8.649999999999999,"Gouveia, M. H.; Meeks, K. A. C.; Pua, V. O. B.; Leal, T. P.; Kehdy, F. S. G.; Mogire, R.; Doumatey, A. P.; Tarazona-Santos, E.; Kittles, R.; Mata, I. F.; O'Connor, T. D.; Adeyemo, A.; Shriner, D.; Rotimi, C.","Mateus H Gouveia","Center for Research on Genomics and Global Health, National Human Genome Research Institute, Bethesda, Maryland, USA.","2025-01-10","1","new results","cc0","genomics","https://www.biorxiv.org/content/early/2025/01/10/2025.01.09.632250.source.xml","The All of Us Research Program (All of Us) seeks to accelerate biomedical research and address the underrepresentation of minorities by recruiting over one million ethnically diverse participants across the United States. A key question is how self-identification with discrete, predefined race and ethnicity categories compares to genetic diversity at continental and subcontinental levels. To contextualize the genetic diversity in All of Us, we analyzed ~2 million common variants from unrelated 230,016 whole genomes using classical population genetics methods, alongside reference panels such as the 1000 Genomes Project, Human Genome Diversity Project, and Simons Genome Diversity Project. Our analysis reveals that participants within self-identified race and ethnicity groups exhibit a gradient of genetic diversity rather than discrete clusters. The distributions of continental and subcontinental ancestries show considerable variation within race and ethnicity, both nationally and across states, reflecting the historical impacts of U.S. colonization, the transatlantic slave trade, and recent migrations. All of Us samples filled most gaps along the top five principal components of genetic diversity in current global reference panels. Notably, Hispanic or Latino participants spanned much of the three-way (African, Native American, and European) admixture spectrum. Ancestry was significantly associated with body mass index (BMI) and height, even after adjusting for socio-environmental covariates. In particular, West-Central and East African ancestries showed opposite associations with BMI. This study emphasizes the importance of assessing subcontinental ancestries, as the continental approach is insufficient to control for confounding in genetic association studies.","NA","biorxiv",1736633251837
"Variant effects depend on polygenic background: experimental, clinical, and evolutionary implications","10.1101/2025.01.07.631805","biorxiv",17.299999999999997,8.05,11,17.299999999999997,17.299999999999997,"Chapel, M. E.; Dennis, J.; de Boer, C. G.","Carl G de Boer","University of British Columbia","2025-01-07","1","new results","cc_by","genomics","https://www.biorxiv.org/content/early/2025/01/07/2025.01.07.631805.source.xml","Both rare and common genetic variants contribute to human disease, and emerging evidence suggests that they combine additively to influence disease liability. However, due to the non-linear relationship between disease liability and disease prevalence, risk variants have more severe phenotypic consequences in high-risk polygenic backgrounds. Consequently, selecting individuals with appropriate polygenic backgrounds may improve variant characterization experiments, as disease-relevant phenotypes may be masked or revealed in different genomic contexts. Simultaneously, selection has limited power to eliminate risk variants because they have minimal impact in low polygenic risk backgrounds, yet is more powerful with higher polygenicity because more individuals achieve genetic and phenotypic extremes. This dependence on polygenic background means that selection acting on an allele should be modeled as a distribution that differs across populations, time, environments, and individuals rather than as a single value. Overall, considering polygenic backgrounds will be critical when investigating the origins of complex traits.","NA","biorxiv",1736633251837
"Metatranscriptomics sheds light on 'who is doing what' in the coral Porites lutea","10.1101/2025.01.09.632055","biorxiv",7.85,7.1,7.85,7.85,7.85,"Tandon, K.; Hu, J.; Ricci, F.; Blackall, L.; Medina, M.; Kuhl, M.; Verbruggen, H.","Kshitij Tandon","The University of Melbourne","2025-01-09","1","new results","cc_by_nc","microbiology","https://www.biorxiv.org/content/early/2025/01/09/2025.01.09.632055.source.xml","Global decline of coral reefs due to climate change calls for effective, nature-based strategies to protect these crucial ecosystems. Developing such strategies requires a thorough understanding of the complex roles and interactions of key inhabitants within coral holobionts. Using a metatranscriptomics approach, we investigated the transcriptionally active microbiome of the healthy stony coral Porites lutea, focusing on the coral tissue, the green endolithic algal layer (Ostreobium layer), and the deeper coral skeleton. We show distinct, metabolically active communities within these compartments and highlight substantial metabolic redundancy across carbon, nitrogen, and sulphur pathways. Our study provides the first transcriptomic evidence of the ability of Ostreobium to transfer fixed carbon to other members of the holobiont and the coral host. Additionally, we identified critical roles of diverse coral holobiont members in nutrient cycling and maintaining homeostasis through scavenging of reactive oxygen and nitrogen species. This study provides novel molecular-level understanding of the functional roles played by diverse coral holobiont members in their respective compartments and underscores that corals harbour several distinct microbiomes with a wide array of functions.","NA","biorxiv",1736633251837
"Elevated Atherogenicity in Long COVID: A Systematic Review and Meta-Analysis","10.1101/2025.01.06.25320068","medrxiv",14.249999999999998,6.699999999999999,8.05,14.249999999999998,14.249999999999998,"Almulla, A. F.; Thipakorn, Y.; Zhang, Y.; Maes, M.","Abbas F. Almulla","Chulalongkorn university","2025-01-06","1","PUBLISHAHEADOFPRINT","cc_by_nc_nd","infectious diseases","https://www.medrxiv.org/content/early/2025/01/06/2025.01.06.25320068.source.xml","BackgroundLong COVID (LC) is a complex, multi-organ syndrome that persists following recovery from the acute phase of coronavirus infection. Cardiovascular involvement is frequently reported in LC, often accompanied by a spectrum of related symptoms. Dysregulated lipid profiles and elevated atherogenic indices have been implicated in LC, yet no comprehensive systematic review and meta-analysis has specifically addressed these biomarkers.

ObjectiveThis study aims to systematically evaluate atherogenic indices and lipid-related biomarkers in individuals with LC compared to healthy controls.

MethodsA systematic search was conducted in databases including PubMed, Google Scholar, SCOPUS, and SciFinder from September to November 2024. Eligible studies reported lipid biomarker data for LC patients and controls, yielding 44 studies encompassing 8,114 participants (3,353 LC patients and 4,761 controls).

ResultsLC patients exhibited significant elevations in Castelli Risk Indexes 1 (standardized mean difference, SMD = 0.199; 95% confidence intervals, CI: 0.087-0.312) and 2 (SMD = 0.202; 95% CI: 0.087-0.318). Atherogenic ratios, including triglyceride (TG)/high-density lipoprotein (HDL) (SMD = 0.294; 95% CI: 0.155-0.433), (TG + low-density lipoprotein, LDL + very low-density lipoprotein, VLDL)/(HDL + apolipoprotein, ApoA) (SMD = 0.264; 95% CI: 0.145-0.383), and ApoB/ApoA (SMD = 0.515; 95% CI: 0.233-0.796), were also significantly elevated. Additionally, LC patients demonstrated increased levels of LDL, total cholesterol, triglycerides, and ApoB, alongside reduced HDL and ApoA levels. Results were free from publication bias.

ConclusionLC is associated with a pro-atherogenic lipid profile, marked by increased atherogenic components and decreased protective lipid biomarkers. These findings highlight a potential heightened risk for cardiovascular complications in LC patients, warranting further clinical and mechanistic investigations.","NA","medrxiv",1736633251837
"Protenix - Advancing Structure Prediction Through a Comprehensive AlphaFold3 Reproduction","10.1101/2025.01.08.631967","biorxiv",6.65,6.65,6.65,6.65,6.65,"chen, x.; zhang, y.; lu, c.; ma, w.; guan, j.; gong, c.; yang, j.; zhang, h.; zhang, k.; wu, s.; zhou, k.; yang, y.; liu, z.; wang, l.; shi, b.; shi, s.; xiao, w.","wenzhi xiao","bytedance","2025-01-11","1","new results","cc_by","bioinformatics","https://www.biorxiv.org/content/early/2025/01/11/2025.01.08.631967.source.xml","In this technical report, we present Protenix, a comprehensive reproduction of AlphaFold3 (AF3), aimed at advancing the field of biomolecular structure prediction. Protenix tackles the challenges of predicting complex interactions involving proteins, ligands, and nucleic acids, while enhancing accessibility and reproducibility. Across diverse benchmarks, including PoseBusters V2, low-homology PDB sets, and CASP15 RNA, Protenix achieves state-of-the-art performance in protein-ligand, protein-protein, and protein-nucleic acid predictions. We also address limitations, such as potential memorization effects, and outline future directions for improvement. By open-sourcing Protenix, we aim to democratize advanced structure prediction tools and accelerate interdisciplinary research in computational biology and drug discovery.","NA","biorxiv",1736633251837
"Identification and characterization of novel bat coronaviruses in Spain","10.1101/2025.01.07.631674","biorxiv",31.9,6.55,31.9,31.9,31.9,"Soriano-Tordera, C.; Buigues, J.; Vinals, A.; Muscolino, E.; Martinez-Recio, R.; Diez, J.; Monros, J. S.; Cuevas, J. M.; Dufloo, J.; Sanjuan, R.","Jérémy Dufloo","Universitat de Valencia","2025-01-08","1","new results","cc_by_nc","microbiology","https://www.biorxiv.org/content/early/2025/01/08/2025.01.07.631674.source.xml","The zoonotic transmission of bat coronaviruses poses a threat to human health. However, the diversity of bat-borne coronaviruses remains poorly characterized in many geographical areas. Here, we recovered six complete coronavirus genomes by performing a metagenomic analysis of fecal samples from hundreds of individual bats captured in Spain, a country with high bat species diversity. Three of these genomes corresponded to potentially novel coronavirus species belonging to the alphacoronavirus genus. Phylogenetic analyses revealed that some of these viruses are closely related to coronaviruses previously described in bats from other countries, suggesting the existence of a shared viral reservoir worldwide. Using viral pseudotypes, we investigated the receptor usage of the identified viruses and found that one of them can use human and bat ACE2, highlighting its zoonotic potential. However, the receptor usage of the other viruses remains unknown. This study broadens our understanding of coronavirus diversity and identifies research priorities for the prevention of zoonotic viral outbreaks.

Author summaryBats carry many viruses, some of which can cross the species barrier and infect humans, a process known as zoonosis. In particular, bat-borne coronaviruses pose a significant threat to human health. To improve our pandemic preparedness, it is essential to characterize the diversity and zoonotic potential of bat coronaviruses. However, such research efforts have historically suffered from a strong geographical bias. For example, despite the rich bat diversity in Spain, few studies have searched for coronaviruses in Iberian bats. Here, we used viral metagenomics to test for the presence of coronaviruses in more than 200 bat samples collected across Spain. We detected six complete coronaviruses, three of which were proposed to be new viral species. We characterized their relationship to previously identified viruses and their ability to use known coronavirus receptors to enter cells, demonstrating that one virus could use human ACE2 as a receptor. Our results highlight the diversity of bat-borne coronaviruses in Spain, their zoonotic potential, and the need to better characterize coronavirus diversity worldwide.","NA","biorxiv",1736633251837
"Single-cell sequencing reveals psilocybin induces sustained cell-type specific plasticity in mouse medial prefrontal cortex","10.1101/2025.01.08.631940","biorxiv",22.85,6.449999999999999,22.85,22.85,22.85,"Zhou, D.; Schuler, H.; Cvetkovska, V.; Meccia, J.; Harutyunyan, A. S.; Ragoussis, J.; Bagot, R. C.","Rosemary C. Bagot","McGill University","2025-01-08","1","new results","cc_by_nc","neuroscience","https://www.biorxiv.org/content/early/2025/01/08/2025.01.08.631940.source.xml","The ever-increasing burden of psychiatric disorders and limitations of current treatments have fueled enormous interest in the therapeutic potential of psychedelics. Yet how psychedelics, such as psilocybin, produce lasting therapeutic effects is unclear. Using scRNA-sequencing we identify a type of deep layer near projecting neuron that is most robustly regulated in the medial prefrontal cortex of female mice 24h after psilocybin. We show that this cell-type specificity does not align with 5-HT2A receptor expression but is consistent with the integrated signaling via cell-type specific 5-HT receptor co-expression patterns. Cell-cell communication reveals that psilocybin also broadly suppresses GABAergic inhibition. Ultimately, psilocybin induces plasticity-related genes in subsets of excitatory neurons suggesting that psilocybin induces sustained increases in neuroplasticity in the mouse mPFC. Our findings point to L5/6NP neurons as a key mediator of psilocybins neuroplastic effects.","NA","biorxiv",1736633251837
"Two independent translocation modes drive neural stem cell dissemination into the human fetal cortex","10.1101/2025.01.08.631865","biorxiv",14.399999999999997,6.3999999999999995,14.399999999999997,14.399999999999997,14.399999999999997,"Wimmer, R.; Lestienne, P.; Brunet, C.; Di Cicco, A.; Chehade, C.; Artioli, A.; Cortes, M.; Mace, A. S.; Fraisier, V.; WANG, X.; Manneville, J. B.; Bessiere, B.; Roy, A.; Forsberg Nilsson, K.; Ladewig, J.; Guimiot, F.; Baffet, A. D.","Alexandre D Baffet","Institut national de la sante et de la recherche medicale (Inserm)","2025-01-09","1","new results","cc_by_nc_nd","neuroscience","https://www.biorxiv.org/content/early/2025/01/09/2025.01.08.631865.source.xml","The strong size increase of the human neocortex is supported both by the amplification and the basal translocation of a neural stem cell population, the basal radial glial cells (or bRG cells). Using live imaging of second trimester human fetal tissue and cortical organoids, we identify two independent translocation modes for bRG cell colonization of the human neocortex. On top of an actomyosin-dependent movement called mitotic somal translocation (MST), we identify a microtubule-dependent motion occurring during interphase, that we call interphasic somal translocation (IST). We show that IST is driven by the LINC complex, through the nuclear envelope recruitment of the dynein motor and of its activator LIS1. Consequently, IST severely altered in LIS1 patient-derived cortical organoids. We also demonstrate that MST occurs during prometaphase and is a mitotic spindle translocation event. MST is controlled by the mitotic cell rounding molecular pathway, via Moesin and Vimentin, driving translocation. We report that 85% of bRG cell translocation is due to IST, for a total movement of 0,67 mm per month of human fetal gestation. Our work identifies how bRG cells colonize the human fetal cortex, and further shows that IST and MST are conserved in bRG-related migrating glioblastoma cells.","NA","biorxiv",1736633251837
"Cholangiocytes contribute to hepatocyte regeneration after partial liver injury during growth spurt in zebrafish","10.1101/2025.01.09.629100","biorxiv",17.699999999999996,6.249999999999999,17.699999999999996,17.699999999999996,17.699999999999996,"Eski, S. E.; Mi, J.; Pozo-Morales, M.; Hovhannisyan, G. G.; Perazzolo, C.; Manco, R.; Ez-Zammoury, I.; Barbhaya, D.; Lefort, A.; Libert, F.; Marini, F.; Gurzov, E. N.; Andersson, O.; Singh, S. P.","Sumeet Pal Singh","Universite libre de Bruxelles","2025-01-09","1","new results","cc_by","developmental biology","https://www.biorxiv.org/content/early/2025/01/09/2025.01.09.629100.source.xml","The livers regenerative ability depends on injury extent. Minor injuries are repaired by hepatocyte self-duplication, while severe damage triggers cholangiocyte involvement in hepatocyte recovery. This paradigm is well-documented for adult animals but is less explored during rapid growth. We design two new partial liver injury models in zebrafish, which were investigated during growth spurts: 1) partial ablation, killing half the hepatocytes; and 2) partial hepatectomy, removing half a liver lobe. In both injuries, de novo hepatocytes emerged alongside existing ones. Single-cell transcriptomics and lineage tracing with Cre-driver lines generated by genome editing identified cholangiocytes as the source of de novo hepatocytes. We further identify active mTORC1 signalling in the uninjured liver of growing animal to be a regulator of the enhanced plasticity of cholangiocytes. Our study suggests cholangiocyte-to-hepatocyte transdifferentiation as the primary mechanism of liver regeneration during periods of rapid growth.","NA","biorxiv",1736633251837
"Molecular characterisation of common Culicoides Biting Midges (Diptera: Ceratopogonidae) in Ireland","10.1101/2025.01.08.631704","biorxiv",7.25,6.25,7.25,7.25,7.25,"Isiye, E.; Olmeda, A. V.; Curran, T.; O'Neill, D.; de Waal, T.; Barry, G.; O'Hanlon, A.; O'Shaughnessy, J.; McCarthy, N. K.; Vellinga, A.; Jenkinson, A.; Johnson, A.; Barrett, D.; Costello, S.; Zintl, A.; O'Meara, D.","Elsie Isiye","SETU School of Science and Computing, South East Technological University, Cork Road, Waterford, Ireland","2025-01-08","1","new results","cc_by_nd","molecular biology","https://www.biorxiv.org/content/early/2025/01/08/2025.01.08.631704.source.xml","BackgroundBiting midges in the genus Culicoides (Diptera: Ceratopogonidae) act as vectors for several arboviruses, including Bluetongue virus (BTV) and Schmallenberg virus (SBV), which affect livestock health and productivity. In Ireland, limited genetic data are available regarding the diversity of Culicoides species. This study represents the first attempt to characterise Culicoides in this region using molecular techniques.

MethodsAdult Culicoides samples were captured using Onderstepoort Veterinary Institute (OVI) traps across six locations in Ireland. Subsequent molecular analyses involved polymerase chain reaction (PCR) and sequencing of the cytochrome oxidase subunit 1 (CO1) and the internal transcriber spacer (ITS) barcoding regions to obtain species identities. Additionally, using both markers, we inferred the population genetic structure and potential colonisation pathways of Culicoides obsoletus sensu stricto (s. str.), the major vector species in Ireland.

ResultsDNA barcoding facilitated identification of 177 specimens. Eight common Culicoides species were identified through DNA barcoding of CO1 and ITS gene regions. The presence of putative vectors of Bluetongue virus (BTV) and Schmallenberg virus (SBV) were also confirmed, including species in the subgenus Avaritia (C. obsoletus s. str., C. scoticus, C. chiopterus, and C. dewulfi) and subgenus Culicoides s. str. (C. pulicaris and C. punctatus). Phylogenetic analysis confirmed the relationship between these vector species and facilitated the placement of Culicoides sp. which could not be identified to species level through DNA barcoding. Haplotype network analysis of C. obsoletus showed that some haplotypes of these species are shared between Continental Europe, the UK, and Ireland, suggesting a possible incursion pathway for this vector.

ConclusionDNA barcoding employing a combination of two barcodes, CO1 and ITS, proved effective in identifying Culicoides, especially species within the obsoletus complex, which are difficult to morphologically distinguish. Our findings also suggest that investigation of the population genetic structure of Culicoides spp. could be used to model the potential introduction routes of midge-borne pathogens into the country.","NA","biorxiv",1736633251837
"Developmental axon diameter growth of central nervous system axons does not depend on ensheathment or myelination by oligodendrocytes","10.1101/2025.01.10.632348","biorxiv",6.1499999999999995,6.1499999999999995,6.1499999999999995,6.1499999999999995,6.1499999999999995,"Bin, J. M.; Emberley, K.; Buscham, T. J.; Eichel-Vogel, M. A.; Doan, R. A.; Steyer, A. M.; Nolan, M. F.; Möbius, W.; Monk, K. R.; Werner, H. B.; Emery, B.; Lyons, D. A.","Jenea M Bin","University of Edinburgh","2025-01-10","1","new results","cc_by_nc_nd","neuroscience","https://www.biorxiv.org/content/early/2025/01/10/2025.01.10.632348.source.xml","Myelination facilitates the rapid conduction of action potentials along axons. In the central nervous system (CNS), myelinated axons vary over 100-fold in diameter, with conduction speed scaling linearly with increasing diameter. Axon diameter and myelination are closely interlinked, with axon diameter exerting a strong influence on myelination. Conversely, myelinating Schwann cells in the peripheral nervous system can both positively and negatively affect axon diameter. However, whether axon diameter is regulated by CNS oligodendrocytes is less clear. Here, we investigated CNS axon diameter growth in the absence of myelin using mouse (Mbpshi/shi and Myrf conditional knockout) and zebrafish (olig2 morpholino) models. We find that neither the ensheathment of axons, nor the formation of compact myelin are required for CNS axons to achieve appropriate and diverse diameters. This indicates that developmental CNS axon diameter growth is independent of myelination, and shows that myelinating cells of CNS and PNS differentially influence axonal morphology.","NA","biorxiv",1736633251837
