"title","doi","altmetric_jid","score","X1d","X3d","X1w","X1m","authors","author_corresponding","author_corresponding_institution","date","version","type","license","category","jatsxml","abstract","funder","published","server","upupdate_time"
"SARS-CoV-2 infection disrupts syncytial and endothelial integrity and alters PLGF levels in the placenta","10.1101/2025.06.27.661568","biorxiv",35.5,0,0,0,28.2,"Jones, B. R.; Nobrega, G. M.; Kumar, D.; Diveley, E.; Antolini-Tavares, A.; Souza, R. T.; Cecatti, J. G.; Kelly, J. C.; Costa, M. L.; Mysorekar, I. U.","Indira U Mysorekar","Baylor College of Medicine","2025-06-30","1","new results","cc_by_nc_nd","microbiology","https://www.biorxiv.org/content/early/2025/06/30/2025.06.27.661568.source.xml","IntroductionSARS-CoV-2 infection during pregnancy has been associated with an increased risk for several pregnancy-related disorders, particularly preeclampsia (PE). However, there are limited studies determining the impact of SARS-CoV-2 on placental physiology and function.

MethodsPlacental samples were acquired from two large prospective cohorts: STOP-COVID19 and REBRACO studies. Placental villous tissues (VTs) were collected from pregnant women who tested positive for SARS-CoV-2 without PE during pregnancy. Immunohistochemistry and immunofluorescence were used to assess pathological features known to be altered in PE, including 1) syncytial knot formation; 2) alterations in renin-angiotensin system components; 3) and endothelial integrity. Maternal serum was collected to examine AT1 autoantibodies levels using an immunoassay.

ResultsSARS-CoV-2 viral proteins spike, nucleocapsid, and ORF3a were observed in the syncytiotrophoblast layer and stroma of placental VT. SARS-CoV-2-infected placentas exhibited increased numbers of syncytial knots, which were positive for Flt-1 and SARS-CoV-2 viral proteins. In addition, the presence of placental infarctions and excessive fibrin deposits was also observed in infected placentas. Infection was associated with decreased placental expression of PlGF and an increase in the placental Flt-1/PlGF expression ratio, mostly driven by PlGF. No significant changes in maternal serum AT1AA levels were observed. Finally, SARS-CoV-2-infected placentas exhibited a significant decrease in vimentin expression.

DiscussionSARS-CoV-2 infection negatively impacts placental integrity in the form of increased syncytial knots, dysregulated RAS components, and endothelial damage. Since all these features are similarly disrupted in PE, this could be a mechanism through which SARS-CoV-2 infection during pregnancy increases the risk of a PE-like syndrome.","[{""name"":""National Institutes of Health"",""id"":""https://ror.org/01cwqze88"",""id-type"":""ROR"",""award"":""R01HD091218-04S1;""}]","NA","bioRxiv",1754345412035
"Evolutionarily diverged on-switch for actin assembly in fungal endocytosis","10.1101/2025.06.22.660955","biorxiv",26.95000000000001,0,0,0,26.95000000000001,"Sebellin, J.; Kandiyoth, F. B.; Picco, A.; Hakala, M.; Rivier-Cordey, A.-S.; Michelot, A.; Toret, C. P.; Kaksonen, M.","Marko Kaksonen","University of Geneva","2025-06-23","1","new results","cc_by","cell biology","https://www.biorxiv.org/content/early/2025/06/23/2025.06.22.660955.source.xml","Clathrin-mediated endocytosis is a conserved eukaryotic trafficking process where an Arp2/3 complex nucleated branched actin network provides force for vesicle formation. The mechanisms that initiate endocytic actin assembly are incompletely understood. In the fission yeast, Schizosaccharomyces pombe, actin assembly is initiated by Dip1, an Arp2/3 activator. In the budding yeast, Saccharomyces cerevisiae, the initiation of actin assembly has remained a mystery. Here we show that S. cerevisiae Ldb17, the homolog of Dip1, functions as an on-switch for endocytic actin assembly. Unexpectedly, the regulation of Ldb17 is more complicated than that of constitutively active Dip1. Ldb17 is controlled by a coat protein, Sla1, via separate recruitment and activation steps. This regulation was likely lost in the S. pombe lineage and this simplification may be related to other changes in actin assembly between these species. Our findings add a key missing piece in the understanding of endocytosis in S. cerevisiae and reveal an intriguing evolutionary tinkering of the actin on-switch.","[{""name"":""Swiss National Science Foundation"",""id"":""https://ror.org/00yjd3n13"",""id-type"":""ROR"",""award"":""212288;""}]","NA","bioRxiv",1754345412035
"Cell-type-specific execution of effector-triggered immunity","10.1101/2025.06.28.662111","biorxiv",26.049999999999997,0,0,0,26.049999999999997,"Chhillar, H.; Jo, L.; Redkar, A.; Kajala, K.; Jones, J. D.; Ding, P.","Pingtao Ding","Institute of Biology Leiden, Leiden University, 2333 BE Leiden, The Netherlands","2025-07-02","3","new results","cc_by_nc_nd","plant biology","https://www.biorxiv.org/content/early/2025/07/02/2025.06.28.662111.source.xml","Effector-triggered immunity (ETI) is a central component of host defense, but whether all cell types execute ETI similarly remains unknown. We combined chemically imposed immune activation with single-cell transcriptomics to profile ETI responses across all leaf cell types in Arabidopsis. Despite uniform ETI perception, we find striking divergence between transcriptional outputs: a core set of defense genes is broadly induced, while distinct cell types activate specialized immune modules. We infer that downstream immune execution is shaped not only by immune receptor activation, but also by cell identity and its associated transcriptional regulatory context, including local transcription factor availability and chromatin accessibility. We further demonstrate that transcriptional regulators preferentially induced in epidermal cells are required to restrict invasion by non-adapted pathogens. Their absence permits pathogen entry into deeper tissues despite intact recognition, revealing a spatial division of immune functions. Our findings uncover a layered immune architecture in plants, challenges the assumption of uniform immune execution, and provides a framework for exploring cell-type-specific resistance logic in multicellular hosts.","[{""name"":""European Research Council"",""id"":""https://ror.org/0472cxd90"",""id-type"":""ROR"",""award"":""101039824;""},{""name"":""Netherlands Organization for Scientific Research"",""id"":"""",""id-type"":""ROR"",""award"":""VI.Vidi.193.104;""},{""name"":""European Molecular Biology Organization"",""id"":""https://ror.org/04wfr2810"",""id-type"":""ROR"",""award"":""ALTF-842-2015;""},{""name"":""Gatsby Charitable Foundation"",""id"":""https://ror.org/0290hax27"",""id-type"":""ROR"",""award"":""""}]","NA","bioRxiv",1754345412035
"ChAHP Silences SINE Retrotransposons by Inhibiting TFIIIB Recruitment","10.1101/2025.07.02.662776","biorxiv",25.65,0,0,0,25.65,"Schnabl-Baumgartner, J.; Mohn, F.; Schwaiger, M.; Ahel, J.; Steiner, J.; Shimada, Y.; Aluri, S.; Buhler, M.","Marc Buhler","Friedrich Miescher Institute for Biomedical Research","2025-07-02","1","new results","cc_by","molecular biology","https://www.biorxiv.org/content/early/2025/07/02/2025.07.02.662776.source.xml","Short interspersed nuclear elements (SINEs) are abundant non-autonomous transposable elements derived from RNA polymerase III (POL III)-transcribed short non-coding RNAs. SINEs retain sequence features recognized by the POL III machinery and constitute a substantial portion of vertebrate genomes. Despite their impact on genome stability and evolution, the mechanisms governing SINE transcription remain poorly understood. Although DNA methylation and heterochromatin formation have been implicated in their repression, we find these pathways play only a minor role in mouse embryonic stem cells. Instead, we identify the ChAHP complex as a key repressor of SINE B2 elements. ChAHP directly inhibits POL III transcription by blocking TFIIIB recruitment without affecting TFIIIC binding. This selective interference prevents transcription initiation and highlights a distinct regulatory mechanism. Our findings establish ChAHP as a non-canonical repressor of POL III-dependent SINE transcription, offering new insights into the control of this pervasive class of non-coding genomic elements.","[{""name"":""Novartis Research Foundation"",""id"":"""",""id-type"":""ROR"",""award"":""n.a.;""},{""name"":""Swiss National Science Foundation"",""id"":""https://ror.org/00yjd3n13"",""id-type"":""ROR"",""award"":""grant 10.001.858;""},{""name"":""EMBO Postdoctoral Fellowship"",""id"":"""",""id-type"":""ROR"",""award"":""ALTF 705-2021;""}]","NA","bioRxiv",1754345412035
"Single-cell-resolved calcium and organelle dynamics in resistosome-mediated cell death","10.1101/2025.06.27.662017","biorxiv",56.600000000000016,0,0,0,25.400000000000006,"Chen, Y.-F.; Lin, K.-Y.; Huang, C.-Y.; Hou, L.-Y.; Yuen, E. L. H.; Sun, W.-C. J.; Chiang, B.-J.; Chang, C.-W.; Wang, H.-Y.; Bozkurt, T. O.; Wu, C.-H.","Chih-Hang Wu","Institute of Plant and Microbial Biology, Academia Sinica, Taipei, Taiwan","2025-07-01","1","new results","cc_by","plant biology","https://www.biorxiv.org/content/early/2025/07/01/2025.06.27.662017.source.xml","Plant nucleotide-binding domain leucine-rich repeat-containing (NLR) proteins act as intracellular immune receptors that assemble into resistosomes to execute immune responses. However, the subcellular processes during cell death following resistosome activation remain unclear. Here, we visualized the changes in calcium signaling and organelle behavior after activation of the NRC4 (NLR-required for cell death 4) resistosome. We found that NRC4 membrane enrichment coincided with calcium influx. This is followed by sequential mitochondria and plastid disruption, endoplasmic reticulum fragmentation and cytoskeleton depolymerization. Subsequent loss of plasma membrane integrity, nuclear shrinkage, and vacuolar collapse mark the terminal stage of cell death. Our findings reveal a spatiotemporally-resolved cascade of subcellular events downstream of resistosome activation, providing new mechanistic insight into the execution phase of plant immune cell death.","[{""name"":""National Science and Technology Council"",""id"":""https://ror.org/02kv4zf79"",""id-type"":""ROR"",""award"":""NSTC-113-2628-B-001-004;NSTC-113-2927-I-001-514;""},{""name"":""Institute of Plant and Microbial Biology, Academia Sinica"",""id"":"""",""id-type"":""ROR"",""award"":""""},{""name"":""Biotechnology and Biological Sciences Research Council"",""id"":""https://ror.org/00cwqg982"",""id-type"":""ROR"",""award"":""BB/X016382/1;""},{""name"":""Royal Society"",""id"":""https://ror.org/03wnrjx87"",""id-type"":""ROR"",""award"":""IECNSFC233289;""}]","NA","bioRxiv",1754345412035
"Decoding cnidarian cell type gene regulation","10.1101/2025.07.01.662323","biorxiv",25.250000000000007,0,0,0,25.250000000000007,"Elek, A.; Iglesias, M.; Mahieu, L.; Zolotarov, G.; Grau-Bove, X.; Aerts, S.; Sebe-Pedros, A.","Arnau Sebe-Pedros","Centre for Genomic Regulation (CRG)","2025-07-03","1","new results","cc_by_nc_nd","genomics","https://www.biorxiv.org/content/early/2025/07/03/2025.07.01.662323.source.xml","Animal cell types are defined by differential access to genomic information, a process orchestrated by the combinatorial activity of transcription factors that bind to cis-regulatory elements (CREs) to control gene expression. However, the regulatory logic and specific gene networks that define cell identities remain poorly resolved across the animal tree of life. As early-branching metazoans, cnidarians can offer insights into the early evolution of cell type-specific genome regulation. Here, we profiled chromatin accessibility in 60,000 cells from whole adults and gastrula-stage embryos of the sea anemone Nematostella vectensis. We identified 112,728 CREs and quantified their activity across cell types, revealing pervasive combinatorial enhancer usage and distinct promoter architectures. To decode the underlying regulatory grammar, we trained sequence-based models predicting CRE accessibility and used these models to infer ontogenetic relationships among cell types. By integrating sequence motifs, transcription factor expression, and CRE accessibility, we systematically reconstructed the gene regulatory networks that define cnidarian cell types. Our results reveal the regulatory complexity underlying cell differentiation in a morphologically simple animal and highlight conserved principles in animal gene regulation. This work provides a foundation for comparative regulatory genomics to understand the evolutionary emergence of animal cell type diversity.","[{""name"":""European Research Council"",""id"":""https://ror.org/0472cxd90"",""id-type"":""ROR"",""award"":""ERC-StG 851647;""},{""name"":""Ministerio de Ciencia e Innovación"",""id"":"""",""id-type"":""ROR"",""award"":""PID2021-124757NB-I00;FPI Severo Ochoa PhD fellowship;""},{""name"":""European Union"",""id"":""https://ror.org/019w4f821"",""id-type"":""ROR"",""award"":""Marie Sk&#322;odowska-Curie INTREPiD co-fund agreement 75442;Marie Sk&#322;odowska-Curie grant agreement 101031767;""}]","NA","bioRxiv",1754345412035