"title","doi","altmetric_jid","score","X1d","X3d","X1w","X1m","authors","author_corresponding","author_corresponding_institution","date","version","type","license","category","jatsxml","abstract","published","server","upupdate_time"
"Structural Basis of Lipopolysaccharide Assembly by the Outer Membrane Translocon Holo-Complex","10.1101/2025.04.10.648201","biorxiv",16.749999999999996,1.7,16.749999999999996,16.749999999999996,16.749999999999996,"Chen, H.; Siroy, A.; Morales, V.; Gurvic, D.; Quentin, Y.; Balor, S.; Abuta'a, Y. A.; Marteau, M.; Froment, C.; Caumont-Sarcos, A.; Marcoux, J.; Stansfeld, P. J.; Fronzes, R.; Ieva, R.","Raffaele Ieva","LMGM, CBI, CNRS, Toulouse, France","2025-04-10","1","new results","cc_no","microbiology","https://www.biorxiv.org/content/early/2025/04/10/2025.04.10.648201.source.xml","Lipopolysaccharide (LPS) assembly at the surfaces-exposed leaflet of the bacterial outer membrane (OM) is mediated by the OM LPS translocon. An essential transmembrane beta-barrel protein, LptD, and a cognate lipoprotein, LptE, translocate LPS selectively into the OM external leaflet via a poorly understood mechanism. Here, we characterize two additional translocon subunits, the lipoproteins LptM and LptY (formerly YedD). We use single-particle cryo-EM analysis, functional assays and molecular dynamics simulations to visualize the roles of LptM and LptY at the translocon holo-complex LptDEMY, uncovering their impact on LptD conformational dynamics. Whereas LptY binds and stabilizes the periplasmic LptD beta-taco domain that functions as LPS receptor, LptM intercalates the lateral gate of the beta-barrel domain, promoting its opening and access by LPS. Remarkably, we demonstrate a conformational switch of the LptD beta-taco/beta-barrel interface alternating between contracted and extended states. The LptD beta-strand 1, which defines the mobile side of the lateral gate, binds LPS and performs a stroke movement toward the external leaflet during the contracted-to-extended state transition. Our findings establish a detailed mechanistic framework explaining the selective transport of LPS to the membrane external leaflet.","NA","biorxiv",1744582124635
"A noncanonical Pol III-dependent, Microprocessor-independent biogenesis pathway generates a germline enriched miRNA family","10.1101/2025.04.11.648421","biorxiv",1.6,1.6,1.6,1.6,1.6,"Sakhawala, R.; Vieux, K.-F.; Haskell, D.; Yu, G.; Zinovyeva, A.; McJunkin, K.","Katherine McJunkin","National Institute of Diabetes and Digestive and Kidney Diseases","2025-04-11","1","new results","cc0","molecular biology","https://www.biorxiv.org/content/early/2025/04/11/2025.04.11.648421.source.xml","MicroRNAs (miRNAs) are short RNAs that post-transcriptionally regulate gene expression and play critical roles in development and differentiation. In canonical miRNA biogenesis, primary miRNAs are transcribed from intergenic loci or intronic regions by RNA polymerase II, sequentially cleaved by the Microprocessor complex and Dicer, and resulting mature miRNAs are loaded into Argonaute to repress target mRNAs. A minority of miRNAs are generated via noncanonical biogenesis pathways that bypass the Microprocessor and/or Dicer. Here, we describe a new Pol III-dependent, Microprocessor-independent, and Dicer-dependent biogenesis pathway exemplified by the mir-1829 family in C. elegans. The mir-1829 family is germline enriched and resides in unusually long introns of three host genes that have no apparent overlapping functions. Using multiple approaches, we determined that the mir-1829 family is derived from independent Pol III transcripts with consistent transcription start sites. Unlike other Pol III-dependent miRNAs, the mir-1829 family small RNAs are the dominant species derived from their loci, rather than fragments of a larger functional noncoding RNA. We extend these findings, identifying additional Pol III-transcribed and noncanonical miRNAs in C. elegans and human datasets. These young, noncanonical miRNAs may represent an early snapshot in the evolution of de novo miRNA genes.","NA","biorxiv",1744582124635
"Long-term evolution of prokaryotic genomes in a chemolithotrophic cave over 5.5 million years of isolation","10.1101/2025.04.10.648229","biorxiv",14.899999999999997,1.6,14.899999999999997,14.899999999999997,14.899999999999997,"Saati-Santamaria, Z.; Novakova, A.; Carro, L.; Gonzalez-Candelas, F.; Iranzo, J.; Hillebrand-Voiculescu, A. M.; Morais, D.; Vetrovsky, T.; Baldrian, P.; Kolarik, M.; Garcia-Fraile, P.","Zaki Saati-Santamaria","Institute of Microbiology of the Czech Academy of Sciences","2025-04-10","1","new results","cc_no","microbiology","https://www.biorxiv.org/content/early/2025/04/10/2025.04.10.648229.source.xml","Fluctuating conditions drive adaptive evolution, yet understanding how genomes evolve under stable conditions over extended periods remains a major challenge, since most research on microbial evolution relies on short-term experiments or phylogenetic comparisons. The Movile Cave, isolated from external influences 5.5 million years, offers a unique opportunity to explore microbial evolution under prolonged environmental stability. Here, we analyzed metagenome-assembled genomes from this cave, revealing that prokaryotes exhibit lower gene diversity and higher levels of pseudogenization compared to those from non-isolated environments, mainly affecting housekeeping functions involved in translation. Functional redundancy across genomes remained comparable to related habitats. Our results suggest that pseudogenization may serve as a fine-tuning mechanism to reduce excess redundancy. Although horizontal gene transfer is limited overall, the cave virome seems to contribute to microbial adaptation through the transfer of auxiliary metabolic genes. Movile microorganisms harbor fewer phage-defense systems than counterparts in related environments, suggesting a long-term adaptation to a relatively stable virosphere. Our findings indicate that prolonged isolation under stable selective pressures does not necessarily lead to major genomic divergence, but rather promotes adaptive gene loss. This study provides key insights into how long-term stability shapes microbial genome evolution and ecosystem function.","NA","biorxiv",1744582124635
"Spatial Clustering of Interface Residues Enhances Few-Shot Prediction of Viral Protein Binding","10.1101/2025.04.10.647895","biorxiv",1.5,1.5,1.5,1.5,1.5,"Basse, M.; Wang, D.; Shakhnovich, E.","Eugene Shakhnovich","Harvard University","2025-04-11","1","new results","cc_by_nc","molecular biology","https://www.biorxiv.org/content/early/2025/04/11/2025.04.10.647895.source.xml","Predicting protein binding affinities across large combinatorial mutation spaces remains a critical challenge in molecular biology, particularly for understanding viral evolution and antibody interactions. While combinatorial mutagenesis experiments provide valuable data for training predictive models, they are typically limited due to experimental constraints. This creates a significant gap in our ability to predict the effects of more extensive mutation combinations, such as those observed in emerging SARS-CoV-2 variants. We present PROXICLUST, which strategically combines smaller combinatorial mutagenesis experiments to enable accurate predictions across larger combinatorial spaces. Our approach leverages the spatial proximity of amino acid residues to identify potential epistatic interactions, using these relationships to optimize the design of manageable-sized combinatorial experiments. By combining just two small combinatorial datasets, we achieve accurate binding affinity predictions across substantially larger mutation spaces (R2 {approx} 0.8), with performance strongly correlated with capture of high-order epistatic effects. We validated our method in five different protein-protein interaction datasets, including binding of SARS-CoV-2 receptor binding domain (RBD) to various antibodies and cellular receptors, as well as influenza RBD-antibody interactions. This work provides a practical framework for extending the predictive power of combinatorial mutagenesis beyond current experimental constraints, offering applications in viral surveillance and antibody engineering.","NA","biorxiv",1744582124635
"MHC Class I-like Gene in Squirrel Monkey Cytomegalovirus and the Evolution of the Virus","10.1101/2025.04.10.648282","biorxiv",1.5,1.5,1.5,1.5,1.5,"Hondo, E.; Mizutani, T.; Shimoda, H.; Iida, A.","Eiichi Hondo","Nagoya University, 4648601, Nagoya, Japan","2025-04-11","1","new results","cc_no","microbiology","https://www.biorxiv.org/content/early/2025/04/11/2025.04.10.648282.source.xml","Homology searches between the entire viral peptides and the human peptides revealed a squirrel monkey cytomegalovirus (Saimiriine herpesvirus 4 strain [SBHV4]) S9 protein exhibiting 60.6% amino acid sequence identity across 86.3% of the full-length human HLA-A. This represents the most extensive and highest level of homology observed to date between a viral protein and an Major Histocompatibility Complex (MHC) class I molecule. Molecular modeling of the S9 and HLA-A proteins and subsequent structural comparison confirmed significant similarity, including the antigen-presenting region. Although cytomegalovirus exhibits high host specificity, the presence of the S9 protein in this virus warrants immunological caution in the event of cross-species transmission. Phylogenetic analysis of MHC class I-like gene sequences corresponding to primate HLA-A and SBHV4 suggested that SBHV4-S9 was likely acquired via LINE-1-mediated horizontal gene transfer from the African Old World monkey Papio anubis or a closely related ancestral species approximately 12.9 to 22.2 million years ago. SBHV4-S9 displayed evidence of strong negative selection following its divergence from Papio anubis. Furthermore, phylogenetic analysis of the SBHV4-S1 gene and primate SLAMF6-like genes indicated that this gene was acquired after the divergence from the New World monkey Saimiri boliviensis boliviensis. Evaluation of the overall genetic similarity between the SBHV4 genome and cDNAs from individual primate species using hierarchical clustering based on Levenshtein distance and Wasserstein distance revealed a higher degree of similarity between the SBHV4 genome and Papio anubis cDNA compared to that with Saimiri boliviensis boliviensis cDNA. Taken together, these findings suggest that Papio anubis has a longer co-evolutionary history with SBHV4 than squirrel monkeys, and that SBHV4 likely spread from Africa to South America, acquiring novel genomic elements in new hosts.","NA","biorxiv",1744582124635
"Does COMT Play a Role in Parkinson's Disease Susceptibility Across Diverse Ancestral Populations?","10.1101/2025.04.11.25325572","medrxiv",1.5,1.5,1.5,1.5,1.5,"Martin-Bornez, M.; Shar, N.; Nour, M. A.; Murphy, D.; Elsayed, I.; N, M. S.; Nwaokorie, F.; Olusanya, A.; Kuznetsov, N.; Bandres-Ciga, S.; Noyce, A. J.; Iwaki, H.; Jones, L.; Gomez-Garre, P.; Mir, P.; The Global Parkinson's Genetics Program (GP2),  ; Perinan, M. T.","María Teresa Periñán","Instituto de Biomedicina de Sevilla; Center for Preventive Neurology (QMUL)","2025-04-11","1","PUBLISHAHEADOFPRINT","cc_by","genetic and genomic medicine","https://www.medrxiv.org/content/early/2025/04/11/2025.04.11.25325572.source.xml","Background: The catechol-O-methyltransferase (COMT) gene is involved in brain catecholamine metabolism, but its association with Parkinson's disease (PD) risk remains unclear. Objective: To investigate the relationship between COMT genetic variants and PD risk across diverse ancestries. Methods: We analyzed COMT variants in 2,251 PD patients and 2,835 controls of European descent using whole-genome sequencing from the Accelerating Medicines Partnership-Parkinson Disease (AMP-PD), along with 20,427 PD patients and 11,837 controls from 10 ancestries using genotyping data from the Global Parkinson's Genetics Program (GP2). Results: Utilizing the largest case-control datasets to date, no significant enrichment of COMT risk alleles in PD patients was observed across any ancestry group after correcting for multiple testing. Among Europeans, no correlations with cognitive decline, motor function, motor complications, or time to LID onset were observed. Conclusions: These findings emphasize the need for larger, diverse cohorts to confirm the role of COMT in PD development and progression.","NA","medrxiv",1744582124635
"TIR immune signaling is blocked by phosphorylation to maintain plant growth","10.1101/2025.04.09.647920","biorxiv",6.6,1.5,6.6,6.6,6.6,"Li, J.; Chen, S.; Yu, B.; Li, Q.; Liu, R.; Wang, Z.; Wan, L.; Zhao, Y.","Yang Zhao","Shanghai Center for Plant Stress Biology, and CAS Center for Excellence in Molecular Plant Sciences,","2025-04-10","1","new results","cc_by","plant biology","https://www.biorxiv.org/content/early/2025/04/10/2025.04.09.647920.source.xml","Toll/interleukin-1 receptor (TIR) domain proteins are immune signaling components and function as NAD+-cleaving enzymes to activate defense responses. Activation of TIRs represses growth and drives cell death in plants and promotes axon degeneration in animals, but how plant TIRs are repressed remains unclear. Here, we show that TIR NADase activity requires a conserved serine residue spatially close to the catalytic glutamate. The plant Ca2+-dependent protein kinases (CPKs), the mammalian Ca2+/calmodulin-dependent protein kinase II delta (CAMK2D) and TANK binding kinase 1 (TBK1) phosphorylate TIR domains at this conserved serine, which blocks TIR NADase activities and functions and thus maintains growth in plants and suppresses SARM1 TIR signaling in animals, respectively. Our findings define a fundamental molecular mechanism by which phosphorylation at a conserved serine residue blocks TIR signaling to balance growth and defense trade-offs.","NA","biorxiv",1744582124635
"Synapses drive local mitochondrial ATP synthesis to fuel plasticity","10.1101/2025.04.09.648032","biorxiv",19.999999999999996,1.5,19.999999999999996,19.999999999999996,19.999999999999996,"Ghosh, I.; Fan, R.; Shah, M.; Bapat, O.; Rangaraju, V.","Vidhya Rangaraju","Max Planck Florida Institute for Neuroscience","2025-04-10","1","new results","cc_by_nc_nd","neuroscience","https://www.biorxiv.org/content/early/2025/04/10/2025.04.09.648032.source.xml","Our brain constantly forms new memories and stabilizes existing memories. To achieve such cognitive flexibility, the brain is wired by plastic synapses that are hotspots of energy consumption. Supplying energy to distant synapses is challenging as they are distributed throughout dendrites and axons, spanning hundreds of microns from their cell body. Synapses, therefore, require an instant and local energy supply provided by mitochondria stabilized near dendritic spines. However, the mechanisms by which synapses communicate their energy demands to locally stable mitochondria to drive local energy production and sustain synaptic plasticity is unknown. Using highly sensitive spine- and mitochondrial ATP reporters and two-photon glutamate uncaging to stimulate individual spines, we find that synaptic plasticity input drives instant and sustained increase in spine ATP levels, provided by local ATP synthesis in [~]10-20 m spatially confined compartments within mitochondria. This spatially localized mitochondrial ATP generation is driven by a spatially localized mitochondrial calcium influx independent of the endoplasmic reticulum. Notably, the initial spine ATP increase, supported by local mitochondrial ATP synthesis, is independent of CaMKII and the energy demands of spine structural plasticity. Without local calcium signaling and mitochondrial stabilization, synapses do not meet their instant and sustained energy needs, resulting in synaptic plasticity defects, as observed in neurological disorders.","NA","biorxiv",1744582124635
"Saturation genome editing of RNU4-2 reveals distinct dominant and recessive neurodevelopmental disorders","10.1101/2025.04.08.25325442","medrxiv",41.90000000000003,1,41.90000000000003,41.90000000000003,41.90000000000003,"De Jonghe, J.; Kim, H. C.; Adedeji, A.; Leitao, E.; Dawes, R.; Chen, Y.; Blakes, A. J.; Simons, C.; Rius, R.; Alvi, J. R.; Amblard, F.; Austin-Tse, C.; Baer, S.; Balton, E. V.; Blanc, P.; Calame, D. G.; Coutton, C.; Cunningham, C. A.; Dargie, N.; Dipple, K. M.; Du, H.; El Chehadeh, S.; Glass, I.; Gleeson, J. G.; Grunewald, O.; Gueguen, P.; Harbuz, R.; Jacquemont, M.-L.; Leventer, R. J.; Marijon, P.; Messaoud, O.; Sultan, T.; Thauvin, C.; Vincent-Delorme, C.; Yilmaz Gulec, E.; Thevenon, J.; Mendez, R.; MacArthur, D. G.; Depienne, C.; Nava, C.; Whiffin, N.; Findlay, G. M.","Nicola Whiffin","Big Data Institute, University of Oxford, Oxford, UK; Centre for Human Genetics, University of Oxford, Oxford, UK;Broad Center for Mendelian Genomics, Program i","2025-04-11","1","PUBLISHAHEADOFPRINT","cc_by","genetic and genomic medicine","https://www.medrxiv.org/content/early/2025/04/11/2025.04.08.25325442.source.xml","Recently, de novo variants in an 18 nucleotide region in the centre of RNU4-2 were shown to cause ReNU syndrome, a syndromic neurodevelopmental disorder (NDD) that is predicted to affect tens of thousands of individuals worldwide. RNU4-2 is a non-protein-coding gene that is transcribed into the U4 small nuclear RNA (snRNA) component of the major spliceosome. ReNU syndrome variants disrupt spliceosome function and alter 5' splice site selection. Here, we performed saturation genome editing (SGE) of RNU4-2 to identify the functional and clinical impact of variants across the entire gene. The resulting SGE function scores, derived from variants' effects on cell fitness, discriminate ReNU syndrome variants from those observed in the population and dramatically outperform in silico variant effect prediction. Using these data, we redefine the ReNU syndrome critical region at single nucleotide resolution, resolve variant pathogenicity for variants of uncertain significance, and show that SGE function scores delineate variants by phenotypic severity. Further, we identify variants impacting function in regions of RNU4-2 that are critical for interactions with other spliceosome components. We show that these variants cause a novel recessive NDD that is clinically distinct from ReNU syndrome. Together, this work defines the landscape of variant function across RNU4-2, providing critical insights for both diagnosis and therapeutic development.","NA","medrxiv",1744582124635
"Atom level enzyme active site scaffolding using RFdiffusion2","10.1101/2025.04.09.648075","biorxiv",31.099999999999994,1.35,31.099999999999994,31.099999999999994,31.099999999999994,"Ahern, W.; Yim, J.; Tischer, D.; Salike, S.; Woodbury, S.; Kim, D.; Kalvet, I.; Kipnis, Y.; Coventry, B.; Altae-Tran, H.; Bauer, M.; Barzilay, R.; Jaakkola, T.; Krishna, R.; Baker, D. A.","David A Baker","University of Washington","2025-04-10","2","new results","cc_by","biochemistry","https://www.biorxiv.org/content/early/2025/04/10/2025.04.09.648075.source.xml","De novo enzyme design starts from ideal active site descriptions consisting of constellations of catalytic residue functional groups around reaction transition state(s), and seeks to generate protein structures that can accurately hold the site in place. Highly active enzymes have been designed starting from such descriptions using the generative AI method RFdiffusion, but there are two current methodological limitations. First, the geometry of the active site can only be specified at the residue level, so for each catalytic residue functional group placed around the reaction transition state, the possible locations of the residue backbone must be enumerated by building side chain rotamers back from the functional group. Second, the location of the catalytic residues along the sequence must be specified in advance, which considerably limits the space of solutions which can be sampled. Here we describe a new deep generative method, RoseTTAFold diffusion 2 (RFdiffusion2), that solves both problems, enabling enzymes to be designed from sequence agnostic descriptions of functional group locations without inverse rotamer generation. We first evaluate RFdiffusion2 on an in silico enzyme design benchmark of 41 diverse active sites and find that it is able to successfully build proteins scaffolding all 41 sites, compared to 16/41 with prior state-of-the-art deep learning methods. Next, we design enzymes around three diverse catalytic sites and characterize the designs experimentally; in each case we identify active catalysts in testing less than 96 sequences. RFdiffusion2 demonstrates the potential of atomic resolution generative models for the design of de novo enzymes directly from their reaction mechanisms.","NA","biorxiv",1744582124635
"Backyard proteomics: A case study with the black widow spider","10.1101/2025.04.11.648442","biorxiv",10.780000000000001,0.85,10.780000000000001,10.780000000000001,10.780000000000001,"Shah, T.; Fitzpatrick, J. A.; Orsburn, B. C.","Benjamin C Orsburn","The University of Pittsburgh","2025-04-11","1","new results","cc_by_nc","biochemistry","https://www.biorxiv.org/content/early/2025/04/11/2025.04.11.648442.source.xml","Nearly all methods of mass spectrometry-based proteomics rely on knowing the proteome of the species. In less studied organisms without annotated genomes, it can seem impossible to perform proteomic analysis. In this study we sought to answer the question - does enough information exist to do proteomics on any organism we want? As a case study we started with material available due to an infestation of a home with black widow spiders. Thanks to the recent publication of an annotated genome for one species of black widow spider, we were able to identify 5502 protein groups and assign putative annotations using ortholog mapping. We also demonstrate that had we not had this resource, over 2000 proteins could be identified using other available spider genome annotations, despite their unrelatedness. Moreover, regardless of spider proteome used, proteins annotated as toxins were almost exclusively observed in the main body of the mature female black widow spider. Overall, these results provide a draft proteome map for the black widow spider and valuable data for validating machine learning models, while also suggesting that the door to insightful quantitative proteomics may already be open for millions of less studied organisms. All raw and processed proteomic data are available through the ProteomeXchange repository as accession PXD051601","NA","biorxiv",1744582124635
"Altair-LSFM: A High-Resolution, Easy-to-Build Light-Sheet Microscope for Sub-Cellular Imaging","10.1101/2025.04.08.647739","biorxiv",9.2,0,9.2,9.2,9.2,"Haug, J.; Gałecki, S.; Dean, K. M.","Kevin M Dean","The University of Texas Southwestern Medical Center","2025-04-10","1","new results","cc_by","biophysics","https://www.biorxiv.org/content/early/2025/04/10/2025.04.08.647739.source.xml","Although several open-source, easy-to-assemble light-sheet microscope platforms already exist--such as mesoSPIM, OpenSPIM, and OpenSpin--they are primarily optimized for imaging large specimens and lack the resolution required to visualize sub-cellular organelles or cytoskeletal architectures. Conversely, commercial systems like Lattice Light-Sheet Microscopy offer improved resolution but are complex, expensive, and alignment-intensive. To address this gap, we developed Altair-LSFM, a high-resolution, open-source, sample-scanning light-sheet microscope specifically designed for sub-cellular imaging. By optimizing the optical pathway in silico, we created a custom baseplate with precisely positioned dowel pins to simplify alignment and assembly. The system integrates streamlined optoelectronics and optomechanics with seamless operation through our open-source software, navigate. Altair-LSFM achieves lateral and axial resolutions of approximately 235 nm and 350 nm, respectively, across a 266-micron field of view after deconvolution. We validate the systems capabilities by imaging sub-diffraction fluorescent nanospheres and visualizing fine structural details in mammalian cells, including microtubules, actin filaments, nuclei, and Golgi apparatus.","NA","biorxiv",1744582124635
