"title","doi","altmetric_jid","score","X1d","X3d","X1w","X1m","authors","author_corresponding","author_corresponding_institution","date","version","type","license","category","jatsxml","abstract","published","server","upupdate_time"
"Reproducible detection of antigen-specific T cells and Tregs via standardized and automated activation-induced marker assay workflows","10.1101/2025.07.15.664847","biorxiv",3.95,3.95,3.95,3.95,3.95,"Halvorson, T.; Boucher, G.; Yokosawa, D.; Huang, J. Q.; Garcia, R.; Sanderink, L.; Chen, L.; Liu, L.; Fajardo-Despaigne, J. E.; Halvorson, J.; Brinkman, R.; Vercauteren, S.; Lesage, S.; Bramson, J.; Rioux, J. D.; Ivison, S.; Levings, M. K.","Sabine Ivison","BC Children\'s Hospital Research Institute, Vancouver, BC, Canada","2025-07-15","1","new results","cc_by_nc_nd","immunology","https://www.biorxiv.org/content/early/2025/07/15/2025.07.15.664847.source.xml","Activation-induced marker (AIM) assays are a promising tool to track antigen-specific T cells, but methodological heterogeneity between research groups hinders their clinical utility. To evaluate AIM assay reproducibility, we conducted a multi-site study of SARS-CoV-2 and cytomegalovirus AIMs. We found inherent variability in AIM assays and optimized approaches to enhance reproducibility, including a standardized workflow to minimize technical variability and a generalizable Box-Cox transformation-based statistical method to optimize calculation of AIM stimulation responses. We further standardized AIM data analysis through development of automated flow cytometric gating software, which had superior reproducibility compared to manual analysis. We also characterized antigen-specific Tregs, finding that gating on a combination of CD134, CD137, FOXP3 and HELIOS optimally detects antigen-specific cells. The combined methodology results in a high degree of reproducibility within and between research groups and provides a comprehensive foundation from which standardized AIM assays can be implemented across diverse scientific and clinical settings.","NA","biorxiv",1752703875454
"Heterotypic Protein Interactions Modulate the Condensate Dynamics and Aggregation of α-Synuclein","10.1101/2025.07.10.664163","biorxiv",3.7,3.7,3.7,3.7,3.7,"Roychowdhury, S.; Paul, S.; Sojitra, K.; Bhattacharya, S.; Mazumder, A.; Mittal, J.; Chattopadhyay, K.","Krishnananda Chattopadhyay","CSIR-Indian Institute of Chemical Biology","2025-07-15","1","new results","cc_by_nc_nd","biophysics","https://www.biorxiv.org/content/early/2025/07/15/2025.07.10.664163.source.xml","Multicomponent biomolecular condensates formed by diverse multivalent proteins underlie numerous cellular processes, from ribosome biogenesis to stress response regulation, and have recently been implicated in disease-related protein aggregation. Understanding how heterotypic protein interactions modulate condensate dynamics and transitions to amyloid states remains a major challenge. Here, we combine fluorescence-based ensemble and single-molecule approaches, molecular simulations, and systematic domain deletions to investigate how charge patterning and domain structure influence co-condensation between -synuclein, a disordered neuronal protein linked to Parkinson's disease, and the SARS-CoV-2 nucleocapsid protein (NP) a structured viral RNA-binding protein. We find that co-condensation is driven by multivalent electrostatic interactions and occurs when the heterotypic affinity exceeds a threshold, resulting in restricted protein dynamics and altered condensate material properties. These changes promote the formation of dense amyloid fibrils, as confirmed by atomic force microscopy and fluorescence assays. Our results elucidate how heterotypic interactions within multiphasic condensates can modulate phase behavior and aggregation, providing insight into broader mechanisms linking condensate dysregulation with neurodegenerative diseases.","NA","biorxiv",1752703875454
"Stem cells actively suppress regenerative plasticity in human colon","10.1101/2025.07.13.664589","biorxiv",4.45,3.7,4.45,4.45,4.45,"Hageman, J. H.; Yalcin, D.; Buissant des Amorie, J. R.; Brunner, S. R.; Kluiver, T. A.; Balwierz, A.; Langner, F. L.; Puschhof, M. C.; Bollen, Y.; Margaritis, T.; Snippert, H. J. G.","Hugo J.G. Snippert","Center for Molecular Medicine; University Medical Center Utrecht, Utrecht, the Netherlands & Oncode Institute, Utrecht, the Netherlands.","2025-07-14","1","new results","cc_no","cell biology","https://www.biorxiv.org/content/early/2025/07/14/2025.07.13.664589.source.xml","Insights into intestinal stem cell functioning during homeostasis and repair have been predominantly derived from genetic mouse models. This is in stark contrast to the largely unexplored situation in the human gut, where the underlying mechanisms and stimuli that induce regeneration are poorly understood. Here, we developed genetic strategies to characterize fluorescently labelled LGR5+ stem cells in normal human colon organoids. In parallel, we made diphtheria toxin-mediated cell type ablation compatible with human cells, thereby enabling in-depth interrogation of the sequence of events during depletion and reappearance of stem cells. Following LGR5+ stem cell depletion, most of the remaining epithelial cells entered a regenerative state characterized by fetal-like expression programs. Strikingly, this regenerative response was already initiated before stem cell loss, indicative of active communication between functional stem cells and progeny during homeostasis. We identified inactivation of retinoid X receptor (RXR) as a crucial trigger to initiate the regenerative response in colonocytes, with human colon stem cells being the producer of the RXR stimulus retinoic acid. Thus, stem cell-derived retinoic acid actively suppresses the regenerative state in colonocytes, explaining how surviving cells sense stem cell loss.","NA","biorxiv",1752703875454
"Design-Build-Test-Learn guided engineering of a whole-cell pyruvate biosensor based on transcription factor","10.1101/2025.07.14.664704","biorxiv",3.5,3.5,3.5,3.5,3.5,"Gao, Z.; Suarez-Diez, M.; Candry, P.","Pieter Candry","Laboratory of Systems and Synthetic Biology, Wageningen University & Research","2025-07-15","1","new results","cc_by_nc_nd","synthetic biology","https://www.biorxiv.org/content/early/2025/07/15/2025.07.14.664704.source.xml","Whole-cell biosensors are powerful tools for metabolite monitoring, yet challenges such as narrow dynamic range and high leaky expression limit their broader applications. Here, we present a systematic workflow based on two Design-Build-Test-Learn (DBTL) cycles to develop and optimize a transcription factor-based pyruvate biosensor in Escherichia coli. In the first iteration of the cycle, we constructed a biosensor that responded to intracellular pyruvate levels within 0.05 - 10mM range. In the second cycle, we implemented design of experiment (DoE) to systematically explore combinatorial effects of promoters and ribosome binding sites (RBSs). A first set of experiments were designed to identify factors with a significant effect on biosensor performance. The results showed RBS of report gene significantly influenced dynamic range by modulating basal and maximum expression, while RBS of transcription factor affected signal span. The Akaike Information Criterion was used to select a model incorporating two main effects and one interaction effects. The best-performing strain exhibited an 18.5-fold increase in dynamic range and a 37.2-fold reduction in leaky expression. Quantification of intracellular pyruvate confirmed an operational range of 1.23 - 6.81 mol/g DCW. Our work demonstrates the power of DBTL cycles with statistical modelling for biosensor engineering, enabling more precise metabolic regulation and screening applications.","NA","biorxiv",1752703875454
"Temperature variation and life history mediate the degree of nonlinearity in fluctuations of global marine fish populations","10.1101/2025.07.13.664566","biorxiv",3.45,3.45,3.45,3.45,3.45,"Hechler, R. M.; Krkosek, M.","Robert M. Hechler","University of Toronto","2025-07-15","1","new results","cc_by_nc_nd","ecology","https://www.biorxiv.org/content/early/2025/07/15/2025.07.13.664566.source.xml","Nonlinear dynamics readily occur in natural ecosystems and can drive irregular population fluctuations through oscillations, chaos and alternative stable states. However, the effects of anthropogenic changes, such as to demography and the climate, on nonlinearity of population fluctuations is unknown. We evaluated the extent and magnitude of nonlinearity and its environmental and life history correlates in 243 recruitment and 267 spawner time series of 143 marine fish species, worldwide. Here we show that temperature variation amplifies nonlinearity in recruitment and spawner biomass, while life history mediates the degree of nonlinearity for the latter, dampening it in slow-lived species. Nonlinearity was displayed by 81% of populations and correlated with the magnitude of fluctuations. These nonlinear dynamics were low-dimensional and causally forced by temperature in 60% of populations with the probability of forcing increasing for recruits in variable temperature environments and fast-lived spawners. Our results challenge assumptions of stable dynamics and sustainable yield common to fisheries management, and suggests nonlinear fluctuations of fish populations are magnified by size-selective fisheries and environmental variability from global climate change.","NA","biorxiv",1752703875454
"Temporal Dynamics of Sensorimotor Integration for Non-Visual Target Information During Movement Preparation and Online Control","10.1101/2025.07.09.663821","biorxiv",3.45,3.45,3.45,3.45,3.45,"Camponogara, I.","Ivan Camponogara","Zayed University","2025-07-14","1","new results","cc_by_nc_nd","neuroscience","https://www.biorxiv.org/content/early/2025/07/14/2025.07.09.663821.source.xml","Online movement variability in non-visual (auditory and proprioceptive) target reaching is modality-dependent. This study investigated whether such modality-specific effects emerge during movement preparation and whether this phase influences subsequent online control. Participants performed reaching movements toward auditory, proprioceptive, or audio-proprioceptive targets. Electromyography and movement kinematics were recorded to examine the effects of sensory modality on sensory encoding and motor coordination during movement preparation, as well as online control at 5%, 50%, and 100% of movement time. Results revealed a modality-dependent sensory encoding phase, whereas a modality-independent motor coordination phase. Movement variability was greater for auditory targets than for proprioceptive and audio-proprioceptive targets at 50% and 100% of movement. Only motor coordination influenced early online control (5%), but this effect was modality-independent. These findings demonstrate that the influence of sensory modality extends beyond execution to the preparatory phase of movement. The results support a four-stage model of action control: a modality-dependent sensory encoding phase of preparation and late online control, alongside a modality-independent motor coordination phase and early online control. These findings offer new insight into the temporal dynamics of sensorimotor control without vision, indicating that non-visual sensory information is differentially used during distinct phases of movement preparation and execution.","NA","biorxiv",1752703875454
"RNA liquid biopsy via nanopore sequencing for novel biomarker discovery and cancer early detection","10.1101/2025.07.02.662774","biorxiv",16.349999999999998,3.45,4.55,12.249999999999998,16.349999999999998,"Peddu, V.; Hill, A.; Velandi Maroli, S. L.; Mattingly, C.; Gardner, J. M. V.; Miga, K. H.; Fitzgerald, R. C.; Kim, D. H.","Daniel H. Kim","Department of Biomolecular Engineering, University of California Santa Cruz, Santa Cruz, CA, USA","2025-07-05","1","new results","cc_by","genomics","https://www.biorxiv.org/content/early/2025/07/05/2025.07.02.662774.source.xml","Liquid biopsies detect disease noninvasively by profiling cell-free nucleic acids that are secreted into the circulation. However, existing methods exhibit low sensitivity for detecting early stages of diseases such as cancer. Here we show that long-read nanopore sequencing of full-length cell-free RNA in plasma from healthy individuals, precancerous Barretts esophagus patients with high-grade dysplasia, or patients with esophageal adenocarcinoma reveals a diverse cell-free RNA transcriptome that can be leveraged for detecting and treating disease. We discovered 270,679 novel, intergenic cell-free RNAs, which we used to build a custom transcriptome reference for quantification, feature selection, and machine learning to accurately classify both precancer and cancer. Moreover, we found potential therapeutic targets, including metabolic, signaling, and immune checkpoint pathways, that are highly upregulated in both precancer and cancer patients. Our findings highlight the utility of our RNA liquid biopsy platform technology for discovering and targeting early stages of disease with molecular precision.","NA","biorxiv",1752703875454
"Dynamic extracellular interactions with AMPA receptors","10.1101/2025.07.11.664166","biorxiv",4.15,3.4,4.15,4.15,4.15,"Merrion, H. G.; Barber, C. N.; Renuse, S. S.; Cutler, J.; Kreimer, S.; Bygrave, A. M.; Meyers, D. J.; Hale, W. D.; Pandey, A.; Huganir, R. L.","Richard L. Huganir","Johns Hopkins School of Medicine","2025-07-14","1","new results","cc_by_nc_nd","neuroscience","https://www.biorxiv.org/content/early/2025/07/14/2025.07.11.664166.source.xml","Synaptic plasticity in the central nervous system enables the encoding, storing, and integrating new information. AMPA-type glutamate receptors (AMPARs) are ligand-gated ion channels that mediate most fast excitatory synaptic transmission in the brain, and plasticity of AMPARs signaling underlies the long-lasting changes in synaptic efficacy and strength important for learning and memory.1,2 Recent work has indicated that the enigmatic N-terminal domain (NTD) of AMPARs may be a critical regulator of synaptic targeting and plasticity of AMPARs. However, few synaptic proteins have been identified that regulate AMPAR plasticity through interactions with AMPAR NTDs. Moreover, the scope of AMPAR NTD interactors that are important for synaptic plasticity remains unknown. Here, we present the dynamic, extracellular interactome for AMPARs during synaptic plasticity. Using surface-restricted proximity labeling and BioSITe-based proteomics, we identified 70 proteins that were differentially labeled by APEX2-tagged AMPARs after induction of chemical Long-term potentiation of synapses (cLTP) in cultured neurons. Included in this list, were four members of the IgLON family of GPI-anchored proteins (Ntm, OBCAM/Opcml, Negr1, Lsamp). We show OBCAM and NTM directly interact with the extracellular domains of AMPARs. Moreover, overexpression of NTM significantly attenuates the mobility of surface AMPARs in dendritic spines. These data represent a significant first step at uncovering the unexplored extracellular regulation of AMPARs, with broad implications for synapse function and synaptic plasticity.

Significance StatementOver the past 30 years, significant effort has been focused on understanding the mechanisms that induce long-lasting changes in synapse strength (synaptic plasticity) that drive learning and memory. While many studies have investigated intracellular mechanisms that enable plasticity, especially those acting on AMPA-type glutamate receptors (AMPARs), significantly less is known regarding extracellular mechanisms that shape changes in synapse function. Here, we identified 70 proteins that differentially associate with the extracellular region of AMPARs during chemically-induced synaptic plasticity. We show that OBCAM and NTM directly interact with the NTD of AMPARs and regulate their mobility on the surface of neurons. These data advance our understanding of extracellular AMPAR regulation, with broad implications for synapse function and synaptic plasticity.","NA","biorxiv",1752703875454
"High precision CA-ID-TIMS U-Pb zircon age for the Dueling Dinosaur locality, with implications for regional correlation, basal age and duration of the Hell Creek Formation, Montana","10.1101/2025.07.10.664044","biorxiv",3.25,3.25,3.25,3.25,3.25,"Roberts, E. M.; Hendrix, M. S.; Ramezani, J.; Clyde, W. C.; Zippi, P.; Hodgson, S.; Yuleridge, V.; Zanno, L. E.","Eric M. Roberts","Colorado School of Mines","2025-07-16","1","new results","cc_by","paleontology","https://www.biorxiv.org/content/early/2025/07/16/2025.07.10.664044.source.xml","Discovery of the spectacular  Dueling Dinosaurs and other significant dinosaur localities from remote and isolated exposures of the Hell Creek Formation in central Montana highlight the complexity of establishing stratigraphic context and correlating Hell Creek Formation fossil localities located outside of the type area. This is particularly problematic for the lower two-thirds of the formation, which generally lacks reliable biostratigraphic or magnetostratigraphic zonation and has no dated ash beds. To address these enduring issues for one of the most significant Upper Cretaceous terrestrial fossil-bearing units in North America, detailed stratigraphic sections were established on the Murray Ranch and on McGinnis Butte in central Montana and correlated with other published Hell Creek Formation localities via magnetostratigraphy, biostratigraphy, and radioisotopic dating of ash beds. Results indicate that the K-Pg boundary is not exposed in the study area, however high-precision U-Pb CA-TIMS zircon ages for two newly discovered ash beds (66.929 {+/-} 0.020 Ma and 66.850 {+/-} 0.026 Ma, respectively) bracketing the  Dueling Dinosaurs locality provide the first absolute ages for the lower portion of the Hell Creek Formation, anywhere. Bayesian age-stratigraphic modelling places the  Dueling Dinosaurs locality at 66.897 +0.023/-0.028 Ma and suggest that the age of the base of the formation is ~67.102 +0.710/-0.173 Ma (or older) in the study area. Comparison of stratigraphic architecture within the study area with published sections in the type area suggests that named sandstone marker horizons used for lithostratigraphic and sequence stratigraphic correlation in the type area have limited utility for regional correlation and need to be used with caution.","NA","biorxiv",1752703875454
"Locomotor Trends Among Early Mammals Illuminated by Predictors of Arboreality from the Mammalian Appendicular Skeleton","10.1101/2025.07.09.663922","biorxiv",3.25,3.25,3.25,3.25,3.25,"Nations, J. A.; Weaver, L. N.; Grossnickle, D. M.","David M Grossnickle","Oregon Institute of Technology","2025-07-14","1","new results","cc_by_nc_nd","paleontology","https://www.biorxiv.org/content/early/2025/07/14/2025.07.09.663922.source.xml","Arboreal locomotion is a common trait among extant mammals, and it likely evolved independently in numerous Mesozoic and Cenozoic mammalian lineages. We review evidence for the evolution of arboreality within lineages of early mammals and their stem relatives (Synapsida) while also emphasizing the uncertainty of locomotor inferences of fossil lineages. An improved understanding of the evolutionary origins and prevalence of arboreality in early mammals requires robust links between morphological traits and locomotor behaviors that can be applied to fossils. To this end, we use a large comparative dataset of linear measurements taken on extant mammalian postcranial specimens to evaluate the skeletal proxies that best differentiate arboreality from other locomotor modes. Consistent with previous research, we find that measures of digit length and elbow proportions are especially powerful predictors of climbing. Locomotor predictions based on single measurements or ratios are improved when phylogeny is incorporated into models. Nonetheless, combining multiple functionally relevant traits into our models yields robust predictions of locomotor mode even without incorporating phylogenetic information--this is especially encouraging for fossil groups with unstable phylogenies. We test these locomotor proxies in three early-mammalian case studies--Multituberculata, Plesiadapiformes, and early Theria. We find that multituberculates had a wide locomotor breadth whereas plesiadapiforms all had a high probability of climbing, consistent with previous studies. However, some Mesozoic therians in our sample are predicted to be ground-dwellers, conflicting with the hypothesis that the ancestral therian was scansorial or arboreal. The predictive tools presented here will improve locomotor inferences for small mammals, further illuminating the prevalence and importance of arboreality in early mammalian evolution.","NA","biorxiv",1752703875454
"A network perspective on the evolution of hybrid incompatibilities","10.1101/2025.07.09.663985","biorxiv",3.1,3.1,3.1,3.1,3.1,"Brud, E.; Guerrero, R.","Rafael Guerrero","North Carolina State University","2025-07-15","1","new results","cc_by_nc","evolutionary biology","https://www.biorxiv.org/content/early/2025/07/15/2025.07.09.663985.source.xml","Theory predicts that hybrid incompatibilities accumulate faster than linearly with genetic divergence, a phenomenon known as the snowball effect. While this prediction is mathematically robust under simplifying assumptions, accumulating evidence suggests that the structure of gene interaction networks can alter both the rate and organization of incompatibility evolution. Here, we extend classic DMI models with a network approach, equating the assumptions of the Orr model with a complete graph of gene interactions. We simulate the evolution of hybrid incompatibilities under different gene interaction networks and evaluate the effects of network density, topology, and substitution model. We find that network density strongly governs the rate of DMI accumulation, particularly under models permitting multiple substitutions per locus, while network topology shapes the agglomeration of incompatibilities into large, connected clusters. Substitution rate heterogeneity, especially when anti-correlated with node degree, further suppresses both accumulation and clustering. These results highlight that while the snowball effect remains qualitatively valid, the structure and evolution of the incompatibility network exhibit nontrivial departures from previous expectations, with implications for observable quantities in empirical systems. Our findings underscore the importance of incorporating genomic architecture and network constraints into models of speciation.","NA","biorxiv",1752703875454
"Multi-seasonal eDNA metabarcoding highlights a resurgence in fish diversity across a severely impacted estuarine ecosystem","10.1101/2025.07.09.663915","biorxiv",3.1,3.1,3.1,3.1,3.1,"Jackman, J. M.; Sales, N. G.; Benvenuto, C.; Drewitt, A.; Wolfenden, A.; Robins, P. E.; Coscia, I.; McDevitt, A. D.","Jake M Jackman","University of Salford","2025-07-14","1","new results","cc_by_nc_nd","ecology","https://www.biorxiv.org/content/early/2025/07/14/2025.07.09.663915.source.xml","Aquatic ecosystems have been in an alarming state of decline for decades. Therefore, there is an urgent need for more accessible and rapid monitoring methods that will ultimately allow for restoration programmes to be implemented. In this study, we deployed environmental DNA (eDNA) metabarcoding as a fish monitoring tool in the Mersey estuarine system (UK), where ecosystem productivity has been severely impacted by water quality degradation since the Industrial Revolution. Monthly water samples were collected over a year (2023-2024) throughout the estuary, covering saline, brackish and freshwater zones. Overall, 69 species of fish were detected, increasing the number of known species within the estuary in comparison to both historical and contemporary records (46 and 39, respectively), with a generally higher observed richness within the upper estuary sampled zones where the water chemistry is predominantly freshwater. Notably, we identified several species returning to the system for the first time since pre-industrial times. Peak species richness was recorded during the winter season (December-February). Species compositions varied significantly by month and spatially by zone within months, but not when grouped seasonally. Furthermore, around [~]15% of the species detected were diadromous, with the endangered Atlantic salmon Salmo salar, for example, being frequently detected during its key migratory period. This study highlights the resurgence in fish diversity in a once biologically depleted estuarine ecosystem and demonstrates how eDNA metabarcoding can be implemented for detecting historically absent species, thereby enhancing restoration monitoring efforts globally.","NA","biorxiv",1752703875454
