"title","doi","altmetric_jid","score","X1d","X3d","X1w","X1m","authors","author_corresponding","author_corresponding_institution","date","version","type","license","category","jatsxml","abstract","published","server","upupdate_time"
"Museums and Zoos: Rapid genetic identification of rare species and practical applications for conservation and systematics in a biodiverse country","10.1101/2025.02.10.637512","biorxiv",8.799999999999999,5.55,8.799999999999999,8.799999999999999,8.799999999999999,"Chavez, D. E.; Carrion, J.; Cabezas, M. B.; Reyes-Barriga, D.; Lojan, P.; Mora, D.; Bustamante, M.; Pinto, M.; Jarrin-V, P.","Daniel E Chavez","Pontifica Universidad Catolica del Ecuador","2025-02-15","1","new results","cc_by_nd","genetics","https://www.biorxiv.org/content/early/2025/02/15/2025.02.10.637512.source.xml","AbstractObtaining genetic information from rare species is challenging for scientists, but it is crucial for understanding animal evolutionary history and informing conservation management initiatives. We present the first example of a collaborative local network that includes zoos and natural history collections to investigate the evolution, systematics, and conservation concerns of olingos (genus Bassaricyon, Procyonidae, Carnivora, Mammalia). We sequenced the entire (1,146 base pairs) cytochrome b gene to phylogenetically identify individuals that have been victims of wildlife trafficking. Unexpectedly, we detected an individual specimen belonging to Bassaricyon medius orinomus (western lowland olingo), which may represent a new geographical record for this taxon in Ecuador. Through our practical experiences, we describe how local collaboration is possible and crucial for promoting wildlife genetic research in the Global South and contributing to protecting the last populations of rare mammals. We also discuss the significance of wild animals under human care as a valuable genetic resource for scientific research, conservation strategies, and informed wildlife management decisions.","NA","biorxiv",1739916494184
"Encoded and non-genetic alternative protein variants expand human functional proteome","10.1101/2025.02.17.638604","biorxiv",5.2,5.2,5.2,5.2,5.2,"Tretyachenko, V.; Leiman, T.; Dahan, O.; Asraf, O.; Dahary, D.; Pilpel, Y. T.","Yitzhak Tzachi Pilpel","Weizmann Institute of Science","2025-02-17","1","new results","cc_by_nc","molecular biology","https://www.biorxiv.org/content/early/2025/02/17/2025.02.17.638604.source.xml","Each stage of the Central Dogma contributes to proteome diversity through mechanisms such as heterozygosity, somatic mutations, transcriptional errors, and translational errors. As a result, a diverse array of protein variants can coexist within a single proteome, such as that of humans. However, until now, methods to detect, quantify, and evaluate the functional consequences of these variants have been lacking. Here we examined a large-scale proteogenomic dataset from 29 healthy human tissues and uncovered over 46,000 of unique single amino acid variants co-existing alongside their corresponding reference proteoforms. Our analysis reveals that substitutions preferentially occur in proteins with low expression levels and often affect less frequently encoded amino acids such as tryptophan, cysteine, histidine, or methionine. We found that the abundance of both genetic (SNPs, somatic mutations) and mistranslated protein variants mirror their allele frequencies in the human population. Moreover, we show that non-genetic substitutions provide a distinct route for exploring protein sequence space, circumventing the mutational constraints imposed by the genetic code. Further, we demonstrate that substitution prevalence correlates negatively with their predicted pathogenicity, particularly in proteins expressed at low levels. We identified hundreds of substituted non-genetic proteoforms that recur consistently in multiple individuals and map to annotated protein functional sites. We propose that these substitutions constitute a novel class of functional protein phenotypic variants. Finally, we illustrate the impact of active-site substitutions in genes such as GAPDH and hemoglobin and highlight potential non-genetic routes of immunoglobulin diversification. Collectively, our findings indicate that non-genetic amino acid substitutions in human proteins provide a recurring and specific route to expanding the functional proteome.","NA","biorxiv",1739916494184
"The Landscape of Shared and Divergent Genetic Influences across 14 Psychiatric Disorders","10.1101/2025.01.14.25320574","medrxiv",8.93,5.08,5.08,5.08,7.93,"Grotzinger, A. D.; Werme, J.; Peyrot, W. J.; Frei, O.; de Leeuw, C.; Bicks, L. K.; Guo, Q.; Margolis, M. P.; Coombes, B. J.; Batzler, A.; Pazdernik, V.; Biernacka, J. M.; Andreassen, O.; Antilla, V.; Borglum, A.; Cai, N.; Demontis, D.; Edenberg, H.; Faraone, S. V.; Franke, B.; Gandal, M.; Gelernter, J.; Hettema, J. M.; Jonas, K.; Knowles, J. A.; Koenen, K. C.; Maihofer, A. X.; Mallard, T. T.; Mattheisen, M.; Mitchell, K. S.; Neale, B.; Nievergelt, C. M.; Nurnberger, J. I.; O'Connell, K. S.; Robinson, E.; Sanchez-Roige, S. S.; Santangelo, S. L.; Stefansson, H.; Stefansson, K.; Stein, M. B.; Str","Andrew David Grotzinger","University of Colorado at Boulder","2025-01-15","1","PUBLISHAHEADOFPRINT","cc_by_nc_nd","genetic and genomic medicine","https://www.medrxiv.org/content/early/2025/01/15/2025.01.14.25320574.source.xml","Psychiatric disorders display high levels of comorbidity and genetic overlap1,2. Genomic methods have shown that even for schizophrenia and bipolar disorder, two disorders long-thought to be etiologically distinct3, the majority of genetic signal is shared4. Furthermore, recent cross-disorder analyses have uncovered over a hundred pleiotropic loci shared across eight disorders5. However, the full scope of shared and disorder-specific genetic basis of psychopathology remains largely uncharted. Here, we address this gap by triangulating across a suite of cutting-edge statistical genetic and functional genomic analyses applied to 14 childhood- and adult-onset psychiatric disorders (1,056,201 cases). Our analyses identify and characterize five underlying genomic factors6 that explain the majority of the genetic variance of the individual disorders ([~]66% on average) and are associated with 268 pleiotropic loci. We observed particularly high levels of polygenic overlap7 and local genetic correlation8 and very few disorder-specific loci9 for two factors defined by: (i) schizophrenia and bipolar disorder (""SB factor""), and by (ii) major depression, PTSD, and anxiety (""internalizing factor""). At the functional level, we applied multiple methods10-12 which demonstrated that the shared genetic signal across the SB factor was substantially enriched in genes expressed in excitatory neurons, whereas the internalizing factor was associated with oligodendrocyte biology. By comparison, the genetic signal shared across all 14 disorders was enriched for broad biological processes (e.g., transcriptional regulation). These results indicate increasing differentiation of biological function at different levels of shared cross-disorder risk, from quite general vulnerability to more specific pathways associated with subsets of disorders. These observations may inform a more neurobiologically valid psychiatric nosology and implicate novel targets for therapeutic developments designed to treat commonly occurring comorbid presentations.","NA","medrxiv",1739916494184
"Peroxisomal Dysfunction Drives Loss of Dynamic Nutrient Responses to Initiate Metabolic Inflexibility During Aging","10.1101/2025.02.14.638340","biorxiv",8,5.05,8,8,8,"Sharma, A.; Mistry, M.; Yao, P.; Liang, Y.; Hui, S. T.; Mair, W. B.","William B Mair","Harvard T. H. Chan School of Public Health","2025-02-16","1","new results","cc_no","cell biology","https://www.biorxiv.org/content/early/2025/02/16/2025.02.14.638340.source.xml","Aging results in a loss of metabolic flexibility during fasting, characterized by the inability to acutely switch between metabolic substrates and reduced lipid mobilization. However, the drivers of these effects intracellularly remain unclear. Here, in Caenorhabditis elegans, we show that loss of coordinated inter-organelle dynamics causally initiates metabolic inflexibility with age. In young animals, peroxisomes emerge as the priming orchestrators of the fasting response, simultaneously governing lipid droplets (LDs) utilization and mitochondrial bioenergetics. With age, peroxisomal priming is lost, leading to mitochondrial fragmentation and impaired dynamic nutrient responses during fasting. Notably, dietary restriction (DR) exerts a rejuvenating effect on peroxisomal function, thereby preserving mitochondrial integrity and promoting longevity. Our study uncovers the expansive network of organelles enabling lipid mobilization during youth, providing critical context to the poorly understood role of peroxisomes in actively maintaining organelle homeodynamics and metabolic flexibility throughout the aging process.","NA","biorxiv",1739916494184
"A Novel Method for Culturing Telencephalic Neurons in Axolotls","10.1101/2025.02.14.638296","biorxiv",5,5,5,5,5,"Bostan, S.; Serdengecti, S.; Bayat, F. K.; Bay, S.; Sezer, A. S.; Aysit, N.; Ozturk, G.","Gurkan Ozturk","Department of Physiology, Faculty of Medicine, Abant Izzet Baysal University, Bolu, Turkiye","2025-02-18","2","new results","cc_by_nc_nd","neuroscience","https://www.biorxiv.org/content/early/2025/02/18/2025.02.14.638296.source.xml","The axolotl (Ambystoma mexicanum), a neotenic salamander with remarkable regenerative capabilities, serves as a key model for studying nervous system regeneration. Despite its potential, the cellular and molecular mechanisms underlying this regenerative capacity remain poorly understood, partly due to the lack of reliable in vitro models for axolotl neural cells. In this study, we developed a novel protocol for primary cultures of adult axolotl telencephalon/pallium, enabling the maintenance of viable and functionally active neural cells. Using calcium imaging and immunocytochemistry, we demonstrated the presence of neuronal and glial markers, synaptic connections, and spontaneous calcium activity, highlighting the functional integrity of the cultured cells. Our findings reveal that these cultures can be maintained in both serum and serum-free conditions, with neurons exhibiting robust neurite outgrowth and responsiveness to injury. This protocol addresses a critical gap in axolotl research by providing a controlled in vitro system to study neurogenesis and regeneration. By offering insights into the regenerative mechanisms of axolotl neurons, this work lays the foundation for comparative studies with mammalian systems, potentially informing therapeutic strategies for neurodegenerative diseases and CNS injuries in humans.","NA","biorxiv",1739916494184
"Maternal age and genome-wide failure of meiotic recombination are associated with triploid conceptions in humans","10.1101/2025.02.15.637872","biorxiv",7.849999999999999,4.9,7.849999999999999,7.849999999999999,7.849999999999999,"Picchetta, L.; Ottolini, C. S.; Tao, X.; Zhan, Y.; Jobanputra, V.; Marin Vallejo, C.; Mulas, F.; Elvezia, E. M.; Escriba Perez, M. J.; Molinaro, T.; Whitehead, C.; Gill, P.; Mounts, E.; Babariya, D.; Rienzi, L. F.; Ubaldi, F. M.; Garcia Velasco, J. A.; Pellicer, A.; Carmi, S.; Hoffmann, E. R.; Capalbo, A.","Antonio Capalbo","Juno Genetics, Reproductive Genetics, Rome, Italy.","2025-02-17","1","new results","cc_by_nc_nd","genetics","https://www.biorxiv.org/content/early/2025/02/17/2025.02.15.637872.source.xml","Triploid and haploid conceptions are not viable and are a common occurrence in humans, where they account for 10% of all pregnancy losses. Despite the parent-of-origin being important in the etiology of the pregnancy, our knowledge of their causes is limited, especially at the point of conception. Using a dataset of 96,660 biopsies and a validation dataset of 44,324 from human blastocysts embryos generated by intra-cytoplasmic sperm injection (ICSI), we estimate that 1.1% of human conceptions (n=1,063) contain extra or missing chromosome sets in zygotes. We identify a maternal age effect, with a 1.059 per year increased risk in triploidy/haploidy (p=0.0008). In 0.03% of couples, we identified three or more triploid/haploid embryos, suggesting a personal risk effect (p=0.03). Genotype analysis of 55 triploid embryo biopsies and their parents show that one third of maternal triploid conceptions originate in meiosis I and two thirds in meiosis II. Seven of these embryos are inferred to have entirely failed to initiate meiotic recombination genome-wide, suggesting that human oocytes with pervasive meiotic recombination failure that are formed during fetal development are capable of ovulation in adult life. Finally, we identify a new type of genome-wide maternal isodiploidy (two maternal chromosome sets) in 0.05% of embryos (41 of 74,009). Collectively, our findings shed light on the biology of meiosis and the formation of human oocytes with the number of chromosome sets.","NA","biorxiv",1739916494184
"Refining sequence-to-expression modelling with chromatin accessibility","10.1101/2025.02.11.637651","biorxiv",8.45,4.85,8.45,8.45,8.45,"Lapohos, O.; Fonseca, G. J.; Emad, A.","Amin Emad","McGill University","2025-02-15","1","new results","cc_by","bioinformatics","https://www.biorxiv.org/content/early/2025/02/15/2025.02.11.637651.source.xml","Sequence-to-expression models have gained popularity in the past decade, enabling prediction of gene expression from genomic sequence alone. However, these models typically do not take into account chromatin accessibility, a major factor limiting gene regulation. We hypothesized that supplying accessibility as an input feature would allow a sequence-to-expression model to focus on important open regions of the genome. Using single-nucleus multiome RNA- and ATAC-sequencing data, we found that the predictive performance of such an augmented model was significantly greater than that of sequence-only or accessibility-only models with similar architectures. Specifically, its ability to predict the expression of highly variable genes and gene expression in other cell types improved, which we attribute to a reduction in bias originating from lowly variable genes. Moreover, post-hoc analyses revealed that higher attribution scores in the input DNA sequences of the augmented model conformed to accessibility, whereas those in the sequence-only model were scattered. Additionally, we show that fine-tuning a pre-trained sequence-only model with both sequence and accessibility can boost performance even further. We also highlight the importance of sequencing depth in sequence-to-expression prediction. Altogether, the results of this study provide a compelling argument for the inclusion of chromatin accessibility in sequence-to-expression models, as this strategy can be implemented easily and may improve downstream applications.","NA","biorxiv",1739916494184
"Effects of using deep learning to predict the geographic origin of barley genebank accessions on genome-environment association studies","10.1101/2025.02.13.638161","biorxiv",4.800000000000001,4.800000000000001,4.800000000000001,4.800000000000001,4.800000000000001,"Chang, C.-W.; Schmid, K. J.","Karl J Schmid","University of Hohenheim","2025-02-17","1","new results","cc_by_nc_nd","plant biology","https://www.biorxiv.org/content/early/2025/02/17/2025.02.13.638161.source.xml","Genome-environment association (GEA) is an approach for identifying adaptive loci by combining genetic variation with environmental parameters, offering potential for improving crop resilience. However, its application to genebank accessions is limited by missing geographic origin data. To address this limitation, we explored the use of neural networks to predict the geographic origins of barley accessions and integrate imputed environmental data into GEA. Neural networks demonstrated high accuracy in cross-validation but occasionally produced ecologically implausible predictions as models solely considered geographical proximity. For example, some predicted origins were located within non-arable regions, such as the Mediterranean Sea. Using barley flowering time genes as benchmarks, GEA integrating imputed environmental data (N=11,032) displayed partially concordant yet complementary detection of genomic regions near flowering time genes compared to regular GEA (N=1,626), highlighting the potential of GEA with imputed data to complement regular GEA in uncovering novel adaptive loci. Also, contrary to our initial hypothesis anticipating a significant improvement in GEA performance by increasing sample size, our simulations yield unexpected insights. Our study suggests potential limitations in the sensitivity of GEA approaches to the considerable expansion in sample size achieved through predicting missing geographical data. Overall, our study provides insights into leveraging incomplete geographical origin data by integrating deep learning with GEA. Our findings indicate the need for further development of GEA approaches to optimize the use of imputed environmental data, such as incorporating regional GEA patterns instead of solely focusing on global associations between allele frequencies and environmental gradients across large-scale landscapes.","NA","biorxiv",1739916494184
"Long-term offspring loss in lactating rats: Neurobiological and emotional consequences in a novel animal model","10.1101/2025.02.17.634946","biorxiv",4.75,4.75,4.75,4.75,4.75,"Demarchi, L.; Sanson, A.; Boos, A.-L.; Bosch, O. J.","Oliver J. Bosch","University of Regensburg","2025-02-18","1","new results","cc_by_nc_nd","neuroscience","https://www.biorxiv.org/content/early/2025/02/18/2025.02.17.634946.source.xml","The maternal bond is a vital social connection that supports the survival and well-being of both the caregiver and offspring. Disruption of this bond, particularly following offspring loss, can result in profound trauma with long-lasting consequences. While considerable research has focused on the impact of maternal separation on offspring development, the biological effects of offspring loss on the mother remain largely unexplored. In this study, we examined the long-term effects of offspring loss on neuroplasticity, the oxytocin (OXT) and corticotropin-releasing factor (CRF) systems, and stress-coping behaviors in Sprague-Dawley rat mothers. We compared mothers that experienced one day of motherhood followed by 19 days of offspring loss, mothers that were with their pups throughout the 20 days, and naive virgin rats. Our results reveal that mothers who lost their pups expressed increased oxytocin receptor binding and decreased dendritic spine density in limbic brain regions, with no changes in estrogen receptor  or calbindin cells. Additionally, separated mothers showed increased passive stress-coping behaviors in the forced swim test and elevated plasma corticosterone levels. Remarkably, the passive stress-coping behavior was rescued by central CRF receptor blockade but not by oxytocin treatment, suggesting that the CRF system plays a key role in the grieving process following offspring loss, and highlights the suitability of the rat model for studying maternal grief. This research provides insights into the complex neurobiology of grief, and suggests potential directions for future studies.","NA","biorxiv",1739916494184
"Mice dynamically adapt to opponents in competitive multi-player games","10.1101/2025.02.14.638359","biorxiv",31.749999999999996,4.7,31.749999999999996,31.749999999999996,31.749999999999996,"Erlich, J. C.; Rastogi, M.; Yin, Q.; Orsolic, I.; Cruz, B. F.; Almeida, A.; Duan, C. A.","Chunyu A. Duan","Sainsbury Wellcome Centre, University College London","2025-02-16","1","new results","cc_no","neuroscience","https://www.biorxiv.org/content/early/2025/02/16/2025.02.14.638359.source.xml","Competing for resources in dynamic social environments is fundamental for survival, and requires continuous monitoring of both 'self' and 'others' to guide effective choices. Yet our understanding of value-based decision-making comes primarily from studying individuals in isolation, leaving open fundamental questions about how animals adapt their strategies during social competition. Here, we developed an ethologically relevant multi-player game, in which freely-moving mice make value-based decisions in a competitive spatial foraging task. We found that mice integrate real-time spatial information about 'self' and the opponent to flexibly shift their preference towards safer, low-payout options when appropriate. Analyses of mice and reinforcement learning agents reveal that these behavioural adaptations cannot be explained by simple reward learning, but are instead consistent with optimal decision strategies guided by opponent features. Using a dynamical model of neural activity, we found that in addition to opponent effects, decisions under competition were also noisier and more sensitive to initial conditions, generating testable predictions for neural recordings and perturbations. Together, this work reveals a fundamental mechanism for competitive foraging, and proposes novel quantitative frameworks towards understanding value-based decision-making in a fast-changing social environment.","NA","biorxiv",1739916494184
"Nested parasitism in hypersaline environments: viruses and virus satellites of haloarchaea and their nanosized cellular symbionts","10.1101/2025.02.15.638363","biorxiv",18.45,4.7,18.45,18.45,18.45,"Zhou, Y.; Gutierrez-Preciado, A.; Liu, Y.; Moreira, D.; Yakimov, M. M.; Lopez-Garcia, P.; Krupovic, M.","Mart Krupovic","Institut Pasteur","2025-02-15","1","new results","cc_by_nc_nd","microbiology","https://www.biorxiv.org/content/early/2025/02/15/2025.02.15.638363.source.xml","It is increasingly recognized that hyperparasitism, whereby a parasite exploits a host which itself is a parasite, is a common phenomenon across ecosystems and domains of life. Here, to explore hyperparasitism in Archaea, we focused on ultra-small archaea of the phylum Nanohaloarchaeota, a distinct lineage within the DPANN superphylum, which establish obligate symbiotic interactions with extreme halophiles of the class Halobacteria. We assembled five metagenomes originating from geothermally influenced salt lakes in the Danakil Depression, Ethiopia, and reconstructed the viromes associated with both haloarchaea and nanohaloarchaea. Both archaeal lineages were associated with viruses from four distinct groups, including head-tailed viruses (class Caudoviricetes), tailless icosahedral viruses, pleomorphic viruses and spindle-shaped viruses, which represent 12 previously undescribed families. The haloarchaeal viruses (HVs) and nanohaloarchaeal viruses (NHVs) are only distantly related, suggesting that viruses from the four groups co-evolved with their respective hosts for an extended period, likely since the divergence of the two archaeal lineages from their last common ancestor. Consistently, our results show that HVs and NHVs are well-adapted to replicate in their respective hosts and to thrive in hypersaline environments. No evidence of host switching between haloarchaea and nanohaloarchaea was obtained, but multiple horizontal transfers of genes implicated in virion structure and morphogenesis between HVs and NHVs were detected. We also identified several NHVs-encoded auxiliary metabolic genes implicated in nucleotide and amino acid metabolisms, which could enhance the metabolic capabilities of the nanohaloarchaeal hosts that have highly reduced genomes. Finally, in addition to HVs and NHVs, we describe plasmid-derived virus satellites that appear to have originated convergently to parasitize spindle-shaped viruses of both haloarchaea and nanohaloarchaea, uncovering an additional layer of parasitism. Collectively, our findings fill the knowledge gap on the diversity of HVs and NHVs, highlight the complexity of virus-host and virus-virus interactions in hypersaline environments, and open doors for further mining of the virosphere of the globally distributed DPANN archaea.","NA","biorxiv",1739916494184
"The ""Podcast"" ECoG dataset for modeling neural activity during natural language comprehension","10.1101/2025.02.14.638352","biorxiv",7.9,4.55,7.9,7.9,7.9,"Zada, Z.; Nastase, S. A.; Aubrey, B.; Jalon, I.; Michelmann, S.; Wang, H.; Hasenfratz, L.; Doyle, W.; Friedman, D.; Dugan, P.; Melloni, L.; Devore, S.; Flinker, A.; Devinsky, O.; Goldstein, A.; Hasson, U.","Zaid Zada","Princeton University","2025-02-16","1","confirmatory results","cc_by","neuroscience","https://www.biorxiv.org/content/early/2025/02/16/2025.02.14.638352.source.xml","Naturalistic electrocorticography (ECoG) data are a rare but essential resource for studying the brains linguistic capabilities. ECoG offers a high temporal resolution suitable for investigating processes at multiple temporal timescales and frequency bands. It also provides broad spatial coverage, often along critical language areas. Here, we share a dataset of nine ECoG participants with 1,330 electrodes listening to a 30-minute audio podcast. The richness of this naturalistic stimulus can be used for various research endeavors, from auditory perception to semantic integration. In addition to the neural data, we extract linguistic features of the stimulus ranging from phonetic information to large language model word embeddings. We use these linguistic features in encoding models that relate stimulus properties to neural activity. Finally, we provide detailed tutorials for preprocessing raw data, extracting stimulus features, and running encoding analyses that can serve as a pedagogical resource or a springboard for new research.","NA","biorxiv",1739916494184
