"title","doi","altmetric_jid","score","X1d","X3d","X1w","X1m","authors","author_corresponding","author_corresponding_institution","date","version","type","license","category","jatsxml","abstract","published","server","upupdate_time"
"Control of tongue movements by the Purkinje cells of the cerebellum","10.1101/2024.07.25.604757","biorxiv",8.8,1.5,8.8,8.8,8.8,"Hage, P.; Fakharian, M. A.; Shoup, A. M.; Pi, J. S.; Sedaghat-Nejad, E.; Orozco, S. P.; Jang, I. K.; Looi, V.; Arginteanu, T.; Shadmehr, R.","Reza Shadmehr","Johns Hopkins University","2024-07-25","1","new results","cc_by_nd","neuroscience","https://www.biorxiv.org/content/early/2024/07/25/2024.07.25.604757.source.xml","To quantify the cerebellum's contributions to control of the tongue, we trained head-fixed marmosets to make dexterous movements, harvesting food from small tubes that were placed orthogonal to the mouth. We identified the lingual regions in lobule VI of the vermis and recorded from hundreds of Purkinje cells (P-cells), each in sessions where the subject produced thousands of licks. Most movements aimed for one of the small tubes, while other movements groomed the mouth area. To quantify contributions of a P-cell to control of the tongue, we relied on the fact that in a small fraction of the licks, the input from the inferior olive produced a complex spike (CS), which then briefly but completely silenced the P-cell. When the movements were targeting a tube, the CS rates increased during protraction for both ipsilateral and contralateral targets, thus identifying the preferred axis of motion in the olivary input, termed CS-on. However, for grooming movements this modulation was absent. We compared the tongue's trajectory in the targeted movement that had experienced the CS with temporally adjacent targeted licks that had not. When the SS suppression occurred during protraction, the tongue exhibited hypermetria, and when the suppression took place during retraction, the tongue exhibited slowing. These effects amplified when two P-cells were simultaneously suppressed. Therefore, CS-induced suppression of P-cells in the lingual vermis disrupted the forces that would normally decelerate the tongue as it approached the target, demonstrating a specialization in stopping the movement. Because the CS-on direction tended to align with the direction of downstream forces produced during P-cell suppression, this suggests that for targeted licks, the olivary input defined an axis of control for the P-cells.","NA","biorxiv",1722204574072
"Combining individual and wastewater whole genome sequencing improves SARS-CoV-2 surveillance","10.1101/2024.07.22.24310067","medrxiv",9.049999999999999,0.85,8.549999999999999,9.049999999999999,9.049999999999999,"Troendle, E. P.; Lee, A. J.; Reyne, M. I.; Allen, D. M.; Bridgett, S. J.; Radulescu, C. H.; Glenn, M.; Wilkins, J.-P.; Rubino, F.; Firoozi Nejad, B.; McSparron, C.; Niebel, M.; Fairley, D. J.; Creevey, C. J.; McKinley, J. M.; Skvortsov, T.; McGrath, J. W.; Bamford, C. G. G.; Simpson, D. A.","David A. Simpson","Queen\'s University Belfast","2024-07-22","1","PUBLISHAHEADOFPRINT","cc_by_nc_nd","public and global health","https://www.medrxiv.org/content/early/2024/07/22/2024.07.22.24310067.source.xml","BackgroundRobust methods to track pathogens support public health surveillance. Both wastewater (WW) and individual whole genome sequencing (WGS) are used to assess viral variant diversity and spread. However, their relative performance and the information provided by each approach have not been sufficiently quantified. Therefore, we conducted a comparative evaluation using extensive individual and wastewater longitudinal SARS-CoV-2 WGS datasets in Northern Ireland (NI).

MethodsWGS of SARS-CoV-2 was performed on >4k WW samples and >23k individuals across NI from 14th November 2021 to 11th March 2023. SARS-CoV-2 RNA was amplified using the ARTIC nCov-2019 protocol and sequenced on an Illumina MiSeq. Wastewater data were analysed using Freyja to determine variant compositions, which were compared to individual data through time series and correlation analyses. Inter-programme agreements were evaluated by mean absolute error (MAE) calculations. WW treatment plant (WWTP) performances were ranked by mean MAE. Volatile periods were identified using numerical derivative analyses. Geospatial spreading patterns were determined by horizontal curve shifting.

FindingsStrong concordance was observed between wastewater and individual variant compositions and distributions, influenced by sequencing rate and variant diversity. Overall variant compositions derived from individual sequences and each WWTP were regionally clustered rather than dominated by local population size. Both individual and WW sequencing detected common nucleotide substitutions across many variants and complementary additional substitutions. Conserved spreading patterns were identified using both approaches.

InterpretationBoth individual and wastewater WGS effectively monitor SARS-CoV-2 variant dynamics. Combining these approaches enhances confidence in predicting the composition and spread of major variants, particularly with higher sequencing rates. Each method detects unique mutations, and their integration improves overall genome surveillance.

FundingIndividual sequencing was funded via the Belfast Health and Social Care Trust (Department of Health for Northern Ireland) and the COVID-19 Genomics UK (COG-UK) consortium, which was supported by the Medical Research Council (MRC), UK Research and Innovation (UKRI), the National Institute for Health Research (NIHR), the Department of Health and Social Care (DHSC), and the Wellcome Sanger Institute. The NI Wastewater Surveillance Programme was funded by the Department of Health for Northern Ireland. EPT was supported through the COG-UK Early Career Funding Scheme.","NA","medrxiv",1722204574072
"Population Performance and Individual Agreement of Coronary Artery Disease Polygenic Risk Scores","10.1101/2024.07.25.24310931","medrxiv",8.45,1.85,8.45,8.45,8.45,"Abramowitz, S. A.; Boulier, K.; Keat, K.; Cardone, K.; Shivakumar, M.; DePaolo, J. M.; Judy, R. M.; Penn Medicine BioBank,  ; Kim, D.; Rader, D. J.; Ritchie, M. D.; Voight, B. F.; Pasaniuc, B.; Levin, M.; Damrauer, S. M.","Scott M. Damrauer","University of Pennsylvania","2024-07-26","1","PUBLISHAHEADOFPRINT","cc_by_nc_nd","genetic and genomic medicine","https://www.medrxiv.org/content/early/2024/07/26/2024.07.25.24310931.source.xml","Importance: Polygenic risk scores (PRSs) for coronary artery disease (CAD) are a growing clinical and commercial reality. Whether existing scores provide similar individual-level assessments of disease liability is a critical consideration for clinical implementation that remains uncharacterized. Objective: Characterize the reliability of CAD PRSs that perform equivalently at the population level at predicting individual-level risk. Design: Cross-sectional Study. Setting: All of Us Research Program (AOU), Penn Medicine Biobank (PMBB), and UCLA ATLAS Precision Health Biobank. Participants: Volunteers of diverse genetic backgrounds enrolled in AOU, PMBB, and UCLA with available electronic health record and genotyping data. Exposures: Polygenic risk for CAD from previously published PRSs and new PRSs developed separately from the testing cohorts. Main Outcomes and Measures: Sets of CAD PRSs that perform population prediction equivalently were identified by comparing calibration and discrimination (Brier score and AUROC) of generalized linear models of prevalent CAD using Bayesian analysis of variance. Among equivalently performing scores, individual-level agreement between risk estimates was tested with intraclass correlation (ICC) and Light's Kappa, measures of inter-rater reliability. Results: 50 PRSs were calculated for 171,095 AOU participants. When included in a model of prevalent CAD, 48 scores had practically equivalent Brier scores and AUROCs (region of practical equivalence = 0.02). Across these scores, 84% of participants had at least one score in both the top and bottom risk quintile. Continuous agreement of individual risk predictions from the 48 scores was poor, with an ICC of 0.351 (95% CI; 0.349, 0.352). Agreement between two statistically equivalent scores was moderate, with an ICC of 0.649 (95% CI; 0.646, 0.652). Light's Kappa, used to evaluate consistency of assignment to high-risk thresholds, did not exceed 0.56 (interpreted as 'fair') across statistically and practically equivalent scores. Repeating the analysis among 41,193 PMBB and 50,748 UCLA participants yielded different sets of statistically and practically equivalent scores which also lacked strong individual agreement. Conclusions and Relevance: Across three diverse biobanks, CAD PRSs that performed equivalently at the population level produced unreliable individual risk estimates. Approaches to clinical implementation of CAD PRSs must consider the potential for discordant individual risk estimates from otherwise indistinguishable scores.","NA","medrxiv",1722204574072
"Integrating in silico predictions with an engineered tissue assay identifies Perlecan as an age-perturbed re-quiescence cue for muscle stem cells","10.1101/2024.07.22.604619","biorxiv",11.35,1,8.399999999999999,11.35,11.35,"Jacques, E.; Garcia, P.; Mercier, O.; Hu, Y.; Degletagne, C.; Ravent, J.; Fall, S.; Almeida, M. P.; Wheeler, A. R.; Angers, S.; Gilbert, P. M.; Le Grand, F.","Fabien Le Grand","Universite Claude Bernard Lyon 1, CNRS UMR 5261, INSERM U1315, Institut NeuroMyoGene,  69008 Lyon, France","2024-07-23","1","new results","cc_no","cell biology","https://www.biorxiv.org/content/early/2024/07/23/2024.07.22.604619.source.xml","Skeletal muscle regeneration is mediated by resident muscle stem cells that produce progeny to repair or recreate muscle. Critical to this function is the ability to transition between states of proliferation and quiescence. This balancing act is disrupted with age, leading to eroded regenerative capacity. Notwistanding, mechanisms by which the regenerating niche directs MuSCs return to the dormant state are largely unknown. Since single-cell RNAseq methods exclude the analysis of multinucleated cells, we generated single-nuclei RNAseq datasets of regenerating muscle to capture the full breadth of myogenic progression. With this, we uncovered new transition states between differentiating myocytes and syncytial multinucleated cells. Using cell communication inference tools, we highlighted receptor-ligand interactions between MuSCs and fusing nuclei. We leveraged a bespoke biomimetic 3D niche that induces MuSC quiescence, to filter the predicted interactions using a Cas9-based functional genomics approach. We found the proteoglycan Perlecan (Hspg2) promotes MuSC re-quiescence. Hspg2 silencing in vivo, during muscle regeneration, induced an aging-like phenotype and perturbed MuSC re-quiescence. Notably, the temporal profile and overall levels of Perlecan were altered with age. Exogenous supplementation with Endorepellin (truncated Perlecan) rescued MuSC decline following aged muscle regeneration, offering a new therapeutic target. Thus, coupling in silico predictions with a 3D in vitro assay followed by in vivo investigations revealed a previously inaccessible window of biology; that spatiotemporal coordination of MuSC re-quiescence is directed by fusing myonuclei.","NA","biorxiv",1722204574072
"Comparative analysis of 43 distinct RNA modifications by nanopore tRNA sequencing","10.1101/2024.07.23.604651","biorxiv",22.550000000000004,0,8.2,22.550000000000004,22.550000000000004,"White, L. K.; Dobson, K.; del Pozo, S.; Bilodeaux, J. M.; Andersen, S. E.; Baldwin, A.; Barrington, C.; Koertel, N.; Martinez-Seidel, F.; Strugar, S. M.; Watt, K. E. N.; Mukherjee, N.; Hesselberth, J. R.","Jay R Hesselberth","University of Colorado School of Medicine","2024-07-24","1","new results","cc_by_nc_nd","molecular biology","https://www.biorxiv.org/content/early/2024/07/24/2024.07.23.604651.source.xml","Transfer RNAs are the fundamental adapter molecules of protein synthesis and the most abundant and heterogeneous class of noncoding RNA molecules in cells. The study of tRNA repertoires remains challenging, complicated by the presence of dozens of post transcriptional modifications. Nanopore sequencing is an emerging technology with promise for both tRNA sequencing and the detection of RNA modifications; however, such studies have been limited by the throughput and accuracy of direct RNA sequencing methods. Moreover, detection of the complete set of tRNA modifications by nanopore sequencing remains challenging. Here we show that recent updates to nanopore direct RNA sequencing chemistry (RNA004) combined with our own optimizations to tRNA sequencing protocols and analysis workflows enable high throughput coverage of tRNA molecules and characterization of nanopore signals produced by 43 distinct RNA modifications. We share best practices and protocols for nanopore sequencing of tRNA and further report successful detection of low abundance mitochondrial and viral tRNAs, providing proof of concept for use of nanopore sequencing to study tRNA populations in the context of infection and organelle biology. This work provides a roadmap to guide future efforts towards de novo detection of RNA modifications across multiple organisms using nanopore sequencing.","NA","biorxiv",1722204574072
"Virological characteristics of the SARS-CoV-2 KP.3.1.1 variant","10.1101/2024.07.16.603835","biorxiv",166.39199999999997,1.85,2.1,66.75,166.39199999999997,"Kaku, Y.; Uriu, K.; Okumura, K.; The Genotype to Phenotype Japan (G2P-Japan) Consortium,  ; Ito, J.; Sato, K.","Kei Sato","Institute of Medical Science, The University of Tokyo","2024-07-17","1","new results","cc_by","microbiology","https://www.biorxiv.org/content/early/2024/07/17/2024.07.16.603835.source.xml","The SARS-CoV-2 JN.1 variant (BA.2.86.1.1), arising from BA.2.86.1 with spike protein (S) substitution S:L455S, outcompeted the previously predominant XBB lineages by the beginning of 2024. Subsequently, JN.1 subvariants including KP.2 (JN.1.11.1.2) and KP.3 (JN.1.11.1.3), which acquired additional S substitutions e.g., S:R346T, S:F456L, and S:Q493E, have emerged concurrently. Thereafter, JN.1 subvariants, such as LB.1 (JN.1.9.2.1), KP.2.3 (JN.1.11.1.2.3), and KP.3.1.1 (JN.1.11.1.3.1.1), which convergently acquired a deletion of Serine at the 31st position in S (S:S31del) in addition to the above substitutions, have emerged and spread as of June 2024. We recently reported the virological features of JN.1 subvariants including KP.2, KP.3, LB.1, and KP.2.3.2,3 Here, we investigated the virological properties of KP.3.1.1. First, we estimated the relative effective reproduction number (Re) of KP.3.1.1 using a Bayesian multinomial logistic model4 based on genome surveillance data from Spain, the USA, France, Canada, and the UK, where this variant has spread as of June 2024. In Spain, the Re of KP.3.1.1 is over 1.2-fold higher than that of JN.1 and even higher than those of KP.2, KP.3, LB.1, and KP.2.3. Additionally, the other countries under investigation herein show higher Re for KP.3.1.1. However, it must be noted there is the possibility of overestimation in these countries due to more limited KP.3.1.1 sequence numbers. These results suggest that KP.3.1.1 will spread worldwide along with other JN.1 sublineages. We then assessed the virological properties of KP.3.1.1 using pseudoviruses. The pseudovirus of KP.3.1.1 had significantly higher infectivity than that of KP.3. Neutralization of KP.3.1.1 was tested using i) convalescent sera after breakthrough infection (BTI) with XBB.1.5 or EG.5, ii) convalescent sera after the infection with HK.3 or JN.1, and iii) sera after monovalent XBB.1.5 vaccination. The 50% neutralization titer (NT50) against KP.3.1.1 was significantly lower than KP.3 (1.4-1.6-fold) in all four groups of convalescent sera tested. KP.3.1.1 also showed a 1.3-fold lower NT50 against XBB.1.5 vaccine sera than KP.3. Moreover, KP.3.1.1 showed stronger resistance with a 1.3-fold lower NT50 with statistical significances to the convalescent sera infected with EG.5 and HK.3 than KP.2.3. Altogether, KP.3.1.1 exhibited a higher Re, higher pseudovirus infectivity, and higher neutralization evasion than KP.3. These results align with our recent report that the JN.1 subvariants with S:S31del (e.g., KP.2.3 and LB.1) exhibited enhanced Re and immune evasion compared to the other JN.1 subvariants without S:S31del (e.g., JN.1, KP.2, and KP.3), highlighting the evolutionary significance of S:S31del in the JN.1 lineages.","NA","biorxiv",1722204574072
"Deep learning guided design of dynamic proteins","10.1101/2024.07.17.603962","biorxiv",71.10000000000001,0,0,57.95000000000003,71.10000000000001,"Guo, A. B.; Akpinaroglu, D.; Kelly, M.; Kortemme, T.","Tanja Kortemme","University of California, San Francisco","2024-07-19","1","new results","cc_by_nc_nd","bioengineering","https://www.biorxiv.org/content/early/2024/07/19/2024.07.17.603962.source.xml","Deep learning has greatly advanced design of highly stable static protein structures, but the controlled conformational dynamics that are hallmarks of natural switch-like signaling proteins have remained inaccessible to de novo design. Here, we describe a general deep-learning-guided approach for de novo design of dynamic changes between intra-domain geometries of proteins, similar to switch mechanisms prevalent in nature, with atom-level precision. We solve 4 structures validating the designed conformations, show microsecond transitions between them, and demonstrate that the conformational landscape can be modulated by orthosteric ligands and allosteric mutations. Physics-based simulations are in remarkable agreement with deep-learning predictions and experimental data, reveal distinct state-dependent residue interaction networks, and predict mutations that tune the designed conformational landscape. Our approach demonstrates that new modes of motion can now be realized through de novo design and provides a framework for constructing biology-inspired, tunable and controllable protein signaling behavior de novo.","NA","biorxiv",1722204574072
"Long-read sequencing transcriptome quantification with lr-kallisto","10.1101/2024.07.19.604364","biorxiv",75.84999999999998,0,0,39.45000000000001,75.84999999999998,"Loving, R. K.; Sullivan, D. K.; Reese, F.; Rebboah, E.; Sakr, J.; Rezaie, N.; Liang, H. Y.; Filimban, G.; Kawauchi, S.; Oakes, C.; Trout, D.; Williams, B. A.; MacGregor, G.; Wold, B.; Mortazavi, A.; Pachter, L.","Lior Pachter","California Institute of Technology","2024-07-19","1","new results","cc_by","bioinformatics","https://www.biorxiv.org/content/early/2024/07/19/2024.07.19.604364.source.xml","RNA abundance quantification has become routine and affordable thanks to high-throughput ""short-read"" technologies that provide accurate molecule counts at the gene level. Similarly accurate and affordable quantification of definitive full-length, transcript isoforms has remained a stubborn challenge, despite its obvious biological significance across a wide range of problems. ""Long-read"" sequencing platforms now produce data-types that can, in principle, drive routine definitive isoform quantification. However some particulars of contemporary long-read datatypes, together with isoform complexity and genetic variation, present bioinformatic challenges. We show here, using ONT data, that fast and accurate quantification of long-read data is possible and that it is improved by exome capture. To perform quantifications we developed lr-kallisto, which adapts the kallisto bulk and single-cell RNA-seq quantification methods for long-read technologies.","NA","biorxiv",1722204574072
"Hierarchical Bayesian modeling of multi-region brain cell count data","10.1101/2024.07.20.603979","biorxiv",39.30000000000001,0,0,39.30000000000001,39.30000000000001,"Dimmock, S.; Exley, B. M. S.; Moore, G.; Menage, L.; Delogu, A.; Schultz, S. R.; Warburton, E. C.; Houghton, C. J.; O'Donnell, C.","Cian O\'Donnell","Ulster University","2024-07-21","1","new results","cc_by_nc_nd","neuroscience","https://www.biorxiv.org/content/early/2024/07/21/2024.07.20.603979.source.xml","We can now collect cell-count data across whole animal brains quantifying recent neuronal activity, gene expression, or anatomical connectivity. This is a powerful approach since it is a multi-region measurement, but because the imaging is done post-mortem, each animal only provides one set of counts. Experiments are expensive and since cells are counted by imaging and aligning a large number of brain sections, they are time-intensive. The resulting datasets tend to be under-sampled with fewer animals than brain regions. As a consequence, these data are a challenge for traditional statistical approaches. We demonstrate that hierarchical Bayesian methods are well suited to these data by presenting a  standard partially-pooled Bayesian model for multi-region cell-count data and applying it to two example datasets. For both datasets the Bayesian model outperformed standard parallel t-tests. Overall, the Bayesian approachs ability to capture nested data and its rigorous handling of uncertainty in under-sampled data can substantially improve inference for cell-count data.

Significance StatementCell-count data is important for studying neuronal activation and gene expression relating to the complex processes in the brain. However, the difficulty and expense of data collection means that such datasets often have small sample sizes. Many routine analyses are not well-suited, especially if there is high variability among animals and surprising outliers in the data. Here we describe a multilevel, mixed effects Bayesian model for these data and show that the Bayesian approach improves inferences compared to the usual approach for two different cell-count datasets with different data characteristics.","NA","biorxiv",1722204574072
"Tiberius: End-to-End Deep Learning with an HMM for Gene Prediction","10.1101/2024.07.21.604459","biorxiv",38.45,0.25,7.949999999999999,38.45,38.45,"Gabriel, L.; Becker, F.; Hoff, K. J.; Stanke, M.","Mario Stanke","University of Greifswald","2024-07-23","1","new results","cc_by","bioinformatics","https://www.biorxiv.org/content/early/2024/07/23/2024.07.21.604459.source.xml","MotivationFor more than 25 years, learning-based eukaryotic gene predictors were driven by hidden Markov models (HMMs), which were directly inputted a DNA sequence. Recently, Holst et al. demonstrated with their program Helixer that the accuracy of ab initio eukaryotic gene prediction can be improved by combining deep learning layers with a separate HMM postprocessor.

ResultsWe present Tiberius, a novel deep learning-based ab initio gene predictor that end-to-end integrates convolutional and long short-term memory layers with a differentiable HMM layer. Tiberius uses a custom gene prediction loss and was trained for prediction in mammalian genomes and evaluated on human and two other genomes. It significantly outperforms existing ab initio methods, achieving F1-scores of 62% at gene level for the human genome, compared to 21% for the next best ab initio method. In de novo mode, Tiberius predicts the exon-intron structure of two out of three human genes without error. Remarkably, even Tiberiuss ab initio accuracy matches that of BRAKER3, which uses RNA-seq data and a protein database. Tiberiuss highly parallelized model is the fastest state-of-the-art gene prediction method, processing the human genome in under 2 hours.

Availability and Implementationhttps://github.com/Gaius-Augustus/Tiberius

Contact{lars.gabriel@uni-greifswald.de, mario.stanke@uni-greifswald.de}","NA","biorxiv",1722204574072
