"title","doi","altmetric_jid","score","X1d","X3d","X1w","X1m","authors","author_corresponding","author_corresponding_institution","date","version","type","license","category","jatsxml","abstract","funder","published","server","upupdate_time"
"Staufen2 modulates the temporal dynamics of human neurogenesis in vitro","10.1101/2025.10.02.679988","biorxiv",4.7,4.7,4.7,4.7,4.7,"Jaya ganesh, A.; Fernandez-Moya, S. M.; Gutierrez-Franco, A.; Chaves Ferreira, N.; Tur-Guasch, R.; Romero-Moya, D.; Giorgetti, A.; Mularoni, L.; Piwecka, M.; Rybak-Wolf, A.; Plass, M.","Mireya Plass","University of Barcelona","2025-10-02","1","new results","cc_by_nc_nd","molecular biology","https://www.biorxiv.org/content/early/2025/10/02/2025.10.02.679988.source.xml","RNA-binding proteins (RBPs) play a central role in post-transcriptional regulation during brain development, yet their specific functions in coordinating human neural lineage decisions remain poorly understood. Here, we investigate for the first time the role of the double-stranded RBP Staufen2 (STAU2) in human neurogenesis. Characterization of STAU2 knockout iPSC derived cells using scRNA-seq shows that loss of STAU2 disrupts neuroepithelial cell identity and accelerates neural differentiation by altering the activity of key transcription factors and driving early metabolic transitions. Additionally, STAU2 regulates the expression of miRNA host genes and alters miRNA-mediated post-transcriptional control in progenitor cells, which exerts additional effects on STAU2 regulated gene regulatory networks. These changes result in neural progenitor exhaustion, unstructured neural rosettes, and reduced organoid size. Together, our work uncovers a previously unrecognized role for STAU2 as a central regulator of early human neurogenesis, acting through both miRNA-mediated and transcriptional pathways to coordinate progenitor maintenance and neuronal fate specification.","NA","NA","bioRxiv",1759442931011
"TOR inhibition drives accumulation of amino acids through transcriptional activation in algae","10.1101/2025.09.29.679311","biorxiv",4.35,4.35,4.35,4.35,4.35,"Upadhyaya, S.; Kosina, S. M.; Hixson, K.; Schepmoes, A.; Mewalal, R.; Zhang, Y.; O'Malley, R. C.; Baumgart, L.; Blaby, I. K.; Lipton, M. S.; Northen, T.; Niyogi, K. K.; Roth, M. S.","Melissa S. Roth","University of California, Berkeley","2025-10-01","1","new results","cc_by","plant biology","https://www.biorxiv.org/content/early/2025/10/01/2025.09.29.679311.source.xml","Cellular homeostasis is maintained by the balance between energy production and breakdown and is fundamental to all forms of life. The conserved, ancient target of rapamycin (TOR) kinase is a central metabolic regulator in eukaryotes that integrates carbon and nitrogen to maintain homeostasis and promote growth and development through protein synthesis. While TOR regulatory mechanisms of amino acid accumulation are well known in yeast and mammals, they remain unknown in photosynthetic organisms. Here, we developed the unicellular green alga Chromochloris zofingiensis as a simpler model system for understanding TOR function. Multiomics experiments showed that TOR inhibition leads to an increase in amino acid levels independent of hexokinase-mediated glucose signaling. We observed upregulation of selective amino acid biosynthesis pathways at the transcript and protein levels as potential mechanisms driving the increase in amino acids. Transcriptomics and proteomics experiments identified a basic helix-loop-helix (bHLH) transcription factor with rapid upregulation during TOR inhibition. DAP-seq analysis demonstrated that bHLH can bind directly to the promoters of amino acid biosynthesis genes, potentially regulating their transcription in response to TOR inhibition. We found high conservation of the bHLH-binding motif in the genomes of other green algae and plants, suggesting a conserved regulatory mechanism for amino acid biosynthesis across Viridiplantae. Phosphoproteomics experiments also revealed novel conserved targets that are not currently recognized as part of the TOR pathway. Altogether, our findings elucidate the transcriptional regulation of amino acid metabolism and explain how TOR regulates nitrogen metabolism to support growth and development in photosynthetic organisms.","NA","NA","bioRxiv",1759442931011
"Neuroelectrophysiological correlates of extended cessation of consciousness in advanced meditators: A multimodal EEG and MEG study","10.1101/2025.09.19.677455","biorxiv",6.95,4.35,4.35,4.35,6.95,"Shinozuka, K.; Yang, W. F. Z.; Potash, R. M.; Sparby, T.; Sacchet, M. D.","Matthew D Sacchet","Harvard Medical School","2025-09-23","2","new results","cc_by_nc","neuroscience","https://www.biorxiv.org/content/early/2025/09/23/2025.09.19.677455.source.xml","In some contemplative traditions, ""extended cessation"" (EC) refers to a state of advanced meditation in which the meditator intentionally suppresses their own consciousness and re-emerges with a profound sense of clarity and equanimity. Here, we present the first electrophysiological study of EC, in which five meditators underwent concurrent electroencephalography (EEG) and magnetoencephalography (MEG) recording. EC significantly reduced alpha power. EC also tended to increase neural complexity, unlike other states in which consciousness is absent (e.g., sleep, anesthesia, disorders of consciousness). Our results indicate that the neural correlates of EC are distinct from other states that induce loss of consciousness and that complexity is not a sufficient condition for consciousness, while also providing new insights into the implications of advanced meditation for human flourishing.","[{""name"":""Dimension Giving Fund"",""id"":"""",""id-type"":""ROR"",""award"":""""},{""name"":""Tan Teo Charitable Foundation"",""id"":"""",""id-type"":""ROR"",""award"":""""}]","NA","bioRxiv",1759442931011
"The Reinstatement of a Forgotten Infantile Memory","10.1101/2025.09.27.678956","biorxiv",5.45,4.2,5.45,5.45,5.45,"Lahr, M.; Imhof, F.; Mauro, L.; Ulmer, T.; Donato, F.","Flavio Donato","University of Basel","2025-09-29","1","new results","cc_no","neuroscience","https://www.biorxiv.org/content/early/2025/09/29/2025.09.27.678956.source.xml","Infantile memories present a striking paradox: while early-life experiences are typically forgotten, reflecting the phenomenon of infantile amnesia, traumatic events from infancy can profoundly shape adult cognition and behavior. How do memories that are seemingly inaccessible persistently influence cognitive processes and behaviors throughout life? Rodent studies have demonstrated that forgotten infantile memories remain encoded as latent ""infantile memory engrams"" (iEngrams) within neuronal circuits, capable of memory reinstatement under artificial experimental conditions. Still, the network mechanisms underpinning the natural reinstatement of a forgotten infantile memory are unknown. Here, we show that infantile memories, though physiologically irretrievable in adults, remain stored within hippocampal circuits and their engrams contribute to hippocampal network dynamics. Crucially, reinstating these memories requires a carefully orchestrated network process. An initial contextual reminder primes the hippocampal network to increase activity of the iEngram during a subsequent aversive reminder, which tags iEngram neurons for offline reactivation. This reactivation facilitates the integration of previously latent infantile memories with novel neuronal ensembles, reinstating behavior consistent with the original memory. These findings critically advance our understanding of the neuronal mechanisms underlying physiological memory encoding, retrieval, and reinstatement across development. Furthermore, they delineate the temporal boundaries and underlying physiological substrate of the process by which a latent representation becomes associated with a novel neuronal substrate, suggesting potential interventions to prevent the maladaptive reinstatement of traumatic infantile memories.","[{""name"":""European Research Council"",""id"":""https://ror.org/0472cxd90"",""id-type"":""ROR"",""award"":""ERC-ST2019 850769;""},{""name"":""Swiss National Science Foundation"",""id"":""https://ror.org/00yjd3n13"",""id-type"":""ROR"",""award"":""CEGP3_194220;""}]","NA","bioRxiv",1759442931011
"Hyper-migratory CAR T cells alleviate ovarian cancer metastatic burden and improve prognosis","10.1101/2025.09.28.679084","biorxiv",4.05,4.05,4.05,4.05,4.05,"Nair, P. R.; Hanna, E.; Joshi, S.; Duarte Alvarado, V.; Bonifant, C.; Wirtz, D.","Denis Wirtz","Johns Hopkins University","2025-09-30","1","new results","cc_by_nc_nd","bioengineering","https://www.biorxiv.org/content/early/2025/09/30/2025.09.28.679084.source.xml","Cellular immunotherapy has shown remarkable efficacy in hematological malignancies but remains limited by infiltration issues in solid tumors, leading to poor treatment efficacy. We have recently shown that mesothelin-targeting CAR T cells co-transduced with cytokine-binding synthetic velocity receptors (VRs, referred to as CAR TV cells) demonstrate increased motility, improved infiltration in solid primary tumors, and lead to a better anti-tumor effect compared to CAR T cells that do not express VRs. However, it is metastasis that causes the vast majority of cancer related deaths and is difficult to target clinically, indicating an urgent unmet need. We show that these CAR T cells engineered to be hyper-migratory using VRs are highly effective against liver metastasis of ovarian cancer along different stages of the metastatic cascade. Mesothelin-targeting CAR TV cells expressing synthetic or native receptors responsive to the cytokine Interleukin-5 improved the survival of mice bearing an extremely high or terminal level of metastatic burden compared to CAR T cells that did not express VRs. Against newly established metastatic lesions and lesions undergoing metastatic outgrowth, CAR TV cells showed a robust anti-cancer effect resulting in an improved prognosis compared to control CAR T cells. Histopathological assessments showed a substantial reduction of metastasis number and lesion size with CAR TV treatment, concomitant with increased immune cell infiltration in the metastatic regions. Our work demonstrates the efficacy of high-motility CAR T cells in a metastatic setting and extends their scope to the treatment of metastasis of solid tumors.","[{""name"":""National Cancer Institute"",""id"":""https://ror.org/040gcmg81"",""id-type"":""ROR"",""award"":""U54CA143868;U54AR081774;U54CA268083;""},{""name"":""NIH Common Fund"",""id"":""https://ror.org/001d55x84"",""id-type"":""ROR"",""award"":""U01AG060903;P30CA006973;""}]","NA","bioRxiv",1759442931011
"Oral Blarcamesine Phase IIb/III Trial Confirms Identified Precision Medicine Patient Population 	-- Significant Broad Clinical and Quality of Life Improvements for Early Alzheimer's Disease Patients","10.1101/2025.09.27.25336656","medrxiv",8,4,8,8,8,"Macfarlane, S.; Grimmer, T.; Teo, K.; O'Brien, T. J.; Woodward, M.; Grunfeld, J.; Mander, A.; Brew, B. J.; Morris, P.; Short, C.; Kurrle, S.; Lai, R.; Bharadwaj, S.; Drysdale, P.; Sturm, J.; Lewis, S. J. G.; Kalafatis, C.; Sharif, S.; Mannering, N.; MacSweeney, J. E.; Pearson, S.; Evans, C.; Bhatt, N.; Connell, S.; Lynch, J.; Dautzenberg, P. L.; Prins, N.; Frölich, L.; Tacik, P.; Peters, O.; Henri-Bhargava, A.; Pasternak, S. H.; Frank, A.; Chertkow, H.; Ingram, J.; Hsiung, G.-Y. R.; Tartaglia, C.; Cohen, S.; Courreges, O.; Villa, L. M.; Gordon, E.; Guizard, N.; Edwards, J.; Kellmeyer, T.; Lop","Marwan N Sabbagh","Barrow Neurological Institute","2025-09-29","1","PUBLISHAHEADOFPRINT","cc_by","neurology","https://www.medrxiv.org/content/early/2025/09/29/2025.09.27.25336656.source.xml","IMPORTANCEThere are no approved oral disease-modifying treatments for Alzheimers disease (AD) with the ability to prolong time in a stable disease state and with clinically meaningful outcomes clear to patients and caregivers.

DESIGNThe Phase IIb/III ANAVEX2-73-AD-004 study was a randomized, double-blind, placebo-controlled, 48-week trial with prespecified gene or GWAS identified genetic variant populations related to the mechanism of the pharmacological intervention.

OBJECTIVEProviding evidence of improved Precision Medicine neurology clinical treatment responses with optimal blarcamesine dose for up to [~]70% of AD patients within prespecified SIGMAR1 (ABCLEAR1) and GWAS identified COL24A1 (ABCLEAR2) and SIGMAR1/COL24A1 (ABCLEAR3) non-missense gene populations. Describing once-daily, oral therapeutic intervention of blarcamesine in early AD, with a differentiated upstream and constitutional mechanism of action by enhancing autophagy through SIGMAR1 activation and restoration of cellular homeostasis.

SETTINGMulticenter - 52 medical research centers/hospitals in 5 countries.

INTERVENTION508 participants with Early AD (Stage 3) were randomized to receive blarcamesine (n = 338) oral capsules once daily either in medium dose group (30 mg) or in high dose group (50 mg) or placebo (n = 170) for 48 weeks. An open-label-extension study ATTENTION-AD, continued for up to 192 weeks.

MAIN OUTCOME AND MEASURESFurther improved clinical and biomarker outcomes of the ABCLEAR2 and ABCLEAR3 populations were accretive to the previously reported intent-to-treat (ITT) and prespecified ABCLEAR1 populations. The co-primary cognitive and functional outcomes were assessed as changes in ADAS-Cog13 and ADCS-ADL from baseline to 48 weeks. The outcomes include the secondary outcome CDR-SB as well as patient assessed clinical outcomes CGI-I, NPI-Q and QoL-AD (Quality of Life AD Patient) as well as biomarkers global brain volume changes measured by MRI. All clinical endpoints were analyzed using mixed model for repeated measures (MMRM), and volumetric MRI scans were analyzed by general linear model.

RESULTSThe ITT population (mean age, 73.7 years; 225 [48.7%] women), consisted of 462 randomized participants, with ABCLEAR1 population comprising of 300 participants, ABCLEAR2 population of 336 participants and ABCLEAR3 of 222 participants. In both the ABCLEAR2 and ABCLEAR3 populations, the co-primary outcomes as well as all other clinical outcomes were statistically significant. ABCLEAR3 blarcamesine group vs. placebo at Week 48 (ADAS-Cog13 difference of -4.179 [95% CI -6.512, -1.845]; P=0.0005; ADCS-ADL difference of +3.131 [95%CI 0.720, 5.542]; P=0.0111; CDR-SB difference of -1.076 [95% CI -1.645, -0.508]; P=0.0002; QoL-AD Patient improvement from baseline of 0.334 [95% CI -1.164, 1.833] and difference of 1.848 [95% CI 0.455, 3.241]; P=0.0095). The clinical outcomes were strongest in the blarcamesine 30 mg cohort (ADAS-Cog13 difference of -4.739 [95% CI -7.370, -2.108]; P=0.0004; ADCS-ADL difference of +4.245 [95%CI 1.518, 6.972]; P=0.0024; CDR-SB difference of -1.414 [95% CI -2.054, -0.775]; P<0.0001; QoL-AD Patient improvement from baseline of 0.182 [95% CI -1.472, 1.835]; and difference of 1.651 [95% CI 0.455, 3.241]; P=0.0392). Whole brain volume loss in blarcamesine group vs. placebo was significantly further decreased from ITT population (37.6%, P=0.0019) to ABCLEAR3 population (44.5%, P=0.0019). Participants in the 30 mg group ABCLEAR3 full safety population with [&ge;]1 serious treatment-emergent adverse events (TEAEs) occurred in 10 participants (12.7%) in the blarcamesine and 6 (9.1%) in the placebo group. Common TEAEs included dizziness, which was transient and mostly mild to moderate in severity. There were no deaths in the blarcamesine group and 1 in the placebo group.

CONCLUSIONS AND RELEVANCEBlarcamesine group demonstrated a balanced safety profile with no associated neuroimaging adverse events. The respective once-daily oral 30 mg blarcamesine cohort in the respective ABCLEAR1, ABCLEAR2, and ABCLEAR3 populations demonstrates further improvement of the already adequate safety profile of the ITT population and hence representing the dose with the most balanced benefit-to-risk ratio. In both ABCLEAR2 and ABCLEAR3 populations significant slowing in decline and even stabilization of clinical worsening was demonstrated. Blarcamesine group vs. placebo was 75.9% reduction in decline at 48 weeks in the total blarcamesine group and was 84.7% in the 30 mg dose group, respectively on the prespecified co-primary cognitive endpoint ADAS-Cog13 in the ABCLEAR3 population. Blarcamesine demonstrated consistently significantly improved clinical effect for all clinical endpoints, which was in accordance with significant and further reduced brain atrophy. Furthermore, a significant absolute improvement in Quality of Life (QoL-AD) scores indicating a reversal of negative trajectory for Alzheimers disease patients from baseline to end of trial was observed. The Phase IIb/III ANAVEX2-73-AD-004 clinical study confirmed blarcamesines consistent efficacy leading to improved cognitive stabilization with continued benefit in the open-label-extension study ATTENTION-AD up to 192 weeks. Evidenced by the Precision Medicine paradigm, including in a prespecified ABCLEAR1 population, a consistent significant improvement for all clinical endpoints in the ABCLEAR2 and ABCLEAR3 populations, respectively, was demonstrated. Coupled with a convenient once daily, oral pill administration, blarcamesine could represent a novel treatment option for up to [~]70% of early AD patients benefiting from further improved outcomes using directed Precision Medicine to alleviate significant medical and economic burden.

TRIAL REGISTRATIONClinicaltrials.gov: NCT03790709; Open-label extension NCT04314934

FUNDINGThis work was funded by Anavex Life Sciences.

Key MessageWithin a heterogeneous Alzheimers disease (AD) population, clinical utility of disease-modifying drug candidates could be enhanced via a Precision Medicine approach of treating those with target-relevant genetic profiles, excluding missense gene populations. This effective targeting could alleviate significant medical and economic burden.","NA","NA","medRxiv",1759442931011
"Evaluating Anti-LGBTQIA+ Medical Bias in Large Language Models","10.1101/2024.08.22.24312464","medrxiv",16.8,4,4,4,4,"Chang, C. T.-T.; Srivathsa, N.; Bou-Khalil, C.; Swaminathan, A.; Lunn, M. R.; Mishra, K.; Koyejo, S.; Daneshjou, R.","Roxana Daneshjou","Stanford University School of Medicine","2025-07-28","3","PUBLISHAHEADOFPRINT","cc_by_nc_nd","health informatics","https://www.medrxiv.org/content/early/2025/07/28/2024.08.22.24312464.source.xml","Large Language Models (LLMs) are increasingly deployed in clinical settings for tasks ranging from patient communication to decision support. While these models demonstrate race-based and binary gender biases, anti-LGBTQIA+ bias remains understudied despite documented healthcare disparities affecting these populations. In this work, we evaluated the potential of LLMs to propagate anti-LGBTQIA+ medical bias and misinformation. We prompted 4 LLMs (Gemini 1.5 Flash, Claude 3 Haiku, GPT-4o, Stanford Medicine Secure GPT [GPT-4.0]) with 38 prompts consisting of explicit questions and synthetic clinical notes created by medically-trained reviewers and LGBTQIA+ health experts. The prompts consisted of pairs of prompts with and without LGBTQIA+ identity terms and explored clinical situations across two axes: (i) situations where historical bias has been observed versus not observed, and (ii) situations where LGBTQIA+ identity is relevant to clinical care versus not relevant. Medically-trained reviewers evaluated LLM responses for appropriateness (safety, privacy, hallucination/accuracy, and bias) and clinical utility. We found that all 4 LLMs generated inappropriate responses for prompts with and without LGBTQIA+ identity terms. The proportion of inappropriate responses ranged from 43-62% for prompts mentioning LGBTQIA+ identities versus 47-65% for those without. The most common reason for inappropriate classification tended to be hallucination/accuracy, followed by bias or safety. Qualitatively, we observed differential bias patterns, with LGBTQIA+ prompts eliciting more severe bias. Average clinical utility score for inappropriate responses was lower than for appropriate responses (2.6 versus 3.7 on a 5-point Likert scale). Future work should focus on tailoring output formats to stated use cases, decreasing sycophancy and reliance on extraneous information in the prompt, and improving accuracy and decreasing bias for LGBTQIA+ patients. We present our prompts and annotated responses as a benchmark for evaluation of future models. Content warning: This paper includes prompts and model-generated responses that may be offensive.

Author summaryLarge Language Models (LLMs), such as ChatGPT, have the potential to enhance healthcare by assisting with tasks like responding to patient messages and assisting providers in making medical decisions. However, these technologies might inadvertently spread medical misinformation or reinforce harmful biases against minoritized groups. Our research examined the risk of LLMs perpetuating anti-LGBTQIA+ biases in medical contexts.

We tested four LLMs with prompts designed by medical and LGBTQIA+ health experts. These prompts addressed various clinical scenarios, some historically linked to bias against LGBTQIA+ individuals. Our evaluation revealed that all four LLMs produced responses that were inaccurate or biased for prompts with and without LGBTQIA+ identity terms mentioned. Qualitatively, the nature of inappropriate responses differed between these groups, with LGBTQIA+ identity terms eliciting more severe bias. The clinical utility of responses was, on average, lower for inappropriate responses than for appropriate responses.

These findings highlight the urgent need to ensure that LLMs used in medical contexts provide accurate and safe medical advice for LGBTQIA+ patients. Future efforts should focus on refining how LLMs generate responses, minimizing biases, and enhancing reliability in clinical settings in addition to critically examining use cases. This work is crucial for fostering equitable healthcare for all individuals.","NA","NA","medRxiv",1759442931011
"A deep learning and co-conservation framework enable discovery of non-canonical Cas proteins","10.1101/2025.09.30.679098","biorxiv",3.95,3.95,3.95,3.95,3.95,"He, B.; Qi, C.; Feng, Y.; Liu, D.; Wu, R.; Wang, Z.; Wang, D.; Yue, Z.; Zhang, Y.; Lan, H.; Zheng, Y.; Li, Y.","Yuxiang Li","BGI Research, Wuhan 430074, China","2025-10-01","1","new results","cc_by_nc","synthetic biology","https://www.biorxiv.org/content/early/2025/10/01/2025.09.30.679098.source.xml","CRISPR-Cas systems are central to prokaryotic adaptive immunity, widely harnessed for biotechnology. Yet, their vast and uncharacterized diversity, especially non-canonical variants, impedes full exploitation. Here we present BioPrinCRISPR, a class-agnostic computational framework leveraging gene co-conservation, protein domain co-occurrence, and embedding similarity to identify and characterize CRISPR-Cas systems across prokaryotic genomes. Applying BioPrinCRISPR to over one million bacterial genomes, we uncovered extensive canonical and uncharacterized systems, revealing a rich landscape of atypical Cas proteins and novel domain architectures. Notably, we identified recurrent fusion proteins with unique enzymatic combinations, suggesting roles in regulatory control or nucleic acid remodeling. Experimental validation of two divergent Cas13an-like effectors demonstrated RNA knockdown capacity in human cells, confirming our framework's predictive power. These findings expand the functional repertoire of CRISPR-associated proteins and highlight unexplored modes of microbial immunity. BioPrinCRISPR thus stands as a powerful tool for comprehensively mapping CRISPR-Cas diversity, offering new insights into prokaryotic defense and facilitating discovery of novel candidates for next-generation genome engineering. An accompanying interactive web platform was also developed to facilitate data exploration.","[{""name"":""National Natural Science Foundation of China"",""id"":""https://ror.org/01h0zpd94"",""id-type"":""ROR"",""award"":""32501343;""},{""name"":""National Key Research and Development Program of China"",""id"":"""",""id-type"":""ROR"",""award"":""7100;""}]","NA","bioRxiv",1759442931011
