"title","doi","altmetric_jid","score","X1d","X3d","X1w","X1m","authors","author_corresponding","author_corresponding_institution","date","version","type","license","category","jatsxml","abstract","published","server","upupdate_time"
"Time-resolved phenotyping at subcellular resolution reveals shared principles and key trade-offs across antimicrobial peptide activities","10.1101/2025.04.10.648262","biorxiv",5.5,3.5,5.5,5.5,5.5,"Fragasso, A.; Schlechtweg, T.; Lin, W.-H.; Barron, A. E.; Jacobs-Wagner, C.","Christine Jacobs-Wagner","Stanford University","2025-04-11","2","new results","cc_by","microbiology","https://www.biorxiv.org/content/early/2025/04/11/2025.04.10.648262.source.xml","Cationic antimicrobial peptides are a large family of host defense molecules with diverse sequences and structures. Here, we present a computational and experimental pipeline for quantifying the membrane-permeabilizing effects, as well as the intracellular impacts on ribosome and DNA organization, of cationic peptides in growing Escherichia coli cells at high temporal and subcellular resolution. Applying this pipeline to 11 diverse natural peptides and synthetic peptidomimetics uncovered shared antibacterial activities, but with different kinetics that categorized them into two classes: class I, where inner membrane permeabilization predominantly correlates with growth inhibition, and class II, where it does not. With the class I peptides, intracellular ribosome and DNA reorganization, along with growth inhibition, occurred abruptly and was coupled with inner membrane permeabilization. However, this coupling led to rapid peptide absorption by the first exposed cells and poor antibacterial activity against dense cell populations. With the class II peptides, ribosome/DNA reorganization and growth inhibition occurred more gradually, as inner membrane permeabilization was either absent or delayed. This was offset by slower intracellular uptake and greater efficacy against high cell densities. These kinetic differences reveal functional trade-offs between classes that have immunological and therapeutic implications.","NA","biorxiv",1744582124635
"Prevention of Transgene Silencing During Human PluripotentStem Cell Differentiation","10.1101/2025.04.07.647695","biorxiv",3.45,3.45,3.45,3.45,3.45,"Uenaka, T.; Napole, A. B.; Saha, A. D.; Sun, D.; Singavarapu, A.; Calzada, L.; Chen, J.; Erlebach, L.; McQuade, A.; Ramos, D.; Rigamonti, A.; Salazar, L.; Samelson, A. J.; Sedov, K.; Welsh, N. J.; Wild, K.; Wu, Q.; Arenas, E.; Bassett, A. R.; Kampmann, M.; Kronenberg-Versteeg, D.; Merkle, F. T.; Schule, B.; Thompson, L. M.; Skarnes, W. C.; Ward, M. E.; Wernig, M.","Marius Wernig","Institute for Stem Cell Biology & Regenerative Medicine, Stanford University School of Medicine, Stanford, CA, 94305, USA, Department of Pathology, Stanford Uni","2025-04-11","1","new results","cc_by_nc","neuroscience","https://www.biorxiv.org/content/early/2025/04/11/2025.04.07.647695.source.xml","While high and stable transgene expression can be achieved in undifferentiated pluripotent stem cells, conventional transgene expression systems are often silenced upon differentiation. Silencing occurs with both randomly integrated transgenes, introduced via transposase or lentiviral methods, and with transgenes targeted to specific genomic sites, including at commonly used safe harbor loci. The challenge to robustly express experimental transgenes in differentiated pluripotent stem cells is a major bottleneck in the field for applications such as CRISPR screening. Here, we conducted a comparative analysis to systematically evaluate the impact of various promoters, transcriptional regulatory elements, insulators, and genomic integration sites on transgene silencing during neuronal differentiation. Our findings reveal that specific combinations of promoters and transcriptional stability elements are able to prevent transgene silencing during differentiation, whereas chromatin insulators had less impact on silencing and three novel safe harbor integration sites performed similarly to the CLYBL locus. Guided by these insights we developed the PiggyBac vector TK4, which showed complete resistance to transgene silencing across various neuronal and microglial differentiation protocols from six different pluripotent stem cell lines, as independently confirmed by seven different laboratories. This construct will be highly useful for assays requiring stable transgene expression during differentiation, and holds the potential for broad applications in various research fields.","NA","biorxiv",1744582124635
"α7 nicotinic acetylcholine receptors regulate radial glia fate in the developing human cortex","10.1101/2025.04.10.647795","biorxiv",2.85,2.85,2.85,2.85,2.85,"Mukhtar, T.; Siebert, C.-V.; Wang, Y.; Pebworth, M.-P.; White, M. L.; Wu, T.; Huang, T. I.; Zuo, G.; Ross, J.; Baltazar, J.; Upadhyay, V.; Shankar, M.; Zhou, L.; Lombardi-Coronel, I.; Mandala, I.; Adam, M. A.; Wang, S.; Bi, Q.; Hoekman, M. F. M.; Li, J.; Kriegstein, A.","Tanzila Mukhtar","UCSF","2025-04-11","2","new results","cc_by_nd","neuroscience","https://www.biorxiv.org/content/early/2025/04/11/2025.04.10.647795.source.xml","Prenatal nicotine exposure impairs fetal cortical grey matter volume, but the precise cellular mechanisms remain poorly understood. This study elucidates the role of nicotinic acetylcholine receptors (nAChRs) in progenitor cells and radial glia (RG) during human cortical development. We identify two nAChR subunits, CHRNA7 and the human-specific CHRFAM7A expressed in SOX2+ progenitors and neurons, with CHRFAM7A particularly enriched along RG endfeet. nAChR activation in organotypic slices and dissociated cultures increases RG proliferation while decreasing neuronal differentiation, whereas nAChR knockdown reduces RG and increases neurons. Single-cell RNA sequencing reveals that nicotine exposure downregulates key genes in excitatory neurons (ENs), with CHRNA7 or CHRFAM7A selectively modulating these changes, suggesting an evolutionary divergence in regulatory pathways. Furthermore, we identify YAP1 as a critical downstream effector of nAChR signaling, and inhibiting YAP1 reverses nicotine-induced phenotypic alterations in oRG cells, highlighting its role in nicotine-induced neurodevelopmental pathophysiology.","NA","biorxiv",1744582124635
"STEAMBOAT: Attention-based multiscale delineation of cellular interactions in tissues","10.1101/2025.04.06.647437","biorxiv",10.95,2.85,7.199999999999999,10.95,10.95,"Liang, S.; Tang, J.; Wang, G.; Ma, J.","Jian Ma","Carnegie Mellon University","2025-04-10","1","new results","cc_by_nc_nd","bioinformatics","https://www.biorxiv.org/content/early/2025/04/10/2025.04.06.647437.source.xml","Spatial-omics technologies profile cells in their native spatial context within tissues, enabling more complete understanding of cellular properties. However, a key computational challenge remains: identifying cellular interactions that underlie cell types and states - interactions that are essential for spatial organization and provide a biologically grounded framework for understanding cell identities and spatial patterns. These interactions span different distances and thus require multiscale modeling, which remains a major gap in existing methods. Here, we introduce SO_SCPLOWTEAMBOATC_SCPLOW, an interpretable machine learning framework that leverage a self-supervised, multi-head attention model to uniquely decompose gene expression of a cell into multiple key factors: intrinsic cell programs, neighboring cell communication, and long-range interactions. By applying SO_SCPLOWTEAMBOATC_SCPLOW to diverse tissues in health and disease across various spatial-omics technologies, we demonstrate its ability to uncover critical multiscale cellular interactions, capturing classical contact signaling and revealing previously unrecognized patterns of cellular communication. SO_SCPLOWTEAMBOATC_SCPLOW provides a powerful approach for spatial-omics analysis, offering new insights into the multiscale spatial organization of cells and their communication across a wide range of biological contexts.","NA","biorxiv",1744582124635
"Immunological and Antigenic Signatures Associated with Chronic Illnesses after COVID-19 Vaccination","10.1101/2025.02.18.25322379","medrxiv",3857.1959999998962,2.85,44.8,60.25,376.5579999999998,"Bhattacharjee, B.; Lu, P.; Monteiro, V. S.; Tabachnikova, A.; Wang, K.; Hooper, W. B.; Bastos, V.; Greene, K.; Sawano, M.; Guirgis, C.; Tzeng, T. J.; Warner, F.; Baevova, P.; Kamath, K.; Reifert, J.; Hertz, D.; Dressen, B.; Tabacof, L.; Wood, J.; Cooke, L.; Doerstling, M.; Nolasco, S.; Ahmed, A.; Proal, A.; Putrino, D.; Guan, L.; Krumholz, H.; Iwasaki, A.","Akiko Iwasaki","Department of Immunobiology, Yale University School of Medicine, New Haven, CT, USA","2025-02-25","2","PUBLISHAHEADOFPRINT","cc_no","allergy and immunology","https://www.medrxiv.org/content/early/2025/02/25/2025.02.18.25322379.source.xml","COVID-19 vaccines have prevented millions of COVID-19 deaths. Yet, a small fraction of the population reports a chronic debilitating condition after COVID-19 vaccination, often referred to as post-vaccination syndrome (PVS). To explore potential pathobiological features associated with PVS, we conducted a decentralized, cross-sectional study involving 42 PVS participants and 22 healthy controls enrolled in the Yale LISTEN study. Compared with controls, PVS participants exhibited differences in immune profiles, including reduced circulating memory and effector CD4 T cells (type 1 and type 2) and an increase in TNF+ CD8 T cells. PVS participants also had lower anti-spike antibody titers, primarily due to fewer vaccine doses. Serological evidence of recent Epstein-Barr virus (EBV) reactivation was observed more frequently in PVS participants. Further, individuals with PVS exhibited elevated levels of circulating spike protein compared to healthy controls. These findings reveal potential immune differences in individuals with PVS that merit further investigation to better understand this condition and inform future research into diagnostic and therapeutic approaches.","NA","medrxiv",1744582124635
"An autism spectrum disorder mutation in Topoisomerase 3B causes accumulation of covalent mRNA intermediates by disrupting metal binding within the zinc finger domain","10.1101/2025.04.11.647616","biorxiv",2.75,2.75,2.75,2.75,2.75,"Warrick, J. E.; Attili, D.; van Eeuwen, T.; Hoffmann-Weitsman, S. E.; Forsyth, N. C.; Barmada, S. J.; Kearse, M. G.","Michael G. Kearse","The Ohio State University","2025-04-11","1","new results","cc_by_nc_nd","biochemistry","https://www.biorxiv.org/content/early/2025/04/11/2025.04.11.647616.source.xml","The loss and mutation of Topoisomerase 3{beta} (TOP3B), the only known eukaryotic topoisomerase with the ability to catalyze RNA strand passage reactions, is linked to schizophrenia, autism, and intellectual disability. Uniquely, TOP3B primarily localizes to the cytoplasm and has been shown to regulate mRNA translation and stability of a subset of transcripts. Three neurological disease-linked de novo TOP3B point mutations outside of the active site have been identified but their impact on TOP3B activity in cells remains poorly understood. Upon establishing a new Neuro2A-cell based TOP3B activity assay, we provide genetic and biochemical evidence that the autism-linked C666R mutation causes accumulation of unresolved TOP3B-mRNA covalent intermediates by directly disrupting metal coordination via a unique D1C3-type metal binding motif within the zinc finger domain. Furthermore, we show that primary neurons are sensitive to high levels of TOP3B-mRNA covalent intermediates and that such adducts are capable of causing ribosome collisions. Together, these data identify a previously underappreciated role of the zinc finger domain and how non-active site disease-linked mutations affect TOP3B activity.","NA","biorxiv",1744582124635
"Alpha-BET: Functional labeling of envelope glycoproteins with single domain antibodies for in-virus single molecule imaging","10.1101/2025.04.11.648405","biorxiv",3.45,2.7,3.45,3.45,3.45,"Williamson, D. J.; Zaza, C.; Carlon Andres, I.; Gentili, A.; Daly, J. I.; Holmes, H.; Thrush, J.; Starling, T.; Neil, S.; Owens, R.; Malim, M. M.; Tynan, C.; Simoncelli, S.; Padilla-Parra, S.","Sergio Padilla-Parra","King\\\'s College London","2025-04-11","1","new results","cc_by_nc_nd","biophysics","https://www.biorxiv.org/content/early/2025/04/11/2025.04.11.648405.source.xml","We present Alpha-BET, a structure-guided strategy leveraging AlphaFold to identify optimal ALFAtag insertion sites for minimally disruptive labeling of viral glycoproteins with high-affinity nanobodies. Applied to HIV-1 Env, SARS-CoV-2 S, and Nipah G, Alpha-BET preserves structural integrity and function. For HIV-1 Env, we demonstrate super-resolution DNA-PAINT MINFLUX 3D imaging enabled by tag insertion, showcasing its power for visualizing native trimers in single virions and potential for broader virological applications.","NA","biorxiv",1744582124635
"Ancient pangenomic origins of noncanonical NLR genes underlying the recent evolutionary rescue of a staple crop","10.1101/2025.04.11.648396","biorxiv",2.6,2.6,2.6,2.6,2.6,"VanGessel, C. J.; Felderhoff, T. J.; Prigozhin, D. M.; Cui, M.; Pressoir, G.; Healey, A. L.; Lovell, J. T.; Nalam, V. J.; Nishimura, M. T.; Morris, G. P.","Geoffrey P Morris","Colorado State University","2025-04-11","1","new results","cc_by_nc","genetics","https://www.biorxiv.org/content/early/2025/04/11/2025.04.11.648396.source.xml","Evolutionary rescue occurs when populations in deteriorating environments avoid extinction by rapid adaptation. The recent evolutionary rescue of the cereal crop sorghum via RMES1 aphid resistance is among a few known in situ cases, but its pangenomic origins and molecular basis is not yet known. Here, we describe the behavioral effects, molecular endophenotypes, and pangenomic evolution underlying this evolutionary rescue. Analysis of near-isogenic lines show that RMES1 disrupts phloem feeding via global immunity activation of conserved defense networks. A growth-to-defense transition is evidenced by extensive transcriptome remodeling (>15% of expressed genes) and mediated by salicylic acid signaling. Nucleotide-binding leucine-rich repeat (NLR) immune receptor genes at the RMES1 locus harbored on a large tandem duplication have extensive copy number variation across the sorghum pangenome. The likely causative NLRs (RMES1A and RMES1B) were inferred from expression and structural variation. The NLRs encoded at RMES1 lack an N-terminal signaling domain and have nucleotide-binding domain sequence variation expected to result in a loss of ATP binding, suggesting RMES1 NLRs function via a noncanonical mechanism. The RMES1 NLR family is shared across the grass super-pangenome and includes the brown planthopper resistance gene BPH40 in Oryza sativa, which is syntenic to RMES1. Finally, k-mer analysis of RMES1 haplotypes in the sorghum pangenome established the East African origin of rare standing variation for resistance. Thus, the birth-and-death process at an ancient gene cluster generated pangenomic variation that was recruited to activate coordinated defense pathways and provide evolutionary rescue.","NA","biorxiv",1744582124635
"Improved detection of multiple sclerosis gadolinium-enhancing lesions: 3D T1 Turbo-Spin-Echo Outperforms 3D T1 Turbo-Field Echo MRI","10.1101/2025.04.09.25325510","medrxiv",2.5,2.5,2.5,2.5,2.5,"Naval-Baudin, P.; Bermudez Bravo, W. F.; Pineda-Borja, V. I.; Arroyo-Pereiro, P.; Martinez-Zalacain, I.; Romero, L.; Mora, P.; Calvo, N.; Martinez-Yelamos, A.; Cos, M.; Martinez-Yelamos, S.; Pons-Escoda, A.; Majos, C.","Pablo Naval-Baudin","Bellvitge University Hospital","2025-04-12","1","PUBLISHAHEADOFPRINT","cc_by","neurology","https://www.medrxiv.org/content/early/2025/04/12/2025.04.09.25325510.source.xml","Objectives: To compare the performance of 3D T1 turbo spin echo (3DT1TSE) and 3D T1 turbo field echo (3DT1TFE) MRI in detecting gadolinium-enhancing lesions in multiple sclerosis (MS). Methods: We retrospectively analyzed 255 3T MRIs from MS patients, each including post-contrast 3DT1TSE and 3DT1TFE sequences. Two blinded readers independently assessed enhancing lesions per sequence. A consensus review, incorporating longitudinal imaging and additional sequences, served as the reference standard. Results: The consensus identified 70 enhancing lesions in 31 patients. All 70 were visible on 3DT1TSE, while 64 (91%) were detectable on 3DT1TFE. Reader sensitivity was higher for 3DT1TSE (84% and 90%) than 3DT1TFE (45% and 40%) (p < 0.01). Inter-reader agreement was excellent for 3DT1TSE (ICC = 0.90) and moderate for 3DT1TFE (ICC = 0.69). Although false positives were more common with 3DT1TSE, they were readily excluded during consensus reading. In six patients, enhancing lesions were detected only on 3DT1TSE, with treatment escalation in two. Conclusion: 3DT1TSE outperformed 3DT1TFE in sensitivity and reader agreement for enhancing lesion detection in MS. Incorporating 3DT1TSE into standard MRI protocols may improve disease activity assessment and clinical decision-making.","NA","medrxiv",1744582124635
"Machine learning identifies clinical sepsis phenotypes that translate to the plasma proteome: a prospective cohort study","10.1101/2025.04.11.25325574","medrxiv",2.5,2.5,2.5,2.5,2.5,"Bracht, T.; Weber, M.; Kappler, K.; Palmowski, L.; Bayer, M.; Schork, K.; Rahmel, T.; Unterberg, M.; Haberl, H.; Wolf, A.; Koos, B.; Rump, K.; Ziehe, D.; Limper, U.; Henzler, D.; Ehrentraut, S. F.; von Groote, T.; Zarbock, A.; Eisenacher, M.; Adamzik, M.; Sitek, B.; Nowak, H.","Thilo Bracht","Ruhr-University Bochum","2025-04-11","1","PUBLISHAHEADOFPRINT","cc_no","intensive care and critical care medicine","https://www.medrxiv.org/content/early/2025/04/11/2025.04.11.25325574.source.xml","Background: Sepsis therapy is still limited to treatment of the underlying infection and supportive measures. To date, various sepsis subtypes were proposed, but therapeutic options addressing the molecular changes of sepsis were not identified. With the aim of a future individualized therapy, we used machine learning (ML) to identify clinical phenotypes and their temporal development in a prospective, multicenter sepsis cohort and characterized them using plasma proteomics. Methods: Routine clinical data and blood samples were collected from 384 patients. Sepsis phenotypes were identified based on clinical measurements and plasma samples from 301 patients were analyzed using mass spectrometry. The obtained data were evaluated in relation to the phenotypes, and supervised ML models were developed enabling prospective phenotype classification and determination of key features distinguishing the phenotypes. Results: Three phenotypes and their progression across four time points in sepsis were identified. Cluster C was characterized by the highest disease severity and multi-organ failure with leading liver failure. Cluster B showed relevant organ failure, with renal damage being particularly prominent in comparison to cluster A. Time course analysis showed a strong association of cluster C with mortality and dynamic properties of cluster B. The plasma proteome reflected the clinical features of the phenotypes and revealed excessive consumption of complement and coagulation factors in severe sepsis. Supervised ML models allow the assignment of patients based on only seven widely available features. Conclusions: The identified clinical phenotypes reflected varying degrees of sepsis severity and were mirrored in the plasma proteome. Proteomic profiling offered novel insights into the molecular mechanisms underlying sepsis and enabled a deeper characterization of the identified phenotypes. This integrative approach may serve as a blueprint for uncovering molecular signatures of sepsis subgroups and holds promise for the development of future targeted therapies.","NA","medrxiv",1744582124635
"Challenges of visibility and inclusion in Long COVID: a population-based interview study","10.1101/2025.04.08.25325457","medrxiv",2.7,2.45,2.7,2.7,2.7,"Cooper, E.; Lound, A.; Jones, K.; Bruton, P. J.; Day, S. E.; Atchison, C. J.; Eccles, C.; Piper, A.; Cooke, G. J.; Chadeau-Hyam, M.; Elliott, P.; Ward, H.","Helen Ward","Imperial College London","2025-04-11","1","PUBLISHAHEADOFPRINT","cc_by_nc_nd","public and global health","https://www.medrxiv.org/content/early/2025/04/11/2025.04.08.25325457.source.xml","Introduction: People with Long Covid report a wide range of symptoms and inconsistent responses when seeking clinical diagnosis and support. Much of the qualitative research on Long Covid has been based on people attending specialist clinical services or who have accessed support groups. We describe the varied ways in which a diverse group of people in a community sample experience, recognise and manage persistent symptoms following COVID-19. Methods: Qualitative interview study nested within the large, community-based REal-time Assessment of Community Transmission (REACT) study in England. Participants reporting persistent symptoms following COVID-19 were asked for consent to be contacted about a follow-up interview. We then purposively sampled by age, gender, ethnicity and symptom severity and conducted 60 interviews. Analysis was carried out using a reflexive thematic analysis approach. Results: Participants were an ethnically diverse group aged between 18 and 80 years who reported symptoms following COVID-19 for between a few months and more than two years. Many had not accessed clinical care or specific Long Covid support, and some did not identify with the category of long covid, rendering their experiences largely invisible. Participants highlighted the ways in which they self-manage symptoms within this context, and the varied burden of coping with ongoing health problems. Conclusion: This diverse sample of people with Long Covid report a range of challenges managing this emerging and contested condition, with uncertainty affecting their own understanding and the validation they receive from professionals, family and friends. These challenges intersect with others such as racism, and are compounded by a lack of specific resources for Long Covid as well as over-stretched health services in the UK. Nevertheless, people show resilience in their self-management, seeking information and support from a range of sources. Patient or Public Contribution: Study design, analysis and outputs informed by Patient Advisory Group.","NA","medrxiv",1744582124635
"A structural roadmap for the formation of the coronavirus nsp3/nsp4 double membrane vesicle pore and its implications for polyprotein processing and replication/transcription","10.1101/2025.04.10.648184","biorxiv",2.25,2.25,2.25,2.25,2.25,"Perry, J.; Itskanov, S.; Bilello, J. P.; Lansdon, E.","Jason Perry","Gilead Sciences","2025-04-11","1","new results","cc_no","molecular biology","https://www.biorxiv.org/content/early/2025/04/11/2025.04.10.648184.source.xml","Coronavirus replication is understood to occur within double membrane vesicles (DMVs) that arise during viral infection. Prior work has determined that these DMVs have characteristic pores formed from the non-structural viral proteins nsp3 and nsp4, which facilitate export of newly synthesized viral RNA. Yet how the replication machinery, which is minimally comprised of the non-structural proteins nsp7 to nsp16, is recruited to the DMV remains a mystery. Working from AlphaFold and previously determined structures, we constructed a series of models that link formation of the DMV pore to nsp5 protease processing of the polyprotein and trapping of the cleaved products within the DMV itself. We argue that the initial pore is formed from twelve subunits of nsp3 and six subunits each of the intermediate uncleaved polyproteins pp1a' (nsp4-nsp10) and pp1ab' (nsp4-nsp16). Formation of this initial structure activates the protease function of alternating nsp5 subunits within a close-packed ring, facilitating the initial trans-cleavage of the nsp4-nsp5 linkage. Maturation of the pore follows, as does formation of canonical nsp5 dimers, which can process the remainder of the polyproteins. When protease activation occurs subsequent to closure of the DMV, the cleavage products, whose stoichiometry is consistent with the previously proposed nsp15-centered hexameric replication complex, will be trapped inside.","NA","biorxiv",1744582124635
