"title","doi","altmetric_jid","score","X1d","X3d","X1w","X1m","authors","author_corresponding","author_corresponding_institution","date","version","type","license","category","jatsxml","abstract","published","server","upupdate_time"
"Restrictor slows early transcription elongation to render RNA polymerase II susceptible to termination at non-coding RNA loci","10.1101/2025.01.08.631787","biorxiv",4.15,4.15,4.15,4.15,4.15,"Mimoso, C. A.; Vlaming, H.; de Wagenaar, N. P.; Adelman, K.","Hanneke Vlaming","Division of Genome Biology & Epigenetics, Institute of Biodynamics and Biocomplexity, Utrecht University, Utrecht, The Netherlands","2025-01-10","1","new results","cc_by_nc_nd","genomics","https://www.biorxiv.org/content/early/2025/01/10/2025.01.08.631787.source.xml","The eukaryotic genome is broadly transcribed by RNA polymerase II (RNAPII) to produce protein-coding messenger RNAs (mRNAs) and a repertoire of non-coding RNAs (ncRNAs). Whereas RNAPII is very processive during mRNA transcription, it terminates rapidly during synthesis of many ncRNAs, particularly those that arise opportunistically from accessible chromatin at gene promoters or enhancers. The divergent fates of mRNA versus ncRNA species raise many questions about how RNAPII and associated machineries discriminate functional from spurious transcription. The Restrictor complex, comprised of the RNA binding protein ZC3H4 and RNAPII-interacting protein WDR82, has been implicated in restraining the expression of ncRNAs. However, the determinants of Restrictor targeting and the mechanism of transcription suppression remain unclear. Here, we investigate Restrictor using unbiased sequence screens, and rapid protein degradation followed by nascent RNA sequencing. We find that Restrictor promiscuously suppresses early elongation by RNAPII, but this activity is blocked at most mRNAs by the presence of a 5' splice site. Consequently, Restrictor is a critical determinant of transcription directionality at divergent promoters and prevents transcriptional interference. Finally, our data indicate that rather than directly terminating RNAPII, Restrictor acts by reducing the rate of transcription elongation, rendering RNAPII susceptible to early termination by other machineries.","NA","biorxiv",1736633251837
"Genomic and metagenomic survey of microbial carbonic anhydrase genes reveals novel clades, high diversity, and biome-specificity","10.1101/2025.01.09.631809","biorxiv",6.4,4.050000000000001,6.4,6.4,6.4,"Franco, M. E. E.; Singer, E.; Roux, S.; Meredith, L. K.; U'Ren, J. M.","Jana M. U\'Ren","Washington State University","2025-01-10","1","new results","cc_by_nc_nd","genomics","https://www.biorxiv.org/content/early/2025/01/10/2025.01.09.631809.source.xml","Carbonic anhydrase (CA) enzymes catalyze the interconversion of carbon dioxide and bicarbonate with an efficiency exceeded only by superoxide dismutase. CA enzymes have convergently evolved multiple times from phylogenetically distant organisms into structurally unrelated classes (, {beta}, {gamma},{delta} ,{zeta} , , {theta}, {iota}) with conserved physiological functions involved in photosynthesis, respiration, pH homeostasis, CO2 transport, and carbonyl sulfide hydrolysis that play central roles in medicine and the environment. Here, we leverage the recent surge in publicly available genomes and metagenomes to re-examine our understanding of the abundance, diversity, and phylogenetic relationships of the three major CA classes in Bacteria/Archaea and microbial Eukaryotes (Fungi, algae). We recovered a total of 57,218 -, {beta}-, and {gamma}-CA sequences from 24,184 metagenomes and genomes, including the first detection of -CA from an Archaeal species. CA sequences formed 3,859 protein clusters (1,188 with [&ge;] 3 sequences) that were taxonomically conserved at higher levels (i.e., Superkingdom, Phylum, Class). When viewed within a phylogenetic framework, the majority of subclades contained CAs representing multiple Superkingdoms, although numerous novel {beta}-CA clades appear unique to Fungi. Queries of CA Hidden Markov models (HMMs) against all public meta-genome and -transcriptome datasets revealed that CA is a ubiquitous enzyme present in virtually all sampled environments. However, CA clusters that were taxonomically conserved also appeared environment-specific, generating high CA diversity. This work represents an important contribution to the evolution, diversity, and environmental distribution of an enzyme that is key for life and has broad environmental and industrial applications.","NA","biorxiv",1736633251837
"Quantifying Differences in Neural Population Activity With Shape Metrics","10.1101/2025.01.10.632411","biorxiv",3.8000000000000003,3.8000000000000003,3.8000000000000003,3.8000000000000003,3.8000000000000003,"Barbosa, J.; Nejatbakhsh, A.; Duong, L. R.; Harvey, S. E.; Brincat, S. L.; Siegel, M.; Miller, E. K.; Williams, A. H.","Alex H Williams","New York University","2025-01-11","1","new results","cc_by","neuroscience","https://www.biorxiv.org/content/early/2025/01/11/2025.01.10.632411.source.xml","Quantifying differences across species and individuals is fundamental to many fields of biology. However, it remains challenging to draw detailed functional comparisons between large populations of interacting neurons. Here, we introduce a general framework for comparing neural population activity in terms of shape distances. This approach defines similarity in terms of explicit geometric transformations, which can be flexibly specified to obtain different measures of population-level neural similarity. Moreover, differences between systems are defined by a distance that is symmetric and satisfies the triangle inequality, enabling downstream analyses such as clustering and nearest-neighbor regression. We demonstrate this approach on datasets spanning multiple behavioral tasks (navigation, passive viewing of images, and decision making) and species (mice and non-human primates), highlighting its potential to measure functional variability across subjects and brain regions, as well as its ability to relate neural geometry to animal behavior.","NA","biorxiv",1736633251837
"MiRNA Locker: A Modularized DNA Assembly As miRNA Inhibitors","10.1101/2025.01.10.632138","biorxiv",3.7,3.7,3.7,3.7,3.7,"Zhu, L.; Min, L.; Zhu, C.-s.; Wu, X.; Li, W.; Ma, J.; Lei, Y.; Gao, C.; Qiu, X.; Liu, C.","Chuanyang Liu","Department of Biology and Chemistry, College of Sciences, National University of Defense Technology","2025-01-11","1","new results","cc_by_nc","synthetic biology","https://www.biorxiv.org/content/early/2025/01/11/2025.01.10.632138.source.xml","MicroRNAs (miRNAs) are vital post-transcriptional regulators that govern key cellular processes such as proliferation, migration, and apoptosis. Current loss-of-function approaches, including chemically modified antisense oligonucleotides (ASOs), face significant challenges, including high costs, limited scalability, and off-target effects. To overcome these limitations, we developed ""miRNA Locker"", a novel miRNA inhibition platform created using the Overlapped Oligo Assembly (OOA) method. This innovative platform constructs highly stable dumbbell-shaped single-stranded DNA structures, offering improved target specificity, scalability, and cost-effectiveness. Using miR-214 as a proof-of-concept target, we demonstrated that miRNA Lockers effectively bind Argonaute-miRNA complexes, reduce miRNA levels, and induce downstream changes in gene expression and cellular phenotypes, surpassing the performance of commercial antagomirs. Furthermore, applying miRNA Lockers to miR-654 validated the regulatory role of miR-654 in modulating RNF8 expression and promoting epithelial-mesenchymal transition (EMT) in lung cancer cells. Our results highlight the potential of miRNA Lockers as a versatile tool for studying miRNA function and advancing miRNA-based therapies.","NA","biorxiv",1736633251837
"Modulation of cellular ageing regulates Integrated Stress Response signalling to control blood cell homeostasis","10.1101/2025.01.09.632127","biorxiv",11.1,3.7,11.1,11.1,11.1,"Ghosh, K.; Iyer, R. K.; Sood, S.; Islam, M. S.; Labad, J. G.; Khadilkar, R. J.","Rohan Jayant Khadilkar","Stem Cell and Tissue Homeostasis laboratory, Advanced Centre for Treatment, Research and Education in Cancer, Tata Memorial Centre, Kharghar, Navi Mumbai - 4102","2025-01-09","1","new results","cc_by_nc_nd","developmental biology","https://www.biorxiv.org/content/early/2025/01/09/2025.01.09.632127.source.xml","Organismal ageing is associated with a decline in cellular and molecular functions. One of the hallmarks of ageing is stem cell exhaustion which occurs due to dynamic changes in the stem cell - niche microenvironment. Ageing affects stem cell potency impacting self-renewal and differentiation trajectories. Blood cell homeostasis in the hematopoietic system is tightly regulated by a fine balance between stemness and differentiation. Here, we employ the Drosophila hematopoietic organ, the larval lymph gland (LG) to investigate the impact of modulating cellular ageing on organ homeostasis. LG consists of a Posterior Signalling Center (PSC) that acts as a stem cell niche and maintains the prohemocytes housed in the Medullary Zone (MZ). Cortical Zone (CZ) consists of differentiated hemocytes namely plasmatocytes, crystal cells and lamellocytes. Intricate signalling networks active in the PSC and MZ orchestrate and regulate homeostasis. In this study, we characterize the effect of genetic perturbation of the molecular circuitry of ageing locally and systemically to investigate its effect on LG blood cell homeostasis. Genetic modulation of cellular ageing displays traditional hallmarks of ageing validating our model in the LG. Our results indicate that induction of accelerated ageing both locally and systemically leads to a reduction in stem cell niche size, DNA damage accumulation and increased progenitor differentiation whereas decelerated ageing shows an opposite trend. We show that the Integrated Stress Response (ISR) pathway is activated upon inducing accelerated ageing in the LG hemocytes possibly to recoup back to homeostatic conditions. Furthermore, LGs of ISR pathway mutants or upon perturbation of ISR pathway components in prohemocytes show increased blood cell differentiation indicating disruption of homeostasis. Genetic epistasis analysis shows that ectopic over-expression of ISR pathway genes in an accelerated ageing scenario over and above the existing levels can rescue the defects in blood cell homeostasis. Overall, our study explores how modulation of cellular aging locally or systemically can impact tissue homeostasis. Our research paves way to understand the cellular mechanisms underlying an aged versus young stem cell-niche microenvironment and how its abrogation may lead to onset of disease.","NA","biorxiv",1736633251837
"Pseudopaline-mediated zinc uptake by Pseudomonas aeruginosa determines specific clinically relevant phenotypes and infection outcome","10.1101/2025.01.08.631948","biorxiv",4.45,3.7,4.45,4.45,4.45,"Bosc, L.; Secher, T.; Ball, G.; Le Pennec, D.; Tribout, M.; Moly, B.; Bai, Y.; Ouerdane, L.; Arnoux, P.; Denis, Y.; Lei, X.; Bordi, C.; Heuze-Vourc'h, N.; Haussler, S.; Gomez, N. O.; Voulhoux, R.","Nicolas Oswaldo Gomez","CNRS / Aix-Marseille Universite LCB UMR7283, Marseille, France.","2025-01-08","1","new results","cc_no","microbiology","https://www.biorxiv.org/content/early/2025/01/08/2025.01.08.631948.source.xml","AUTHOR SUMMARYThe host-pathogen interface is a biological niche in which two entities competes for essential resources. The hosts nutritional immunity restrict access to metals, while a successful pathogen overcomes these restrictions using dedicated uptake pathways. Pseudopaline is a high-affinity metallophore allowing Pseudomonas aeruginosa to acquire zinc in chelated environments. We demonstrate that this pathway is the last-resort solution to acquire zinc for this dreadful pathogen. The capacity to provide this metal to zinc-metalloproteins drives clinically relevant phenotypes, such as the capacity to form a mature and antibiotic-tolerant biofilm, or to affect the outcome of an infection. These results place pseudopaline as a potential drug target for blocking P. aeruginosa pathogenic capacity and resensitizing established biofilm to classic antibiotic treatment.

ABSTRACTBiological metals are essential trace elements which are required by metalloproteins, involved in virtually every cellular, structural and catalytic function of the bacterial cell. Bacterial pathogenesis involves a tug-of-war between the host nutritional immunity, sequestering essential metals and the invading pathogens that deploy high-metal affinity uptake strategies in order to overcome these defence mechanisms. Metallophores are high-affinity, low-molecular mass metal chelators produced and secreted by bacteria to access chelated metals from the environment. Pseudopaline is a metallophore produced and secreted by Pseudomonas aeruginosa to acquire zinc when the bioavailability of this metal is severely restricted, as in the presence of a strong metal chelator such as EDTA, or during infections when the nutritional immunity of the host is active, in mammals through the production of the zing binding protein calprotectin. We show that under the conditions of metal deprivation, a pseudopaline-deficient P. aeruginosa strain exhibit a severe intracellular zinc deficiency, establishing that the pseudopaline pathway is the last-resort and unique pathway for the bacteria to acquire zinc under these restricted growth conditions. The present study explores the pleiotropic role of pseudopaline-mediated zinc acquisition on several clinically relevant phenotypes and its capacity to drive infection outcomes, placing this machinery as a promising therapeutic target for P. aeruginosas infection, acting synergistically as a pathogenicity determinant as well as an adaptative trait allowing the establishment of a mature and antibiotic resistance biofilm necessary for recalcitrant chronic infections.","NA","biorxiv",1736633251837
"Local alkalinity enhancement using artificial substrates increases survivorship of early-stage coral recruits","10.1101/2025.01.07.631763","biorxiv",3.6,3.6,3.6,3.6,3.6,"Ruszczyk, M.; Rodriguez, S.; Tuen, M.; Rux, K.; Chandragiri, S.; Stickley, M.; Haus, B. K.; Baker, A. C.; Miller, M.; Suraneni, P.; Langdon, C.; Prakash, V. N.","Vivek N. Prakash","University of Miami","2025-01-10","1","new results","cc_by_nc_nd","ecology","https://www.biorxiv.org/content/early/2025/01/10/2025.01.07.631763.source.xml","Efforts to restore coral reefs using sexually derived coral recruits are often hindered by their low survivorship and growth, hence scalable interventions to improve these parameters are urgently needed. Here we developed novel settlement substrates that modify the local chemical and hydrodynamic environments and provide local alkalinity enhancement (AE) within the laminar boundary layer to aid in coral restoration. Cement tiles with four different chemistries and two different surface topographies were tested in a novel flume system to quantify their ability to change local pH under reef-like conditions and their effect on larval settlement, survivorship, and growth of the endangered Caribbean coral, Orbicella faveolata. Chemistry had a minimal effect on the initial settlement of coral larvae, with textured tiles preferred over smooth tiles. However, substrates that created a more alkaline local environment increased post-settlement survivorship. The increased survivorship of O. faveolata recruits on AE tiles was not due to increased growth on AE tiles, although trends in growth were dependent on chemistry and topography of tiles. Our results indicate that mixing sodium bicarbonate into the cement used to fabricate artificial reef structures could be an effective means to enhance the development of coral cover.","NA","biorxiv",1736633251837
"A tightly regulated auxin signaling landscape is required for spatial accommodation of lateral roots in Arabidopsis","10.1101/2025.01.07.631685","biorxiv",3.6,3.6,3.6,3.6,3.6,"Bui, T. X.; Shekhar, V.; Marc Martin, S.; Bellande, K.; Vermeer, J. E.","Joop EM Vermeer","University of Neuchatel","2025-01-10","1","new results","cc_by_nc","plant biology","https://www.biorxiv.org/content/early/2025/01/10/2025.01.07.631685.source.xml","In Arabidopsis thaliana, lateral root (LR) development requires spatial accommodation responses in overlying endodermal cells. This includes loss of cell volume whilst maintaining membrane integrity to allow the expansion of the underlying LR primordia (LRPs). These accommodation responses are regulated by auxin-mediated signaling, specifically through Aux/IAA proteins, involving IAA3/SHY2. Plants that express a stabilized version of SHY2, shy2-2, in differentiated endodermal cells, CASP1pro::shy2-2 plants, fail to make LRs. Exogenous treatment with 1-naphthaleneacetic acid (NAA) was reported to partially restore LR formation in this spatial accommodation mutant. Using treatments with auxins with different transport properties, such as NAA, indole-3-acetic acid (IAA), and 2,4-dichlorophenoxyacetic acid (2,4-D), we assessed the ability of each auxin to rescue LR formation in CASP1pro::shy2-2 roots. This revealed that IAA is the most effective in partially restoring LR development, NAA is effective in inducing LRPs but cannot maintain their canonical phenotype, whereas 2,4-D induces non-controlled cell divisions. In addition, we show that in CASP1pro::shy2-2 roots, AUX1 appears to be repressed in the zone where oscillation of the auxin response have been described. Our study advances the understanding of auxin-regulated spatial accommodation mechanisms during LRP formation and highlights the complex interplay of auxin transport and signaling in bypassing the endodermal constraints.","NA","biorxiv",1736633251837
"The subunit 3 of the SUPERKILLER (SKI) complex mediates miR172-directed cleavage of Nodule Number Control 1 (NNC1) to modulate nodulation in Medicago truncatula","10.1101/2025.01.06.631520","biorxiv",3.6,3.6,3.6,3.6,3.6,"Traubenik, S.; Reynoso, M. A.; Sanchez-Rodriguez, F.; Yacullo, M.; Christ, A.; Hummel, M.; Blein, T.; Crespi, M.; Bailey-Serres, J.; Blanco, F. A.; Zanetti, M. E.","María Eugenia Zanetti","Instituto de Biotecnología y Biología Molecular","2025-01-10","1","new results","cc_no","plant biology","https://www.biorxiv.org/content/early/2025/01/10/2025.01.06.631520.source.xml","Legumes and rhizobia establish a nitrogen-fixing symbiosis that involves the formation of a lateral root organ, the nodule, and the infection process that allows intracellular accommodation of rhizobia within nodule cells. This process involves significant gene expression changes regulated at the transcriptional and post-transcriptional levels. We have previously shown that a transcript encoding the subunit 3 of the Superkiller Complex (SKI), which guides mRNAs to the exosome for 3'-to-5' degradation, is required for nodule formation and bacterial persistence within the nodule, as well as the induction of early nodulation genes (e.g. MtENOD40) during the Medicago truncatula-Sinorhizobium meliloti symbiosis. Here, we reveal through transcript degradome analysis that knockdown of MtSKI3 impairs the miR172-directed endonucleolytic cleavage of the mRNA encoding Nodule Number Control 1 (MtNNC1), an APETALA2 transcription factor that negatively modulates nodulation. Specific silencing of MtNNC1 enhances nodule number, bacterial infection, and the induction of MtENOD40 upon inoculation with S. meliloti whereas overexpression of a miR172-resistant form of MtNNC1 significantly reduces nodule formation. This work identifies miR172 cleavage of MtNNC1 and its control by MtSKI3, a component of the 3'-to-5' mRNA degradation pathway, as a new regulatory hub controlling indeterminate nodulation.","NA","biorxiv",1736633251837
"DefensePredictor: A Machine Learning Model to Discover Novel Prokaryotic Immune Systems","10.1101/2025.01.08.631726","biorxiv",29.999999999999996,1.7,29.999999999999996,29.999999999999996,29.999999999999996,"DeWeirdt, P. C.; Mahoney, E. M.; Laub, M. T.","Michael T. Laub","Massachusetts Institute of Technology","2025-01-08","1","new results","cc_by_nc","microbiology","https://www.biorxiv.org/content/early/2025/01/08/2025.01.08.631726.source.xml","Anti-phage defense systems protect bacteria from viruses. Studying defense systems has begun to reveal the evolutionary roots of eukaryotic innate immunity and produced important biotechnologies such as CRISPR-Cas9. Dozens of new systems have been discovered by looking for systems that co-localize in genomes, but this approach cannot identify systems outside defense islands. Here, we present DefensePredictor, a machine-learning model that leverages embeddings from a protein language model to classify proteins as defensive. We applied DefensePredictor to 69 diverse E. coli strains and validated 45 previously unknown systems, with >750 additional unique proteins receiving high confidence predictions. Our model, provided as open-source software, will help comprehensively map the anti-phage defense landscape of bacteria, further reveal connections between prokaryotic and eukaryotic immunity, and accelerate biotechnology development.","NA","biorxiv",1736633251837
"Calcium-triggered apoplastic ROS bursts balance gravity and mechanical signals to navigate soil","10.1101/2025.01.07.631646","biorxiv",26.650000000000002,2.85,25.650000000000002,26.650000000000002,26.650000000000002,"Kulich, I.; Vladimirtsev, D.; Randuch, M.; Gao, S.; Citterico, M.; Konrad, K.; Nagel, G.; Wrzaczek, M.; Friml, J.","Jiri Friml","Institute of Science and Technology Austria (IST Austria)","2025-01-08","1","new results","cc_by_nc_nd","plant biology","https://www.biorxiv.org/content/early/2025/01/08/2025.01.07.631646.source.xml","Reactive oxygen species (ROS) have been implicated repeatedly in multiple signaling processes in plants but the underlying mechanisms and roles remain enigmatic. Here, we developed live imaging of apoplastic ROS at the root surface. Different signals, including auxin, extracellular ATP and RALF1 peptide, all induce cytosolic calcium transients and apoplastic ROS bursts. Genetic and optogenetic manipulations identified calcium transients as necessary and sufficient for ROS bursts via activation of NADPH oxidases RBOHC and RBOHF. Apoplastic ROS bursts are not required but rather limit the gravity-induced root bending. Root bending is sensed by stretch-activated calcium channel MCA1 leading to NADPH oxidase activation at the stretched side. The resulting ROS production stiffens cell wall for better soil penetration. Apoplastic ROS thus provides a means to balance tissue flexibility and stiffness to efficiently navigate soil.","NA","biorxiv",1736633251837
"Metagenomic estimation of absolute bacterial biomass in the mammalian gut through host-derived read normalization.","10.1101/2025.01.07.631807","biorxiv",20.75,0.85,20.75,20.75,20.75,"Tang, G.; Carr, A. V.; Perez, C.; Ramos Sarmiento, K.; Levy, L.; Lampe, J.; Diener, C.; Gibbons, S. M.","Sean M Gibbons","Institute for Systems Biology","2025-01-08","1","new results","cc_by","microbiology","https://www.biorxiv.org/content/early/2025/01/08/2025.01.07.631807.source.xml","Absolute bacterial biomass estimation in the human gut is crucial for understanding microbiome dynamics and host-microbe interactions. Current methods for quantifying bacterial biomass in stool, such as flow cytometry, qPCR, or spike-ins (i.e., adding cells or DNA from an organism not normally found in a sample), can be labor-intensive, costly, and confounded by factors like water content, DNA extraction efficiency, PCR inhibitors, and other technical challenges that add bias and noise. We propose a simple, cost-effective approach that circumvents some of these technical challenges: directly estimating bacterial biomass from metagenomes using bacterial-to-host (B:H) read ratios. We compare B:H ratios to the standard methods outlined above, demonstrating that B:H ratios are useful proxies for bacterial biomass in stool and possibly in other host-associated substrates. We show how B:H ratios can be used to track antibiotic treatment response and recovery in both mice and humans, which showed 403-fold and 45-fold reductions in bacterial biomass during antibiotic treatment, respectively. Our results indicate that host and bacterial metagenomic DNA fractions in human stool fluctuate longitudinally around a stable mean in healthy individuals, and the average host read fraction varies across healthy individuals by < 8-9 fold. B:H ratios offer a convenient alternative to other absolute biomass quantification methods, without the need for additional measurements, experimental design considerations, or machine learning algorithms, enabling retrospective absolute biomass estimates from existing stool metagenomic data.","NA","biorxiv",1736633251837
