"title","doi","altmetric_jid","score","X1d","X3d","X1w","X1m","authors","author_corresponding","author_corresponding_institution","date","version","type","license","category","jatsxml","abstract","published","server","upupdate_time"
"ChromBERT: Uncovering Chromatin State Motifs in the Human Genome Using a BERT-based Approach","10.1101/2024.07.25.605219","biorxiv",11.549999999999999,4.35,11.549999999999999,11.549999999999999,11.549999999999999,"Lee, S.; Lin, C.; Chen, C.-Y.; Nakato, R.","Ryuichiro Nakato","The University of Tokyo","2024-07-26","1","new results","cc_by_nc","bioinformatics","https://www.biorxiv.org/content/early/2024/07/26/2024.07.25.605219.source.xml","Chromatin states, fundamental to gene regulation and cellular identity, are defined by a unique combination of histone post-translational modifications. Despite their importance, comprehensive patterns within chromatin state sequences, which could provide insights into key biological functions, remain largely unexplored. In this study, we introduce ChromBERT, a BERT-based model specifically designed to detect distinct patterns of chromatin state annotation data sequences. Notably, ChromBERT was pre-trained on promoter regions across a diverse range of epigenomes and subsequently fine-tuned using a dataset from multiple cell lines where RNA-seq data were available, highlighting the model's ability to discern conserved chromatin state patterns within these regions. In addition to its predictive powers across tasks, evidenced by high AUC scores, ChromBERT provides further analysis through the incorporation of motif clustering using Dynamic Time Warping (DTW). This method enhances the model's ability to dissect chromatin state sequence motifs, typically involving transcription and enhancer sites. The introduction of motif clustering with DTW into ChromBERT's workflow is poised to facilitate the discovery of genomic regions linked to novel biological functions, deepening our understanding of chromatin state dynamics.","NA","biorxiv",1722204574071
"Re-analysis of mobile mRNA datasets highlights challenges in the detection of mobile transcripts from short-read RNA-Seq data","10.1101/2024.07.25.604588","biorxiv",12.45,4.35,12.45,12.45,12.45,"Paajanen, P.; Tomkins, M.; Hoerbst, F.; Veevers, R.; Heeney, M.; Thomas, H. R.; Apelt, F.; Saplaoura, E.; Gupta, S.; Frank, M.; Walther, D. J.; Faulkner, C.; Kehr, J.; Kragler, F.; Morris, R. J.","Richard J Morris","John Innes Centre","2024-07-26","1","contradictory results","cc_by_nc_nd","plant biology","https://www.biorxiv.org/content/early/2024/07/26/2024.07.25.604588.source.xml","Short-read RNA-Seq analyses of grafted plants have led to the proposal that large numbers of mRNAs move over long distances between plant tissues, acting as potential signals. The detection of transported transcripts by RNA-Seq is both experimentally and computationally challenging, requiring successful grafting, delicate harvesting, rigorous contamination controls and data processing approaches that can identify rare events in inherently noisy data. Here, we perform a meta-analysis of existing datasets and examine the associated bioinformatic pipelines. Our analysis reveals that technological noise, biological variation and incomplete genome assemblies give rise to features in the data that can distort the interpretation. Taking these considerations into account, we find that a substantial number of transcripts that are currently annotated as mobile are left without support from the available RNA-Seq data. Whilst several annotated mobile mRNAs have been validated, we cannot exclude that others may be false positives. The identified issues may impact also other RNA-Seq studies, in particular those using single nucleotide polymorphisms (SNPs) to detect variants.","NA","biorxiv",1722204574071
"A metabolic atlas of the Klebsiella pneumoniae species complex reveals lineage-specific metabolism that supports persistent co-existence of diverse lineages","10.1101/2024.07.24.605038","biorxiv",26.950000000000006,4.35,26.950000000000006,26.950000000000006,26.950000000000006,"Vezina, B.; Cooper, H. B.; Rethoret-Pasty, M.; Brisse, S.; Monk, J. M.; Holt, K. E.; Wyres, K. L.","Ben Vezina","Monash University","2024-07-25","1","new results","cc_by","microbiology","https://www.biorxiv.org/content/early/2024/07/25/2024.07.24.605038.source.xml","The Klebsiella pneumoniae species complex inhabits a wide variety of hosts and environments. Genomics has revealed the population comprises multiple species/subspecies and hundreds of distinct co-circulating sub-lineages that are associated with distinct gene complements. These data are consistent with metabolic differentiation as a driver of population structure, but this has so far remained unsubstantiated. Here we used comparative genomics and genome-scale metabolic modelling to systematically explore metabolic diversity across the population (n=7,835 genomes). We simulated growth outcomes for carbon, nitrogen, phosphorus and sulfur sources under aerobic and anaerobic conditions (n=1,278), and confirmed that sub-lineages exhibit unique metabolic profiles. In vitro co-culture experiments demonstrated reciprocal commensalistic cross-feeding between sub-lineages, effectively extending the range of conditions supporting individual growth. We propose that these substrate specialisations promote the existence and persistence of co-circulating sub-lineages by reducing nutrient competition and facilitating commensal interactions.","NA","biorxiv",1722204574071
"Limiting the impact of protein leakage in single-cell proteomics","10.1101/2024.07.26.605378","biorxiv",4.75,4.25,4.75,4.75,4.75,"Leduc, A.; Xu, Y.; Shipkovenska, G.; Dou, Z.; Slavov, N.","Nikolai Slavov","Northeastern University","2024-07-27","1","new results","cc_by_nc_nd","molecular biology","https://www.biorxiv.org/content/early/2024/07/27/2024.07.26.605378.source.xml","Limiting artifacts during sample preparation can significantly increase data quality in single-cell proteomics experiments. Towards this goal, we characterize the impact of protein leakage by analyzing thousands of primary single cells that were prepared either fresh immediately after dissociation or cryopreserved and prepared at a later date. We directly identify permeabilized cells and use the data to define a signature for protein leakage. We use this signature to build a classifier for identifying damaged cells that performs accurately across cell types and species.","NA","biorxiv",1722204574071
"The dynamic and diverse nature of parenchyma cells in the Arabidopsis root during secondary growth","10.1101/2024.07.18.604073","biorxiv",25.550000000000004,4.25,24.55,24.55,25.550000000000004,"Lyu, M.; Iida, H.; Eekhout, T.; Makela, M.; Muranen, S.; Ye, L.; Vaten, A.; Wybouw, B.; Wang, X.; De Rybel, B.; Mahonen, A. P.","Ari Pekka Mahonen","University of Helsinki","2024-07-19","1","new results","cc_by_nc","plant biology","https://www.biorxiv.org/content/early/2024/07/19/2024.07.18.604073.source.xml","During the process of secondary growth, the vascular cambium produces the conductive xylem and phloem cells, while the phellogen (cork cambium) deposit phellem (cork) as the outermost protective barrier. Although most of the secondary tissues is made up by parenchyma cells which are also produced by both cambia, their diversity and function are poorly understood. Here we combined single-cell RNA sequencing analysis with lineage tracing to recreate developmental trajectories of the cell types in the Arabidopsis root undergoing secondary growth. By analysing 93 reporter lines, we were able to identify 20 different cell types or cell states, many of which have not been described before. We additionally observed distinct transcriptome signatures of parenchyma cells depending on their maturation state and proximity to the conductive cell types. Our data shows that both xylem and phloem parenchyma tissues are required for normal formation of conductive tissue cell types. Furthermore, we showed that mature phloem parenchyma gradually obtains periderm identity, and this transition can be accelerated by jasmonate or wounding. Thus, our study reveals the remarkable dynamic and diverse nature of parenchyma cells during secondary growth.","NA","biorxiv",1722204574071
"HCS-3DX, a next-generation AI-driven automated 3D high-content screening system","10.1101/2024.07.15.603536","biorxiv",11.099999999999998,4.25,10.849999999999998,10.849999999999998,11.099999999999998,"Diosdi, A.; Toth, T.; Grexa, I.; Schrettner, B.; Hapek, N.; Kovacs, F.; Kriston, A.; Harmati, M.; Buzas, K.; Pampaloni, F.; Piccinini, F.; Horvath, P.","Peter Horvath","HUN-REN Biological Research Centre (HUN-REN BRC), Szeged, Hungary","2024-07-17","1","new results","cc_by_nc_nd","bioinformatics","https://www.biorxiv.org/content/early/2024/07/17/2024.07.15.603536.source.xml","Multicellular 3D biological models, the so-called ""-oids"", are the pivot key for the new generation of high-content screening (HCS) of drug analysis, cancer research, and regenerative medicine. However, the standardisation of 3D cell culture generation, handling, imaging, and data analysis remains a challenge and lacks convincing applications. In this work, we propose HCS-3DX, a next-generation system revolutionising HCS research in 3D imaging and evaluation. HCS-3DX is based on three main components: an automated Artificial Intelligence (AI)-driven micromanipulator for oid selection, an engineered HCS foil multiwell plate for optimised imaging, and an image-based software for single-cell data analysis. The developed system was validated through different experiments with 3D tumour models, including tumour-stroma co-cultures. The results prove that the resolution achievable with HCS-3DX enables us to overcome the limitations of current systems and reliably perform 3D high-content screening (HCS) at the single-cell level.","NA","biorxiv",1722204574071
"Long-term NMN treatment increases lifespan and healthspan in mice in a sex dependent manner","10.1101/2024.06.21.599604","biorxiv",20.608,4.25,4.25,4.25,19.358,"Kane, A. E.; Chellappa, K.; Schultz, M. B.; Arnold, M.; Li, J.; Amorim, J.; Diener, C.; Zhu, D.; Mitchell, S. J.; Griffin, P. T.; Tian, X.; Petty, C.; Conway, R.; Walsh, K.; Shelerud, L.; Duesing, C.; Mueller, A.; Li, K.; McNamara, M.; Shima, R. T.; deCabo, R.; Gibbons, S. M.; Wu, L. E.; Ikeno, Y.; Baur, J. A.; Rajman, L.; Sinclair, D. A.","David A. Sinclair","Paul F. Glenn Center for Biology of Aging  Research at Harvard Medical School","2024-06-27","1","new results","cc_no","pharmacology and toxicology","https://www.biorxiv.org/content/early/2024/06/27/2024.06.21.599604.source.xml","Nicotinamide adenine dinucleotide (NAD) is essential for many enzymatic reactions, including those involved in energy metabolism, DNA repair and the activity of sirtuins, a family of defensive deacylases. During aging, levels of NAD+ can decrease by up to 50% in some tissues, the repletion of which provides a range of health benefits in both mice and humans. Whether or not the NAD+ precursor nicotinamide mononucleotide (NMN) extends lifespan in mammals is not known. Here we investigate the effect of long-term administration of NMN on the health, cancer burden, frailty and lifespan of male and female mice. Without increasing tumor counts or severity in any tissue, NMN treatment of males and females increased activity, maintained more youthful gene expression patterns, and reduced overall frailty. Reduced frailty with NMN treatment was associated with increases in levels of Anerotruncus colihominis, a gut bacterium associated with lower inflammation in mice and increased longevity in humans. NMN slowed the accumulation of adipose tissue later in life and improved metabolic health in male but not female mice, while in females but not males, NMN increased median lifespan by 8.5%, possible due to sex-specific effects of NMN on NAD+ metabolism. Together, these data show that chronic NMN treatment delays frailty, alters the microbiome, improves male metabolic health, and increases female mouse lifespan, without increasing cancer burden. These results highlight the potential of NAD+ boosters for treating age-related conditions and the importance of using both sexes for interventional lifespan studies.","NA","biorxiv",1722204574071
"Epigenetic mechanisms controlling human leukemia stem cells and therapy resistance","10.1101/2022.09.22.509005","biorxiv",11.299999999999999,4.2,4.2,4.2,4.2,"Takao, S.; Morell, V.; Uni, M.; Slavit, A.; Rha, S.; Cheng, S.; Schmalbrock, L. K.; Brown, F. C.; Calabuig, S. B.-; Koche, R.; Velten, L.; Kentsis, A.","Alex Kentsis","Molecular Pharmacology Program, Tow Center for Developmental Oncology, Department of Pediatrics, Memorial Sloan Kettering Cancer Center, and Departments of Pedi","2024-07-26","2","new results","cc_no","cancer biology","https://www.biorxiv.org/content/early/2024/07/26/2022.09.22.509005.source.xml","Many human cancers, including acute myeloid leukemia (AML), arise from mutations of stem and progenitor cells. Immunophenotypic profiling has shown that leukemias develop hierarchically, with mutations in leukemia stem cells associated with disease propagation and relapse1,2. Although leukemia initiating cells can be enriched using cell surface markers, their frequency tends to be variable and low, obscuring mechanisms and hindering effective therapies3,4. To define AML stem cells in human patients, we performed functional genomic profiling of diverse leukemias using label tracing techniques designed to preserve hematopoietic stem cell (HSC) function in vivo. We found that propagation of human AML is mediated by a rare but distinct quiescent label-retaining cell (LRC) population that evades detection by currently known immunophenotypic markers. We show that human AML LRC quiescence is reversible, sparing genetic clonal competition that maintains its epigenetic inheritance. LRC quiescence is defined by distinct promoter-centered chromatin and gene expression dynamics and controlled by a distinct AP-1/ETS transcription factor network, including JUN in particular, which is associated with disease persistence and chemotherapy resistance in diverse patients. These results enable prospective isolation and functional genetic manipulation of immunophenotypically-varied leukemia stem cells in human patient specimens, as well as establish key functions of epigenetic plasticity in leukemia development and therapy resistance. We anticipate that these findings will lead to the elucidation of essential properties of leukemia stem cell quiescence and the design of therapeutic strategies for their clinical identification and control.","NA","biorxiv",1722204574071
"Partial redundancy buffers deleterious effects of mutating DNA methyltransferase 1-1 (MET1-1) in polyploid wheat","10.1101/2024.07.26.605257","biorxiv",4.35,4.1,4.35,4.35,4.35,"Burrows, S.; Dorussen, D.; Crudgington, J.; Di Santolo, G.; Simmonds, J.; Catoni, M.; Borrill, P.","Philippa Borrill","John Innes Centre","2024-07-26","1","new results","cc_by_nc","plant biology","https://www.biorxiv.org/content/early/2024/07/26/2024.07.26.605257.source.xml","DNA methylation is conserved across biological kingdoms, playing important roles in gene expression, transposable element silencing and genome stability. Altering DNA methylation could generate additional phenotypic variation for crop breeding, however the lethality of epigenetic mutants in crop species has hindered its investigation. Here, we exploit partial redundancy between homoeologs in polyploid wheat to generate viable mutants in the DNA methyltransferase 1-1 (MET1-1) gene with altered methylation profiles. In both Triticum turgidum (tetraploid wheat) and Triticum aestivum (hexaploid wheat) we identified clear segregation distortions of higher-order mutants (5/6 and 6/6 mutant met1-1 copies in hexaploid and 3/4 and 4/4 copies in tetraploid) when genotyping segregating seeds and seedlings, which we attribute to reduced transmission of null mutant gametes. We found that the reduced transmission occurred from both the maternal and paternal gametes, however, we did not detect any deleterious effects on pollen development. The loss of four or more functional copies of MET1-1 results in decreased CG methylation in hexaploid wheat. Changes to gene expression increase stepwise with the number of mutant alleles suggesting a dosage dependent effect. Finally, we identify heritable changes to flowering and awn phenotypes which segregate independently of MET1-1. Together our results demonstrate that polyploidy can be leveraged to generate quantitative changes to CG methylation without the lethal consequences observed in other crops, opening the potential to exploit novel epialleles in plant breeding.","NA","biorxiv",1722204574071
"A novel quinone biosynthetic pathway illuminates the evolution of aerobic metabolism","10.1101/2024.07.27.605408","biorxiv",4,4,4,4,4,"Elling, F. J.; Pierrel, F.; Chobert, S.-C.; Abby, S. S.; Evans, T. W.; Reveillard, A.; Pelosi, L.; Schnoebelen, J.; Hemingway, J. D.; Boumendjel, A.; Becker, K. W.; Blom, P.; Cordes, J.; Nathan, V.; Baymann, F.; Lucker, S.; Spieck, E.; Leadbetter, J. R.; Hinrichs, K.-U.; Summons, R. E.; Pearson, A.","Felix J Elling","Department of Earth and Planetary Sciences, Harvard University, Cambridge, MA 02138, USA; Leibniz-Laboratory for Radiometric Dating and Isotope Research, Christ","2024-07-27","1","new results","cc_by_nc_nd","microbiology","https://www.biorxiv.org/content/early/2024/07/27/2024.07.27.605408.source.xml","The dominant organisms in modern oxic ecosystems rely on respiratory quinones with high redox potential (HPQs) for electron transport in aerobic respiration and photosynthesis. The diversification of quinones, from low redox potential in anaerobes to HPQs in aerobes, is assumed to have followed Earth's surface oxygenation ~2.3 billion years ago. However, the evolutionary origins of HPQs remain unresolved. Here, we reconstruct the biosynthetic pathway of a novel HPQ, methyl-plastoquinone, that is unique to bacteria of the phylum Nitrospirota. We demonstrate that the three extant HPQ biosynthetic pathways, in Nitrospirota, Cyanobacteriota, and Pseudomonadota, share a common origin that predates the emergence of these phyla. We show that aerobic metabolism using HPQs is ancestral to Cyanobacteriota and Pseudomonadota and significantly predates Earth's surface oxygenation.","NA","biorxiv",1722204574071
"Emergence of a novel reassortant Oropouche virus drives persistent human outbreaks in the Brazilian Amazon region from 2022 to 2024","10.1101/2024.07.23.24310415","medrxiv",12.549999999999999,4,10.3,12.549999999999999,12.549999999999999,"Naveca, F. G.; Almeida, T. A. P.; Souza, V. C.; Nascimento, V. A.; Silva, D. S.; Nascimento, F. O.; Mejia, M. C. C.; Oliveira, Y. S.; Rocha, L.; Xavier, N.; Lopes, J.; Maito, R.; Meneses, C.; Amorim, T.; Fe, L.; Camelo, F. S.; Silva, S. C. A.; Melo, A. X.; Fernandes, L. G.; Oliveira, M. A. A.; Arcanjo, A. R.; Araujo, G.; Andre Junior, W.; Carvalho, R. L. C.; Rodrigues, R. S. S.; Albuquerque, S. V. G.; Mattos, C.; Silva, C. C.; Mendonca, A. L. F. M.; Rodrigues, T.; Mariscal, F.; Morais, M. A.; Presibella, M. M.; Marques, N. Q.; Paiva, A.; Ribeiro, K.; Vieira, D.; Queiroz, J. A. S.; Passos-Silva","Felipe G Naveca","ILMD-Fiocruz","2024-07-24","1","PUBLISHAHEADOFPRINT","cc_by","infectious diseases","https://www.medrxiv.org/content/early/2024/07/24/2024.07.23.24310415.source.xml","The Brazilian western Amazon region is currently experiencing its largest laboratory confirmed Oropouche virus (OROV) outbreak, with nearly 6,000 reported cases in the states of Amazonas (AM), Acre (AC), Rondonia (RO), and Roraima (RR), between August 2022 and March 2024. Here, we sequenced and analyzed 382 full-length OROV genomes from human samples collected between 2022 and 2024 from all four states, aiming to trace the origin and genetic evolution of OROV leading to the current outbreak. Genomic analyses revealed that the recent upsurge of OROV cases in the Brazilian Amazon region coincides with the emergence of a novel reassortant viral lineage containing the M segment of viruses detected in the eastern Amazon region from 2009 to 2018 and the L and S segments of viruses detected in Peru, Colombia, and Ecuador from 2008 to 2021. The novel reassortant OROV lineage likely emerged in the Central region of the AM state between 2010 and 2014 and displayed a long-range silent dispersion during the second half of the 2010s. The 2022-2024 OROV epidemic was spatially segregated into three major subpopulations located in RR, AMACRO (a bordering region between AC, RO, and AM-Southern region), and AM-Central (which includes the Amazonas capital, Manaus) regions. The peak of OROV transmissions in all regions occurred during the rainy season in the Amazon basin. Furthermore, our phylodynamics reconstructions showed that OROV spread was driven mainly by short-range (< 2 km) movements, with an average dispersal rate [&le;] 1.2 km/day, consistent with the pattern of an active flight of infected vectors. Nevertheless, a substantial proportion (22%) of long-range (> 10 km) OROV migrations were also detected, consistent with viral dispersion via human activities. Our data provides an unprecedented view of the real-time spread and evolution of a neglected emergent human pathogen. Moreover, our results emphasize the need for widespread, long-term genomic surveillance to better understand the real burden of OROV within and beyond the Amazon region.","NA","medrxiv",1722204574071
"Deep mutational scanning of SARS-CoV-2 Omicron BA.2.86 and epistatic emergence of the KP.3 variant","10.1101/2024.07.23.604853","biorxiv",16.349999999999998,3.95,16.349999999999998,16.349999999999998,16.349999999999998,"Taylor, A. L.; Starr, T. N.","Tyler N Starr","University of Utah","2024-07-24","1","new results","cc_by","microbiology","https://www.biorxiv.org/content/early/2024/07/24/2024.07.23.604853.source.xml","Deep mutational scanning experiments aid in the surveillance and forecasting of viral evolution by providing prospective measurements of mutational effects on viral traits, but epistatic shifts in the impacts of mutations can hinder viral forecasting when measurements were made in outdated strain backgrounds. Here, we report measurements of the impact of all single amino acid mutations on ACE2-binding affinity and protein folding and expression in the SARS-CoV-2 Omicron BA.2.86 spike receptor-binding domain (RBD). As with other SARS-CoV-2 variants, we find a plastic and evolvable basis for receptor binding, with many mutations at the ACE2 interface maintaining or even improving ACE2-binding affinity. Despite its large genetic divergence, mutational effects in BA.2.86 have not diverged greatly from those measured in its Omicron BA.2 ancestor. However, we do identify strong positive epistasis among subsequent mutations that have accrued in BA.2.86 descendants. Specifically, the Q493E mutation that decreased ACE2-binding affinity in all previous SARS-CoV-2 backgrounds is reversed in sign to enhance human ACE2-binding affinity when coupled with L455S and F456L in the currently emerging KP.3 variant. Our results point to a modest degree of epistatic drift in mutational effects during recent SARS-CoV-2 evolution but highlight how these small epistatic shifts can have important consequences for the emergence of new SARS-CoV-2 variants.","NA","biorxiv",1722204574071
"Illuminating microbial mat assembly: Cyanobacteria and Chloroflexota cooperate to structure light-responsive biofilms","10.1101/2024.07.24.605005","biorxiv",9.2,3.85,9.2,9.2,9.2,"Bunbury, F.; Rivas, C.; Calatrava, V.; Malkovskiy, A.; Joubert, L.-M.; Parvate, A.; Evans, J. E.; Grossman, A. R.; Bhaya, D.","Freddy Bunbury","University of Chicago","2024-07-25","2","new results","cc_no","microbiology","https://www.biorxiv.org/content/early/2024/07/25/2024.07.24.605005.source.xml","Microbial mats are stratified communities often dominated by unicellular and filamentous phototrophs within an exopolymer matrix. It is challenging to quantify the dynamic responses of community members in situ as they experience steep gradients and rapid fluctuations of light. To address this, we developed a binary consortium using two representative isolates from hot spring mats, the unicellular oxygenic phototrophic cyanobacterium Synechococcus OS-B' (Syn OS-B') and the filamentous anoxygenic phototroph Chloroflexus MS-CIW-1 (Chfl MS-1). We quantified the motility of individual cells and entire colonies and demonstrated that Chfl MS-1 formed bundles of filaments that moved in all directions with no directional bias to light. Syn OS-B' was slightly less motile but exhibited positive phototaxis. This binary consortium displayed cooperative behavior by moving further than either species alone and formed ordered arrays where both species aligned with the light source. No cooperative motility was observed when a non-motile pilB mutant of Syn OS-B' was used instead of Syn OS-B'. The binary consortium also produced more adherent biofilm than individual species, consistent with the close interspecies association revealed by electron microscopy. We propose that cyanobacteria and Chloroflexota cooperate in forming natural microbial mats, by colonizing new niches and building robust biofilms.","NA","biorxiv",1722204574071
