"title","doi","altmetric_jid","score","X1d","X3d","X1w","X1m","authors","author_corresponding","author_corresponding_institution","date","version","type","license","category","jatsxml","abstract","published","server","upupdate_time"
"Estimating recent trends in UK alcohol sales from alcohol duty revenue","10.1101/2024.12.12.24318899","medrxiv",10.049999999999999,8.95,9.799999999999999,10.049999999999999,10.049999999999999,"Angus, C.; Schoeley, J.","Colin Angus","University of Sheffield","2024-12-13","1","PUBLISHAHEADOFPRINT","cc_by_nc","public and global health","https://www.medrxiv.org/content/early/2024/12/13/2024.12.12.24318899.source.xml","Background and AimsThe onset of the COVID-19 pandemic led to significant changes in individual-level alcohol consumption and a sharp increase in heavy drinking in the UK. More recently, high rates of inflation, the resulting  cost-of-living crisis and reforms to alcohol taxation have affected the affordability of alcohol, but little is understood about how these changes have impacted on alcohol sales and consumption. We aimed gain insights into recent trends in alcohol sales by assessing changes in alcohol duty revenue collected by the UK government since 2020.

Design and SettingWe used published data on UK alcohol duty revenue to model trends from 2010-2019. We forecasted these trends through to October 2024 using a novel statistical approach and compared these forecasts to observed receipts.

MeasurementsMonthly inflation-adjusted alcohol duty receipts received by the UK Treasury in pounds sterling for beer, cider, spirits and wine.

FindingsDuring the pandemic, alcohol duty receipts fell during lockdowns and rose as restrictions were subsequently lifted. Since 2022 alcohol duty receipts have been consistently below the historical trend, with a gradually increasing deficit in wine receipts and comparable deficit in spirits receipts that began sharply in late 2022. The reforms to the alcohol duty system in August 2023 do not appear to have significantly affected these trends.

ConclusionsOur findings suggest that the  cost of living crisis in 2022/23 has led to a fall in alcohol sales relative to the pre-pandemic trend. The magnitude of this fall differs by beverage type, indicating that wine and spirits drinkers may have changed their behaviour more than beer and cider drinkers.","NA","medrxiv",1734473302830
"AI-first structural identification of pathogenic protein targets","10.1101/2024.12.12.628104","biorxiv",8.25,8.25,8.25,8.25,8.25,"Saluri, M.; Landreh, M.; Bryant, P.","Patrick Bryant","Stockholm University","2024-12-16","1","new results","cc_by","bioinformatics","https://www.biorxiv.org/content/early/2024/12/16/2024.12.12.628104.source.xml","The likelihood for pandemics is increasing as the world population grows and becomes more interconnected. Obtaining structural knowledge of protein-protein interactions between a pathogen and its host can inform pathogenic mechanisms and treatment or vaccine design. Currently, there are 52 nonredundant human-pathogen interactions with known structure in the PDB, although there are 21064 with experimental support in the HPIDB, meaning that only 0.2% of known interactions have known structure. Recent improvements in structure prediction of protein complexes based on AlphaFold have made it possible to model heterodimeric complexes with very high accuracy. However, it is not known how this translates to host-pathogen interactions which share a different evolutionary relationship. Here, we analyse the structural protein-protein interaction network between ten different pathogens and their human host. We predict the structure of 9452 human-pathogen interactions of which only 10 have known structure. We find that we can model 30 interactions with an expected TM-score of [&ge;]0.9, expanding the structural knowledge in these networks three-fold. We select the highly-scoring Francisella tularensis dihydroprolyl dehydrogenase (IPD) complex with human immunoglobulin Kappa constant (IGKC) for detailed analysis with homology modeling and native mass spectrometry. Our results confirm the predicted 1:2:1 heterotetrameric complex with potential implications for bacterial immune response evasion. We are entering a new era where structure prediction can be used to guide vaccine and drug development towards new pathogenic targets in very short time frames.","NA","biorxiv",1734473302830
"ProCyon: A multimodal foundation model for protein phenotypes","10.1101/2024.12.10.627665","biorxiv",10.25,8.25,10.25,10.25,10.25,"Queen, O.; Huang, Y.; Calef, R.; Giunchiglia, V.; Chen, T.; Dasoulas, G.; Tai, L.; Ektefaie, Y.; Noori, A.; Brown, J.; Cobley, T.; Hrovatin, K.; Hartvigsen, T.; Theis, F.; Pentelute, B. L.; Khurana, V.; Kellis, M.; Zitnik, M.","Marinka Zitnik","Department of Biomedical Informatics, Harvard Medical School, Boston, MA, USA; Kempner Institute for the Study of Natural and Artificial Intelligence, Harvard U","2024-12-15","1","new results","cc_by","bioinformatics","https://www.biorxiv.org/content/early/2024/12/15/2024.12.10.627665.source.xml","Understanding the roles of human proteins remains a major challenge, with approximately 20% of human proteins lacking known functions and more than 40% missing context-specific functional insights. Even well-annotated proteins are often poorly characterized in diverse biological contexts, disease states, and perturbations. We present ProCyon, a foundation model for modeling, generating, and predicting protein phenotypes across five interrelated knowledge domains: molecular functions, therapeutic mechanisms, disease associations, functional protein domains, and molecular interactions. To support this, we created ProCyon-Instruct, a dataset of 33 million protein phenotype instructions, representing a comprehensive resource for multiscale protein phenotypes. By co-training a large language model with multimodal molecular encoders, ProCyon integrates phenotypic and protein data. A novel architecture and instruction tuning strategy allow ProCyon to process arbitrarily interleaved protein-and-phenotype inputs, achieve zero-shot task transfer, and generate free-form text phenotypes interleaved with retrieved protein sequence, structure, and drug modalities in a single unified model. ProCyon achieves strong performance against single-modality models, multimodal models such as ESM3, as well as text-only LLMs on dozens of benchmarking tasks such as contextual protein retrieval and question answering. We extensively evaluate ProCyon for biological applications, including identifying protein domains that bind small molecule drugs, predicting peptide binding with enzymes, and assessing the functional impact of Alzheimer's disease mutations. ProCyon enables conditional retrieval of proteins linked to small molecules through complementary mechanisms of action. It generates candidate phenotypes for under-characterized proteins recently implicated in Parkinson's disease, facilitating hypothesis generation for poorly understood proteins and biological processes. ProCyon paves the way toward an effective, general solution for functional protein biology that can enable new insights into the human proteome.","NA","biorxiv",1734473302830
"DIYNAFLUOR: An Affordable DIY Plug-and-Play Nucleic Acid Fluorometer for eDNA Quantification in Resource Limited Settings","10.1101/2024.12.16.626200","biorxiv",7.999999999999999,7.999999999999999,7.999999999999999,7.999999999999999,7.999999999999999,"Anderson, W.; Antaw, F.; Kenny, S.; Rupani, H.; Khamis, R.; Constantin, N.; Kumar, V.; Gemmell, A.; Bell, C.; Trau, M.; Korbie, D.","Will Anderson","The Centre for Personalised Nanomedicine within the Australian Institute for Bioengineering and Nanotechnology, The University of Queensland","2024-12-16","1","new results","cc_by_nc_nd","molecular biology","https://www.biorxiv.org/content/early/2024/12/16/2024.12.16.626200.source.xml","Nucleic Acid (NA) fluorometry is widely employed for quantifying environmental DNA (eDNA) samples and their downstream DNA sequencing libraries, owing to its sensitivity, accuracy, and speed. However, the high cost of NA fluorometers presents a barrier to eDNA sequencing in resource limited settings (RLSs). For instance, at ~$1.5-3.3k USD, current NA fluorometers present a greater capital cost than ONT's $1k USD portable MinION third-generation Nanopore sequencing platform. The collapse of international scientific device and consumable supply chains during the COVID-19 pandemic also highlighted the need for distributed manufacturing of molecular research tools to mitigate the impact of increased pricing to RLSs. To address these challenges, we have developed the ""DIYNAFLUOR"" (DIY Nucleic Acid FLUORometer), a portable, open-source, <$40 USD NA fluorometer, designed using readily available off-the-shelf components, simple 3D-printed parts, and plug-and-play, solder-free assembly. The DIYNAFLUOR was primarily designed to be compatible with the popular DNA-centric Qubit High Sensitivity (HS) and Broad Range (BR) assay kits. Notably, the DIYNAFLUOR demonstrated an 'in-assay' Limit of Detection with the Qubit HS kit of 0.0028 ng/uL, and an average absolute bias of 0.018 ng/muL across a 0-10 ng/uL working range using a 2-point linear calibration methodology. Device verification was performed by comparative measurements with a Qubit 4 fluorometer in a busy biotechnology laboratory, and build instructions were validated through assembly and qualification of three DIYNAFLUOR devices by researchers outside the primary design team. We also describe a custom ""extreme"" low-cost assay, < 13 cent USD per-measurement, that uses SYBR Safe dye to quantify DNA across a working range of 0-0.5 ng/uL. This assay reports a lower sensitivity and accuracy than commercial kits but may be of use to RLSs in times of extreme resource constraints or as a teaching tool for STEM educators. To demonstrate its practical application for field-based eDNA analysis in RLSs, the DIYNAFLUOR was used to perform all quality control measurements throughout the preparation of a 16S and 18S metabarcoding library generated from eDNA extracted from Australian lake water, leading to the successful identification of Australian fauna via Nanopore sequencing. Finally, configurations of the DIYNAFLUOR for RNA and Protein quantification are briefly described.","NA","biorxiv",1734473302830
"Proteomic Sensors for Quantitative, Multiplexed and Spatial Monitoring of Kinase Signaling","10.1101/2024.12.16.628391","biorxiv",8,8,8,8,8,"Comstock, W. J.; Navarro, M. V.; Maybee, D. V.; Rho, Y.; Wagner, M.; Wang, Y.; Smolka, M. B.","Marcus B Smolka","Cornell University","2024-12-16","1","new results","cc_no","molecular biology","https://www.biorxiv.org/content/early/2024/12/16/2024.12.16.628391.source.xml","Understanding kinase action requires precise quantitative measurements of their activity in vivo. In addition, the ability to capture spatial information of kinase activity is crucial to deconvolute complex signaling networks, interrogate multifaceted kinase actions, and assess drug effects or genetic perturbations. Here we developed a proteomic kinase activity sensor platform (ProKAS) for the analysis of kinase signaling using mass spectrometry. ProKAS is based on a tandem array of peptide sensors with amino acid barcodes that allow multiplexed analysis for spatial, kinetic, and screening applications. We engineered a ProKAS module to simultaneously monitor the activities of the DNA damage response kinases ATR, ATM, and CHK1 in response to genotoxic drugs, while also uncovering differences between these signaling responses in the nucleus, cytosol, and replication factories. Furthermore, we developed an in silico approach for the rational design of specific substrate peptides expandable to other kinases. Overall, ProKAS is a novel versatile system for systematically and spatially probing kinase action in cells.","NA","biorxiv",1734473302830
"Deconvoluting TCR-dependent & -independent activation is vital for reliable Ag-specific CD4+ T cell characterization by AIM assay","10.1101/2024.12.10.627643","biorxiv",15.799999999999997,7.5,13.449999999999998,15.799999999999997,15.799999999999997,"Zheng, M. Z. M.; Burmas, L.; Tan, H.-X.; Trieu, M.-C.; Lee, H. J.; Rawlinson, D.; Haque, A. P.; Kent, S. J.; Wheatley, A. K.; Juno, J. A.","Jennifer A Juno","Peter Doherty Institute for Infection and Immunity","2024-12-13","1","new results","cc_by_nc_nd","immunology","https://www.biorxiv.org/content/early/2024/12/13/2024.12.10.627643.source.xml","AIM assays are thought to detect antigen (Ag)-specific T cell responses in an HLA- and cytokine-independent manner. Recent studies using AIM assays identified prominent Th17-like (CCR6+) CD4+ T cells and circulating follicular T helper cells (cTfh) in anti-viral contexts, but were not observed with peptide/HLA tetramer staining. We demonstrate that CD39+ Treg-like and CD26hi Th22-like cells can be activated by cytokines in a TCR-independent manner during in vitro Ag stimulation, leading to non-specific upregulation of prototypical AIM readouts. Transcriptional analysis of memory CD4+ T cells that underwent TCR-dependent or -independent activation enabled discrimination of bona fide Ag-specific T cells from cytokine-activated Treg and Th22 cells. CXCR4 downregulation emerged as a hallmark of clonotypic expansion and TCR-dependent activation in memory CD4+ T cells and cTfh. Tracking tetramer-binding cells during re-stimulation showed that CXCR4-CD137+ cells provide a more accurate measure of the Ag-specific population than standard AIM readouts. This modified assay excludes the predominately CCR6+ cytokine-activated T cells that contribute to an average 12-fold overestimation of the Ag-specific population. As AIM assays enable the rapid study of T cell responses against emerging pathogens, our findings provide a highly accurate approach to characterize genuine Ag-specific T cell responses that contribute to protective immunity.","NA","biorxiv",1734473302830
"COVID-19 mRNA-vaccination and all-cause mortality in the adult population in Norway during 2021-2023: a population-based cohort study","10.1101/2024.12.15.24319058","medrxiv",6.7,6.7,6.7,6.7,6.7,"Dahl, J.; Tapia, G.; Boas, H.; Landsjoasen Bakken, I. J.; Lovdal Gulseth, H.","Jesper Dahl","Norwegian Institute of Public Health","2024-12-16","1","PUBLISHAHEADOFPRINT","cc_by_nc_nd","epidemiology","https://www.medrxiv.org/content/early/2024/12/16/2024.12.15.24319058.source.xml","Introduction: Most countries worldwide have experienced excess mortality that coincides temporally with the COVID-19 mass vaccination campaigns. This has led to speculation on the potential long-term effects of the vaccines on mortality risk. Methods: The study was designed as a retrospective cohort study, and included all individuals aged [&ge;]18 years living in Norway during January 1, 2021, through December 31, 2023. Individuals were categorized as either unvaccinated (received no doses), partially vaccinated (received one or two doses) or fully vaccinated (received three or more doses) from the date of vaccination and onwards. Age-stratified Poisson models were used to estimate incidence rate ratios of death (all causes) between vaccination groups, adjusting for sex, calendar time, county of residence and risk group status (nursing home resident or preexisting condition with increased risk of severe COVID-19). Results: The study included 4 645 910 individuals (49.8% women) with 132 963 deaths during follow-up. There was a higher proportion of individuals that were part of a risk group among fully vaccinated individuals compared to unvaccinated individuals in all age groups, and a lower unadjusted rate of death: 51.5 vs 73.6 per 100 000 person years (py) among individuals aged 18-44 years, 295.1 vs 405.3 per 100 000 py among 45-64 years, and 3620.2 vs 4783.8 per 100 000 py among 65 years or older. The adjusted IRR of death for the same age groups were 0.42 (95% CI 0.38-0.47), 0.39 (95% CI 0.37-0.41) and 0.42 (95% CI 0.41-0.43), respectively. The differences in rate of death between vaccination groups were larger among men and peaked during 2022. Conclusion: Vaccinated individuals had a lower rate of all-cause death during 2021-2023 in Norway.","NA","medrxiv",1734473302830
"Subtle changes at the RBD/hACE2 interface during SARS-CoV2 variant evolution: a molecular dynamics study","10.1101/2024.12.12.628120","biorxiv",10.849999999999998,6.6499999999999995,9.849999999999998,10.849999999999998,10.849999999999998,"Gheeraert, A.; Leroux, V.; Mias-Lucquin, D.; Karami, Y.; Vuillon, L.; Chauvot de Bauchene, I.; Devignes, M.-D.; Rivalta, I.; Maigret, B.; Chaloin, L.","Laurent Chaloin","Centre National de la Recherche Scientifique","2024-12-13","1","new results","cc_by","bioinformatics","https://www.biorxiv.org/content/early/2024/12/13/2024.12.12.628120.source.xml","The SARS-CoV-2 Omicron variants present a different behavior compared to the previous variants, all particularly in respect to the Delta variant, as it seems to promote a lower morbidity although being much more contagious. In this perspective, we performed new molecular dynamics (MD) simulations of the various spike RBD/hACE2 complexes corresponding to the WT, Delta and Omicron variants (BA.1 up to BA.4/5) over 1.5 {micro}s timescale. Then, carrying out a comprehensive analysis of residue interactions within and between the two partners, allowed us to draw the profile of each variant by using complementary methods (PairInt, hydrophobic potential, contact PCA). Main results of PairInt calculations highlighted the most involved residues in electrostatic interactions that represent a strong contribution in the binding with highly stable contacts between spike RBD and hACE2 (importance of mutated residues at positions 417, 493 and 498). In addition to the swappable arginine residues (493/498), the apolar contacts made a substantial and complementary contribution in Omicron with the detection of two hydrophobic patches, one of which was correlated with energetic contribution calculations. This study brings new highlights on the global dynamics of spike RBD/hACE2 complexes resulting from the analysis of contact networks and cross-correlation matrices able to detect subtle changes at point mutations. The results of our study are also consistent with alternative approaches such as binding free energy calculations but are more informative and sensitive to transient or low-energy interactions. Nevertheless, the energetic contributions of residues at positions 501 and 505 were in good agreement with hydrophobic interactions measurements. The contact PCA networks could identify the intramolecular incidence of the S375F mutation occurring in all Omicron variants and likely conferring them an advantage in binding stability. Collectively, these data revealed the major differences observed between WT/Delta and Omicron variants at the RBD/hACE2 interface, which may explain the greater persistence of Omicron.

Author SummaryThe evolution of SARS-CoV-2 was extremely rapid, leading to the global predominance of Omicron variants, despite the many mutations identified in the spike protein. Some of these were introduced to evade the immune system, but many others were located in the Receptor Binding Domain (RBD) without affecting its efficient binding to hACE2 and preserving the high infectivity of this variant. To unravel the mechanism by which this protein-protein connection remains strong or stable, it is necessary to study the different types of interactions at the atomic level and over time using molecular dynamics (MD) simulations. Indeed, in contrast to crystal or cryo-EM structures providing only a fixed image of the binding process, MD simulations have allowed to unambiguously identify the sustainability of some interactions mediated by key residues of spike RBD. This study could also highlight the interchangeable role of certain residues in compensating for a mutation, which in turn allows the virus to maintain durable binding to the host cell receptor.



O_FIG O_LINKSMALLFIG WIDTH=200 HEIGHT=83 SRC=""FIGDIR/small/628120v1_ufig1.gif"" ALT=""Figure 1"">
View larger version (35K):
org.highwire.dtl.DTLVardef@1f23e84org.highwire.dtl.DTLVardef@e64f28org.highwire.dtl.DTLVardef@56fdd1org.highwire.dtl.DTLVardef@131e524_HPS_FORMAT_FIGEXP  M_FIG Graphical abstract

C_FIG","NA","biorxiv",1734473302830
"Mapping targetable sites on the human surfaceome for the design of novel binders","10.1101/2024.12.16.628626","biorxiv",6.1,6.1,6.1,6.1,6.1,"Balbi, P. E. M.; Sadek, A.; Marchand, A.; Yu, T.; Damjanovic, J.; Georgeon, S.; Schmidt, J.; Fulle, S.; Yang, C.; Khakzad, H.; Correia, B.","Bruno Correia","Ecole Polytechnique Federale de Lausanne (EPFL)","2024-12-16","1","new results","cc_no","synthetic biology","https://www.biorxiv.org/content/early/2024/12/16/2024.12.16.628626.source.xml","The human cell surfaceome, integral to cell communication and disease mechanisms, presents a prime target for therapeutic intervention. De novo protein binder design against these cell surface proteins offers a promising yet underexplored strategy for drug development. However, the vast search space and limited data on natural or competitive binders have historically limited experimental success. In this study, we systematically analyzed the entire human surfaceome, identifying approximately 4,500 targetable sites and introducing high-quality binder seeds tailored for protein design applications. To validate these seeds, we implemented two experimental approaches (protein scaffolding and peptide cyclization) on three representative targets (FGFR2, IFNAR2, and HER3). Our results revealed a high success rate, emphasizing the precision and therapeutic potential of these seeds, as well as the need for constant improvements of computational protein design pipelines utilizing machine learning and physics-based methods. Additionally, we present SURFACE-Bind, an interactive database offering open access to all generated data. The high-throughput computational design methods and target-specific binder seeds established here pave the way for a new generation of targeted therapeutics for the human surfaceome.","NA","biorxiv",1734473302830
"Morphogenetic constrains in the development of gastruloids: implications for mouse gastrulation","10.1101/2024.12.12.628151","biorxiv",6.05,6.05,6.05,6.05,6.05,"Fiuza, U.-M.; Bonavia, S.; Pascual-Mas, P.; Torregrosa, G.; Casani, P.; Robertson, G.; Martinez Arias, A.","Alfonso Martinez Arias","Universitat Pompeu Fabra","2024-12-17","1","new results","cc_by_nc","developmental biology","https://www.biorxiv.org/content/early/2024/12/17/2024.12.12.628151.source.xml","Mammalian embryonic size is tightly controlled with checkpoints and compensatory mechanisms correcting size defects. Here, we take advantage of gastruloids, a stem cell embryoid system not subject to most size controls, to study the role of size in emergent properties of mammalian embryogenesis. We report that gastruloids exhibit robust morphology and transcriptional profiles within a size range. However, size affects the dynamics, and, outside a range of robust morphogenesis, the precision of anterior-posterior (AP) axial elongation. Gastruloid axial elongation exhibits active cellular contractility, requires planar cell polarity (PCP), adhesion and cell-cell contact remodelling. Smaller gastruloids initiate elongation earlier, correlated with an earlier Brachyury polarisation. Brachyury expression increases tissue fluidity. Axis formation is regulated by the balance of Brachyury multifoci coalescence and the timing of initiation of the elongation programme. Sizes beyond the robust range can modify relative tissue composition. Very small aggregates have increased neural fate bias, accompanied by a loss of paraxial mesoderm mediated by differences in Nodal signalling activity.","NA","biorxiv",1734473302830
