"title","doi","altmetric_jid","score","X1d","X3d","X1w","X1m","authors","author_corresponding","author_corresponding_institution","date","version","type","license","category","jatsxml","abstract","published","server","upupdate_time"
"Predators at the Viral Gate: Multi-Species Foraging at a Marburg Virus Reservoir","10.1101/2025.06.16.659814","biorxiv",50.4,0,0,0,50.4,"Atukwatse, B.; Cornille, O.; Muhereza, J.; Nsabimana, W.; Ssemakula, Y.; Braczkowski, A. A.","Alexander AR Braczkowski","Kyambura Lion Project, Volcanoes Safaris Partnership Trust, Kampala, Uganda","2025-06-19","1","new results","cc_by","ecology","https://www.biorxiv.org/content/early/2025/06/19/2025.06.16.659814.source.xml","Understanding how zoonotic viruses spill over from wildlife to humans requires direct ecological observation at reservoir-host interfaces -- yet such events remain rare in the literature, and no such interface has been documented at scale. As part of a broader long-term study on African leopard (Panthera pardus) population ecology in Queen Elizabeth National Park, Uganda, we deployed camera traps on animal trails and at Python Cave, a known roost site of Egyptian fruit bats (Rousettus aegyptiacus) and a confirmed Marburg and virus reservoir. This serendipitous deployment yielded the first visual documentation of a multi-trophic predator and scavenger guild interacting at a filovirus reservoir site. Over a five month period (February 16th - June 5th 2025) across 304 trap nights, we recorded at least 14 different vertebrate species, including leopards, primates, raptors, and small carnivores, engaging in bat predation, scavenging on bat remains, guano foraging, or cave exploration across 261 temporally and spatially independent events (>1 hour apart). These instances were structured, repeated and the species continuously made contact with the bats or entered their roosting space. Camera traps also recorded an estimated 400 human individuals visiting the cave -- including school groups, tourists, and local trainees -- the majority with no personal protective equipment. The shallow, accessible structure of Python Cave appears to collapse the typical spatial buffers between reservoir species and both predators and humans. These observations constitute the first ecological confirmation of a dynamic, multispecies exposure network at a known Marburg virus site, and may represent a Rosetta Stone for interpreting the real-time mechanics of zoonotic spillover.","NA","biorxiv",1752703875454
"Mental and Emotional Health of Youth after 24 months of Gender-Affirming Medical Care Initiated with Pubertal Suppression","10.1101/2025.05.14.25327614","medrxiv",137.35000000000002,0,0,0,49.7,"OLSON-KENNEDY, J.; Durazo-Arvizu, R.; Wang, L.; Wong, C.; Chen, D.; Ehrensaft, D.; Hidalgo, M.; Chan, Y.-M.; Garofalo, R.; Radix, A.; Rosenthal, S. M.","JOHANNA OLSON-KENNEDY","Children\'s Hospital Los Angeles","2025-05-16","1","PUBLISHAHEADOFPRINT","cc0","pediatrics","https://www.medrxiv.org/content/early/2025/05/16/2025.05.14.25327614.source.xml","Background and ObjectivesMedical interventions for youth with gender dysphoria can include the use of gonadotropin releasing hormone analogs (GnRHas) for suppression of endogenous puberty. This analysis aimed to understand the impact of medical intervention initiated with GnRHas on psychological well-being among youth with gender dysphoria over 24 months.

MethodsParticipants were enrolled as part of the Trans Youth Care United States Study. Eligibility criteria for youth included a diagnosis of Gender Dysphoria and pubertal initiation. Youth with precocious puberty or pre-existing osteoporosis were ineligible. Youth reported on depressive symptoms, emotional health and suicidality at baseline, 6, 12, 18 and 24 months after initiation of GnRHas. Parent/caretaker completed the Child Behavior Checklist at baseline, 12 and 24 months after initiation of GnRHas. Latent Growth-Curve Models analyzed trajectories of change over the 24-month period.

ResultsNinety-four youth aged 8-16 years (mean=11.2 y) were predominately Non-Hispanic White (56%), early pubertal (86%) and assigned male at birth (52%). Depression symptoms, emotional health and CBCL constructs did not change significantly over 24 months. At no time points were the means of depression, emotional health or CBCL constructs in a clinically concerning range.

ConclusionParticipants initiating medical interventions for gender dysphoria with GnRHas have self- and parent-reported psychological and emotional health comparable with the population of adolescents at large, which remains relatively stable over 24 months. Given that the mental health of youth with gender dysphoria who are older is often poor, it is likely that puberty blockers prevent the deterioration of mental health.

Whats known on this subjectPuberty blockers are effective in halting endogenous puberty and prior research suggests improved mental health in youth with gender dysphoria. Few studies originate from the United States and most include older youth in later stages of puberty at initiation of blockers.

What this study addsThis is the largest longitudinal cohort of youth with gender dysphoria initiating medical intervention beginning with puberty blockers in early puberty to be followed in the United States. Youth demonstrated both stability and improvement in emotional and mental health over 24 months.

Contributors Statement PageDr. Olson-Kennedy conceptualized and designed the study, drafted the initial manuscript, and critically reviewed and revised the manuscript.

Dr. Durazo-Arvizu carried out follow-up analyses and critically reviewed the manuscript.

Drs. Garofalo, Rosenthal, Chan, Chen, Ehrensaft, and Hidalgo conceptualized and designed the study, and critically reviewed and revised the manuscript.

Drs. Wang and Wong carried out the initial analyses and critically reviewed and revised the manuscript.

Dr. Radix critically reviewed and revised the manuscript.

All authors approved the final manuscript as submitted and agree to be accountable for all aspects of the work.","NA","medrxiv",1752703875454
"X-Atlas/Orion: Genome-wide Perturb-seq Datasets via a Scalable Fix-Cryopreserve Platform for Training Dose-Dependent Biological Foundation Models","10.1101/2025.06.11.659105","biorxiv",49.349999999999994,0,0,0,49.349999999999994,"Huang, A. C.; Hsieh, T.-H. S.; Zhu, J.; Michuda, J.; Teng, A.; Kim, S.; Rumsey, E. M.; Lam, S. K.; Anigbogu, I.; Wright, P.; Ameen, M.; You, K.; Graves, C. J.; Kim, H. J.; Litterman, A. J.; Sit, R. V.; Blocker, A.; Chu, C.","Ci Chu","Xaira Therapeutics","2025-06-16","1","new results","cc_by_nc","genomics","https://www.biorxiv.org/content/early/2025/06/16/2025.06.11.659105.source.xml","The rapid expansion of massively parallel sequencing technologies has enabled the development of foundation models to uncover novel biological findings. While these have the potential to significantly accelerate scientific discoveries by creating AI-driven virtual cell models, their progress has been greatly limited by the lack of large-scale high-quality perturbation data, which remains constrained due to scalability bottlenecks and assay variability. Here, we introduce ""Fix-Cryopreserve-ScRNAseq"" (FiCS) Perturb-seq, an industrialized platform for scalable Perturb-seq data generation. We demonstrate that FiCS Perturb-seq exhibits high sensitivity and low batch effects, effectively capturing perturbation-induced transcriptomic changes and recapitulating known biological pathways and protein complexes. In addition, we release X-Atlas: Orion edition (X-Atlas/Orion), the largest publicly available Perturb-seq atlas. This atlas, generated from two genome-wide FiCS Perturb-seq experiments targeting all human protein-coding genes, comprises eight million cells deeply sequenced to over 16,000 unique molecular identifiers (UMIs) per cell. Furthermore, we show that single guide RNA (sgRNA) abundance can serve as a proxy for gene knockdown (KD) efficacy. Leveraging the deep sequencing and substantial cell numbers per perturbation, we also show that stratification by sgRNA expression can reveal dose-dependent genetic effects. Taken together, we demonstrate that FiCS Perturb-seq is an efficient and scalable platform for high-throughput Perturb-seq screens. Through the release of X-Atlas/Orion, we highlight the potential of FiCS Perturb-seq to address current scalability and variability challenges in data generation, advance foundation model development that incorporates gene-dosage effects, and accelerate biological discoveries.","NA","biorxiv",1752703875454
"Multidimensional feature tuning in category-selective areas of human visual cortex","10.1101/2025.06.17.659578","biorxiv",48.05000000000001,0,0,0,48.05000000000001,"van Dyck, L. E.; Hebart, M. N.; Dobs, K.","Leonard E. van Dyck","Justus Liebig University Giessen","2025-06-24","2","new results","cc_by","neuroscience","https://www.biorxiv.org/content/early/2025/06/24/2025.06.17.659578.source.xml","Human high-level visual cortex has been described in two seemingly opposed ways. A categorical view emphasizes discrete category-selective areas, while a dimensional view highlights continuous feature maps spanning across these areas. Can these divergent perspectives on cortical organization be reconciled within a unifying framework? Using data-driven decomposition of fMRI responses in face-, body-, and scene-selective areas, we identified overlapping activity patterns shared across individuals. Each area encoded multiple interpretable dimensions tuned to both finer subcategory features and coarser cross-category distinctions beyond its preferred category, even in the most category-selective voxels. These dimensions formed distinct clusters within category-selective areas but were also sparsely distributed across the broader visual cortex, supporting both locally selective, category-specific, and globally distributed, feature-based coding. Together, these findings suggest multidimensional tuning as a fundamental organizing principle that integrates feature-selective clusters, category-selective areas, and large-scale tuning maps, providing a more comprehensive understanding of category representations in human visual cortex.","NA","biorxiv",1752703875454
"Population-specific brain charts reveal Chinese-Western differences in neurodevelopmental trajectories","10.1101/2025.06.17.659820","biorxiv",46.70000000000002,0,0,1,46.70000000000002,"Sun, L.; Qin, W.; Liang, X.; Wang, C.; Men, W.; Duan, Y.; Fan, X.-R.; Cai, Q.; Qiu, S.; Wang, M.; Gong, Q.; Tian, Y.; Liang, P.; Liu, Z.; Zhang, X.; Song, H.; Ye, Z.; Zhang, P.; Dong, Q.; Tao, S.; Zhu, W.; Zhang, J.; Xie, F.; Feng, J.; Zhang, J.; Liu, C.; Qian, Q.; Zhang, B.; Meng, M.; Hu, L.; Gao, J.-H.; Jiang, T.; Zhu, X.; Zhang, Y.; Liu, L.; Liu, H.; Liao, W.; Wang, D.; Wang, H.; Guo, T.; Dai, Z.; Lui, S.; Xu, K.; Li, L.; Xie, P.; Feng, C.; Cui, G.; Wu, J.; Yin, X.; Ding, G.; Xian, J.; Zhao, L.; Lu, J.; Liu, Z.; Han, Y.; Yuan, Z.; Zhang, X.; Si, T.; Zhou, F.; Bi, Y.; Wu, D.; Gao, F.; Wang, ","Yong He","State Key Laboratory of Cognitive Neuroscience and Learning, Beijing Normal University, Beijing, China","2025-06-18","1","new results","cc_by_nd","neuroscience","https://www.biorxiv.org/content/early/2025/06/18/2025.06.17.659820.source.xml","Human brain charts provide unprecedented opportunities for decoding neurodevelopmental milestones and establishing clinical benchmarks for precision brain medicine 1-7. However, current lifespan brain charts are primarily derived from European and North American cohorts, with Asian populations severely underrepresented. Here, we present the first population-specific brain charts for China, developed through the Chinese Lifespan Brain Mapping Consortium (Phase I) using neuroimaging data from 43,037 participants (aged 0-100 years) across 384 sites nationwide. We establish the lifespan normative trajectories for 296 structural brain phenotypes, encompassing global, subcortical, and cortical measures. Cross-population comparisons with Western brain charts (based on data from 56,339 participants aged 0-100 years) reveal distinct neurodevelopmental patterns in the Chinese population, including prolonged cortical and subcortical maturation, accelerated cerebellar growth, and earlier development of sensorimotor regions relative to paralimbic regions. Crucially, these Chinese-specific charts outperform Western-derived models in predicting healthy brain phenotypes and detecting pathological deviations in Chinese clinical cohorts. These findings highlight the urgent need for diverse, population-representative brain charts to advance equitable precision neuroscience and improve clinical validity across populations.","NA","biorxiv",1752703875454
"The Luminal Ring Protein C2CD3 Acts as a Radial In-to-Out Organizer of the Distal Centriole and Appendages","10.1101/2025.06.17.660204","biorxiv",46.65000000000003,0,0,0,46.65000000000003,"Bertiaux, E.; Louvel, V.; McCafferty, C.; van den Hoek, H.; Batman, U.; Mukherjee, S.; Bournonville, L.; Mercey, O.; Mean, I.; Mueller, A.; Van der Stappen, P.; Buss, G.; Daraspe, J.; Genoud, C.; Stearns, T.; Engel, B. D.; Hamel, V.; Guichard, P.","Paul Guichard","University of Geneva","2025-06-18","1","new results","cc_by_nc_nd","cell biology","https://www.biorxiv.org/content/early/2025/06/18/2025.06.17.660204.source.xml","Centrioles are polarized microtubule-based structures with appendages at their distal end that are essential for cilia formation and function. The protein C2CD3 is critical for distal appendage assembly, with mutations linked to orofaciodigital syndrome and other ciliopathies. However, its precise molecular role in appendage recruitment remains unclear. Using Ultrastructure Expansion Microscopy (U-ExM), iterative U-ExM, and in situ cryo-electron tomography (cryo-ET), we reveal that C2CD3 adopts a radially symmetric 9-fold organization within the centrioles distal lumen. We show that the C-terminal region of C2CD3 localizes close to a [~]100 nm luminal ring structure consisting of [~]27 nodes, while its N-terminal region localizes close to a hook-like structure that attaches to the A-microtubule as it extends from the centriole interior to exterior. This hook structure is adjacent to the DISCO complex (MNR/CEP90/OFD1), which marks future appendage sites. C2CD3 depletion disrupts not only the recruitment of the DISCO complex via direct interaction with MNR but also destabilizes the luminal ring network composed of C2CD3/SFI1/centrin-2/CEP135/NA14, as well as the distal microtubule tip protein CEP162. This reveals an intricate ""in-to-out"" molecular hub connecting the centriolar lumen, distal microtubule cap, and appendages. Although C2CD3 loss results in shorter centrioles and appendage defects, key structural elements remain intact, permitting continued centriole duplication. We propose that C2CD3 forms the luminal ring structure and extends radially to the space between triplet microtubules, functioning as an architectural hub that scaffolds the distal end of the centriole, orchestrating its assembly and directing appendage formation.","NA","biorxiv",1752703875454
"Genomes of the Golden Horde Elites and their Implications for the Rulers of the Mongol Empire","10.1101/2025.06.11.659160","biorxiv",45.300000000000026,0.85,0.85,0.85,45.300000000000026,"Askapuli, A.; Kanzawa-Kiriyama, H.; Kakuda, T.; Kassenali, A.; Yessen, S.; Schamiloglu, U.; Schrodi, S. J.; Hawks, J.; Saitou, N.","Ayken Askapuli","Department of Integrative Biology, University of Wisconsin-Madison, Wisconsin, United States of America","2025-06-17","1","new results","cc_no","genomics","https://www.biorxiv.org/content/early/2025/06/17/2025.06.11.659160.source.xml","The Golden Horde, the northwestern extension of the Mongol Empire that was ruled by the eldest son of Genghis Khan (also spelled Chinggis Khan) and his descendants, played an important role in the history of Central Eurasia and eastern Europe. For this reason, the genetic profiles of Genghis Khan and his descendants are of keen academic and public interest. His Y-chromosome has been hypothesized to belong to haplogroup C3* (C2a1a3-F1918) but this has yet to be substantiated. To explore the genetic ancestry of Genghis Khan, we analyzed four archaeological individuals from the Golden Horde, including three males and one female, who were buried in separate medieval elite mausoleums in the Ulitau region of Kazakstan. One of the males is believed to be Joshi (Juchi), the eldest son of Genghis Khan. We generated genomic data from these archaeological individuals and found that the three males were paternally related, sharing the Y-chromosome haplogroup C3*, consistent with the hypothesized signature haplotype of Genghis Khan. In addition, we confirm that the Golden Horde elites derived most of their genomes from Ancient Northeast Asians (ANA) while having an additional ancestral component from either Ancient North Eurasians (ANE) or a Berel Scythian related population. Furthermore, we were able to identify their medieval relatives in the Mongolian Plateau through constructing an Identity by Descent (IBD) network.","NA","biorxiv",1752703875454
"Condensate-driven chromatin organization via elastocapillary interactions","10.1101/2025.06.12.659369","biorxiv",44.10000000000001,0,0,0,44.10000000000001,"Zhao, H.; Strom, A. R.; Eeftens, J. M.; Haataja, M.; Kosmrlj, A.; Brangwynne, C. P.","Clifford P Brangwynne","Princeton University","2025-06-15","1","new results","cc_no","biophysics","https://www.biorxiv.org/content/early/2025/06/15/2025.06.12.659369.source.xml","Biomolecular condensates are ubiquitous structures found throughout eukaryotic cells, with nuclear condensates playing a key role in the mesoscale organization and functionality of the genome1,2. Protein- and RNA-rich liquid-like condensates form through phase separation on and around chromatin, driving diverse condensate morphologies with varying sphericity and intra-condensate chromatin density3,4. However, a unifying set of physical principles underlying these varied interactions and their implications for chromatin organization remains elusive. Here, we develop and experimentally validate a mesoscopic model that bridges the physics of phase separation and chromatin mechanics. Specifically, by integrating computational modeling with experiments using two canonical condensate proteins, the heterochromatin protein HP1, and the euchromatin protein BRD4, we demonstrate that wetting properties and chromatin stiffness shape condensate morphology, while condensates remodel chromatin mechanics and organization. This two-way interplay is governed by elastocapillarity--the deformation of chromatin by condensate interfacial tension -- and resolves discrepancies in nuclear condensate behavior, with emergent behaviors that deviate from the simplest liquid-liquid phase separation (LLPS) models5-8. Our findings underscore that nuclear condensates and chromatin cannot be studied in isolation, as they are fundamentally interdependent, impacted by biomolecularly-defined wetting properties, with implications for genome organization, transcriptional regulation, and epigenetic control in diverse phenotypes, including cancer2,9,10. Beyond the nucleus, the methodologies we present offer a generalizable platform for exploring multiphase, multicomponent soft matter systems across a broad range of biological and synthetic contexts11.","NA","biorxiv",1752703875454
"Enhancer Poising Enables Pathogenic Gene Activation by Noncoding Variants","10.1101/2025.06.20.660819","biorxiv",40.050000000000026,0,0,0,40.050000000000026,"Hollingsworth, E.; Chen, Z.; Chen, C. X.; Jacinto, S. H.; Liu, T. A.; Kvon, E.","Evgeny Kvon","Department of Developmental and Cell Biology, University of California, Irvine, CA 92697, USA","2025-06-21","1","new results","cc_no","genomics","https://www.biorxiv.org/content/early/2025/06/21/2025.06.20.660819.source.xml","Single nucleotide variants within enhancers--non-coding DNA elements that regulate transcription--often lead to aberrant gene activation and contribute to a wide range of genetic disorders (Claussnitzer et al. 2015; Doan et al. 2016; Turner et al. 2017; Yanchus et al. 2022; Lettice et al. 2008). The mechanism by which ectopic gene activation occurs through these gain-of-function enhancer mutations remains poorly understood. Using the ZRS, a benchmark disease-associated enhancer of Sonic hedgehog (Shh), as a model, we demonstrate that poised (i.e., accessible but inactive) chromatin sensitizes Shh to aberrant activation in anterior limb bud, leading to polydactyly. In the anterior limb cells of wild-type mice, Shh is inactive, but the ZRS is accessible and marked by enhancer-associated histone modifications. We demonstrate that this poising signature explains how over 20 independent rare variants within the ZRS cause Shh misexpression in the same anterior limb bud cell population, resulting in similar limb malformations, despite affecting binding sites for different activators and repressors. Disabling pioneer transcription factor binding to the ZRS suppresses its poised state in anterior cells, prevents aberrant activation of the ZRS by rare variants, and fully rescues limb malformations in variant knock-in mice. A thorough examination of other disease-associated enhancers with pathogenic gain-of-function variants revealed that they are all poised in tissues with ectopic activity. We use this poising signature to predict and validate in vivo ectopic forebrain activity of previously uncharacterized autism-associated non-coding variants. Our findings suggest that spatial enhancer poising, likely a byproduct of development, creates a susceptibility to non-coding mutations and offers a potential mechanistic explanation for the burden of disease-associated non-coding variants.","NA","biorxiv",1752703875454
"Sex bias determines MERS-CoV infection outcomes in a mouse model of differential pathogenicity","10.1101/2025.06.19.660369","biorxiv",39.20000000000002,1.5,1.5,1.5,39.20000000000002,"Habbick, M. R.; Bushmaker, T.; Singh, R.; Sharma, P.; Munster, V. J.; van Doremalen, N.; Rasmussen, A. L.","Angela L Rasmussen","University of Saskatchewan","2025-06-19","1","new results","cc0","microbiology","https://www.biorxiv.org/content/early/2025/06/19/2025.06.19.660369.source.xml","Middle East respiratory syndrome coronavirus (MERS-CoV) causes a spectrum of disease outcomes in infected humans, ranging from asymptomatic or tolerant to lethal. While the virus itself contributes to pathogenesis, disease severity is primarily influenced by the hosts response to infection. One factor observed to impact the host response is sex, as epidemiological data indicates that male persons have a higher case fatality rate than females infected with MERS-CoV. However, the mechanism underlying this sex bias is unknown and disease course remains difficult to predict. This study investigates how male and female transgenic mice expressing humanized dipeptidyl peptidase-4 (hDPP4) respond to MERS-CoV infection following exposure to either a tolerance-inducing low dose or lethal high dose. We observed that female hDPP4 mice display dose-dependent tolerance to infection and males experienced uniformly lethal disease in both dosing groups. Longitudinal transcriptomic analysis revealed that males suppress innate and inflammatory responses early after infection, causing delayed induction of the host antiviral response. In contrast, high dose females mount an immediate and sustained interferon and inflammatory response, activating antiviral effectors and interferon-stimulated genes. Tolerant females displayed the greatest transcriptional control, showing no pathway enrichment and minimal changes in weight throughout infection. Our results suggest that the magnitude of the response is driven by dose while the nature of the response in shaped by sex. Females mount a more robust response to MERS-CoV infection, allowing females to tolerate low-dose infection but causing uncontrolled inflammation after high dose infection. In contrast, males experienced lethal outcomes regardless of dose. By examining the dynamics of sex-biased host transcriptional responses in determining disease severity, this study highlights the importance of sex as a biological variable in coronavirus pathogenesis research.","NA","biorxiv",1752703875454
