"title","doi","altmetric_jid","score","X1d","X3d","X1w","X1m","authors","author_corresponding","author_corresponding_institution","date","version","type","license","category","jatsxml","abstract","published","server","upupdate_time"
"An RNA Splicing System that Excises Transposons from Animal mRNAs","10.1101/2025.02.14.638102","biorxiv",39.300000000000004,39.300000000000004,39.300000000000004,39.300000000000004,39.300000000000004,"Zhao, L.-W.; Nardone, C.; Paulo, J. A.; Elledge, S.; Kennedy, S.","Scott Kennedy","Harvard Medical School","2025-02-17","1","new results","cc_by_nc_nd","genetics","https://www.biorxiv.org/content/early/2025/02/17/2025.02.14.638102.source.xml","All genomes harbor mobile genetic parasites called transposable elements (TEs). Here we describe a system, which we term SOS splicing, that protects C. elegans and human genes from DNA transposon-mediated disruption by excising these TEs from host mRNAs. SOS splicing, which operates independently of the spliceosome, is a pattern recognition system triggered by base-pairing of inverted terminal repeat elements, which are a defining feature of the DNA transposons. We identify three factors required for SOS splicing in both C. elegans and human cells; AKAP17A, which binds TE-containing mRNAs; the RNA ligase RTCB; and CAAP1, which bridges RTCB and AKAP17A, allowing RTCB to ligate mRNA fragments generated by TE excision. We propose that SOS splicing is a novel, conserved, and RNA structure-directed mode of mRNA splicing and that one function of SOS splicing is to genetically buffer animals from the deleterious effects of TE-mediated gene perturbation.","NA","biorxiv",1739916494184
"Mapping the nanoscale organization of the human cell surface proteome reveals new functional associations and surface antigen clusters","10.1101/2025.02.12.637979","biorxiv",32.750000000000014,32.750000000000014,32.750000000000014,32.750000000000014,32.750000000000014,"Floyd, B. M.; Schmidt, E. L.; Till, N. A.; Yang, J. L.; Liao, P.; George, B. M.; Flynn, R. A.; Bertozzi, C. R.","Carolyn R Bertozzi","Stanford University","2025-02-17","1","new results","cc_by_nc_nd","systems biology","https://www.biorxiv.org/content/early/2025/02/17/2025.02.12.637979.source.xml","The cell surface is a dynamic interface that controls cell-cell communication and signal transduction relevant to organ development, homeostasis and repair, immune reactivity, and pathologies driven by aberrant cell surface phenotypes. The spatial organization of cell surface proteins is central to these processes. High-resolution fluorescence microscopy and proximity labeling have advanced studies of surface protein associations, but the spatial organization of the complete surface proteome remains uncharted. In this study, we systematically mapped the surface proteome of human T-lymphocytes and B-lymphoblasts using proximity labeling of 85 antigens, identified from over 100 antibodies tested for binding to surface-exposed proteins. These experiments were coupled with an optimized data-independent acquisition mass spectrometry workflow to generate a robust dataset. Unsupervised clustering of the resulting interactome revealed functional modules, including well-characterized complexes such as the T-cell receptor and HLA class I/II, alongside novel clusters. Notably, we identified mitochondrial proteins localized to the surface, including the transcription factor TFAM, suggesting previously unappreciated roles for mitochondrial proteins at the plasma membrane. A high-accuracy machine learning classifier predicted over 6,000 surface protein associations, highlighting functional associations such as IL10RBs role as a negative regulator of type I interferon signaling. Spatial modeling of the surface proteome provided insights into protein dispersion patterns, distinguishing widely distributed proteins, such as CD45, from localized antigens, such as CD226 pointing to active mechanisms of regulating surface organization. This work provides a comprehensive map of the human surfaceome and a resource for exploring the spatial and functional dynamics of the cell membrane proteome.","NA","biorxiv",1739916494184
"PyOrthoANI, PyFastANI, and Pyskani: a suite of Python libraries for computation of average nucleotide identity","10.1101/2025.02.13.638148","biorxiv",15.25,15.25,15.25,15.25,15.25,"Larralde, M.; Zeller, G.; Carroll, L. M.","Laura M Carroll","Department of Clinical Microbiology, SciLifeLab, Umea University, 90187 Umea, Sweden","2025-02-17","1","new results","cc_by","bioinformatics","https://www.biorxiv.org/content/early/2025/02/17/2025.02.13.638148.source.xml","Summary: The average nucleotide identity (ANI) metric has become the gold standard for prokaryotic species delineation in the genomics era. The most popular ANI algorithms are available as command-line tools and/or web applications, making it inconvenient or impossible to incorporate them into bioinformatic workflows, which utilize the popular Python programming language. Here, we present PyOrthoANI, PyFastANI, and Pyskani, Python libraries for three popular ANI computation methods. ANI values produced by PyOrthoANI, PyFastANI, and Pyskani are virtually identical to those produced by OrthoANI, FastANI, and skani, respectively. All three libraries integrate seamlessly with BioPython, making it easy and convenient to use, compare, and benchmark popular ANI algorithms within Python-based workflows. Availability and Implementation: Source code is open-source and available via GitHub (PyOrthoANI, https://github.com/althonos/orthoani; PyFastANI, https://github.com/althonos/pyfastani; Pyskani, https://github.com/althonos/pyskani). Supplementary Information: Supplementary data are available on bioRxiv.","NA","biorxiv",1739916494184
"Antero-posterior patterning in the brittle star Amphipholis squamata and the evolution of body plans across echinoderms","10.1101/2025.02.13.638179","biorxiv",21.500000000000004,14.999999999999996,21.500000000000004,21.500000000000004,21.500000000000004,"Formery, L.; Peluso, P.; Rank, D. R.; Rokhsar, D. S.; Lowe, C. J.","Laurent Formery","Department of Biology, Hopkins Marine Station, Stanford University, Pacific Grove, CA, USA; Department of Cell and Molecular Biology, University of California B","2025-02-17","1","new results","cc_by_nc_nd","evolutionary biology","https://www.biorxiv.org/content/early/2025/02/17/2025.02.13.638179.source.xml","Although the adult pentaradial body plan of echinoderms evolved from a bilateral ancestor, identifying axial homologies between the morphologically divergent echinoderms and their bilaterian relatives has been an enduring problem in zoology. The expression of conserved bilaterian patterning genes in echinoderms provides a molecular framework for resolving this puzzle. Recent studies in juvenile asteroids suggest that the bilaterian antero-posterior axis maps onto the medio-lateral axis that is perpendicular to each of the five rays of the pentaradial body plan. Here we test this hypothesis in another echinoderm class, the ophiuroids, using the cosmopolitan brittle star Amphipholis squamata. Our results show that the general principles of axial patterning are similar to those described in asteroids, and comparisons with existing molecular data from other echinoderm taxa support the idea that medio-lateral deployment of the AP patterning program across the rays predates the evolution of the asterozoan and likely the echinoderm crown-groups. Our data also reveal expression differences between A. squamata and asteroids, which we attribute to secondary modifications specific to ophiuroids. Together, this work provides important comparative data to reconstruct the evolution of axial properties in echinoderm body plans.","NA","biorxiv",1739916494184
"Sidechain conditioning and modeling for full-atom protein sequence design with FAMPNN","10.1101/2025.02.13.637498","biorxiv",14.299999999999999,14.299999999999999,14.299999999999999,14.299999999999999,14.299999999999999,"Shuai, R. W.; Widatalla, T.; Huang, P.; Hie, B. L.","Brian L. Hie","Stanford University","2025-02-17","1","new results","cc_by","bioengineering","https://www.biorxiv.org/content/early/2025/02/17/2025.02.13.637498.source.xml","Leading deep learning-based methods for fixed-backbone protein sequence design do not model protein sidechain conformation during sequence generation despite the large role the three-dimensional arrangement of sidechain atoms play in protein conformation, stability, and overall protein function. Instead, these models implicitly reason about crucial sidechain interactions based on backbone geometry and known amino acid sequence labels. To address this, we present FAMPNN (Full-Atom MPNN), a sequence design method that explicitly models both sequence identity and sidechain conformation for each residue, where the per-token distribution of a residue's discrete amino acid identity and its continuous sidechain conformation are learned with a combined categorical cross-entropy and diffusion loss objective. We demonstrate that learning these distributions jointly is a highly synergistic task that both improves sequence recovery while achieving state-of-the-art sidechain packing. Furthermore, benefits from explicit full-atom modeling generalize from sequence recovery to practical protein design applications, such as zero-shot prediction of experimental binding and stability measurements.","NA","biorxiv",1739916494184
"Herbaria provide a valuable resource for obtaining informative mRNA","10.1101/2025.02.12.637878","biorxiv",18.049999999999997,13.949999999999998,18.049999999999997,18.049999999999997,18.049999999999997,"Tyszka, A. S.; Chia, K.-S.; Bretz, E. C.; Mansour, L.; Larson, D. A.; Carella, P.; Walker, J. F.","Joseph F. Walker","University of Illinois Chicago","2025-02-17","1","new results","cc_by_nc","plant biology","https://www.biorxiv.org/content/early/2025/02/17/2025.02.12.637878.source.xml","While DNA has built the framework for molecular insights from museum collections, the utility of archival RNA remains largely unexplored. Likely a consequence of the known instability of RNA relative to DNA, this has effectively nullified the use of herbaria for transcriptomics. Here, we challenge the assumption that herbaria cannot be used for transcriptomics by assembling transcriptomes from RNA extracted from herbarium specimens. Through systematic comparison of transcriptomes from fresh-collected, silica-dried, and archival specimens, we demonstrate the suitability of herbarium-derived RNA for transcriptomics. The practical applicability of archival mRNA was further illustrated by the functional validation of a plant immune receptor synthesized from a specimen collected in 1956. These results contradict the community consensus regarding archival RNA and open the door to subsequent transcriptomic explorations in rare and extinct species. Our findings highlight the importance of preserving and utilizing the diversity embedded within herbarium collections.","NA","biorxiv",1739916494184
"comBO: A combined human bone and lympho-myeloid bone marrow organoid for pre-clinical modelling of haematopoietic disorders","10.1101/2025.02.16.638505","biorxiv",13.749999999999998,13.749999999999998,13.749999999999998,13.749999999999998,13.749999999999998,"Shen, Y.; Benlabiod, C.; Rodriguez-Romera, A.; Watson, E.; Reyat, J. S.; Gurashi, K.; Adnan-Awad, S.; Hargreaves, R.; Kemble, S.; Smith, C. G.; Croft, A. P.; Oppermann, U.; Jooss, N.; Wong, Z. C.; Rayes, J.; Mead, A. J.; Roy, A.; Gooding, S.; Psaila, B.; Khan, A. O.","Abdullah Obaid Khan","University of Oxford","2025-02-17","1","new results","cc_no","cancer biology","https://www.biorxiv.org/content/early/2025/02/17/2025.02.16.638505.source.xml","The bone marrow supports lifelong blood and immune cell production. Current human bone marrow organoid models do not include both lymphoid and myeloid elements and lack the complexity of stromal cell types present in native haematopoietic tissues, precluding the accurate ex vivo modelling of human pathologies. Here we introduce comBOs (combined bone and lympho/myeloid bone marrow organoids) that include osteolineage, vascular, lymphoid and myeloid cells. comBOs are generated by the differentiation of induced pluripotent stem cells guided by physiologically-relevant oxygen and cytokine exposures within an innovative granular microgel scaffold to increase scalability and reproducibility. We demonstrate that comBOs can be used to generate chimeroids, incorporating healthy or aberrant cells from adult donors, and recapitulate features of diseased microenvironments. ComBOs are one of the most physiologically relevant human organoid systems to date, and this study showcases the potential of 3D in vitro disease models for discovery science and translational studies.","NA","biorxiv",1739916494184
"Phylogenomic analyses reveal that Panguiarchaeum is a clade of genome-reduced Asgard archaea","10.1101/2025.02.13.637844","biorxiv",12.349999999999998,12.349999999999998,12.349999999999998,12.349999999999998,12.349999999999998,"Huang, W.-C.; Probst, M.; Hua, Z.-S.; Szantho, L. L.; Szollosi, G. J.; Ettema, T.; Rinke, C.; Williams, T. A.; Spang, A.","Anja Spang","Department of Marine Microbiology and Biogeochemistry, NIOZ and Institute for Biodiversity and Ecosystem Dynamics, UvA","2025-02-17","1","new results","cc_by_nc_nd","evolutionary biology","https://www.biorxiv.org/content/early/2025/02/17/2025.02.13.637844.source.xml","The Asgard archaea are a diverse archaeal phylum that includes the host lineage from which eukaryotes evolved. Due to the importance of the Asgard archaea for our understanding of cellular evolution and eukaryotic complexity, recent efforts have focused on better characterizing the genomic diversity of this lineage and its relatives from the TACK archaea. Newly discovered lineages, the Njordarchaeales and Panguiarchaeales, are difficult to place, branching either with Korarchaeota or Asgard archaea. The phylogenetic position of these taxa is important because they include genome-reduced and potentially symbiotic lineages, which may help to inform our understanding of genome evolution and the evolution of symbiotic interactions within Asgard archaea and their relatives. To resolve the placement of Njordarchaeales and Panguiarchaeales in the archaeal tree, we performed a range of phylogenetic analyses revealing that the Njordarchaeales and Pangiuarchaeales constitute the newly-identified class Njordarchaeia within the Asgard archaea. Members of the Njordarchaeia exhibit hallmarks of adaptations to (hyper-) thermophilic lifestyles, which may contribute conflicting signals to phylogenetic analyses. Panguiarchaeum appears to be metabolically distinct from its relatives, displaying reduced metabolic potential and various auxotrophies. Gene tree-species tree reconciliation recovers a complex common ancestor of Asgard archaea that encoded the Wood Ljungdahl pathway, however the subsequent loss of this pathway during the reductive evolution of Panguiarchaeum may have been associated with the switch to a symbiotic lifestyle based on H2 syntrophy. Our analyses identify Panguiarchaeum as the first described Asgard archaea lineage with streamlined genomes that show indications for a symbiotic lifestyle.","NA","biorxiv",1739916494184
"A flexible Bayesian method for estimating stratigraphic intervals and their co-occurrence in time","10.1101/2025.02.13.638199","biorxiv",12.899999999999999,12.149999999999999,12.899999999999999,12.899999999999999,12.899999999999999,"Ballen, G. A.","Gustavo A. Ballen","Museu de Zoologia da Universidade de Sao Paulo","2025-02-17","1","new results","cc_by_nc","evolutionary biology","https://www.biorxiv.org/content/early/2025/02/17/2025.02.13.638199.source.xml","The fossil record is both incomplete and full of biases, which hinders making inferences about the past of life on earth. Stratigraphic intervals help us estimate two important quantities from the fossil record of a given lineage, its origination and extinction times. Many models are available in the literature. This toolset is complemented here by proposing a flexible method which allows to estimate origination and extinction times, as well as model preservation potential in flexible ways. A method is presented for representing the stratigraphic interval as a continuous distribution by integrating over parameter uncertainty through the use of the posterior predictive distribution. It is possible then to combine these distributions using conflation, to build a time probabilistic model for the co-occurrence of these intervals. Empirical examples using Palynomorphs and the origination time of the marine Barracudas are used for illustrating the potential of the method. The methods are implemented in the StratIntervals.jl Julia package, which allows a big amount of possible prior distributions, and MCMC samplers.","NA","biorxiv",1739916494184
"Functional memory T cells are derived from exhausted clones and expanded by checkpoint blockade","10.1101/2025.02.10.637523","biorxiv",35.5,11.7,35.5,35.5,35.5,"Raposo, C. J.; Yan, P. K.; Chen, A. Y.; Majidi, S.; Hiam-Galvez, K. J.; Satpathy, A. T.","Ansuman T Satpathy","Stanford University School of Medicine","2025-02-15","1","new results","cc_by_nc_nd","immunology","https://www.biorxiv.org/content/early/2025/02/15/2025.02.10.637523.source.xml","Immune checkpoint blockade can facilitate tumor clearance by T cells, resulting in long term patient survival. However, the capacity of exhausted CD8+ T cells (Tex), present during chronic antigen exposure, to form memory after antigen clearance remains unclear. Here, we performed longitudinal single cell RNA/T cell receptor sequencing and ATAC-sequencing on antigen-specific T cells after the clearance of chronic lymphocytic choriomeningitis virus (LCMV) infection. These data revealed the formation of a robust population of memory CD8+ T cells that transcriptionally, epigenetically, and functionally resemble central memory T cells (Tcm) that form after clearance of acute infection. To lineage trace the origin and memory recall response of Tex-derived memory clones, we utilized T cell receptor sequencing over the course of primary infection and rechallenge. We show that chronic Tcm are a clonally distinct lineage of Tex derived from progenitor exhausted cells, persist long-term in the absence of antigen, and undergo rapid clonal expansion during rechallenge. Finally, we demonstrate that PD-L1 immune checkpoint blockade after chronic LCMV infection preferentially expands clones which form Tcm after clearance. Together, these data support the concept that chronically stimulated T cells form bona fide functional memory T cells through an analogous differentiation pathway to acutely stimulated T cells, which may have significant implications for enhancing immune memory to cancer through checkpoint blockade and vaccination.","NA","biorxiv",1739916494184
"Assessing the Pandemic Potential of Emerging Avian Influenza A(H5N1) in the United States Using the Viral Trait Assessment for Pandemics (ViTAP) Model","10.1101/2025.02.04.25321643","medrxiv",16.5,10.799999999999999,10.799999999999999,12.649999999999997,16.5,"Jones, C.; Beitelshees, M.","Charles Jones","Independent","2025-02-05","1","PUBLISHAHEADOFPRINT","cc_by","infectious diseases","https://www.medrxiv.org/content/early/2025/02/05/2025.02.04.25321643.source.xml","In an increasingly interconnected world, the threat of a devastating influenza pandemic looms large. Highly pathogenic avian influenza A(H5N1), with its high case fatality rate and potential for adaptation in avian reservoirs, is a prime candidate for triggering such a pandemic. We applied the Viral Trait Assessment for Pandemics (ViTAP) model, a quantitative framework, to assess the pandemic potential of H5N1 strains currently circulating in the United States. Through a systematic literature review and structured expert elicitation involving virologists and epidemiologists, we refined and validated ViTAP scores across 11 key viral traits. The resulting assessment yielded a final ViTAP score of 3.28 out of 5, placing the U.S. H5N1 strains in the moderate-to-high risk category. This elevated risk is driven by the viruss high human fatality rate, its segmented RNA genome enabling reassortment, and its propensity for mutation. Sensitivity analyses highlight the transmission mode of the virus as a critical factor, with even minor increases in human-to-human spread dramatically escalating the pandemic threat. Comparisons with historical pandemics underscore the potential for H5N1 to rival the devastating impact of the 1918 H1N1 pandemic. Our findings emphasize the urgent need for enhanced surveillance in avian and mammalian hosts, targeted vaccine development, and comprehensive pandemic preparedness efforts. By demonstrating the utility of the ViTAP model for pandemic risk assessment, we provide a valuable tool to guide policy and interventions in the face of emerging zoonotic threats.","NA","medrxiv",1739916494184
"MyoFuse: A fully AI-based workflow for automated quantification of skeletal muscle cell fusion in vitro","10.1101/2025.02.17.638596","biorxiv",10.299999999999999,10.299999999999999,10.299999999999999,10.299999999999999,10.299999999999999,"Lair, B.; Cazorla, C.; Lobeto, A.; Labour, A.; Laurens, C.; Rustan, A. C.; Weiss, P.; Flores Flores, R.; Moro, C.","Benjamin Lair","Institute of Metabolic and Cardiovascular Diseases, INSERM/Toulouse University UMR1297, Toulouse, France","2025-02-17","1","new results","cc_by","cell biology","https://www.biorxiv.org/content/early/2025/02/17/2025.02.17.638596.source.xml","Background: The myogenic fusion index (FI) is commonly used in skeletal muscle cell culture to assess the ability of myoblasts to form myotubes, as the ratio of myoblast nuclei fused with myotubes over the total number of myoblasts. The manual quantification of the FI from 2D microscopy images is tedious and biased, thus several automated methods have been developed. However, they still face challenges such as efficient nucleus segmentation and classification of fused and isolated myoblast nuclei. Here, we developed a novel workflow entirely based on AI for fully automated and unbiased quantification of the FI. Results: Using current methods, we show that myoblast nuclei located above or below myotubes can significantly corrupt accurate FI computation. To circumvent this issue, we developed MyoFuse which enables an accurate and high-throughput segmentation and classification of myonuclei. It comprises a nuclei segmentation step using Cellpose, followed by a classification network trained with Svetlana. MyoFuse demonstrated strong accuracy when tested against manual annotation in mouse C2C12 and human primary myotubes. The trained classifier is able to differentiate myotube nuclei from myoblast nuclei based on myotube cytoplasm staining only. Experimental comparisons also highlighted that the previously developed methods lead to a significant overestimation of the FI. Conclusion: In summary, we underscore the lack of accuracy of traditional methods for automated FI quantification. MyoFuse enables a direct and accurate segmentation of nuclei even in nuclei clusters frequently observed in myotubes. This workflow thus offers a new and more reliable method to evaluate the FI. It also limits the selection bias by processing large images.","NA","biorxiv",1739916494184
"ActSeek: Fast and accurate search algorithm of active sites in Alphafold database","10.1101/2025.02.11.637678","biorxiv",20.65,10.1,20.65,20.65,20.65,"Castillo, S.; Ollila, O. H. S.","Sandra Castillo","VTT","2025-02-15","1","new results","cc_by_nc_nd","bioinformatics","https://www.biorxiv.org/content/early/2025/02/15/2025.02.11.637678.source.xml","Finding proteins with specific functions by mining modern databases can potentially lead to substantial advancements in wide range of fields, from medicine and biotechnology to material science. Currently available algorithms enable mining of proteins based on their sequence or structure. However, activities of many proteins, such as enzymes and drug targets, are dictated by active site residues and their surroundings rather than the overall structure or sequence of a protein. Here we present ActSeek - a computer vision-inspired fast program - that searches structural databases for proteins with active sites similar to the seed protein. ActSeek is implemented to mine proteins with desired active site environments from the Alphafold database. The potential of ActSeek to find innovative solutions to the worlds most pressing challenges is demonstrated by finding enzymes that may be used to produce biodegradable plastics or degrade plastics, as well as potential off-targets for common drug molecules.","NA","biorxiv",1739916494184
