"title","doi","altmetric_jid","score","X1d","X3d","X1w","X1m","authors","author_corresponding","author_corresponding_institution","date","version","type","license","category","jatsxml","abstract","published","server","upupdate_time"
"Evaluating Long-Term Autonomic Dysfunction and Functional Impacts of Long COVID: A Follow-Up Study","10.1101/2024.10.11.24315277","medrxiv",190.94999999999965,57.05000000000003,84.24999999999997,190.94999999999965,190.94999999999965,"Eastin, E.; Machnik, J.; Larsen, N.; Seliger, J.; Geng, L. N.; Bonilla, H.; Yang, P.; Stiles, L.; Miglis, M. G.","Mitchell G Miglis","Stanford University","2024-10-16","1","PUBLISHAHEADOFPRINT","cc_no","infectious diseases","https://www.medrxiv.org/content/early/2024/10/16/2024.10.11.24315277.source.xml","BackgroundThe longitudinal prevalence and autonomic symptom burden in Long COVID patients is not well-established.

ObjectiveAssess the duration and severity of autonomic dysfunction in adults with Long COVID and evaluate its impact on function and quality of life.

DesignA follow-up survey of a subset of participants from a cross-sectional online survey of adults with Long COVID. Multivariable logistic regression identified predictors of moderate to severe autonomic dysfunction.

Participants526 adults (ages 20-65) with a history of Long COVID

Main measuresThe Composite Autonomic Symptom 31 (COMPASS-31) score, the RAND 36-Item Health Survey, the prevalence of new postural orthostatic tachycardia syndrome (POTS), and predictors of autonomic dysfunction, including POTS

Key results71.9% of Long COVID patients had a COMPASS-31 score >20, suggestive of moderate to severe autonomic dysfunction. The median symptom duration was 36 [30-40] months, reaching up to 3.5 years after SARS-CoV-2 infection. 37.5% of Long COVID patients could no longer work or had to drop out of school due to their Long COVID illness. 40.5% were newly diagnosed with POTS following SARS-CoV-2 infection.

ConclusionsEvidence of persistent moderate to severe autonomic dysfunction was seen in 71.9% of Long COVID patients in our study, with a 36-month median symptom duration, suggesting that enduring autonomic dysfunction is highly prevalent in the Long COVID population. Moderate to severe autonomic dysfunction was significantly correlated with impaired function and capacity, highlighting the need to address POTS and other manifestations of autonomic dysfunction as a key component of Long COVID management.","NA","medrxiv",1729634990535
"A long context RNA foundation model for predicting transcriptome architecture","10.1101/2024.08.26.609813","biorxiv",51.100000000000016,31.6,31.6,31.6,38.05000000000001,"Saberi, A.; Choi, B.; Wang, S.; Hernandez-Corchado, A.; Naghipourfar, M.; Namini, A.; Ramani, V.; Emad, A.; Najafabadi, H. S.; Goodarzi, H.","Hani Goodarzi","UCSF","2024-10-21","2","new results","cc_by_nc_nd","bioinformatics","https://www.biorxiv.org/content/early/2024/10/21/2024.08.26.609813.source.xml","Linking DNA sequence to genomic function remains one of the grand challenges in genetics and genomics. Here, we combine large-scale single-molecule transcriptome sequencing of diverse cancer cell lines with cutting-edge machine learning to build LoRNASH, an RNA foundation model that learns how the nucleotide sequence of unspliced pre-mRNA dictates transcriptome architecture--the relative abundances and molecular structures of mRNA isoforms. Owing to its use of the StripedHyena architecture, LoRNASH handles extremely long sequence inputs (~65 kilobase pairs), allowing for quantitative, zero-shot prediction of all aspects of transcriptome architecture, including isoform abundance, isoform structure, and the impact of DNA sequence variants on transcript structure and abundance. We anticipate that our public data release and proof-of-concept model will accelerate varying aspects of RNA biotechnology. More broadly, we envision the use of LoRNASH as a foundation for fine-tuning of any transcriptome-related downstream prediction task, including cell-type specific gene expression, splicing, and general RNA processing.","NA","biorxiv",1729634990535
"Replication-dependent histone (Repli-Histo) labeling dissects the physical properties of euchromatin/heterochromatin in living human cells.","10.1101/2024.10.20.618801","biorxiv",48.20000000000002,23.300000000000004,48.20000000000002,48.20000000000002,48.20000000000002,"Minami, K.; Ide, S.; Nakazato, K.; Kaizu, K.; Higashi, K.; Tamura, S.; Toyoda, A.; Takahashi, K.; Kurokawa, K.; Maeshima, K.","Kazuhiro Maeshima","National Institute of Genetics","2024-10-21","1","new results","cc_by_nc","cell biology","https://www.biorxiv.org/content/early/2024/10/21/2024.10.20.618801.source.xml","A string of nucleosomes, where genomic DNA is wrapped around histones, is organized in the cell as chromatin. Chromatin in the cell varies greatly, from euchromatin to heterochromatin, in its genome functions. It is important to understand how heterochromatin is physically different from euchromatin. However, their specific labeling methods in living cells are limited. To address this, we have developed replication-dependent histone labeling (Repli-Histo labeling) to label nucleosomes in euchromatin and heterochromatin based on DNA replication timing. We investigated local nucleosome motion in the four chromatin classes from euchromatin to heterochromatin of living human and mouse cells. We found that more euchromatic regions (earlier replicated regions) show greater nucleosome motion. Notably, the motion profile in each chromatin class persists throughout interphase. Genome chromatin is essentially replicated from regions with greater nucleosome motions, even though the replication timing program is perturbed. Our findings, combined with computational modeling, suggest that earlier replicated regions have more accessibility and local chromatin motion can be a major determinant of genome-wide replication timing.","NA","biorxiv",1729634990535
"Tissue-Like Multicellular Development Triggered by Mechanical Compression in Archaea","10.1101/2024.10.19.619234","biorxiv",46.65000000000001,16.349999999999998,46.65000000000001,46.65000000000001,46.65000000000001,"Rados, T.; Leland, O.; Escudeiro, P.; Mallon, J.; Andre, K.; Caspy, I.; vonKugelgen, A.; Stolovicki, E.; Nguyen, S.; Patop, I.; Rangel, L. T.; Kadener, S.; Renner, L.; Thiel, V.; Soen, Y.; Bharat, T.; Alva, V.; Bisson, A.","Alex Bisson","Brandeis University","2024-10-19","1","new results","cc_by_nc","cell biology","https://www.biorxiv.org/content/early/2024/10/19/2024.10.19.619234.source.xml","The advent of clonal multicellularity is a critical evolutionary milestone, seen often in eukaryotes, rarely in bacteria, and - until now - never in archaea. We show that uniaxial compression induces clonal multicellularity in haloarchaea, forming tissue-like structures. These archaeal tissues are mechanically and molecularly distinct from their unicellular lifestyle, mimicking several eukaryotic features. Notably, archaeal tissues undergo a coenocytic stage followed by a tubulin-independent cellularization, orchestrated by active membrane tension at a critical cell size. Past cellularization, tissues are organized into two cell types - apical and basal scutoids - with junction elasticity akin to animal tissues, with actin and protein glycosylation as fiducial polarity markers. Our findings highlight the remarkable biophysical potential of convergent evolution in the emergence of multicellular systems across domains of life.","NA","biorxiv",1729634990535
"Intrinsic Diversity in Primary Cilia Revealed Through Spatial Proteomics","10.1101/2024.10.20.619273","biorxiv",16.5,15.999999999999998,16.5,16.5,16.5,"Lundberg, E.; Hansen, J.; Sun, H.; Kahnert, K.; Johannesson, A.; Tzavlaki, K.; Winsnes, C.; Pohjahnen, E.; Fall, J.; Uhlen, M.; Axelsson, U.; Navarro, F. B.; Backstrom, A.; Lindskog, C.; Johansson, F.; von Feilitzen, K.; Vega, A. D.; Casals, A. M.; Mahdessian, D.; Lindstrand, A.; Westenius, E.","Emma Lundberg","Stanford University","2024-10-21","1","new results","cc_by_nc_nd","cell biology","https://www.biorxiv.org/content/early/2024/10/21/2024.10.20.619273.source.xml","Primary cilia are solitary filamentous protrusions on most human cells. Our understanding of their function is informed by the study of ciliopathies, hereditary diseases linked to cilia dysfunction. These disorders present a wide array of symptoms, highlighting the tissue-specific roles of cilia. However, cell-state and cell-type specific functions remain poorly understood due to limited tools for analyzing individual ciliary protein composition. Here, we utilize antibody-based spatial proteomics to expand the Human Protein Atlas with a dedicated section for primary cilia. We identify the subciliary locations of 654 proteins across three cell lines, analyzing 218,412 individual cilia. Our findings reveal that 67% of the ciliary proteins are cell-type specific and that 78% of ciliary proteins show heterogeneous localization patterns within cell populations, suggesting that the functional tuning of individual cilia is substantially driven by protein trafficking rather than gene expression. Our atlas portrays the cilium as a dynamic sensory organelle, suggesting that individual cells can fine-tune their ciliary structure - both in terms of receptors and signaling components - to sense and integrate diverse signals, computing a response to relay to the cell body. We identify 71 novel cilia proteins, establish CFAP300 as a specific and broad marker for cilia, and suggest multiple potential ciliopathy genes including CREB3, where we show that a coding genetic variant can be linked to blindness and skeletal abnormalities. In summary, our spatially resolved cilia atlas paves new avenues for basic and clinical research on cilia and ciliopathies.","NA","biorxiv",1729634990535
"Engineering Resilient Gene Drives Towards Sustainable Malaria Control: Predicting, Testing and Overcoming Target Site Resistance","10.1101/2024.10.21.618489","biorxiv",15.799999999999999,15.799999999999999,15.799999999999999,15.799999999999999,15.799999999999999,"Morianou, I.; Phillimore, L.; Khatri, B. S.; Marston, L.; Gribble, M.; Burt, A.; Bernardini, F.; Hammond, A. M.; Nolan, T.; Crisanti, A.","Andrew M. Hammond","Imperial College London","2024-10-21","1","new results","cc_by_nc","synthetic biology","https://www.biorxiv.org/content/early/2024/10/21/2024.10.21.618489.source.xml","CRISPR-based gene drives are selfish genetic elements with the potential to spread through entire insect populations for sustainable vector control. Gene drives designed to disrupt the reproductive capacity of females can suppress laboratory populations of the malaria mosquito. However, any suppressive intervention will inevitably exert an evolutionary pressure for resistance. Here, we present a pipeline for the accelerated discovery, engineering, and testing of both natural and drive-induced variants that could reverse gene drive spread. We applied our method to stress-test a highly effective gene drive that has evaded resistance in all laboratory-contained releases to date, known as Ag(QFS)1. We showed that previously undetected resistant alleles can arise at low frequency, and discovered novel, partially resistant alleles that can perturb drive-invasion dynamics. We then engineered next-generation gene drives that can actively remove resistant alleles by targeting several highly conserved and non-overlapping sites in the female-specific exon of the doublesex gene. Our models predict that such gene drive designs could suppress large, natural populations of the malaria mosquito in the field.","NA","biorxiv",1729634990535
"Getting to the bottom of social learning: Chimpanzees copy arbitrary behavior from conspecifics","10.1101/2024.08.30.607436","biorxiv",56.66000000000001,15.149999999999997,30.250000000000007,30.250000000000007,30.250000000000007,"van Leeuwen, E. J. C.; Bryon, E.; Rogers, A.; Balaran, A.; Motsch, P.; Brooker, J. S.","Edwin J. C. van Leeuwen","Utrecht University","2024-08-30","1","new results","cc_no","animal behavior and cognition","https://www.biorxiv.org/content/early/2024/08/30/2024.08.30.607436.source.xml","Studying animal culture has been crucial for understanding the complexities of knowledge transmission and tracing human cultures evolutionary origins1. Defined as the use of tools to provide clear practical benefits to individuals, well-documented examples of material culture include nut-cracking2 and termite fishing3 in chimpanzees. Additionally, there is growing interest in animal social traditions, which appear crucial for social interaction and group cohesion. We have previously documented such a tradition, in which chimpanzees copied inserting blades of grass in their ears from one persistent inventor4. Now, over a decade later, we have observed an unrelated group of chimpanzees where 5/8 individuals began wearing grass in their ears and 6/8 from their rectums. As of 2024, one newly introduced chimpanzee has adopted the grass-in-ear behavior. Given that the behaviors were not observed in seven other groups in the same sanctuary (N=148), we conclude that social learning of arbitrary behavior occurred and discuss our findings considering the larger scope of animal culture.","NA","biorxiv",1729634990535
"Hijacking and Integration of Algal Plastids andMitochondria in a Polar Planktonic Host","10.1101/2024.10.20.619283","biorxiv",14.749999999999998,14.749999999999998,14.749999999999998,14.749999999999998,14.749999999999998,"Rao, A. K.; Yee, D. P.; Chevalier, F.; Lekieffre, C.; Pavie, M.; Olivetta, M.; Dudin, O.; Gallet, B.; Hehenberger, E.; Seifi, M.; Jug, F.; Deschamps, J.; Wu, T.-D.; Gast, R.; Jouneau, P.-H.; Decelle, J.","Johan Decelle","CNRS","2024-10-21","1","new results","cc_by_nc_nd","ecology","https://www.biorxiv.org/content/early/2024/10/21/2024.10.20.619283.source.xml","In oceanic plankton, various host organisms are capable of engulfing and temporarily integrating microalgae (photosymbiosis) or just their photosynthetic plastids (kleptoplastidy) as a solar-powered energy source. These cellular interactions can be considered to be representative of evolutionary steps in plastid acquisition in eukaryotes, but the underlying cellular mechanisms and dynamics are not fully understood. Here, we studied a kleptoplastidic dinoflagellate (RSD: Ross Sea Dinoflagellate), which is known to steal plastids of the microalga Phaeocystis antarctica. We tracked the morphology and activity of stolen plastids over several months by combining multimodal subcellular imaging and photophysiology. Upon integration inside a host vacuole, the volume of plastids and pyrenoids significantly increased and photosynthetic activity was boosted along with carbon fixation and transfer to the host. This may be supported by the retention of a 50-fold larger algal nucleus for ~1 week. Once the algal nucleus was lost, there was a decrease in plastid volume and photosynthesis, but plastids were still beneficial for the host after > 2 months. Unlike other kleptoplastidic interactions, we showed that the algal mitochondrion was also stolen and retained for several months, transforming into an extensive network in close proximity with plastids. This highlights a new strategy in plankton along the continuum of plastid symbioses where both the energy-producing plastid and mitochondrion of a microalga are hijacked for several months by a host. This symbiosis that we found to be widely-distributed in polar regions suggests that plastid-mitochondrion interaction may have played a role in the evolution of plastid acquisition.","NA","biorxiv",1729634990535
"Methylthio-alkane reductases use nitrogenase metalloclusters for carbon-sulfur bond cleavage","10.1101/2024.10.19.619033","biorxiv",20.700000000000003,13.649999999999999,20.700000000000003,20.700000000000003,20.700000000000003,"Lago-Maciel, A.; Soares, J. C.; Zarzycki, J.; Buchanan, C. J.; Reif-Trauttmansdorff, T.; Schmidt, F. V.; Lometto, S.; Paczia, N.; Schuller, J. M.; Hansen, D. F.; Heller, G. T.; Prinz, S.; Hochberg, G. K. A.; Pierik, A. J.; Rebelein, J. G.","Johannes G Rebelein","Max Planck Institute for Terrestrial Microbiology","2024-10-19","1","new results","cc_by_nc_nd","biochemistry","https://www.biorxiv.org/content/early/2024/10/19/2024.10.19.619033.source.xml","Methylthio-alkane reductases convert methylated sulfur compounds to methanethiol and small hydrocarbons, a process with important environmental and biotechnological implications. These enzymes are classified as nitrogenase-like enzymes, despite lacking the ability to convert dinitrogen to ammonia, raising fundamental questions about the factors controlling their activity and specificity. Here, we present the first molecular structure of the methylthio-alkane reductase, which reveals large metalloclusters, including the P-cluster and the [Fe8S9C]-cluster, previously only found in nitrogenases. Our findings suggest that distinct metallocluster coordination, surroundings, and substrate channels, determine the activity of these related metalloenzymes. This study provides new insights into nitrogen fixation, sulfur-compound reduction, and hydrocarbon production. We also shed light on the evolutionary history of P-cluster and [Fe8S9C]-cluster-containing reductases emerging prior to nitrogenases.","NA","biorxiv",1729634990535
"Single-step in vitro ribosome reconstitution mediated by two GTPase factors, EngA and ObgE","10.1101/2024.10.17.618970","biorxiv",21.500000000000007,12.949999999999998,21.250000000000004,21.500000000000007,21.500000000000007,"Sato, A.; Lai, W. Y.; Sakai, Y.; Shimizu, Y.","Yoshihiro Shimizu","RIKEN Center for Biosystems Dynamics Research","2024-10-18","1","new results","cc_by_nc_nd","biochemistry","https://www.biorxiv.org/content/early/2024/10/18/2024.10.17.618970.source.xml","When bacterial ribosomes are assembled in vitro, manipulation of incubation temperature and magnesium ion concentration have been an essential procedure, which is a crucial step for the assembly of active large subunits. The present study tackles with this issue to develop a single-step procedure, which can be performed in a physiological condition. We found that GTPase factors EngA and ObgE can complement the changes in temperature and magnesium ion concentrations. In the presence of these factors, ribosome assembly can proceed under physiological conditions, with magnesium ion concentrations below 10 mM, potassium concentrations around 100 mM, and temperatures of 37 {degrees}C. Both the ribosome assembly and translation processes were successfully integrated in the reconstituted cell-free protein synthesis system. Furthermore, we found that these GTPase factors can reassemble the ribosomes to an active state, whose structure was disrupted by EDTA chelation of magnesium ions, indicating that these two factors can reversibly induce the ribosome structure to an intact state. The findings are essential for the bottom-up construction of synthetic cells.","NA","biorxiv",1729634990535
"Polygenic modifiers of expressivity in telomere biology disorders","10.1101/2024.10.17.24315475","medrxiv",12.899999999999999,12.899999999999999,12.899999999999999,12.899999999999999,12.899999999999999,"Poeschla, M.; Arora, U. P.; Walne, A.; McReynolds, L. J.; Niewisch, M. R.; Giri, N.; Zeigler, L.; Gusev, A.; Machiela, M. J.; Tummala, H.; Savage, S. A.; Sankaran, V. G.","Vijay G. Sankaran","Boston Children\'s Hospital","2024-10-21","1","PUBLISHAHEADOFPRINT","cc_by_nc_nd","genetic and genomic medicine","https://www.medrxiv.org/content/early/2024/10/21/2024.10.17.24315475.source.xml","Variable expressivity, where individuals carrying identical genetic variants display diverse phenotypes, presents an important challenge in clinical genetics. This is exemplified by the telomere biology disorders (TBDs), which exhibit tremendous clinical heterogeneity despite their presumed monogenic nature, even among individuals harboring the same pathogenic variant. Here, we studied cohorts of patients with TBDs and population biobanks to demonstrate that common genome-wide polymorphisms associated with variation in telomere length in the general population combine with large-effect causal variants to significantly impact TBD expressivity. We go on to show that polygenic variation can contribute to expressivity within a single family with a shared large-effect causal variant, and that common and rare variation converge on a shared set of genes implicated in telomere maintenance. By elucidating the role of common genetic variation in rare disease expressivity in TBDs, these results provide a framework for understanding phenotypic variability in other presumed monogenic disorders.","NA","medrxiv",1729634990535
"Dysregulation of the fluid homeostasis system by aging","10.1101/2024.09.26.615271","biorxiv",14.858,12.608,12.608,12.608,14.858,"Jang, H.; Behne Sharma, A.; Dan, U.; Wong, J. H.; Knight, Z. A.; Garrison, J. L.","Jennifer L. Garrison","Buck Institute for Research on Aging","2024-09-27","1","new results","cc_by_nc_nd","neuroscience","https://www.biorxiv.org/content/early/2024/09/27/2024.09.26.615271.source.xml","Chronic dehydration is a leading cause of morbidity for the elderly, but how aging alters the fluid homeostasis system is not well understood. Here, we used a combination of physiologic, behavioral and circuit analyses to characterize how fluid balance is affected by aging in mice. We found that old mice have a primary defect in sensing and producing the anti-diuretic hormone vasopressin, which results in chronic dehydration. Recordings and manipulations of the thirst circuitry revealed that old mice retain the ability to sense systemic cues of dehydration but are impaired in detecting presystemic, likely oropharyngeal, cues generated during eating and drinking, resulting in disorganized drinking behavior on short timescales. Surprisingly, old mice had increased drinking and motivation after 24-hour water deprivation, indicating that aging does not result in a general impairment in the thirst circuit. These findings reveal how a homeostatic system undergoes coordinated changes during aging.","NA","biorxiv",1729634990535
"A human brain network linked to restoration of consciousness after deep brain stimulation","10.1101/2024.10.17.24314458","medrxiv",30.35000000000001,12.45,30.35000000000001,30.35000000000001,30.35000000000001,"Warren, A. E. L.; Raguz, M.; Friedrich, H.; Schaper, F. L. W. V. J.; Tasserie, J.; Snider, S. B.; Li, J.; Chua, M. M. J.; Butenko, K.; Friedrich, M. U.; Jha, R.; Iglesias, J. E.; Carney, P. W.; Fischer, D.; Fox, M. D.; Boes, A. D.; Edlow, B. L.; Horn, A.; Chudy, D.; Rolston, J. D.","Aaron E.L. Warren","Brigham and Women\'s Hospital, Harvard Medical School","2024-10-18","1","PUBLISHAHEADOFPRINT","cc_by_nc_nd","neurology","https://www.medrxiv.org/content/early/2024/10/18/2024.10.17.24314458.source.xml","Disorders of consciousness (DoC) are states of impaired arousal or awareness. Deep brain stimulation (DBS) is a potential treatment, but outcomes vary, possibly due to differences in patient characteristics, electrode placement, or stimulation of specific brain networks. We studied 40 patients with DoC who underwent DBS targeting the thalamic centromedian-parafascicular complex. Better-preserved gray matter, especially in the striatum, correlated with consciousness improvement.

Stimulation was most effective when electric fields extended into parafascicular and subparafascicular nuclei--ventral to the centromedian nucleus, near the midbrain-- and when it engaged projection pathways of the ascending arousal network, including the hypothalamus, brainstem, and frontal lobe. Moreover, effective DBS sites were connected to networks similar to those underlying impaired consciousness due to generalized absence seizures and acquired lesions. These findings support the therapeutic potential of DBS for DoC, emphasizing the importance of precise targeting and revealing a broader link between effective DoC treatment and mechanisms underlying other conscciousness-impairing conditions.","NA","medrxiv",1729634990535
