"title","doi","altmetric_jid","score","X1d","X3d","X1w","X1m","authors","author_corresponding","author_corresponding_institution","date","version","type","license","category","jatsxml","abstract","published","server","upupdate_time"
"Risk of Hair Loss with Semaglutide for Weight Loss","10.1101/2025.02.23.25322568","medrxiv",310.15,8,14.95,169.6,254.65,"Sodhi, M.; Rezaeianzadeh, R.; Kezouh, A.; Frey, C.; Etminan, M.","Mahyar Etminan","University of British Columbia","2025-03-06","2","PUBLISHAHEADOFPRINT","cc_by","epidemiology","https://www.medrxiv.org/content/early/2025/03/06/2025.02.23.25322568.source.xml","GLP-1 (glucagon-like peptide-1) agonists including semaglutide are some of the most prescribed medications in the world. Many recent studies have quantified their adverse events with a focus on gastrointestinal adverse events. However, no large epidemiologic study has investigated the risk of hair loss with these medications. We conducted a retrospective cohort study using a large health claims database to investigate this risk. Using a random sample of 16 million patients, we identified new users of semaglutide and an active comparator bupropion-naltrexone. We excluded those with a diagnosis of diabetes or use of antihyperglycemics prior to cohort entry. Cohort members were followed from the first date of a study drug prescription to the diagnosis of hair loss. We adjusted for age, sex, geographic location, depression, steroid use, hypothyroidism, polycystic ovary syndrome, and anemia. Our cohort included 1,926 semaglutide users and 1,348 users of bupropion-naltrexone. The incidence of hair loss was higher among the semaglutide group than the active comparator, bupropion-naltrexone. The adjusted hazard ratio for hair loss for all patients using semaglutide, for men, and for women compared to bupropion-naltrexone were 1.52 (95% confidence interval (CI):0.86-2.69), 0.86 (95% CI: 0.05-14.49), and 2.08 (95% CI: 1.17-3.72) respectively. Our results demonstrate an increased risk of hair loss with semaglutide in women. Future studies are required to ascertain the association between semaglutide and hair loss.","NA","medrxiv",1744582124635
"Real-time tracking of mRNP complex assembly reveals various mechanisms that synergistically enhance translation repression","10.1101/2025.04.07.647595","biorxiv",27.95000000000001,7.85,27.95000000000001,27.95000000000001,27.95000000000001,"Payr, M.; Meyer, J.; Geissen, E.-M.; Hennig, J.; Duss, O.","Janosch Hennig","European Molecular Biology Laboratory Heidelberg","2025-04-10","1","new results","cc_by","biophysics","https://www.biorxiv.org/content/early/2025/04/10/2025.04.07.647595.source.xml","Protein biosynthesis must be highly regulated to ensure proper spatiotemporal gene expression and thus cellular viability. Translation is often modulated at the initiation stage by RNA binding proteins through either promotion or repression of ribosome recruitment to the mRNA. However, it largely remains unknown how the kinetics of mRNA ribonucleoprotein (mRNP) assembly on untranslated regions (UTRs) relates to its translation regulation activity. Using Sex-lethal (Sxl)-mediated translation repression of msl-2 in female fly dosage compensation as a model system, we show that different mechanisms in mRNP assembly synergistically achieve tight translation repression. Using multi-color single-molecule fluorescence microscopy we show that 1) Sxl targets its binding sites via sliding and double-binding, 2) that Unr recruitment is accelerated over 500-fold by RNA-bound Sxl and 3) that Hrp48 further stabilizes RNA-bound Sxl indirectly via ATP-independent RNA remodeling. Overall, we provide a framework to study how multiple RBPs dynamically cooperate with RNA to achieve function.","NA","biorxiv",1744582124635
"Structures of protein folding intermediates on the ribosome","10.1101/2025.04.07.647236","biorxiv",17.349999999999998,7.2,17.349999999999998,17.349999999999998,17.349999999999998,"Chan, S. H. S.; Streit, J. O.; Wlodarski, T.; Mitropoulou, A.; Cabrita, L. D.; Christodoulou, J.","John Christodoulou","University College London","2025-04-11","1","new results","cc_by_nc_nd","biophysics","https://www.biorxiv.org/content/early/2025/04/11/2025.04.07.647236.source.xml","The ribosome biases the conformations sampled by nascent polypeptide chains along folding pathways towards biologically active states. A hallmark of the co-translational folding (coTF) of many proteins are highly stable folding intermediates that are absent or only transiently populated off the ribosome, yet persist during translation well-beyond complete emergence of the domain from the ribosome exit tunnel. Intermediates are important for folding fidelity; however, their structures have remained elusive. Here, we have structurally characterised two coTF intermediates of an immunoglobulin-like domain by developing comprehensive 19F NMR analyses using chemical shifts, paramagnetic relaxation enhancement (PRE), and protein engineering. We integrated these experimental data with extensive molecular dynamics (MD) simulations to obtain atomistic structures of the folding intermediates on the ribosome. The resulting structures are distinguished by native-like folds initiated from either their N- or C-termini, and reveal multiple parallel folding pathways, which are structurally conserved within the protein domain family, in contrast to their in vitro refolding mechanisms. By redirecting proteins to fold along hierarchical, parallel routes, the ribosome may promote efficient folding by avoiding kinetic traps, and regulate nascent chain assembly and targeting by auxiliary factors to maintain cellular proteostasis.","NA","biorxiv",1744582124635
"4D mitochondrial network assumes distinct and predictive phenotypes through human lung and intestinal epithelial development","10.1101/2025.04.09.648043","biorxiv",7.8999999999999995,6.8999999999999995,7.8999999999999995,7.8999999999999995,7.8999999999999995,"McMahon, G.; Agarwal, D.; Arora, M.; Wang, Z.; Hakozaki, H.; Schöneberg, J.","Johannes Schöneberg","University of California, San Diego","2025-04-10","1","new results","cc_no","cell biology","https://www.biorxiv.org/content/early/2025/04/10/2025.04.09.648043.source.xml","Mitochondria form a dynamic three-dimensional network within the cell that exhibits a wide range of morphologies and behaviors. Depending on cell state, cell type, and cell fate, a cells mitochondrial phenotype might range from relatively isolated mitochondrial segments to complex branching networks, and from stationary mitochondria to highly motile structures. While isolated mitochondrial phenotypes have been described for a subset of cell states, types, and fates, an integrated map of how mitochondrial phenotypes change over the full course of tissue development has so far been lacking. Here, we identify the mitochondrial phenotypes that appear throughout the course of lung and intestinal epithelial development from stem cells to differentiated tissue. Using human stem cell-derived intestinal and branching lung organoids that mimic developing human organs as model systems, we extract and analyze key mitochondrial biophysical phenotypes in human development. To achieve this, we employ lattice light-sheet microscopy (LLSM), which enables high-resolution, 4D (x, y, z, time) imaging of mitochondria in organoid tissues with minimal damage to the sample. We image at key developmental time points from stem cell differentiation into mature organoid tissue. For data processing, we utilize the MitoGraph and MitoTNT software packages along with our developed custom computational tools. These tools allow for automated 4D organoid to single cell image processing and quantitative 4D single cell mitochondrial temporal network tracking. This work represents the first 4D high spatiotemporal-resolution quantification of live human organoid tissues at the single-cell level through development. We identified distinct mitochondrial phenotypes unique to each organoid type and found correlations between mitochondrial phenotypes, cellular age, and cell type. Furthermore, we demonstrate that mitochondrial network characteristics can predict both organoid type and cell age. Our findings reveal fundamental aspects of mitochondrial biology that were previously unobservable, offering new insights into cell-type-specific mitochondrial dynamics and enabling new findings in relevant human model systems. We believe that our findings and methods will be essential for advancing 4D cell biology, providing a powerful framework for characterizing organelles in organoid tissues.","NA","biorxiv",1744582124635
"A common framework for semantic memory and semantic composition","10.1101/2025.04.11.648390","biorxiv",6.300000000000001,6.300000000000001,6.300000000000001,6.300000000000001,6.300000000000001,"Law, R. M. C.; Hauk, O.; Lambon Ralph, M.","Ryan M. C. Law","University of Cambridge","2025-04-11","1","new results","cc_by","neuroscience","https://www.biorxiv.org/content/early/2025/04/11/2025.04.11.648390.source.xml","How the brain constructs meaning from individual words and phrases is a fundamental question for research in semantic cognition, language and their disorders. These two aspects of meaning are traditionally studied separately, resulting in two large, multi-method literatures, which we sought to bring together in this study. Not only would this address basic cognitive questions of how semantic cognition operates but also because, despite their distinct focuses, both literatures ascribe a critical role to the anterior temporal lobe (ATL) in each aspect of semantics. Given these considerations, we explored the notion that these systems rely on common underlying computational principles when activating conceptual semantic representations via single words, vs. building a coherent semantic representation across sequences of words. The present study used magnetoencephalography and electroencephalography to track brain activity in participants reading nouns and adjective-noun phrases, whilst integrating conceptual variables from both literatures: the concreteness of nouns (e.g., ""lettuce"" vs. ""fiction"") and the denotational semantics of adjectives (subsective vs. privative; e.g., ""bad"" vs. ""fake""). Region-of-interest analyses show that the left, and to a lesser extent the right, ATLs responded more strongly to phrases at different timepoints, irrespective of concreteness, suggesting a unified ATL function for semantic memory and composition. Decoding analyses further revealed a time-varying representational format for adjective semantics, whereas representations of noun concreteness were more stable and maintained for around 300 ms. Further, the neural representation of noun concreteness was modulated by the preceding adjectives: decoders learning concreteness signals in single words generalized better to subsective relative to privative phrases.","NA","biorxiv",1744582124635
"De novo chemo-optogenetics through rational small-molecule design and TRAP display","10.1101/2025.04.10.648175","biorxiv",9.2,5.35,9.2,9.2,9.2,"Miyazaki, T.; Fujino, T.; Yoshii, T.; Funane, M.; Murata, N.; Kim, C. N.; Nagatoishi, S.; Tsumoto, K.; Hayashi, G.; Murakami, H.; Tsukiji, S.","Shinya Tsukiji","Nagoya Institute of Technology","2025-04-10","1","new results","cc_by_nc_nd","synthetic biology","https://www.biorxiv.org/content/early/2025/04/10/2025.04.10.648175.source.xml","Optical control of biomolecules is a powerful technique for biological research, but current tools derived from natural proteins face significant limitations. Engineering these proteins to meet researchers' needs remains challenging. In this study, we present a novel approach to the de novo creation of tailored chemo-optogenetic tools. This method combines the rational design of synthetic photo-switchable molecules with in vitro selection of artificial protein binders that specifically recognize a particular conformation of these molecules. We demonstrate the utility of this approach by generating artificial proteins that bind exclusively to the cis-form of designed azobenzene derivatives. The newly created pairs enable sustained protein activation with a single light pulse and allow for precise, reversible, and repeatable switching of cellular processes using two distinct wavelengths of light in mammalian cells. This de novo technique provides tailored synthetic photoswitch-protein binder pairs, expanding the potential for optical biomolecule manipulation.","NA","biorxiv",1744582124635
"scnanoseq: an nf-core pipeline for Oxford Nanopore single-cell RNA-sequencing","10.1101/2025.04.08.647887","biorxiv",20.349999999999998,4.550000000000001,20.349999999999998,20.349999999999998,20.349999999999998,"Trull, A.; nf-core community,  ; Worthey, E. A.; Ianov, L.","Lara Ianov","Department of Neurobiology, University of Alabama at Birmingham, Birmingham, AL, USA.","2025-04-11","1","confirmatory results","cc_by_nd","bioinformatics","https://www.biorxiv.org/content/early/2025/04/11/2025.04.08.647887.source.xml","Recent advancements in long-read single-cell RNA sequencing (scRNA-seq) have facilitated the quantification of full-length transcripts and isoforms at the single-cell level. Historically, long-read data would need to be complemented with short-read single-cell data in order to overcome the higher sequencing errors to correctly identify cellular barcodes and unique molecular identifiers. Improvements in Oxford Nanopore sequencing, and development of novel computational methods have removed this requirement. Though these methods now exist, the limited availability of modular and portable workflows remains a challenge. Here we present, nf-core/scnanoseq, a secondary analysis pipeline for long-read single-cell and single-nuclei RNA that delivers gene and transcript-level quantification. The scnanoseq pipeline is implemented using Nextflow and is built upon the nf-core framework, enabling portability across computational environments, scalability and reproducibility of results across pipeline runs. The nf-core/scnanoseq workflow follows best practices for analyzing single-cell and single-nuclei data, performing barcode detection and correction, genome and transcriptome read alignment, unique molecular identifier deduplication, gene and transcript quantification, and extensive quality control reporting.","NA","biorxiv",1744582124635
"A conserved differentiation program facilitates inhibitory neuron production in the developing mouse and human cerebellum","10.1101/2025.04.10.648162","biorxiv",11.649999999999999,4.45,11.649999999999999,11.649999999999999,11.649999999999999,"Christensen, J. B.; Donovan, A. P. A.; Moradi, M.; Vanacore, G.; Helmy, M.; Reid, A. J.; Lee, J. T. H.; Bayraktar, O. A.; Brand, A. H.; Bayin, N. S.","N Sumru Bayin","Gurdon Institute, Cambridge University, Cambridge, UK and Department of Physiology, Development and Neuroscience, Cambridge University, Cambridge, UK","2025-04-10","1","new results","cc_by_nc_nd","developmental biology","https://www.biorxiv.org/content/early/2025/04/10/2025.04.10.648162.source.xml","Understanding the molecular mechanisms driving lineage decisions and differentiation during development is challenging in complex systems with a diverse progenitor pool, such as the mammalian cerebellum. Importantly, how different transcription factors cooperate to generate neural diversity and the gene regulatory mechanisms that drive neuron production, especially during the late stages of cerebellar development are poorly understood. Here, we used single cell RNA-sequencing (scRNA-seq) to investigate the developmental trajectories of Nestin-expressing progenitors (NEPs) in the neonatal mouse cerebellum. We identified FOXO1 as a key regulator of NEP-to-inhibitory neuron differentiation, acting directly downstream of ASCL1. Genome occupancy and functional experiments using primary NEPs showed that both ASCL1 and FOXO1 regulate neurogenesis genes during differentiation while independently regulating proliferation and survival, respectively. Furthermore, we demonstrated that WNT signalling promotes the transition from an ASCL1+ to a FOXO1+ cellular state. Finally, we showed that the role of WNT signalling in promoting neuron production via FOXO1 is conserved in primary human NEPs. By resolving how cerebellar interneurons differentiate, our findings could have implications for cerebellar disorders such as spinocerebellar ataxia, where cerebellar interneurons are overproduced.","NA","biorxiv",1744582124635
"Feedback-Feedforward Dynamics Shape De Novo Motor Learning","10.1101/2025.04.10.648105","biorxiv",4.300000000000001,4.300000000000001,4.300000000000001,4.300000000000001,4.300000000000001,"Avraham, C.; Mawase, F.","Firas Mawase","Technion - Israel Institute of Technology","2025-04-10","1","new results","cc_no","neuroscience","https://www.biorxiv.org/content/early/2025/04/10/2025.04.10.648105.source.xml","Humans excel at adjusting movements and acquiring new skills through feedback corrections and predictive control, yet how these feedback-feedforward computations evolve in the motor system remains unclear. We investigated this process by examining how humans learned a novel, continuous visuomotor mirror reversal (MR) tracking task over multiple days. Using a frequency-dependent system-identification approach and responses to cursor perturbations, we dissociated feedback-driven corrections from predictive feedforward adjustments. Our findings reveal two distinct learning pathways: early learning relies on rapid, corrective feedback at lower frequencies, while feedforward control gradually emerges at higher frequencies, compensating for feedback limitations. These findings suggest that motor learning involves a dynamic interplay between feedback and feedforward control, providing mechanistic insights into sensorimotor learning, with implications for optimizing motor skill acquisition and neurorehabilitation strategies","NA","biorxiv",1744582124635
"CEPR2 perceives group II CEPs to regulate cell surface immunity in Arabidopsis","10.1101/2025.04.10.648145","biorxiv",8.4,4.2,8.4,8.4,8.4,"Rzemieniewski, J.; Zecua-Ramirez, P.; Schade, S.; Camgöz, Z.; Haljiti, G.; Kaur, S.; Ludwig, C.; Hückelhoven, R.; Stegmann, M.","Martin Stegmann","Technische Universitat Munchen","2025-04-10","1","new results","cc_by","plant biology","https://www.biorxiv.org/content/early/2025/04/10/2025.04.10.648145.source.xml","Plant endogenous peptides are crucial for diverse aspects of plant physiology. Among them, C-TERMINALLY ENCODED PEPTIDEs (CEPs) have recently emerged as important regulators of plant growth and stress responses. CEPs are divided into two major subgroups: group I CEPs and the less studied group II CEPs. We recently demonstrated that group I CEPs coordinate cell surface immunity with the nitrogen status in Arabidopsis thaliana (hereafter Arabidopsis). To mount full group I CEP responsiveness, the three phylogenetically related CEP RECEPTOR 1 (CEPR1), CEPR2 and RECEPTOR-LIKE KINASE 7 (RLK7) are required. Here, we provide evidence that biotic stress induces expression of the group II CEP peptide CEP14. CEP14 and the related CEP13 and CEP15 trigger hallmark immune signaling outputs in a proline hydroxylation pattern-dependent manner in Arabidopsis. Genetic data indicates that group II CEP members contribute to cell surface immunity against bacterial infection. We further show that group II CEP perception primarily depends on CEPR2. Our work provides new insights into CEP function during biotic stress and sheds new light on the complexity of sequence-divergent CEP signalling mediated by specific endogenous receptors.","NA","biorxiv",1744582124635
"VP-CLEM-Kit: An accessible pipeline for visual proteomics using super resolution volume correlative light and electron microscopy (SR-vCLEM)","10.1101/2025.04.08.647770","biorxiv",8.5,4.050000000000001,8.5,8.5,8.5,"Lumkwana, D.; Lightley, J.; Vesga, A. G.; de Folter, J.; Domart, M.-C.; Maclachlan, C.; Kumar, S.; Evans, J. R.; Peddie, C.; Burrell, A.; Yoshimura, A.; Mangali, A.; Vahrjmeijer, N.; Bhaga, M.; Smit, C.; Titze, B.; Horrocks, M. H.; Cobra Straker, L.; Garcia, E.; Jones, M. L.; Mclean, A.; Roufosse, C.; Loos, B.; Gandhi, S.; Strange, A.; Henriques, R.; French, P. M.; Collinson, L.","Lucy Collinson","Francis Crick Institute","2025-04-10","1","new results","cc_by","cell biology","https://www.biorxiv.org/content/early/2025/04/10/2025.04.08.647770.source.xml","Visual proteomics (VP) aims to allow researchers to visualise, measure and analyse proteins in the context of cell and tissue structure in health and disease. VP is becoming a reality through technological advances across several domains, including in situ structural biology and correlative light and electron microscopy (CLEM). However, widespread adoption remains limited due to the complexity and cost of the various VP approaches reported to date. Here we present the VP-CLEM-Kit, a disruptive cost-effective pipeline for super resolution volume CLEM (SR-vCLEM) that can be implemented with minimal advanced electron microscopy expertise and equipment, making it accessible to light microscopy facilities and research labs. SR-vCLEM is based on in-resin fluorescence (IRF), where fluorophores are preserved through processing into resin. The easyIRF protocol reported here reduces the requirement for complex costly sample preparation equipment and toxic chemicals compared to standard IRF protocols. easyIRF blocks are cut into ultrathin sections that are imaged using  tomoSTORM, a new modular and cost-effective openFrame-based light microscope controlled by the open-source software package Micro-Manager that provides serial single molecule localisation microscopy in array tomography format. Sections are then post-stained and imaged using a tabletop scanning electron microscope controlled by open-source SBEMimage software to run in array tomography format. We demonstrate the potential of the VP-CLEM-Kit by imaging organelle reporters in human cell lines and stem cell derived neurons, fluorescently labelled protein in neurons, and immunolabelled cells in human kidney biopsy tissue from transplant patients. The VP-CLEM-Kit delivers a [~]5-fold improvement in resolution at a [~]7-fold lower cost, and thus provides new technical capability as well as a blueprint for more equitable access to advanced imaging workflows.","NA","biorxiv",1744582124635
"ROS regulation of stigma papillae growth and maturation in Arabidopsis thaliana","10.1101/2025.04.08.647846","biorxiv",6.1499999999999995,3.5500000000000003,6.1499999999999995,6.1499999999999995,6.1499999999999995,"Sankaranarayanan, S.; Venkatesan, S. D.; Davis, T. C.; Kessler, S. A.","Sharon A Kessler","Purdue University","2025-04-10","1","new results","cc_by_nc_nd","plant biology","https://www.biorxiv.org/content/early/2025/04/10/2025.04.08.647846.source.xml","Highly specialized stigma papillae cells play a critical role in plant reproduction. Their main purpose is to catch and interact with pollen, to mediate compatibility responses, to regulate pollen germination, and to guide pollen tubes to the transmitting tract so that the sperm cells carried in the pollen can be delivered to the female gametophyte to achieve double fertilization. In Arabidopsis thaliana, the stigma consists of single-celled stigma papillae that emerge from the apex of the fused carpels. Despite their critical function in plant reproduction, the molecular mechanisms that govern growth and maturation of stigma papillae remain poorly understood. Reactive Oxygen Species (ROS) have been implicated in stigma receptivity, but their roles in papillae development are less explored. Here we show that reactive oxygen species (ROS) also play different roles in stigma papillae development, with superoxide accumulating during the initiation and growth phase and hydrogen peroxide accumulating in mature papillae that are receptive to pollen. Reducing superoxide levels in the stigma by pharmacological treatments or over-expressing superoxide dismutase enzymes under an early stigma promoter inhibited stigma papillae growth, suggesting that ROS homeostasis is critical to papillae growth and differentiation for optimal pollination.

Statements and DeclarationsThe authors declare no competing interests","NA","biorxiv",1744582124635
