"title","doi","altmetric_jid","score","X1d","X3d","X1w","X1m","authors","author_corresponding","author_corresponding_institution","date","version","type","license","category","jatsxml","abstract","published","server","upupdate_time"
"Unbiased mapping of cereblon neosubstrate landscape by high-throughput proteomics","10.1101/2024.10.18.618633","biorxiv",9.85,5.6,9.85,9.85,9.85,"Rankovic, Z.; Wu, Q.; Yang, J.; Nishiguchi, G.; Daub, H.; Shashikadze, B.; Machata, S.; Graef, T.; Schwalb, B.; Bartoschek, D.; Ohmayer, U.; Bednarz, A. H.; McGowan, K.; Shi, Z.; Price, J.; Mayasundari, A.; Yang, L.; Demichev, V.; Steger, M.","Zoran Rankovic","Centre for Protein Degradation The Institute of Cancer Research London UK","2024-10-19","1","new results","cc_by","biochemistry","https://www.biorxiv.org/content/early/2024/10/19/2024.10.18.618633.source.xml","Molecular glue degraders (MGDs) are small molecules that harness the ubiquitin-proteasome system to induce degradation of target proteins lacking conventional druggable pockets. Given the challenges in their rational design, MGD discovery predominantly relies on screening-based approaches, such as cell viability assays. However, one potential limitation of such screening methods is the risk of overlooking non-essential neosubstrates of potential therapeutic value. To address this concern, we present a high-throughput proteome-wide MGD screening platform utilizing label-free, data-independent acquisition mass spectrometry (DIA-MS) for integrated proteomics and ubiquitinomics analysis. Processing a diverse set of 100 CRBN-ligands across two cancer cell lines reveals a broad array of neosubstrates, including 50 novel candidates validated by MS-based ubiquitinomics. These findings considerably expand the current landscape of CRBN-mediated neosubstrates. Comprehensive hit validation and structure-degradation relationship analyses guided by global proteomics, identifies highly selective and potent phenyl glutarimide-based degraders of novel neosubstrates, including KDM4B, G3BP2 and VCL, none of which contain the classical CRBN degron motif. This study demonstrates that comprehensive, high-throughput proteomic screening offers new opportunities in MGD drug discovery.","NA","biorxiv",1729634990535
"Pervasive findings of directional selection realize the promise of ancient DNA to elucidate human adaptation","10.1101/2024.09.14.613021","biorxiv",324.7300000000002,5.55,88.29999999999994,90.64999999999992,142.32999999999979,"Akbari, A.; Barton, A. R.; Gazal, S.; Li, Z.; Kariminejad, M.; Perry, A.; Zeng, Y.; Mittnik, A.; Patterson, N.; Mah, M.; Zhou, X.; Price, A. L.; Lander, E. S.; Pinhasi, R.; Rohland, N.; Mallick, S.; Reich, D.","Ali Akbari","Department of Genetics, Harvard Medical School, Boston, MA, USA; Department of Human Evolutionary Biology, Harvard University, Cambridge, MA, USA; Broad Institu","2024-09-15","1","new results","cc_by_nc_nd","evolutionary biology","https://www.biorxiv.org/content/early/2024/09/15/2024.09.14.613021.source.xml","We present a method for detecting evidence of natural selection in ancient DNA time-series data that leverages an opportunity not utilized in previous scans: testing for a consistent trend in allele frequency change over time. By applying this to 8433 West Eurasians who lived over the past 14000 years and 6510 contemporary people, we find an order of magnitude more genome-wide significant signals than previous studies: 347 independent loci with >99% probability of selection. Previous work showed that classic hard sweeps driving advantageous mutations to fixation have been rare over the broad span of human evolution, but in the last ten millennia, many hundreds of alleles have been affected by strong directional selection. Discoveries include an increase from [~]0% to [~]20% in 4000 years for the major risk factor for celiac disease at HLA-DQB1; a rise from [~]0% to [~]8% in 6000 years of blood type B; and fluctuating selection at the TYK2 tuberculosis risk allele rising from [~]2% to [~]9% from [~]5500 to [~]3000 years ago before dropping to [~]3%. We identify instances of coordinated selection on alleles affecting the same trait, with the polygenic score today predictive of body fat percentage decreasing by around a standard deviation over ten millennia, consistent with the ""Thrifty Gene"" hypothesis that a genetic predisposition to store energy during food scarcity became disadvantageous after farming. We also identify selection for combinations of alleles that are today associated with lighter skin color, lower risk for schizophrenia and bipolar disease, slower health decline, and increased measures related to cognitive performance (scores on intelligence tests, household income, and years of schooling). These traits are measured in modern industrialized societies, so what phenotypes were adaptive in the past is unclear. We estimate selection coefficients at 9.9 million variants, enabling study of how Darwinian forces couple to allelic effects and shape the genetic architecture of complex traits.","NA","biorxiv",1729634990535
"In-Situ Structure and Topography of AMPA Receptor Scaffolding Complexes Visualized by CryoET","10.1101/2024.10.19.619226","biorxiv",8.45,5.35,8.45,8.45,8.45,"Held, R. G.; Liang, J.; Esquivies, L.; Khan, Y. A.; Wang, C.; Azubel, M.; Brunger, A. T.","Axel T Brunger","Stanford University","2024-10-22","2","new results","cc_by_nc_nd","neuroscience","https://www.biorxiv.org/content/early/2024/10/22/2024.10.19.619226.source.xml","Most synapses in the brain transmit information by the presynaptic release of vesicular glutamate, driving postsynaptic depolarization through AMPA-type glutamate receptors (AMPARs). The nanometer-scale topography of synaptic AMPARs regulates response amplitude by controlling the number of receptors activated by synaptic vesicle fusion. The mechanisms controlling AMPAR topography and their interactions with postsynaptic scaffolding proteins are unclear, as is the spatial relationship between AMPARs and synaptic vesicles. Here, we used cryo-electron tomography to map the molecular topography of AMPARs and visualize their in-situ structure. Clustered AMPARs form structured complexes with postsynaptic scaffolding proteins resolved by sub-tomogram averaging. Sub-synaptic topography mapping reveals the presence of AMPAR nanoclusters with exclusion zones beneath synaptic vesicles. Our molecular-resolution maps visualize the predominant information transfer path in the nervous system.","NA","biorxiv",1729634990535
"Pseudomonas aeruginosa supports the survival of Prevotella melaninogenica in a cystic fibrosis lung polymicrobial community through metabolic cross-feeding","10.1101/2024.10.21.619475","biorxiv",5.3,5.3,5.3,5.3,5.3,"El Hafi, B.; Jean-Pierre, F.; O'Toole, G.","George O\'Toole","Geisel School of Medicine at Dartmouth","2024-10-21","1","new results","cc_by_nd","microbiology","https://www.biorxiv.org/content/early/2024/10/21/2024.10.21.619475.source.xml","Cystic fibrosis (CF) is a multi-organ genetic disorder that affects more than 100,000 individuals worldwide. Chronic respiratory infections are among the hallmark complications associated with CF lung disease, and these infections are often due to polymicrobial communities that colonize the airways of persons with CF (pwCF). Such infections are a significant cause of morbidity and mortality, with studies indicating that pwCF who are co-infected with more than one organism experience more frequent pulmonary exacerbations, leading to a faster decline in lung function. Previous work established an in vitro CF-relevant polymicrobial community model composed of P. aeruginosa, S. aureus, S. sanguinis, and P. melaninogenica. P. melaninogenica cannot survive in monoculture in this model. In this study, we leverage this model to investigate the interactions between P. aeruginosa and P. melaninogenica, allowing us to understand the mechanisms by which the two microbes interact to support the growth of P. melaninogenica specifically in the context of the polymicrobial community. We demonstrate a cross-feeding mechanism whereby P. melaninogenica metabolizes mucin into short-chain fatty acids that are in turn utilized by P. aeruginosa and converted into metabolites (succinate, acetate) that are cross-fed to P. melaninogenica, supporting the survival of this anaerobe in the CF lung-relevant model.","NA","biorxiv",1729634990535
"Nirmatrelvir-Resistant Mutations in SARS-CoV-2 Mpro Enhance Host Immune Evasion via Cleavage of NF-B Essential Modulator","10.1101/2024.10.18.619137","biorxiv",120.64999999999985,5.15,120.64999999999985,120.64999999999985,120.64999999999985,"Thomas, M.; Hughes, T.","Merrilee Thomas","Montana State University","2024-10-19","1","new results","cc_no","immunology","https://www.biorxiv.org/content/early/2024/10/19/2024.10.18.619137.source.xml","Nirmatrelvir is a SARS-CoV-2 Mpro inhibitor in Paxlovid. Patients treated with it often produce mutant viruses in which the Mpro resists Nirmatrelvir inhibition. A common interpretation is that the mutations allow the virus to escape inhibition, but here we report that these mutations enable the protease to more effectively cleave the host protein NF-kappa-B essential modulator (NEMO), which weakens the immune response, improves viral replication, and may contribute to long COVID.","NA","biorxiv",1729634990535
"From Eggs to Guts: Symbiotic Association of Sodalis nezarae sp. nov. with the Southern Green Shield Bug Nezara viridula","10.1101/2024.10.18.619066","biorxiv",5,5,5,5,5,"Rogowska-van der Molen, M. A.; Manzano-Marin, A.; Postma, J. L.; Coolen, S.; van Alen, T.; Jansen, R. S.; Welte, C. U.","Cornelia U Welte","Radboud University","2024-10-21","1","new results","cc_by_nd","microbiology","https://www.biorxiv.org/content/early/2024/10/21/2024.10.18.619066.source.xml","Phytophagous insects engage in symbiotic relationships with bacteria that contribute to digestion, nutrient supplementation, and development of the host. The analysis of shield bug microbiomes has been mainly focused on the gut intestinal tract predominantly colonized by Pantoea symbionts, and other microbial community members in the gut or other organs have hardly been investigated. In this study, we reveal that the Southern green shield bug Nezara viridula harbours a Sodalis symbiont in several organs, with a notable prevalence in salivary glands, and anterior regions of the midgut. Removing external egg microbiota via sterilization profoundly impacted insect viability but did not disrupt the vertical transmission of Sodalis and Pantoea symbionts. Based on the dominance of Sodalis in testes, we deduce that N. viridula males could be involved in symbiont vertical transmission. Genomic analyses comparing Sodalis species revealed that Sodalis sp. Nvir shares characteristics with both free-living and obligate insect-associated Sodalis spp. Sodalis sp. Nvir also displays genome instability typical of endosymbiont lineages, which suggests ongoing speciation to an obligate endosymbiont. Together, our study reveals that shield bugs harbour unrecognized symbionts that might be paternally transmitted.","NA","biorxiv",1729634990535
"A fine kinetic balance of interactions directs transcription factor hubs to genes","10.1101/2024.04.16.589811","biorxiv",40.55000000000001,4.7,4.7,5.199999999999999,5.199999999999999,"Fallacaro, S.; Mukherjee, A.; Ratchasanmuang, P.; Zinski, J.; Haloush, Y. I.; Shankta, K.; Mir, M.","Mustafa Mir","Howard Hughes Medical Insitute","2024-10-15","3","new results","cc_by","molecular biology","https://www.biorxiv.org/content/early/2024/10/15/2024.04.16.589811.source.xml","Eukaryotic gene regulation relies on the binding of sequence-specific transcription factors (TFs). TFs bind chromatin transiently yet occupy their target sites by forming high-local concentration microenvironments (hubs and condensates) that increase the frequency of binding. Despite their ubiquity, such microenvironments are difficult to study in endogenous contexts due to technical limitations. Here, we use live embryo light-sheet imaging, single-molecule tracking, and genomics to overcome these limitations and investigate how hubs are localized to target genes to drive TF occupancy and transcription. By examining mutants of a hub-forming TF, Zelda, in Drosophila embryos, we find that hub formation propensity, spatial distributions, and temporal stabilities are differentially regulated by DNA binding and disordered protein domains. We show that hub localization to genomic targets is driven by a finely-tuned kinetic balance of interactions between proteins and chromatin, and hubs can be redirected to new genomic sites when this balance is perturbed.","NA","biorxiv",1729634990535
"Virological characteristics of the SARS-CoV-2 XEC variant","10.1101/2024.10.16.618773","biorxiv",268.8419999999996,4.65,27.000000000000007,268.8419999999996,268.8419999999996,"Kaku, Y.; Okumura, K.; Kawakubo, S.; Uriu, K.; Chen, L.; Kosugi, Y.; Uwamino, Y.; Begum, M. M.; Leong, S.; Ikeda, T.; Sadamasu, K.; Asakura, H.; Nagashima, M.; Yoshimura, K.; The Genotype to Phenotype Japan (G2P-Japan) Consortium,  ; Ito, J.; Sato, K.","Kei Sato","Institute of Medical Science, The University of Tokyo","2024-10-17","1","new results","cc_by_nc_nd","microbiology","https://www.biorxiv.org/content/early/2024/10/17/2024.10.16.618773.source.xml","The SARS-CoV-2 JN.1 variant (BA.2.86.1.1), arising from BA.2.86.1 with spike protein (S) substitution S:L455S, outcompeted the previously predominant XBB lineages by the beginning of 2024. Subsequently, JN.1 subvariants including KP.2 (JN.1.11.1.2) and KP.3 (JN.1.11.1.3), which acquired additional S substitutions (e.g., S:R346T, S:F456L, and S:Q493E), have emerged concurrently. As of October 2024, KP.3.1.1 (JN.1.11.1.3.1.1), which acquired S:31del, outcompeted other JN.1 subvariants including KP.2 and KP.3 and is the most predominant SARS-CoV-2 variant in the world. Thereafter, XEC, a recombinant lineage of KS.1.1 (JN.13.1.1.1) and KP.3.3 (JN.1.11.1.3.3), was first identified in Germany on August 7, 2024. XEC acquired two S substitutions, S:T22N and S:F59S, compared with KP.3 through recombination, with a breakpoint at genomic position 21,738-22,599. We estimated the relative effective reproduction number (Re) of XEC using a Bayesian multinomial logistic model based on genome surveillance data from the USA, the United Kingdom, France, Canada, and Germany, where this variant has spread as of August 2024. In the USA, the Re of XEC is 1.13-fold higher than that of KP.3.1.1. Additionally, the other countries under investigation herein showed higher Re for XEC. These results suggest that XEC has the potential to outcompete the other major lineage including KP.3.1.1. We then assessed the virological properties of XEC using pseudoviruses. Pseudovirus infection assay showed that the infectivity of KP.3.1.1 and XEC was significantly higher than that of KP.3. Although S:T22N did not affect the infectivity of the pseudovirus based on KP.3, S:F59S significantly increased it. Neutralization assay was performed using three types of human sera: convalescent sera after breakthrough infection (BTI) with XBB.1.5 or KP.3.3, and convalescent sera after JN.1 infection. In all serum groups, XEC as well as KP.3.1.1 showed immune resistance when compared to KP.3 with statistically significant differences. In the cases of XBB.1.5 BTI sera and JN.1 infection sera, the 50% neutralization titers (NT50s) of XEC and KP.3.1.1 were comparable. However, we revealed that the NT50 of XEC was significantly (1.3-fold) lower than that of KP.3.1.1. Moreover, both S:T22N and S:F59S significantly (1.5-fold and 1.6-fold) increased the resistance to KP.3.3 BTI sera. Here we showed that XEC exhibited higher pseudovirus infectivity and higher immune evasion than KP.3. Particularly, XEC exhibited more robust immune resistance to KP.3.3 BTI sera than KP.3.1.1. Our data suggest that the higher Re of XEC than KP.3.1.1 is attributed to this property and XEC will be a predominant SARS-CoV-2 variant in the world in the near future.","NA","biorxiv",1729634990535
"Fluorescent anionic cyanine plasma membrane probes for live cell and in vivo imaging","10.1101/2024.10.17.618786","biorxiv",10.049999999999999,4.35,8.3,10.049999999999999,10.049999999999999,"Danylchuk, D. I.; Khalin, I.; Suseela, Y. V.; Filser, S.; Plesnila, N.; Klymchenko, A. S.","Andrey S. Klymchenko","Laboratoire de Bioimagerie et Pathologies, UMR 7021 CNRS, Universite de Strasbourg, 74 route du Rhin, 67401, Illkirch, France","2024-10-17","1","new results","cc_by","biochemistry","https://www.biorxiv.org/content/early/2024/10/17/2024.10.17.618786.source.xml","Proper staining of cell plasma membrane is indispensable for fluorescence imaging. Herein, we present an array of five anionic cyanine-based turn-on plasma membrane probes with emission spanning from green to near infrared. They are analogous of commonly used MemBright probes family, where two zwitterionic anchor groups are replaced with anionic sulfonates with dodecyl chains. The developed probes provide selective wash-free staining of plasma membranes of live cells in vitro, featuring improved brightness and slower internalization inside the cells. In comparison to protein-based (wheat germ agglutinin) membrane markers, new membrane probes provide better staining in poorly assessable cell-cell contacts. A key challenge is to stain cell plasma membranes directly in vivo. During in vivo brain tissue imaging in living mice by two-photon microscopy, the anionic cyanine probes allowed us to visualize in detail the pyramidal neurons with high image quality, clearly resolving neuron soma, dendrites with dendritic spines and axons with axonal boutons. The developed anionic cyanine-based plasma membrane probes constitute an important extension of the toolbox of fluorescent probes for plasma membrane research.","NA","biorxiv",1729634990535
"Path2Space: An AI Approach for Cancer Biomarker Discovery Via Histopathology Inferred Spatial Transcriptomics","10.1101/2024.10.16.618609","biorxiv",64.95000000000005,4.25,16.4,64.95000000000005,64.95000000000005,"Shulman, E. D.; Campagnolo, E. M.; Lodha, R.; Cantore, T.; Hu, T.; Nasrallah, M.; Hoang, D.-T.; Aldape, K.; Ruppin, E.","Eytan Ruppin","Cancer Data Science Laboratory, Center for Cancer Research, National Cancer Institute, Bethesda, MD, USA.","2024-10-18","1","new results","cc_no","cancer biology","https://www.biorxiv.org/content/early/2024/10/18/2024.10.16.618609.source.xml","The rise of spatial transcriptomics (ST) is transforming our understanding of tumor heterogeneity by enabling high-resolution, location-specific mapping of gene expression across the tumor microenvironment. However, the translational potential of spatial transcriptomics is still limited by its high cost, hindering the assembly of large patient cohorts needed for robust biomarker discovery. Here we present Path2Space, a deep learning model trained on spatial transcriptomics data to predict spatial gene expression directly from histopathology slides. Studying breast cancer, the model was first trained on one ST breast cancer patients cohort and further independently tested and validated on two other ST cohorts. Path2Space identifies 4,500 genes whose spatial expression is robustly predicted in all three cohorts, markedly more accurate than existing ST predictors. Second, we show that based on the inferred ST, Path2Space accurately infers cell-type abundances in the tumor microenvironment (TME). Thirdly, Applying Path2Space to the TCGA breast cancer cohort we identify three TME spatially grounded subsets of patients that have markedly different survival rates. Fourth, analyzing two large breast cancer patients cohorts treated with trastuzumab, we show that the heterogeneity of the inferred HER2 levels across the tumor microenvironment is predictive of response, concordant with the bystander hypothesis. Finally, we developed a spatially interpretable model for predicting trastuzumab response directly from the H&E-slides. This models performance surpasses that of existing response prediction models that use measured bulk multi-omics data. Path2Space is the first approach capable of robustly delineating the tumor microenvironment on an unprecedented scale directly from the tumor slides. It heralds the upcoming development of robust spatially grounded biomarkers of patients survival and treatment that promises to transform precision oncology in both the developed and developing worlds.","NA","biorxiv",1729634990535
"Microglia regulate GABAergic neurogenesis in prenatal human brain through IGF1","10.1101/2024.10.19.619180","biorxiv",4.2,4.2,4.2,4.2,4.2,"Yu, D.; Jain, S.; Wangzhou, A.; De Florencio, S.; Zhu, B.; Kim, J.; Choi, J.; Paredes, M.; Nowakowski, T. J.; Huang, E. J.; Piao, X.","Xianhua Piao","University of California, San Francisco","2024-10-20","1","new results","cc_no","neuroscience","https://www.biorxiv.org/content/early/2024/10/20/2024.10.19.619180.source.xml","GABAergic neurons are an essential cellular component of neural circuits. Their abundance and diversity have enlarged significantly in the human brain, contributing to the expanded cognitive capacity of humans. However, the developmental mechanism of the extended production of GABAergic neurons in the human brain remains elusive. Here, we use single-cell transcriptomics, bioinformatics, and histological analyses to uncover microglial regulation of the sustained proliferation of GABAergic progenitors and neuroblasts in the human medial ganglionic eminence (hMGE). We show that insulin-like growth factor 1 (IGF1) and its receptor IGR1R as the top ligand-receptor pair underlying microglia-progenitor communication in the prenatal human brain. Using our newly developed neuroimmune hMGE organoids, which mimics hMGE cytoarchitecture and developmental trajectory, we demonstrate that microglia-derived IGF1 promotes progenitor proliferation and the production of GABAergic neurons. Conversely, IGF1-neutralizing antibodies and IGF1 knockout human embryonic stem cells (hESC)-induced microglia (iMG) completely abolished iMG-mediated progenitor proliferation. Together, these findings reveal a previously unappreciated role of microglia-derived IGF1 in promoting proliferation of neural progenitors and the development of GABAergic neurons.","NA","biorxiv",1729634990535
"Thermal Proteome Profiling reveals rapid proteomic responses to redox changes in specific cellular compartments","10.1101/2024.10.17.618419","biorxiv",4.35,4.1,4.35,4.35,4.35,"Revazian, A.; Nesterenko, A. M.; Ezerina, D.; Luo, T.; Vertommen, D. M.; Gibhardt, C. S.; Bogeski, I.; Messens, J.; Belousov, V. V.","Vsevolod V Belousov","Center for Precision Genome Editing and Genetic Technologies for Biomedicine, Pirogov Russian National Research Medical University, Moscow 117997, Russia","2024-10-18","1","new results","cc_no","systems biology","https://www.biorxiv.org/content/early/2024/10/18/2024.10.17.618419.source.xml","Hydrogen peroxide (H2O2) functions as a secondary messenger in cellular redox signaling, acting mainly via oxidation of protein thiols. Its spatially and temporally regulated activity within cells is essential for maintaining proper redox balance, and disruptions in these patterns can lead to oxidative stress and various related pathologies. Redox proteomics, which examines the impact of H2O2 at the proteome level, typically focuses only on thiol oxidation, overlooking broader proteomic alterations and the significance of subcellular localization in these redox processes. In this study, we address these open questions by combining chemogenetics with Thermal Proteome Profiling (TPP) to map global proteome response to compartmentalized H2O2 production. We identified hundreds of proteins with altered thermostability and/or abundance upon localized H2O2 generation in the cytosol, nucleus, and the ER lumen, highlighting their roles in cellular responses to localized H2O2. We identified proteins such as MAP2K1, PARK7, TRAP1, and UBA2 to be highly sensitive to localized H2O2 production. Furthermore, we validated their altered thermostability and found that these changes are controlled via dysregulated protein-protein interactions. This study provides a valuable resource for researchers exploring redox-mediated signal transduction and offers novel insights that could be harnessed in treating oxidative stress-induced pathologies.","NA","biorxiv",1729634990535
