"title","doi","altmetric_jid","score","X1d","X3d","X1w","X1m","authors","author_corresponding","author_corresponding_institution","date","version","type","license","category","jatsxml","abstract","published","server","upupdate_time"
"H2AK119ub Safeguards Against Ectopic Transcription Factor Mediated Gene Activation in the Developing Forebrain","10.1101/2025.07.07.663591","biorxiv",14.449999999999998,0,0,14.449999999999998,14.449999999999998,"Doyle, L. A.; Derrien, A.; Sengupta, D.; Unlu Bektas, F.; Lawson, J.; Pednekar, C.; von Kriegsheim, A.; Adams, I. R.; Illingworth, R. S.","Robert Scott Illingworth","Centre for Regenerative Medicine - Institute for Regeneration and Repair, 5 Little France Drive, University of Edinburgh, Edinburgh, EH16 4UU, UK","2025-07-10","1","new results","cc_by","molecular biology","https://www.biorxiv.org/content/early/2025/07/10/2025.07.07.663591.source.xml","The PRC1 complex regulates developmental gene expression in mammals by ubiquitinating histones (H2AK119ub) and nucleating repressive chromatin interactions. Human genetic data and functional experimentation have demonstrated that H2AK119ub is required for cortical development, however the molecular mechanism for this remains unknown. Here, we show that mouse embryos expressing catalytically deficient RING1B exhibit intact early neurogenesis but display impaired neuroectodermal fate restriction. Using in vivo, primary, and in vitro models, we demonstrate that reduced H2AK119ub leads to ectopic activation of lineage-inappropriate transcriptional programmes, including mesodermal and endodermal gene expression during neural differentiation. This transcriptional deregulation is not solely attributable to H2AK119ub or H3K27me3 loss but instead reflects sensitisation of PRC1 target genes to inappropriate transcription factor (TF)-mediated activation. Synthetic induction of candidate TFs, including GATA6, SOX7, and SNAI1, phenocopies the fate-skewing effects of PRC1 catalytic dysfunction, confirming their causal role. Our results uncover a buffering role for PRC1-catalysed H2AK119ub in safeguarding neural progenitor identity by preventing inappropriate TF-driven transcription and provides a mechanistic framework for understanding the cellular heterogeneity and phenotypic variability observed in Polycomb-associated neurodevelopmental disorders.","NA","biorxiv",1752703875454
"Most science is published from countries lacking in democracy and freedom of press","10.1101/2025.07.03.663115","biorxiv",20.299999999999997,0,2.35,14.35,20.299999999999997,"Ioannidis, J.; Baas, J.","John Ioannidis","Stanford University","2025-07-08","1","new results","cc_by_nc_nd","scientific communication and education","https://www.biorxiv.org/content/early/2025/07/08/2025.07.03.663115.source.xml","Democracy and freedom of press may affect how science is prioritized, produced, communicated and disseminated. We aimed to map the production of scientific publications worldwide in terms of democracy and freedom of press ratings of countries. Democracy ratings used the Democracy Index in 2024 and in 2006 (when first released by the Economist Intelligence Unit) and Freedom of Press ratings used the 2024 index by Reports Without Borders. The Scopus database was used for publications from each country. Fractional counts were assigned for publications co-authored by authors from different countries. Full articles, reviews, conference papers, books and book chapters were included. In 2024, countries characterized as full democracies produced only 22% of the Scopus-indexed publications, versus 66% in 2006. There was no correlation between the ratio of publications indexed in 2024 versus 2006 and the absolute or relative change in Democracy Index between 2006 and 2024 (r=0.02 and r=0.00, respectively). 78% of publications in 2024 came from countries with problematic (including USA) or worse (including China) freedom of press. Proportions of publications originated from countries with problematic or worse situations were 81%, 91%, 61%, 62%, and 63% for political, economic, legislative, sociocultural, and safety/security dimensions, respectively. Results were similar when limited to articles published in 2024 in journals with continuous annual presence in Scopus during 2006-2024. In conclusion, most published science originates from countries struggling or suffering in democracy and/or freedom of press. The deeper causes and implications of this emerging landscape require further study.","NA","biorxiv",1752703875454
"TATAT: a containerized software for generating annotated coding transcriptomes from raw RNA-seq data","10.1101/2025.07.09.663867","biorxiv",13.6,2.5,13.6,13.6,13.6,"Brown, A. J.; Seifert, S. N.","Stephanie N. Seifert","Paul G. Allen School for Global Health, Washington State University, Pullman, WA 99164","2025-07-14","1","new results","cc_by_nc","bioinformatics","https://www.biorxiv.org/content/early/2025/07/14/2025.07.09.663867.source.xml","MotivationMany transcriptome creation workflows are not standardized, are difficult to install or share, prone to breaking as dependencies update or cease to be maintained and are resource intensive. Due to a lack of authoritative literature, many also overlook potentially important steps, such as thinning contig over-assembly or identifying transcript consensus across samples, which reduce resource demands during annotation and increase the accuracy of final transcripts.

ResultsWe developed TATAT, a modular, Dockerized software that contains all the tools necessary to generate an annotated coding transcriptome from raw RNA-seq data. The tools remain in a static state and can be coordinated with bash and python scripts provided therein, making TATAT a standardized, reproducible workflow that can easily be shared and installed. We preferentially incorporate tools that are not only accurate, but are fast and require less RAM, and subsequently show TATAT can generate a comprehensive transcriptome for a non-model organism, the Egyptian rousette bat (Rousettus aegyptiacus), in [~]8 hours in a high-performance computing (HPC) environment.

Availability and implementationThe TATAT code, instructions, and tutorial are available at https://github.com/viralemergence/tatat.","NA","biorxiv",1752703875454
"MORPH Predicts the Single-Cell Outcome of Genetic Perturbations Across Conditions and Data Modalities","10.1101/2025.06.27.661992","biorxiv",16.25,0,0,13,16.25,"He, C.; Zhang, J.; Dahleh, M. A.; Uhler, C.","Caroline Uhler","Massachusetts Institute of Technology","2025-07-02","1","new results","cc_by_nc_nd","bioinformatics","https://www.biorxiv.org/content/early/2025/07/02/2025.06.27.661992.source.xml","Modeling cellular responses to genetic perturbations is a significant challenge in computational biology. Measuring all gene perturbations and their combinations across cell types and conditions is experimentally challenging, highlighting the need for predictive models that generalize across data types to support this task. Here we present MORPH, a MOdular framework for predicting Responses to Perturbational cHanges. MORPH combines a discrepancy-based variational autoencoder with an attention mechanism to predict cellular responses to unseen perturbations. It supports both single-cell transcriptomics and imaging outputs and can generalize to unseen perturbations, combinations of perturbations, and perturbations in new cellular contexts. The attention-based framework enables inference of gene interactions and regulatory networks, while the learned gene embeddings can guide the design of informative perturbations. Overall, we envision MORPH as a flexible tool for optimizing perturbation experiments, enabling efficient exploration of the perturbation space to advance understanding of cellular programs for fundamental research and therapeutic applications.","NA","biorxiv",1752703875454
"Expression of nano-engineered RNA organelles in bacteria","10.1101/2025.07.08.663582","biorxiv",12.85,0,0,12.85,12.85,"Ng, B.; Fan, C.; Dordevic, M.; Knirsch, A.; Malouf, L.; Fabrini, G.; Nuccio, S. P.; Rubio-Sanchez, R. M.; Christie, G.; Takinoue, M.; Cicuta, P.; Di Michele, L.","Lorenzo Di Michele","University of Cambridge","2025-07-08","1","new results","cc_by_nc","synthetic biology","https://www.biorxiv.org/content/early/2025/07/08/2025.07.08.663582.source.xml","Designing synthetic biomolecular condensates, or membrane-less organelles, offers insights on the functions of their natural counterparts, and is equally valuable for cellular and metabolic engineering. Choosing E. coli for its biotechnological relevance, we deploy RNA nanotechnology to design and express non-natural membrane-less organelles in vivo. The designer condensates assemble co-transcriptionally from branched RNA motifs interacting via base-pairing. Exploiting binding selectivity we express orthogonal, non-mixing condensates, and by embedding a protein-binding aptamer we achieve selective protein recruitment. Condensates can be made to dissolve and re-assemble upon thermal cycling, thereby reversibly releasing and re-capturing protein clients. The synthetic organelles are expressed robustly across the cell population and remain stable despite enzymatic RNA processing. Compared with existing solutions based on peptide building blocks or repetitive RNA sequences, these nanostructured RNA motifs enable algorithmic control over interactions, affinity for clients, and condensate microstructure, opening new directions in synthetic biology and biotechnology.","NA","biorxiv",1752703875454
"Different ways to die: harnessing variation in Drosophila reveals loss of tolerance and resistance over age and sex-specific association between infection susceptibility and lifespan","10.1101/2025.07.07.663438","biorxiv",12.599999999999998,1,1.85,12.599999999999998,12.599999999999998,"Monteiro-Black, B.; Corbally, M.-K.; Aleksandrowicz, J.; Taggart, A. M.; Langella, F.; Belmonte, R. L.; Mika, P.; Duneau, D.; Regan, J. C.","Jennifer C Regan","University of Edinburgh","2025-07-10","1","new results","cc_by_nc_nd","immunology","https://www.biorxiv.org/content/early/2025/07/10/2025.07.07.663438.source.xml","It is widely accepted that susceptibility to infection increases with age. The reason often invoked is the dysregulation of the immune system, which is both cause and consequence of ageing. However, we do not all age in the same way, and increased susceptibility may not be solely due to immune dysregulation affecting resistance to infection. There are many possible ways to make a host less tolerant to infection by dysregulating key physiological or metabolic processes. We hypothesised that the increase in susceptibility to infection over age can be linked to both immune ageing and decreased tolerance, and importantly, that it will depend on genotype and sex of the host. We assessed susceptibility to Gram-negative bacterial challenge in both sexes in 22 Drosophila isolines at young and old ages, and leveraged variation between genotypes to investigate how frequently an increase in susceptibility to infection was more associated with a decline in resistance or disease tolerance mechanisms. To achieve this, we assessed pathogen load to report on host immune decline. Strikingly, in most cases, greater infection susceptibility at old age was driven by reduced tolerance, although we also frequently identify cases that suffered bona fide immunosenescence, e.g. impaired resistance. We screened across bacterial pathogens during systemic and oral infections and found sex-specific signatures in survival in young and old individuals, but increased susceptibility with age occurred in both sexes. Pairing infection survival with lifespan data, we find that transcending genotype variation, susceptibility at old age predicts lifespan in males only, regardless of the existence or direction of sex bias in longevity. This work highlights that increased infection susceptibility is an early-arising ageing phenotype that occurs in both sexes, but only predicts lifespan in males, paralleling burgeoning evidence in mammals for male-biased effects of age on infection and its connection with mortality. Our data support a model where infection susceptibility increases with age following the same multiplicative pattern as organismal mortality, with existing failures making new failures more consequential. We propose that the term ""immunosenescence"" be used specifically to describe proven dysregulation of immune tissue resistance mechanisms. We argue that to fully understand the drivers of age-related susceptibility to infection, it is essential to consider genotype, sex, and their interaction, as well as the dysregulation of non-immune functions that influence the ability to control pathogens.","NA","biorxiv",1752703875454
"Spatial joint profiling of DNA methylome and transcriptome in mammalian tissues","10.1101/2025.07.01.662607","biorxiv",34.550000000000004,0,0,12.350000000000001,34.550000000000004,"Lee, C. N.; Fu, H.; Cardilla, A.; Zhou, W.; Deng, Y.","Yanxiang Deng","University of Pennsylvania","2025-07-04","1","new results","cc_by_nd","genomics","https://www.biorxiv.org/content/early/2025/07/04/2025.07.01.662607.source.xml","The spatial resolution of omics dynamics is fundamental to understanding tissue biology. Spatial profiling of DNA methylation, which is a canonical epigenetic mark extensively implicated in transcriptional regulation, remains an unmet demand. Here, we introduce a method for whole genome spatial co-profiling of DNA methylation and transcriptome of the same tissue section at near single-cell resolution. Applying this technology to mouse embryogenesis and postnatal brain resulted in rich DNA-RNA bimodal tissue maps. These maps revealed the spatial context of known methylation biology and its interplay with gene expression. The two modalities concordance and distinction in spatial patterns highlighted a synergistic molecular definition of cell identity in spatial programming of mammalian development and brain function. By integrating spatial maps of mouse embryos at two different developmental stages, we reconstructed the dynamics of both epigenome and transcriptome underlying mammalian embryogenesis, revealing details in sequence, cell type, and region-specific methylation-mediated transcriptional regulation. This method extends the scope of spatial omics to DNA cytosine methylation for a more comprehensive understanding of tissue biology over development and disease.","NA","biorxiv",1752703875454
"Structural basis for size-selective perception of chitin in plants","10.1101/2025.07.09.663820","biorxiv",11.65,0,11.65,11.65,11.65,"Gysel, K.; Hansen, S. B.; Rübsam, H.; Alsarraf, H. M. A. B.; Madland, E.; Cheng, J. X. J.; Baadegaard, C.; Poulsen, E. C.; Vinther, M.; Fort, S.; Stougaard, J.; Andersen, K. R.","Kira Gysel","Department of Molecular Biology and Genetics, Aarhus University, 8000 Aarhus C, Denmark","2025-07-12","1","new results","cc_no","plant biology","https://www.biorxiv.org/content/early/2025/07/12/2025.07.09.663820.source.xml","Plants detect microbes through pattern recognition receptors that perceive conserved microbial surface motifs known as microbe-associated molecular patterns (MAMPs). LysM receptors recognize and mediate downstream responses to chitinous MAMPs. Here, we elucidate the mechanism for the specific recognition of long-chain chitin oligomers and identify a hallmark bridge domain characteristic for the CHIP receptor class. Structural analysis of receptor-ligand complexes, biochemistry, and in planta functional studies using inhibitory nanobodies reveal the mechanism of size-selective, high affinity chitin perception in Lotus japonicus and Medicago truncatula. Additionally, we identify CERKs as low-affinity, yet essential co-receptors and propose a mechanistic model for a ligand-induced core signaling heterocomplex. Our findings provide mechanistic insights into plant chitin perception and the formation of receptor complexes critical for immune signaling.","NA","biorxiv",1752703875454
"The involvement of the ER-phagy receptor FAM134B in membrane contact sites between ER and endolysosomes promotes ERLAD","10.1101/2025.07.08.663682","biorxiv",11.399999999999999,0,0,11.399999999999999,11.399999999999999,"Fasana, E.; Fregno, I.; Molinari, M.","Maurizio Molinari","Institute for Research in Biomedicine","2025-07-09","1","new results","cc_by_nc_nd","cell biology","https://www.biorxiv.org/content/early/2025/07/09/2025.07.08.663682.source.xml","Membrane contact sites (MCS) between organelles maintain the proximity required for controlled exchange of small molecules and ions yet preventing fusion events that would compromise organelles identity and integrity. Here, by investigating the intracellular fate of the disease-causing Z-variant of alpha1 antitrypsin (ATZ), we report on a novel function of MCS between the endoplasmic reticulum (ER) and RAB7/LAMP1-positive endolysosomes in ER-to-lysosome-associated degradation (ERLAD). For this function, the VAPA:ORP1L:RAB7 multi-protein complex forming MCS between the ER and endolysosomes engages, in an ERLAD client-driven manner, the misfolded protein segregation complex formed by the lectin chaperone Calnexin (CNX), the ER-phagy receptor FAM134B and the ubiquitin-like protein LC3. Generation of this supramolecular complex facilitates the membrane fusion events regulated by the SNARE proteins STX17 and VAMP8 that ensure efficient delivery of ATZ polymers from their site of generation, the ER, to the site of their intracellular clearance, the degradative RAB7/LAMP1-positive endolysosomes.","NA","biorxiv",1752703875454
"T cell protrusions enable fast, localised initiation of CAR signalling","10.1101/2025.07.08.662959","biorxiv",11.2,0,0.85,11.2,11.2,"Rodilla-Ramirez, C.; Carai, G.; Fox, E.; Zehtabian, A.; Adam, H.; Dallio, K.; Ewers, H.; Su, X.; Bottanelli, F.","Francesca Bottanelli","Freie Universitaet Berlin","2025-07-09","1","new results","cc_by","cell biology","https://www.biorxiv.org/content/early/2025/07/09/2025.07.08.662959.source.xml","Actin-rich protrusions densely cover the surface of T cells and are well characterised for their role in cell migration. However, recent studies have uncovered their role in antigen surveillance and immune signalling initiation. To investigate how membrane protrusions initiate and contribute to signalling, from the first cell-cell contact to immunological synapse formation, we performed dynamic imaging experiments of endogenously tagged signalling proteins in T cells. To quantitatively capture the early dynamics of cell-cell interactions, we employed HER2-CAR-expressing T cells targeting HER2+breast cancer cells. By harnessing live-cell imaging and super-resolution stimulated emission depletion (STED) microscopy we were able to capture topological membrane changes and their correlation with mesoscale protein rearrangements over time. Our findings indicate that, prior to activation, key molecular players in T cell activation, including the kinase Lck, the phosphatase CD45 and the adaptor LAT, as well as the exogenously expressed CAR, lack any enrichment in actin-rich protrusions. However, upon initial contact of the T cell with the target cell, a dynamic and fast rearrangement of the surface receptors, phosphatases, and kinases occurs within the protrusions, ensuring a rapid and effective initiation of the immune signalling cascade. The rapid clustering of the HER2-CAR occurs preferentially within protrusions rather than flat membrane regions and is accompanied by enhanced recruitment of the kinase ZAP-70 and LAT. While the localisation of the kinase Lck remained unchanged, protrusion-cell contacts trigger a pronounced exclusion of the phosphatase CD45, an effect observed both with and without the cytosolic signalling domain of the CAR. Overall, the signalling machinery rearranged more rapidly and efficiently at contacts mediated by protrusive structures compared to non-protrusive regions. Together, our data provide a quantitative framework illustrating how signalling proteins are dynamically reorganised to facilitate CAR-mediated activation within these specialised structures.","NA","biorxiv",1752703875454
"Distinct brain-wide neural dynamics predict social approach behavior","10.1101/2025.07.09.663340","biorxiv",10.749999999999998,1.7,9.25,10.749999999999998,10.749999999999998,"Lifshitz, I.; Livneh, N.; Moshkivitz, M.; Karmi, A.; Avitan, L.","Lilach Avitan","The Hebrew University of Jerusalem","2025-07-11","1","new results","cc_by_nc","neuroscience","https://www.biorxiv.org/content/early/2025/07/11/2025.07.09.663340.source.xml","Social behavior is essential for animal survival and adaptation, requiring the integration of sensory cues to guide interactions with conspecifics. A key component of social behavior is approach, where animals actively move to-ward social partners to maintain group cohesion, establish affiliations, and coordinate actions. While a continuous stream of social information is encoded across sensory modalities, it remains unclear whether a distinct neural process underlies social approach. Here, we developed a novel assay in which a head-fixed, tail-free zebrafish interacts with a freely swimming conspecific, enabling precise quantification of social behavior alongside whole-brain functional imaging at cellular resolution. We demonstrate that zebrafish approach behavior is jointly shaped by spatial and temporal information from conspecifics rather than by these features acting independently. Social approach behavior is preceded by distinct brain-wide neural activity patterns emerging seconds before movement onset, characterized by increased activity in a small subset of forebrain neurons and decreased activity in midbrain and hindbrain neuronal populations. These activity patterns reliably predict upcoming approach movements from each of these regions separately. Moreover, the extent to which neural activity distinguishes approach from non-approach movements predicts individual differences in social behavior, directly linking neural dynamics to behavioral variability. Together, our findings reveal a neural mechanism underlying social approach behavior, highlighting how a distributed yet functionally coordinated network facilitates social interaction.","NA","biorxiv",1752703875454
"Methylation dynamics in the decades preceding acute myeloid leukaemia","10.1101/2025.06.26.661643","biorxiv",29.749999999999996,0,0,10.55,29.749999999999996,"Fonseca, A. V.; Boniface, C. T.; Watson, C.; Hackett, S.; Gabbutt, C.; Ramos-Yamasaki, A. D.; Tan, A. B.; Montoya, J. M.; Strogantsev, R.; Hanssen, L.; Zhang, Y.; Apostolidou, S.; Gentry-Maharaj, A.; Esener, S.; Spellman, P.; Graham, T.; Menon, U.; Mohammed, H.; Blundell, J. R.","Jamie R Blundell","University of Cambridge","2025-06-27","1","new results","cc_by_nc","genomics","https://www.biorxiv.org/content/early/2025/06/27/2025.06.26.661643.source.xml","DNA methylation is emerging as a highly sensitive and specific marker of cancer initiation and progression. How these cancer-specific methylation changes are established in the decades before cancer, however, remains largely unknown. Here, we use a unique collection of longitudinal blood samples collected annually up to 15 years prior to a diagnosis of acute myeloid leukaemia to sensitively track the dynamics of DNA methylation changes at high temporal resolution. We identify thousands of differentially methylated regions (DMRs) that exhibit altered patterns of methylation up to 10 years before acute myeloid leukaemia (AML) diagnosis. Most of these DMRs are strongly associated with expanding clones carrying somatic driver mutations. We identify a subset of  epigenetic driver DMRs characterised by recurrent CpG alterations that are highly shared across pre-AML cases. These are likely to reflect early epigenetic reprogramming associated with AML development. We also reveal large numbers of stochastic  passenger CpGs whose differential methylation results from hitch-hiking with clonal expansions driven by somatically acquired genetic events. These passenger CpGs can be exploited for lineage tracing to discover clonal expansions driven by missing driver mutations. Our findings show widespread changes in methylation patterns during the early stages of cancer development which could be utilised for risk prediction and therapeutic intervention.","NA","biorxiv",1752703875454
