"title","doi","altmetric_jid","score","X1d","X3d","X1w","X1m","authors","author_corresponding","author_corresponding_institution","date","version","type","license","category","jatsxml","abstract","published","server","upupdate_time"
"Benchmarking open access publication rates for the pharmaceutical industry and research-intensive academic institutions","10.1101/2024.09.14.613042","biorxiv",9.33,8.08,8.08,8.08,8.08,"Rees, T. J.; Philippon, V.; Liew, A.; Baronikova, S.; Gattrell, W. T.; Gordon, J.; Koskenkorva, T. S.; Mysore, S.; Osorio, J.; Koder, T. J.","Tomas J Rees","Oxford PharmaGenesis, Ltd","2024-09-16","1","new results","cc_by","scientific communication and education","https://www.biorxiv.org/content/early/2024/09/16/2024.09.14.613042.source.xml","ObjectiveIn biomedical and health sciences, many articles are published open access (OA). Rates of OA publications continue to grow, including for research carried out by pharmaceutical companies. To help drive more openness in the pharmaceutical industry, we aimed to compare the OA publication rates of pharmaceutical companies with those of academic institutions.

MethodsWe assessed OA publication rates from the 40 largest pharmaceutical companies by earnings and 40 comparator academic institutions that publish the largest number of medical research articles in their geographical region. Using the Lens, we built a live public dashboard that presents the OA publication rates for articles with authors affiliated to the pharmaceutical companies and comparator academic institutions of interest, detailed by OA model and licence, and by medical therapy area. We performed further analysis on data downloaded from the dashboard.

ResultsIn our primary analysis of articles 12-24 months since publication date, 76.6% of pharmaceutical company (pharma) and 69.5% of academic institution (academia) publications were OA. The most common OA models were gold (pharma, 37%; academia, 41%) and hybrid (pharma, 22%; academia, 11%). Oncology had lower rates of OA publications than other therapy areas. Growth in the OA publication rate was generally more rapid for pharmaceutical companies than for academic institutions, regardless of field.

ConclusionsThe OA publication rate was higher for pharmaceutical companies than for academic institutions and continues to increase. With the pharmaceutical industry focused on encouraging authors to publish OA and increasingly aware of the different types of OA licences, we expect and welcome further changes. Our new report provides data on pharmaceutical company and academic institution publications that are updated every 2 weeks. We encourage others to use this open resource and report their results.

Key messagesO_ST_ABSWhat is already known on this topicC_ST_ABSOpen access (OA) publication rates for pharmaceutical companies have been steadily growing. However, previous methods for analysing pharmaceutical company OA publication rates have not been conducive to automation and have not facilitated easy comparison between pharmaceutical companies and other research-intensive environments, such as academic institutions.

What this study addsWe built an online dashboard that presents continually and automatically updated OA publication rates for articles with authors affiliated to several large pharmaceutical companies and academic institutions. We found that the OA publication rate was higher for pharmaceutical companies than for academic institutions and that growth in OA publications was generally more rapid for pharmaceutical companies than for academic institutions.

How this study might affect research, practice or policyOur dashboard allows ongoing monitoring, and we encourage the use of this free tool to capture evolving OA publishing behaviours and the disclosure of these results to help drive greater adoption of OA publishing practices.

Strengths and limitations of this studyO_LIAs expected with large-scale bibliometrics sampling, there are various points at which error and/or information loss may have entered this analysis, for example, during the parsing of author affiliations or categorisation of topics and article types.
C_LIO_LIThe comparator set (a globally representative group of research-intensive academic institutions) may not represent academic institutions in general because it includes only the largest academic institutions (in terms of publication counts) from each global region.
C_LIO_LIThere is overlap between the pharmaceutical company and academic institution analysis sets because first, pharmaceutical company publications often include academic authors, and second, academic institution publications may include pharmaceutical company authors. Hence, some individual publications may have been included in both analysis sets.
C_LIO_LIThe analysis does not account for studies that are led by authors at academic institutions but funded by pharmaceutical companies. These investigator-sponsored studies typically do not have pharmaceutical company authors, and pharmaceutical companies have no influence over decisions relating to publications resulting from these studies, including target journal, OA status and license type.
C_LI

Plain Language SummaryBiotechnology and pharmaceutical companies develop and deliver most of the worlds new medicines. To ensure important information about these medicines is shared transparently with audiences across the world, more and more often, pharmaceutical companies are choosing to publish their research open access. Open access publishing allows anyone to read and, in some cases, reuse the contents of research publications for free. In medical journals, an increasing proportion of articles are published open access every year. However, at the moment, we dont understand how the open access publication rates of medical publications from pharmaceutical companies compare with those of medical publications from academic institutions. Understanding this could help the scientific community assess how open access publication practices are changing over time.

We made an online platform that provides a free, live report of the open access publication rates for pharmaceutical companies and academic institutions. We found that 77% of pharmaceutical company research publications and 70% of academic institution research publications were published open access. Open access publication rates increased each year for both pharmaceutical company and academic institution research publications, but the rates were increasing faster for pharmaceutical companies.

Our results are similar to those from other studies of open access publication rates. We encourage users to explore our free online live report and share their results publicly. The live report can be accessed using the following link: https://www.lens.org/lens/report/view/Open-access-dashboard/14572/page/14573.","NA","biorxiv",1729634990535
"Vitamin D supplementation to prevent acute respiratory infections: systematic review and meta-analysis of stratified aggregate data","10.1101/2024.09.18.24313866","medrxiv",10.25,8,8,8,8,"Jolliffe, D. A.; Camargo Jr, C. A.; Sluyter, J. D.; Aglipay, M.; Aloia, J. F.; Bergman, P.; Bischoff-Ferrari, H. A.; Borzutzky, A.; Bubes, V. Y.; Damsgaard, C. T.; Ducharme, F.; Dubnov-Raz, G.; Esposito, S.; Ganmaa, D.; Gilham, C.; Ginde, A. A.; Golan-Tripto, I.; Goodall, E. C.; Grant, C. C.; Griffiths, C. J.; Hibbs, A. M.; Janssens, W.; Khadilkar, A. V.; Laaksi, I.; Lee, M. T.; Loeb, M.; Maguire, J. L.; Majak, P.; Manaseki-Holland, S.; Manson, J. E.; Mauger, D. T.; Murdoch, D. R.; Nakashima, A.; Neale, R. E.; Pham, H.; Rake, C.; Rees, J. R.; Rosendahl, J.; Scragg, R.; Shah, D.; Shimizu, Y.; S","David A Jolliffe","Blizard Institute, Faculty of Medicine and Dentistry, Queen Mary University of London, London, UK","2024-09-19","1","PUBLISHAHEADOFPRINT","cc_no","respiratory medicine","https://www.medrxiv.org/content/early/2024/09/19/2024.09.18.24313866.source.xml","BackgroundA 2021 meta-analysis of 37 randomised controlled trials (RCTs) of vitamin D supplementation for prevention of acute respiratory infections (ARI) revealed a statistically significant protective effect of the intervention (odds ratio [OR] 0.92, 95% confidence interval [CI] 0.86 to 0.99). Since then, 6 eligible RCTs have completed, including one large trial (n=15,804).

MethodsUpdated systematic review and meta-analysis of data from RCTs of vitamin D for ARI prevention using a random effects model. Sub-group analyses were done to determine whether effects of vitamin D on risk of ARI varied according to baseline 25-hydroxyvitamin D (25[OH]D) concentration, dosing regimen or age. We searched MEDLINE, EMBASE, the Cochrane Central Register of Controlled Trials, Web of Science and the ClinicalTrials.gov were searched between May 2020 (previous search) and April 2024. No language restrictions were imposed. Double-blind RCTs supplementing vitamin D for any duration, with placebo or low-dose vitamin D control, were eligible if approved by Research Ethics Committee and if ARI incidence was collected prospectively and pre-specified as an efficacy outcome. Aggregate data, stratified by baseline 25(OH)D concentration and age, were obtained from study authors. The study was registered with PROSPERO (no. CRD42024527191).

FindingsWe identified 6 new RCTs (19,337 participants). Data were obtained for 16,086 (83.2%) participants in 3 new RCTs and combined with data from 48,488 participants in 43 previously identified RCTs. For the primary comparison of any vitamin D vs. placebo, the intervention did not significantly affect overall ARI risk (OR 0.94, 95% CI 0.88 to 1.00, P=0.057; 40 studies; I2 26.4%). Pre-specified subgroup analysis did not reveal evidence of effect modification by age, baseline vitamin D status, or dosing regimen. Vitamin D did not influence the proportion of participants experiencing at least one serious adverse event (OR 0.96, 95% CI 0.90 to 1.04; 38 studies; I2 0.0%). A funnel plot showed left-sided asymmetry (P=0.002, Eggers test).

InterpretationThis updated meta-analysis yielded a similar point estimate for the overall effect of vitamin D supplementation on ARI risk to that obtained previously, but the 95% CI for this effect estimate now spans 1.00, indicating no statistically significant protection.

FundingNone

Research in contextO_ST_ABSEvidence before this studyC_ST_ABSWe searched MEDLINE, EMBASE, the Cochrane Central Register of Controlled Trials (CENTRAL), Web of Science and the ClinicalTrials.gov registry from 1st May 2020 (date of our previous search) to 30th April 2024 for randomised Controlled Trials and meta-analyses of randomised Controlled Trials evaluating effectiveness of vitamin D supplementation for the prevention of acute respiratory infections. Our previous meta-analysis of 43 randomised Controlled Trials (RCTs) of vitamin D supplementation for prevention of acute respiratory infections (ARI) conducted in 2021 revealed a statistically significant protective effect of the intervention (OR 0.92, 95% CI 0.86 to 0.99). A further 6 eligible RCTs, contributing data from 19,337 participants have now completed, including one large trial (n=15,804).

Added value of this studyOur meta-analysis of aggregate data from 64,086 participants in 46 randomised controlled trials, stratified by baseline 25(OH)D concentration and age, provides an updated estimate of the protective effects of vitamin D against acute respiratory infection overall (OR 0.94, 95% CI 0.88 to 1.00), and in sub-groups defined by baseline vitamin D status, age, and dosing frequency, amount and duration.

Implications of all the available evidenceUpdated meta-analysis including the latest available RCT data shows no statistically significant protective effect of vitamin D supplementation against ARI, either overall or in sub-group analyses.","NA","medrxiv",1729634990535
"Foamy microglia link oxylipins to disease progression in multiple sclerosis","10.1101/2024.10.18.619040","biorxiv",7.749999999999999,7.749999999999999,7.749999999999999,7.749999999999999,7.749999999999999,"van der Vliet, D.; Di, X.; Shamorkina, T. M.; Pavlovic, A.; Van der Vliet, I. A. C. M.; Zeng, Y.; Macnair, W.; van Egmond, N.; Chen, J. Q. A.; van den Bosch, A. M. R.; Engelenburg, H. J.; Mason, M. R. J.; Coulon-Bainier, C.; Gagestein, B.; Dusseldorp, E.; van Eijk, M.; Grether, U.; Netherlands Brain Bank (NBB),  ; Harms, A. C.; Hankemeier, T.; Collin, L.; Heck, A. J. R.; Huitinga, I.; van der Stelt, M.","Mario van der Stelt","Department of Molecular Physiology, Leiden Institute of Chemistry, Leiden University, Einsteinweg 55, 2333 CC, Leiden, The Netherlands.","2024-10-21","1","new results","cc_no","neuroscience","https://www.biorxiv.org/content/early/2024/10/21/2024.10.18.619040.source.xml","Multiple sclerosis (MS) is a neuroinflammatory disease characterized by expanding demyelinating lesions, leading to severe and irreversible disability. The mechanisms driving lesion expansion, however, remain poorly understood. Here, using a multi-omics approach, we identified foamy microglia as primary contributors to the molecular profile of lesions and disease progression in secondary progressive MS. Lesions with foamy microglia are marked by the accumulation of cholesterol esters, bismonoacylglycerolphosphates (BMP), and oxylipins, along with high B-cell infiltration, increased levels of immunoglobulin G1, and elevated expression of Fcgamma- and complement receptors. Lesions with foamy GPNMB+-microglia display markers of enhanced phagocytosis, lipid metabolism, lysosomal dysfunction, and antigen presentation, but lack classical pro-inflammatory markers. Our data suggest that sustained phagocytosis of myelin overwhelms microglial endo-lysosomal capacity, leading to lipid droplet and oxylipin formation. This microglial phenotype may induce further recruitment of adaptive immune cells, axonal damage, drive lesion expansion and prevent remyelination. Monoacylglycerol lipase, involved in producing oxylipin precursors, was identified as a potential therapeutic target to disrupt this cycle and prevent chronic lesion expansion.","NA","biorxiv",1729634990535
"Abandoning the Quadrupole for Mass Spectrometry Fragmentation Analysis: Towards 1,000 Hz Speeds with 100% Ion Utilization Using High Resolution Ion Mobility Precursor Isolation","10.1101/2024.10.18.619158","biorxiv",17.18,7.58,17.18,17.18,17.18,"DeBord, D.; Rorrer, L.; Deng, L.; Strathmann, F.","Daniel DeBord","MOBILion Systems, Inc.","2024-10-19","1","new results","cc_by_nc_nd","biochemistry","https://www.biorxiv.org/content/early/2024/10/19/2024.10.18.619158.source.xml","In today's fast-evolving landscape of omics research, tandem mass spectrometry has become a cornerstone for uncovering the complexities of biological systems. Yet, despite its essential role, the technology remains bound by the inherent limitations of quadrupole filters, which throw away up to 99% of the useful ion signal and caps the speed at which fragmentation data can be generated. These deficiencies often force compromises in data depth and accuracy, hindering breakthroughs that tie genomics, proteomics, and metabolomics together. A new technology is poised to break through these performance barriers, unlocking unprecedented capabilities in precision, sensitivity and throughput. This step-change in how mass spectrometry fragmentation analysis is performed will reshape the future of scientific discovery, pushing the boundaries of what's possible. The solution is high resolution ion mobility (HRIM), which offers a means to quickly and efficiently isolate ions prior to fragmentation and detection by a high resolution mass spectrometer (HRMS) while also resolving challenging isomeric and isobaric compounds that lead to chimeric MS/MS spectra. HRIM isolates ions in time as a result of a high speed separation rather than acting as a filter that discards ion signal like the pervasive quadrupole mass analyzer, allowing higher sensitivity analysis to be achieved. Also, since HRIM eliminates the need to hop or sweep electronics control parameters, as is the case with a quadrupole, fragmentation spectral generation can occur at a much faster rate, upwards of 500 Hz. This whitepaper describes an IM/MS methodology first contemplated over twenty years ago and today being positioned as the fastest method for high resolution fragmentation analysis. Revisiting this concept using the latest generation ion mobility technology based on structures for lossless ion manipulation (SLIM), which is the only HRIM technology that delivers similar resolution and range of analysis as a quadrupole, realizes the full potential of this approach to deliver benefits in both speed and sensitivity for high performance MS/MS measurements. This new way of achieving ion fragmentation in complex samples is set to revolutionize the mass spectrometry space, starting in the growing field of proteomics where all researchers are seeking faster methods to achieve more comprehensive proteomic coverage. Due to the advantages of HRIM physics, we predict this will set the bar for high throughput -omics within the coming years and will eventually be as ubiquitous as the quadrupole is today.","NA","biorxiv",1729634990535
"Abstract choice representations during stable choice-response associations","10.1101/2024.10.17.618830","biorxiv",9.049999999999999,7.55,9.049999999999999,9.049999999999999,9.049999999999999,"Quinn, K. R.; Sandhaeger, F.; Noury, N.; Zezelic, E.; Siegel, M.","Markus Siegel","University of Tuebingen","2024-10-18","1","new results","cc_by_nc_nd","neuroscience","https://www.biorxiv.org/content/early/2024/10/18/2024.10.17.618830.source.xml","Perceptual decisions have long been framed in terms of the actions used to report a choice. Accordingly, studies of perceptual decision-making have historically relied on tasks with fixed choice-response mappings, in which choice and motor response are inextricably linked. Although several studies have since dissociated choice and response, they have typically involved dynamic switching of the choice-response mapping on a trial-by-trial basis. Thus, it remains unclear if abstract choice representations arise specifically when choice-response relationships change dynamically, or if they reflect a more general property of the decision-making process. Here, we show that in the human brain, choices are represented abstractly, even when the association between choice and motor response remains stable over time. We measured neural activity in humans using magnetoencephalography (MEG) while participants performed a motion discrimination task. Importantly, the associations between perceptual choice and motor response were balanced across experimental conditions and remained stable over many trials. We found neural information about the participants perceptual choice, independent of both the motor response and the visual stimulus. This abstract choice information increased during the stimulus period and peaked after the response had been made. Furthermore, choice and response information showed distinct cortical distributions, with strongest choice information in frontoparietal regions. Our results suggest that abstract choice representations are not restricted to action-independent contexts or those with dynamic choice-response associations and may therefore reflect a general role in perceptual decision-making.","NA","biorxiv",1729634990535
"Apical clathrin-coated endocytic pits control the growth and size of epithelial microvilli","10.1101/2024.10.21.619431","biorxiv",7.5,7.5,7.5,7.5,7.5,"Perkins, O. L.; Mulligan, A. G.; Krystofiak, E. S.; Peebles, K. E.; Meenderink, L. M.; Millis, B. A.; Tyska, M. J.","Matthew J Tyska","Department of Cell and Developmental Biology, Vanderbilt University School of Medicine, Nashville, TN 37232","2024-10-21","1","new results","cc_no","cell biology","https://www.biorxiv.org/content/early/2024/10/21/2024.10.21.619431.source.xml","Epithelial cells from diverse contexts assemble apical specializations to serve tissue-specific functions. In virtually all cases, these features consist of arrays of microvilli: micron-scale, actin bundle-supported protrusions that mediate biochemical and physical interactions with the external environment. Despite their importance for epithelial physiology, how microvilli grow during cellular differentiation remains poorly understood. Using genetic and small molecule perturbations, we found that an epithelial cell[&prime]s potential for growing microvilli of normal size is limited by an adjacent actin-dependent process: apical clathrin-mediated endocytosis. Timelapse imaging of individual microvillar growth events revealed tight spatial and temporal coupling to sites of clathrin-mediated endocytosis. Finally, ultrastructural analysis of undifferentiated epithelial monolayers showed that most nascent microvilli are immediately adjacent to or in contact with an apical endocytic pit. Based on these discoveries, we conclude that clathrin-mediated endocytosis controls the timing and location of microvillar growth, as well as the dimensions of the resulting protrusions.","NA","biorxiv",1729634990535
"Wideband ratiometric measurement of tonic and phasic dopamine release in the striatum","10.1101/2024.10.17.618918","biorxiv",7.449999999999999,7.449999999999999,7.449999999999999,7.449999999999999,7.449999999999999,"Gottschalk, A.; Menees, H.; Bogner, C.; Zewde, S.; Jibin, J.; Gamam, A.; Flink, D.; Mosissa, M.; Bonneson, F.; Wehelie, H.; Alonso-Caraballo, Y.; Hamid, A. A.","Arif A. Hamid","University of Minnesota","2024-10-21","1","new results","cc_by_nc_nd","neuroscience","https://www.biorxiv.org/content/early/2024/10/21/2024.10.17.618918.source.xml","Reward learning, cognition, and motivation are supported by changes in neurotransmitter levels across multiple timescales. Current measurement technologies for various neuromodulators (such as dopamine and serotonin) do not bridge timescales of fluctuations, limiting the ability to define the behavioral significance, regulation, and relationship between fast (phasic) and slow (tonic) dynamics. To help resolve longstanding debates about the behavioral significance of dopamine across timescales, we developed a novel quantification strategy, augmenting extensively used carbon-fiber Fast Scan Cyclic Voltammetry (FSCV). We iteratively engineered the FSCV scan sequence to rapidly modify electrode sensitivity within a sampling window and applied ratiometric analysis for wideband dopamine measurement. This allowed us to selectively eliminate artifacts unrelated to electrochemical detection (i.e., baseline drift), overcoming previous limitations that precluded wideband dopamine detection from milliseconds to hours. We extensively characterize this approach in vitro, validate performance in vivo with simultaneous microdialysis, and deploy this technique to measure wideband dopamine changes across striatal regions under pharmacological, optogenetic, and behavioral manipulations. We demonstrate that our approach can extend to additional analytes, including serotonin and pH, providing a robust platform to assess the contributions of multi-timescale neuromodulator fluctuations to cognition, learning, and motivation.","NA","biorxiv",1729634990535
