"title","doi","altmetric_jid","score","X1d","X3d","X1w","X1m","authors","author_corresponding","author_corresponding_institution","date","version","type","license","category","jatsxml","abstract","funder","published","server","upupdate_time"
"Non-synaptic exocytosis along the axon shaft and its regulation by the submembrane periodic skeleton","10.1101/2025.09.17.676728","biorxiv",64.15000000000003,7.85,7.85,7.85,64.15000000000003,"Wiesner, T.; Parperis, C. L.; Boroni-Rueda, F.; Jullien, N.; Mendes, A.; Marie, L.; Mezache, L.; Papandreou, M.-J.; Henriques, R.; Leterrier, C.","Christophe Leterrier","Aix Marseille Université, CNRS, INP UMR7051, NeuroCyto, Marseille, France","2025-09-17","1","new results","cc_by_nc","cell biology","https://www.biorxiv.org/content/early/2025/09/17/2025.09.17.676728.source.xml","Neuronal communication relies on signaling molecules transferred via exo- and endocytosis throughout the brain. Historically, studies have focused on vesicle exo- and endocytosis and their release machinery at synapses, and much less is known about non-synaptic exocytosis. If and how vesicles can access the plasma membrane along the axonal shaft, overcoming the insulating layer of the membrane-associated periodic scaffold, remains unclear. Here, we used fast live-cell imaging of mature cultured hippocampal neurons expressing the vamp2-pHluorin reporter to map sponta-neous exocytosis along axons. We detected non-synaptic exocytic events along the axon shaft that concentrated at the axon initial segment. Perturbation of the membrane-associated actin-spectrin skeleton revealed its role in regulating shaft exocytosis, similarly to its recently demonstrated role in shaping axonal endocytosis. To visualize the nanoscale arrangement of exocytic locations, we developed a novel correlative live-cell/two - color, single-molecule localization microscopy (SMLM) approach. We observed that regions of exocytosis are devoid of the submembrane spectrin mesh, with these spectrin-free areas being spatially separated from the spectrin clearings that contain clathrin-coated pits. Overall, our work reveals a new process of spontaneous exocytosis along the axon shaft, and how the axonal submem-brane skeleton shapes a heterogeneous landscape that uniquely segregates vesicular trafficking events.","[{""name"":""Agence Nationale de la Recherche"",""id"":""https://ror.org/00rbzpz17"",""id-type"":""ROR"",""award"":""ANR-20-CE13-0024;ANR-21-CE42-0015;ANR-20-CE16-0021;""},{""name"":""Fondation pour la Recherche Médicale"",""id"":"""",""id-type"":""ROR"",""award"":""EQ202103012966;""},{""name"":""Fédération pour la Recherche sur le Cerveau"",""id"":"""",""id-type"":""ROR"",""award"":""AOE 16 “Espoir en tête” 2021;""},{""name"":""CPER-FEDER"",""id"":"""",""id-type"":""ROR"",""award"":""PA0014842;""},{""name"":""AMIDEX"",""id"":"""",""id-type"":""ROR"",""award"":""AMX-19-IET-002;""},{""name"":""European Research Council"",""id"":""https://ror.org/0472cxd90"",""id-type"":""ROR"",""award"":""101001332;""},{""name"":""European Innovation Council"",""id"":""https://ror.org/05cx8cy07"",""id-type"":""ROR"",""award"":""Pathfinder Open;""},{""name"":""European Molecular Biology Organization"",""id"":""https://ror.org/04wfr2810"",""id-type"":""ROR"",""award"":""EMBO-2020-IG-4734;""},{""name"":""Chan Zuckerberg Initiative (United States)"",""id"":""https://ror.org/02qenvm24"",""id-type"":""ROR"",""award"":""EOSS6-0000000260;""}]","NA","bioRxiv",1759442931011
"OmniPath: integrated knowledgebase for multi-omics analysis","10.1101/2025.09.11.675512","biorxiv",58.45000000000002,0.85,0.85,0.85,58.45000000000002,"Turei, D.; Schaul, J.; Palacio-Escat, N.; Bohar, B.; Bai, Y.; Ceccarelli, F.; Cevrim, E.; Daley, M.; Darcan, M.; Dimitrov, D.; Dogan, T.; Domingo-Fernandez, D.; Dugourd, A.; Gabor, A.; Gul, L.; Hall, B. A.; Hoyt, C. T.; Ivanova, O.; Klein, M.; Lawrence, T.; Mananes, D.; Modos, D.; Muller-Dott, S.; Olbei, M. L.; Schmidt, C.; Sen, B.; Theis, F. J.; Unlu, A.; Ulusoy, E.; Valdeolivas, A.; Korcsmaros, T.; Saez-Rodriguez, J.","Denes Turei","Heidelberg University Hospital","2025-09-13","1","new results","cc_by","bioinformatics","https://www.biorxiv.org/content/early/2025/09/13/2025.09.11.675512.source.xml","Analysis and interpretation of omics data largely benefit from the use of prior knowledge. However, this knowledge is fragmented across resources and often is not directly accessible for analytical methods. We developed OmniPath (https://omnipathdb.org/), a database combining diverse molecular knowledge from 168 resources. It covers causal protein-protein, gene regulatory, miRNA, and enzyme-PTM (post-translational modification) interactions, cell-cell communication, protein complexes, and information about the function, localization, structure, and many other aspects of biomolecules. It prioritizes literature curated data, and complements it with predictions and large scale databases. To enable interactive browsing of this large corpus of knowledge, we developed OmniPath Explorer, which also includes a large language model (LLM) agent that has direct access to the database. Python and R/Bioconductor client packages and a Cytoscape plugin create easy access to customized prior knowledge for omics analysis environments, such as scverse. OmniPath can be broadly used for the analysis of bulk, single-cell and spatial multi-omics data, especially for mechanistic and causal modeling.

Graphical Abstract

O_FIG O_LINKSMALLFIG WIDTH=200 HEIGHT=79 SRC=""FIGDIR/small/675512v1_ufig1.gif"" ALT=""Figure 1"">
View larger version (27K):
org.highwire.dtl.DTLVardef@17c2b6borg.highwire.dtl.DTLVardef@1069835org.highwire.dtl.DTLVardef@1f2ce76org.highwire.dtl.DTLVardef@1d0b34f_HPS_FORMAT_FIGEXP  M_FIG C_FIG","[{""name"":""Landesinstitut für Bioinformatikinfrastruktur in Baden-Württemberg"",""id"":"""",""id-type"":""ROR"",""award"":""""},{""name"":""European Union’s Horizon 2020 programme"",""id"":"""",""id-type"":""ROR"",""award"":""965193;""},{""name"":""German Research Foundation (DFG)"",""id"":"""",""id-type"":""ROR"",""award"":""DFG-508152189;""},{""name"":""UKRI BBSRC"",""id"":"""",""id-type"":""ROR"",""award"":""BB/X011054/1;BBS/E/F/000PR13631;""},{""name"":""TUBITAK ARDEB"",""id"":"""",""id-type"":""ROR"",""award"":""120E531;""},{""name"":""German Federal Ministry of Research, Technology and Space"",""id"":"""",""id-type"":""ROR"",""award"":""031L0257B;""},{""name"":""Imperial College London"",""id"":""https://ror.org/041kmwe10"",""id-type"":""ROR"",""award"":""""},{""name"":""SmartCare"",""id"":"""",""id-type"":""ROR"",""award"":""03LW0233K;""}]","NA","bioRxiv",1759442931011
"Disruption of theta-timescale spiking impairs learning but spares hippocampal replay","10.1101/2025.09.15.675587","biorxiv",52.55000000000005,0,2.7,2.7,52.55000000000005,"Joshi, A.; Comrie, A. E.; Bray, S.; Mankili, A.; Guidera, J. A.; Nevers, R.; Sun, X.; Monroe, E.; Kharazia, V.; Ly, R.; Maya, D. A.; Morales-Rodriguez, D.; Yu, J.; Kiseleva, A.; Perez, V.; Frank, L. M.","Abhilasha Joshi","National Center for Biological Sciences, Bangalore, India","2025-09-17","1","new results","cc_by_nc","neuroscience","https://www.biorxiv.org/content/early/2025/09/17/2025.09.15.675587.source.xml","The ability to rapidly learn and retrieve salient information about new environments is critical for survival. In mammals, the hippocampus plays a crucial role in that learning. Specialized features of hippocampal population coding, including network-level theta oscillatory activity, location-specific firing of principal cells, and reactivation of experience during immobility (replay), have been implicated in rapid storage and retrieval of spatial information. Disruptions of theta and replay jointly, or replay alone, are sufficient to impair learning; however, the specific contribution of theta-associated temporal structure during locomotion remains unknown. In this study, we manipulated hippocampal spiking activity in rats specifically during locomotion by optogenetically activating septal parvalbumin-expressing GABAergic neurons. We developed a closed-loop, theta phase-specific stimulation protocol that reliably reduced theta power shortly after stimulation onset. This manipulation preserved the place codes of individual cells but disrupted the fine temporal structure of endogenous spatio-temporal representations (for example, theta sequences) at the pairwise and population level. Theta disruption during locomotion was also sufficient to cause pronounced deficits in learning the more cognitively challenging component of a spatial alternation task, even though disruption was applied on only [~]66% of trials. Notably, network effects accompanying theta disruption were restricted to locomotor periods; we did not observe changes in replay rate, length, or content during immobility. Together, these results demonstrate the importance of the precise temporal microstructure of locomotion-associated spatial representations in the hippocampus for learning.","[{""name"":""Simons Foundation"",""id"":""https://ror.org/01cmst727"",""id-type"":""ROR"",""award"":""1189761 (Joshi);1283731 (Joshi);542981 (Frank);""},{""name"":""Life Sciences Research Foundation"",""id"":""https://ror.org/0195dxj21"",""id-type"":""ROR"",""award"":""Joshi;""},{""name"":""NSF GRFP"",""id"":"""",""id-type"":""ROR"",""award"":""1650113 (Comrie);""},{""name"":""nih"",""id"":"""",""id-type"":""ROR"",""award"":""F31MH124366 (Comrie);""},{""name"":""UCSF Jonas Cohler Discovery Fellowship"",""id"":"""",""id-type"":""ROR"",""award"":""Comrie;""},{""name"":""National Institute of Mental Health"",""id"":""https://ror.org/04xeg9z08"",""id-type"":""ROR"",""award"":""F30MH126483 (Guidera);""},{""name"":""UCSF Discovery 411 Fellowship"",""id"":"""",""id-type"":""ROR"",""award"":""Guidera;""},{""name"":""Phi Beta Kappa Graduate Award"",""id"":"""",""id-type"":""ROR"",""award"":""Guidera;""},{""name"":""Howard Hughes Medical Institute"",""id"":""https://ror.org/006w34k90"",""id-type"":""ROR"",""award"":""Frank;""}]","NA","bioRxiv",1759442931011
"Molecular basis of polyadenylated RNA fate determination in the nucleus","10.1101/2025.09.16.676470","biorxiv",50.30000000000003,0,0.5,3.5500000000000003,50.30000000000003,"Bugai, A.; Hohmann, U.; Lorenzo, A.; Graf, M.; Fin, L.; Rouviere, J. O.; Tirian, L.; Dou, Y.; Polak, P.; Johnsen, D.; Jakobsen, L.; Andersen, J. S.; Brennecke, J.; Plaschka, C.; Jensen, T. H.","Torben Heick Jensen","Department of Molecular Biology and Genetics, Aarhus University","2025-09-16","1","new results","cc_by_nc_nd","molecular biology","https://www.biorxiv.org/content/early/2025/09/16/2025.09.16.676470.source.xml","Eukaryotic genomes generate a plethora of polyadenylated (pA+) RNAs1,2, that are packaged into ribonucleoprotein particles (RNPs). To ensure faithful gene expression, functional pA+ RNPs, including protein-coding RNPs, are exported to the cytoplasm, while transcripts within non-functional pA+ RNPs are degraded in the nucleus1-4. How cells distinguish these opposing fates remains unknown. The DExD-box ATPase UAP56/DDX39B is a central component of functional pA+ RNPs, promoting their docking to the nuclear pore complex (NPC)-anchored  transcription and export complex 2 (TREX-2) (ref.5,6), which triggers transcript release from UAP56 to facilitate export (ref.7,8). Here, we uncover that the  Poly(A) tail exosome targeting (PAXT) connection9 harbors its own TREX-2-like module, which releases pA+ RNAs from UAP56 for decay by the nuclear exosome. The core of this module consists of a LENG8-PCID2-SEM1 (LENG8-PS) trimer, which we show is structurally and functionally equivalent to the central GANP-PCID2-SEM1 (GANP-PS) trimer of TREX-2. Mutagenesis and transcriptomic data demonstrate that the nuclear fate of pA+ RNPs is governed by the contending actions of nucleoplasmic PAXT and NPC-associated TREX-2, which interpret RNA-bound UAP56 as a signal for RNA decay or export, respectively. As RNA targets of PAXT are generally short and intron-poor, we propose an overall model for pA+ RNP fate determination, whereby the distinct sub-nuclear localizations of PAXT and TREX-2 govern the degradation of short non-functional pA+ RNAs while allowing export of their longer and functional counterparts.","NA","NA","bioRxiv",1759442931011
"Improved cryo-EM reconstruction of sub-50 kDa complexes using 2D template matching","10.1101/2025.09.11.675606","biorxiv",34.650000000000006,0.85,1.35,2.35,34.650000000000006,"Zhang, K.; Grant, T.; Grigorieff, N.","Kexin Zhang","University of Massachusetts Chan Medical School","2025-09-16","1","new results","cc_by","biophysics","https://www.biorxiv.org/content/early/2025/09/16/2025.09.11.675606.source.xml","Visualizing the structures of small proteins and complexes has been a longstanding challenge in single-particle cryo-EM. Some of these targets have been successfully resolved by binding to antibody fragments (Fabs) or fusing with external scaffolds to increase their size. Recent advances in conventional single-particle techniques have enabled the determination of an in-creasing number of structures smaller than 100 kDa, achieving resolutions relevant to drug research. Compared to X-ray crystallography, cryo-EM preserves the near-native states of biomolecules, can resolve structural heterogeneity, and has the potential to apply to a wide range of targets. In this work, we demonstrate that the alignment and reconstruction of small macromolecular complexes can be significantly improved using high-resolution structures as priors combined with 2D template matching. Using this method, we were able to reconstruct previously intractable targets under 50 kDa and improve the density of the ligand-binding sites in the reconstructions. We envision that this method will further lower the molecular weight limit of single-particle cryo-EM, enabling its application to important drug-binding complexes that are below 50 kDa.","[{""name"":""Howard Hughes Medical Institute"",""id"":""https://ror.org/006w34k90"",""id-type"":""ROR"",""award"":""""}]","NA","bioRxiv",1759442931011
"PIEZO channels link mechanical forces to uterine contractions in parturition","10.1101/2025.09.17.676899","biorxiv",32.55000000000002,0,0,0.25,32.55000000000002,"Zhang, Y.; Kini, S. A.; Mishkanian, S. A.; Luo, R.; Seradj, S. H.; Leung, V.; Wang, Y.; Rocio, S.-V. M.; Keenan, W. T.; Sonmez, U.; Yarishkin, O.; Sanchez-Alavez, M.; Liu, Y.; Jin, X.; Lipomi, D. J.; Li, Y.; Petrascheck, M.; Frolova, A. I.; England, S. K.; Patapoutian, A.","Ardem Patapoutian","The Scripps Research Institute","2025-09-18","1","new results","cc_by","physiology","https://www.biorxiv.org/content/early/2025/09/18/2025.09.17.676899.source.xml","AbstractMechanical forces are extensively involved in pregnancy and parturition, but their precise roles and mechanisms remain poorly understood. Here, we identify mechanically activated ion channels PIEZO1 and PIEZO2 as key mechanotransducers required for labor progression. Genetic deletion of Piezo1 and Piezo2 in mice resulted in weakened uterine contractions and severe parturition defects. Tissue-specific knockouts revealed that deletion in either the uterus or sensory neurons alone caused modest defects, whereas combined loss significantly impaired labor, demonstrating additive effects. Single-nuclei sequencing showed that loss of PIEZO reduced expression of connexin43 (Gja1), a gap junction protein in uterine smooth muscle cells, suggesting a mechanistic link to impaired contraction. These findings highlight the critical role of PIEZO channels in mechanotransduction during parturition and suggest therapeutic targets for labor dysfunction.","[{""name"":""National Institute of Neurological Disorders and Stroke"",""id"":""https://ror.org/01s5ya894"",""id-type"":""ROR"",""award"":""R35 NS105067;R01AT012051;""},{""name"":""Damon Runyon Cancer Research Foundation"",""id"":""https://ror.org/01gd7b947"",""id-type"":""ROR"",""award"":""DRG-2405-20;""},{""name"":""U.S. National Science Foundation"",""id"":""https://ror.org/021nxhr62"",""id-type"":""ROR"",""award"":""CMMI-2135428;""},{""name"":""NIH Common Fund"",""id"":""https://ror.org/001d55x84"",""id-type"":""ROR"",""award"":""DP2DK128800;""},{""name"":""Howard Hughes Medical Institute"",""id"":""https://ror.org/006w34k90"",""id-type"":""ROR"",""award"":""""}]","NA","bioRxiv",1759442931011
"The eukaryotic replisome intrinsically generates asymmetric daughter chromatin fibers","10.1101/2025.09.18.677126","biorxiv",32.50000000000002,0,0,1.7,32.50000000000002,"Eckhardt, B. V.; Richter, H. J.; Rondeel, I.; Renduchintala, K.; Mattiroli, F.; Ramani, V.","Francesca Mattiroli","Hubrecht Institute","2025-09-18","1","new results","cc_by_nc_nd","biochemistry","https://www.biorxiv.org/content/early/2025/09/18/2025.09.18.677126.source.xml","DNA replication is molecularly asymmetric, due to distinct mechanisms for lagging and leading strand DNA synthesis. Whether chromatin assembly on newly replicated strands is also asymmetric remains unknown, as visualizing this short-lived state in cells is impossible. To circumvent this limitation, we combine in vitro reconstitution of the Saccharomyces cerevisiae DNA and chromatin replication machineries with replication-aware single-molecule chromatin footprinting, to study how chromatin is re-assembled on replicated DNA. Leveraging the non-destructive, single-molecule, and strand-specific nature of our data, we discover an intrinsic asymmetry in nucleosome positioning patterns and organization between lagging- and leading-strand chromatin created by the yeast replisome. This asymmetry is only partially restored upon addition of chromatin assembly factors involved in de novo histone deposition and the ATP-dependent chromatin remodeler Isw1a, implying that other regulatory factors must resolve this asymmetry in cells. In sum, our data reveal the complexity of chromatin re-establishment following DNA replication, and suggest an asymmetric chromatin assembly intermediate on each daughter chromatid. These pathways have implications for essential chromatin-templated processes such as DNA repair, transcription, and gene silencing at replication forks.","[{""name"":""European Research Council"",""id"":""https://ror.org/0472cxd90"",""id-type"":""ROR"",""award"":""851564;""},{""name"":""Dutch Research Council"",""id"":""https://ror.org/04jsz6e67"",""id-type"":""ROR"",""award"":""VI.Vidi.233.038;""},{""name"":""National Institutes of Health"",""id"":""https://ror.org/01cwqze88"",""id-type"":""ROR"",""award"":""DP2-HG012442;""},{""name"":""W. M. Keck Foundation"",""id"":""https://ror.org/000dswa46"",""id-type"":""ROR"",""award"":""-;""},{""name"":""Searle Scholars Program"",""id"":"""",""id-type"":""ROR"",""award"":""-;""}]","NA","bioRxiv",1759442931011
"Single-cell morphodynamics predict cell fate decisions during mucociliary epithelial differentiation.","10.1101/2025.09.17.676780","biorxiv",32.250000000000014,0,0,1.35,32.250000000000014,"Tolonen, M.; Xu, Z.; Beker, O.; Kapoor, V.; Dumitrascu, B.; Sedzinski, J.","Jakub Sedzinski","The Novo Nordisk Foundation Center for Stem Cell Medicine (reNEW), University of Copenhagen, Copenhagen, Denmark.","2025-09-17","1","new results","cc_by_nd","developmental biology","https://www.biorxiv.org/content/early/2025/09/17/2025.09.17.676780.source.xml","Cell state transitions underlie the emergence of diverse cell types and are traditionally defined by changes in gene expression. Yet these transitions also involve coordinated shifts in cell morphology and behaviour, which remain poorly characterized in densely packed epithelia. We developed a quantitative live-imaging and computational framework to track thousands of individual cells over time in the rapidly differentiating Xenopus mucociliary epithelium (MCE). From segmentations and trajectories, we extracted dynamic features-cell and nuclear shape, movement, position-to create a time-resolved morphodynamic dataset spanning the full course of differentiation. While single features showed high noise and low separability of ground-truth cell types, supervised machine learning revealed that integrating time-resolved features robustly predicts final cell fate. Gradient-boosted trees and multinomial logistic regression achieved moderate but consistent accuracy, especially for abundant epithelial lineages. Key discriminants included normalized Z-position, membrane-nucleus offset, and absolute experimental time, whereas movement contributed minimally to the results. Our results show that morphodynamic signatures encode predictive information about cell identity and provide a framework linking physical dynamics with molecular state.","[{""name"":""Novo Nordisk Foundation"",""id"":""https://ror.org/04txyc737"",""id-type"":""ROR"",""award"":""NNF21CC0073729;NNF19SA0035442;NNF22OC0076414;NNF19OC0056962;""},{""name"":""European Research Council CoG"",""id"":"""",""id-type"":""ROR"",""award"":""101125803 MechanoFate;""},{""name"":""LEO Foundation"",""id"":""https://ror.org/02rgsr590"",""id-type"":""ROR"",""award"":""LF-OC-19-000219;""},{""name"":""GENCI-IDRIS"",""id"":"""",""id-type"":""ROR"",""award"":""A0161013396;AD011013695;""}]","NA","bioRxiv",1759442931011
"Cysteine-rich receptor-like kinases mediate Wall Teichoic Acid perception in Arabidopsis","10.1101/2025.09.18.677107","biorxiv",30.649999999999995,0,0,0.85,30.649999999999995,"Pierdzig, L.; Seinsche, C.; Kalla, S.; Armiento, S.; Schulz, L. M.; Rismondo, J.; Molinaro, A.; De Castro, C.; Petutschnig, E. K.; Lipka, V.","Volker Lipka","University of Goettingen","2025-09-21","1","new results","cc_no","plant biology","https://www.biorxiv.org/content/early/2025/09/21/2025.09.18.677107.source.xml","Plants and animals detect microbe-associated molecular patterns (MAMPs) to initiate defense responses. Both lineages employ pattern recognition receptors (PRRs), yet plant mechanisms for sensing Gram-positive bacterial MAMPs remain poorly understood. Wall teichoic acids (WTAs), anionic glycopolymers unique to Gram-positive bacteria, are shown here to activate salicylic acid signaling, defense priming, and a non-canonical programmed cell death in Arabidopsis. We demonstrate that glycosylated WTAs from diverse Gram-positive species elicit these responses and provide genetic evidence that their recognition depends on two members of the plant-specific CYSTEINE-RICH RECEPTOR-LIKE KINASE (CRK) gene family, which is absent in animals and whose function remains elusive. These findings reveal WTAs as a novel class of MAMPs in plants and highlight CRKs as key components in their perception.","[{""name"":""DFG"",""id"":"""",""id-type"":""ROR"",""award"":""RI 2920/3-1;GRK 2172;INST 186/1277-1 FUGG;""}]","NA","bioRxiv",1759442931011
"mRNA-1273.251 and mRNA-1283.251 vaccines expressing SARS-CoV-2 variant LP.8.1 antigens broadly neutralize contemporary JN.1-lineage viruses","10.1101/2025.09.16.676634","biorxiv",30.350000000000012,0,0,3.5,30.350000000000012,"Nasir, A.; Lee, D. W.; Wang, Z.; Ogega, C.; Bopp, N.; Wisti, P.; Makrinos, D.; Jani, H.; Gorrie, A.; Bender, M. F.; Laciak, A. R.; Sharma, A.; Hu, X.; Speidel, T.; Ghantous, F.; Berrueta, D. M.; Hou, Y. J.; Hardcastle, K.; Elbashir, S.; Harmon, C.; Amato, N. J.; Wu, K.; Schief, W. R.; Hohn, K.; Carfi, A.; Budigi, Y.; Wahid, R.; Edwards, D. K.; Freyn, A. W.","Alec W Freyn","Moderna","2025-09-17","1","new results","cc_no","immunology","https://www.biorxiv.org/content/early/2025/09/17/2025.09.16.676634.source.xml","The continued evolution of the SARS-CoV-2 Omicron JN.1 lineage has led to the emergence of antigenically distinct subvariants including KP.2, KP.3, XEC, and LP.8.1, which became the dominant strains in the Americas and Europe by mid-2025. LP.8.1 was designated a Variant Under Monitoring by the WHO in January 2025 due to its potential to displace prior circulating variants. Informed by early growth modeling and antigenic analysis, we selected LP.8.1 as a candidate strain for the 2025-2026 vaccine season. Here, we describe the development of updated LP.8.1-matched mRNA vaccine compositions encoding either the full-length spike protein for mRNA-1273 (monovalent) or the membrane-anchored receptor-binding and N-terminal domains for the mRNA-1283 vaccine. Initial in vitro characterization, including structural analysis, demonstrated robust antigen expression and intact antigenic features. Immunogenicity of both vaccines were evaluated in murine models following immunization as either a primary series in naive animals or as a booster dose. LP.8.1-matched vaccines elicited strong neutralizing antibody responses against the homologous LP.8.1 strain and more recently emerging JN.1-lineage subvariants, including XFG and NB.1.8.1. Notably, the mRNA-1283 vaccine expressing LP.8.1 induced higher mean neutralization titers than the mRNA-1273 version across multiple variants. These data demonstrate the immunogenicity and breadth of both LP.8.1-based mRNA-1273 and mRNA-1283 vaccines in the context of ongoing JN.1 lineage evolution and support the selection of LP.8.1 as the updated vaccine antigen for the 2025-2026 season.","NA","NA","bioRxiv",1759442931011
