"title","doi","altmetric_jid","score","X1d","X3d","X1w","X1m","authors","author_corresponding","author_corresponding_institution","date","version","type","license","category","jatsxml","abstract","funder","published","server","upupdate_time"
"SegmentQTL: Identifying genetic variants influencing molecular phenotypes in copy number-driven cancers","10.1101/2025.07.28.667150","biorxiv",3,0,3,3,3,"Leppiniemi, S.; Afenteva, D.; Li, Y.; Micoli, G.; Lavikka, K.; Holmström, S.; Boyenval, D.; Oikkonen, J.; Hautaniemi, S.; Muranen, T. A.","Taru A Muranen","University of Helsinki","2025-07-31","1","new results","cc_by","bioinformatics","https://www.biorxiv.org/content/early/2025/07/31/2025.07.28.667150.source.xml","MotivationMolecular quantitative trait loci (molQTL) analysis links genetic variants to molecular phenotypes, such as gene expression, but existing tools do not account for the structural complexity of copy number-driven cancers. High genomic instability of these cancers leads to chromosomal breaks (breakpoints), which disrupt the physical connection between genes and adjacent regulatory elements. Standard molQTL methods are unable to accommodate breakpoint information and would therefore indiscriminately test associations across breakpoints, leading to spurious signals and reduced biological relevance. To address these challenges, we developed SegmentQTL, a segmentation-aware molQTL analysis tool, designed to improve the accuracy of association testing in unstable cancer genomes by incorporating sample-specific break-point information.

ResultsSegmentQTL applies an integrated purifying filtering step that removes associations spanning breakpoints, ensuring that only variants within the same segment as the phenotype are tested. This prevents false discoveries and reduces background noise. We evaluated SegmentQTL on selected genes from stable and unstable genomic regions and compared its results with a previously published state-of-the-art tool. In stable regions, SegmentQTL produced similar results, validating its approach. In unstable regions, however, the filtering step refined detected associations by shifting peak locations and removing artefactual signals that would arise if genomic instability were not properly accounted for.

Availability and implementationhttps://github.com/HautaniemiLab/SegmentQTL","[{""name"":""European Unions Horizon 2020 research and innovation programme"",""id"":"""",""id-type"":""ROR"",""award"":""965193;""}]","NA","bioRxiv",1754345412035
"KIASORT: Knowledge-Integrated Automated Spike Sorting for Geometry-Free Neuron Tracking","10.1101/2025.07.10.664175","biorxiv",7.9,0,2,2,7.9,"Boroujeni, K. B.; Womelsdorf, T.; Kastner, S.","Kianoush Banaie Boroujeni","Princeton University","2025-07-16","1","new results","cc_by_nc_nd","neuroscience","https://www.biorxiv.org/content/early/2025/07/16/2025.07.10.664175.source.xml","Identifying single units from extracellularly recorded neural signals is critical for understanding brain circuit dynamics. With the advancements of large-scale recordings, efficient and precise automated spike sorting methods have become essential. Existing approaches face challenges with channel quality variability, neuron-specific waveform drifts, and nonlinear changes in spike shapes that depend on neuronal morphology and electrode proximity. We introduce KIASORT (Knowledge-Integrated Automated Spike Sorting), which integrates knowledge from channel-specific classifiers trained on clustered spike waveforms to sort the data. KIASORT evaluates channel quality, automatically excludes noisy recordings, and identifies spike classes using a hybrid dimensionality reduction approach combining linear with nonlinear embeddings. To validate our approach against existing methods, we developed biophysical simulations demonstrating that conventional one-dimensional drift correction methods cannot address heterogeneous neuron-specific drift and nonlinear waveform changes. KIASORTs geometry-free, per-neuron tracking approach overcomes these limitations without assumptions about cluster shape or temporal stability. Specifically, KIASORT identified significantly greater number of high-quality units than Kilosort4 in ground-truth simulations with neuron-specific drift, while maintaining real-time processing capability. Complementing these advances, KIASORT also includes a unified graphical interface for data inspection, sorting, and curation, which is freely available online through link https://github.com/banaiek/KIASORT.","[{""name"":""Starr Foundation"",""id"":""https://ror.org/00gqt9c14"",""id-type"":""ROR"",""award"":""""},{""name"":""National Institute of Mental Health"",""id"":""https://ror.org/04xeg9z08"",""id-type"":""ROR"",""award"":""R01MH123687;""}]","NA","bioRxiv",1754345412035
"Extensive horizontal transfer of transposable elements shape fungal mobilomes","10.1101/2025.06.16.659975","biorxiv",27.80000000000001,0,0,5.4,5.4,"Romeijn, J.; Belaunde, I. B.; Seidl, M. F.","Michael F. Seidl","Utrecht University","2025-06-20","1","new results","cc_by_nc","evolutionary biology","https://www.biorxiv.org/content/early/2025/06/20/2025.06.16.659975.source.xml","Transposons impact eukaryotic genome size and evolution. Horizontal transfer of transposons (HTT) is important for their long-term persistence, but has only been systematically studied in animals, and thus the abundance, impact, and factors that shape HTTs in lineages outside animals is unknown. Fungi are at least as ancient and diverse as animals and are characterized by extensive genome size variation caused by transposons. Here, we screened 1,348 genomes across fungal biodiversity, genome sizes, and lifestyles to detect extensive HTTs, that generated on average 7% but up to 70% of the transposon content in some taxa. We in total identified at least 5,518 independent HTTs, mostly involving Tc1/Mariner DNA transposons. While the majority of HTTs occur between closely related taxa, irrespective of their lifestyles, HTTs were particularly common in Mucoromycotina, Sordariomycetes, Dothideomycetes, and Leotiomycetes. Importantly, species lacking fungal-specific defense mechanisms against transposons and those with gene-sparse and repeat-rich genomic compartments are involved in significantly higher number of HTTs, unveiling ecological and genomic factors shaping HTTs. Our findings thus illuminate the dynamic landscape of HTTs in fungi, providing the framework to further study the impact of HTTs on genome evolution and the processes that mediate transposon transfers within and between eukaryotic lineages.","[{""name"":""Utrecht University, Incentive Grant"",""id"":"""",""id-type"":""ROR"",""award"":""""}]","NA","bioRxiv",1754345412035
"Controlling treatment toxicity in ovarian cancer to prime the patient for tumor extinction therapy","10.1101/2025.07.10.664235","biorxiv",9.5,0,0,5,9.5,"Gallagher, K.; Sousa, R. S.; Gatenbee, C. D.; Schenck, R.; Chen, P.; Citak, T.; Leither, S.; Mazzacurati, L.; Xella, A.; Zhou, Z.; Lemanne, D.; Rodriguez, P.; George, E.; Strobl, M. A. R.","Maximilian A R Strobl","Department of Translational Hematology and Oncology Research, Cleveland Clinic, Ohio, USA","2025-07-16","1","new results","cc_by_nc","cancer biology","https://www.biorxiv.org/content/early/2025/07/16/2025.07.10.664235.source.xml","High-grade serous ovarian cancer (HGSOC) remains a major clinical challenge. In particular among those patients with homologous recombination (HR)-proficient tumors (>50%), most eventually succumb to their disease due to high recurrence rates, acquired resistance, and cumulative toxicity. This report summarizes work from the 12th IMO Workshop in which we explored an alternative ""extinction therapy"" strategy for frontline treatment of HGSOC. Inspired by ecological principles, this multi-strike approach aims to eradicate tumors not through a singular ""magic bullet"" but through a series of therapies after standard frontline treatment when the tumor is still, and perhaps most, vulnerable. We present a framework leveraging mathematical modeling (MM) to develop personalized multi-strike protocols for HGSOC. Key contributions include: 1) An ""IMOme"" score using liquid biopsy data to assess patient-specific hematopoietic toxicity risk, guiding the timing and selection of subsequent therapies, 2) MM strategies to design effective lowdose combinations of targeted agents to achieve synthetic lethality while managing toxicity, and 3) A MM framework to analyze the interplay between chemotherapy, gut microbiome toxicity, and immunotherapy, demonstrating how mitigating microbiome damage could enhance immune response. Overall, the computational approaches presented herein aim to support the design of personalized, multi-strike regimens in the frontline setting that proactively target tumor extinction while managing toxicity, ultimately seeking to deliver cures for patients with HGSOC.","[{""name"":""NCI"",""id"":"""",""id-type"":""ROR"",""award"":""U54CA193489;""}]","NA","bioRxiv",1754345412035
"Guidance of cellular nematics into shape-programmable living surfaces","10.1101/2025.06.27.660992","biorxiv",82.40000000000006,0,0,0,82.40000000000006,"Guillamat, P.; Mirza, W.; Bal, P. K.; Gomez-Gonzalez, M.; Roca-Cusachs, P.; Arroyo, M.; Trepat, X.","Xavier Trepat","Institute for Bioengineering of Catalonia (IBEC), The Barcelona Institute for Science and Technology (BIST), 08028 Barcelona, Spain","2025-06-27","1","new results","cc_by","biophysics","https://www.biorxiv.org/content/early/2025/06/27/2025.06.27.660992.source.xml","Engineering living materials capable of autonomously morphing into predetermined shapes holds great potential for applications ranging from synthetic tissue morphogenesis to soft robotics. In this regard, harnessing the inherent ability of cellular tissues to self-organize and generate robust force fields offers a promising strategy for creating self-shaping living surfaces. However, achieving precise control over tissue mechanics to direct specific morphogenetic outcomes remains a challenge. Here, we introduce a strategy to program tissue shape transformations through the nematic organization of cellular forces. By precisely controlling nematic order and topological defects, we generate millimeter-scale tissues programmed with specific multicellular tension fields. Using a theoretical framework that integrates contractile nematics with thin sheet mechanics, we explore the role of nematically guided tensions in shape morphogenesis. Experimentally, upon tissue detachment, nematically guided tension fields drive out-of-plane deformations, generating reproducible 3D shapes. By integrating tissue contractility and nematic patterning, our approach offers a robust framework for the rational design of shape-programmable living surfaces.","NA","NA","bioRxiv",1754345412035
"mamp-ml: A deep learning approach to epitope immunogenicity in plants","10.1101/2025.07.11.664399","biorxiv",55.70000000000002,0,0,0,55.70000000000002,"Stevens, D. M.; Yang, D.; Liang, T. J.; Li, T.; Vega, B.; Coaker, G.; Krasileva, K.","Ksenia Krasileva","University of California, Berkeley","2025-07-15","1","new results","cc_by_nc","immunology","https://www.biorxiv.org/content/early/2025/07/15/2025.07.11.664399.source.xml","Eukaryotes detect biomolecules through surface-localized receptors, key signaling components. A subset of receptors survey for pathogens, induce immunity, and restrict pathogen growth. Comparative genomics of both hosts and pathogens has unveiled vast sequence variation in receptors and potential ligands, creating an experimental bottleneck. We have developed mamp-ml, a machine learning framework for predicting plant receptor-ligand interactions. We leveraged existing functional data from over two decades of foundational research, together with the large protein language model ESM-2, to build a pipeline and model that predicts immunogenic outcomes using a combination of receptor-ligand features. Our model achieves 73% prediction accuracy on a held-out test set, even when an experimental structure is lacking. Our approach enables high-throughput screening of LRR receptor-ligand combinations and provides a computational framework for engineering plant immune systems.","[{""name"":""nih"",""id"":"""",""id-type"":""ROR"",""award"":""1DP2AT011967-01;2R35GM136402;""}]","NA","bioRxiv",1754345412035
"Conformational asymmetry of replicated human chromosomes","10.1101/2025.07.09.663929","biorxiv",52.100000000000044,0,0,0,52.100000000000044,"Corsi, F.; Kolesnikova, S.; Steinacker, T. L.; Takacs, Z.; Batty, P.; Mitter, M.; Gerlich, D. W.; Goloborodko, A.","Anton Goloborodko","Institute of Molecular Biotechnology of the Austrian Academy of Sciences","2025-07-14","1","new results","cc_by","molecular biology","https://www.biorxiv.org/content/early/2025/07/14/2025.07.09.663929.source.xml","DNA replication creates two sister chromatids that must acquire specific three-dimensional conformations to support genome function and stability. This organization is largely mediated by cohesin complexes, which extrude intra-chromosomal loops and link two chromatids, thus forming ""chromatid cohesion"". Although sister chromatids are genetically identical, the replication process is intrinsically asymmetric: each chromatid inherits a different parental DNA strand, while the new strands are synthesized using distinct ""leading"" and ""lagging"" mechanisms of the replication fork. Whether and how this molecular asymmetry impacts higher-order chromatin organization remains unknown. Using sister-chromatid-sensitive Hi-C, strand-specific FISH, and polymer modeling, we reveal a consistent, genome-wide shift in sister chromatid alignment, biased along the 5'-3' direction of the inherited strands. This shift persists without loop extrusion but is lost upon disruption of cohesion, implicating cohesive cohesins in maintaining the displacement. Polymer simulations indicate that a modest ([~]100 kb) misalignment of ""cohesive"" cohesins is responsible for the observed asymmetry. We propose two mechanistic models that explain how this displacement arises from replication fork asymmetry: either through the dislocation of cohesin during replication or through the asymmetric anchoring and subsequent random sliding of cohesin pairs. These findings reveal a previously unrecognized chromosome-scale asymmetry in sister chromatid organization, which has implications for homology search during DNA repair.","[{""name"":""FWF Austrian Science Fund"",""id"":""https://ror.org/013tf3c58"",""id-type"":""ROR"",""award"":""SFB F 8804-B “Meiosis”;""},{""name"":""European Research Council"",""id"":""https://ror.org/0472cxd90"",""id-type"":""ROR"",""award"":""101163751;101019039;Marie Curie Sk&#322;odowska Grant Agreement Nr. 847548;Marie Sk&#322;odowska-Curie Individual Fellowship Nr. 101103258;Marie Sklodowska-Curie grant agreement Nr. 101033347;""},{""name"":""Vienna Science and Technology Fund"",""id"":""https://ror.org/01f9mc681"",""id-type"":""ROR"",""award"":""LS19-001;""},{""name"":""European Molecular Biology Organization"",""id"":""https://ror.org/04wfr2810"",""id-type"":""ROR"",""award"":""ALTF 866-2022;""},{""name"":""Boehringer Ingelheim Fonds"",""id"":""https://ror.org/00dkye506"",""id-type"":""ROR"",""award"":""""},{""name"":""Austrian Academy of Sciences"",""id"":""https://ror.org/03anc3s24"",""id-type"":""ROR"",""award"":""""},{""name"":""Vienna International Postdoc Program"",""id"":"""",""id-type"":""ROR"",""award"":""""}]","NA","bioRxiv",1754345412035
"A plant pathogen effector blocks stepwise assembly of a helper NLR resistosome","10.1101/2025.07.14.664264","biorxiv",41.70000000000001,0,0,0,41.70000000000001,"Seager, B. A.; Harant, A.; Contreras, M. P.; Hou, L.-Y.; Wu, C.-H.; Kamoun, S.; Madhuprakash, J.","Jogi Madhuprakash","University of Hyderabad","2025-07-14","1","new results","cc_by","plant biology","https://www.biorxiv.org/content/early/2025/07/14/2025.07.14.664264.source.xml","Helper NLRs function as central nodes in plant immune networks. Upon activation, they oligomerize into inflammasome-like resistosomes to initiate immune signaling, yet the dynamics of resistosome assembly remain poorly understood. Here, we show that the virulence effector AVRcap1b from the Irish potato famine pathogen Phytophthora infestans suppresses immune activation by directly engaging oligomerization intermediates of the tomato helper NLR SlNRC3. Cryo-EM structures of SlNRC3 in AVRcap1b-bound and unbound states reveal that AVRcap1b bridges multiple protomers, stabilizing a stalled intermediate and preventing formation of a functional resistosome. Leveraging AVRcap1b as a molecular tool, we also capture an additional SlNRC3 resistosome intermediate showing that assembly proceeds in a stepwise manner from dissociated monomers. These findings uncover a previously unrecognized vulnerability in NLR activation and reveal a pathogen strategy that disrupts immune complex assembly. This work advances mechanistic understanding of resistosome formation and uncovers a previously unrecognized facet of pathogen-plant coevolution.","[{""name"":""Biotechnology and Biological Sciences Research Council"",""id"":""https://ror.org/00cwqg982"",""id-type"":""ROR"",""award"":""BB/V002937/1;BB/Y002997/1;""},{""name"":""European Research Council"",""id"":""https://ror.org/0472cxd90"",""id-type"":""ROR"",""award"":""EP/Y032187/1;""}]","NA","bioRxiv",1754345412035
"Enhancer Poising Enables Pathogenic Gene Activation by Noncoding Variants","10.1101/2025.06.20.660819","biorxiv",40.050000000000026,0,0,0,40.050000000000026,"Hollingsworth, E.; Chen, Z.; Chen, C. X.; Jacinto, S. H.; Liu, T. A.; Kvon, E.","Evgeny Kvon","Department of Developmental and Cell Biology, University of California, Irvine, CA 92697, USA","2025-06-21","1","new results","cc_no","genomics","https://www.biorxiv.org/content/early/2025/06/21/2025.06.20.660819.source.xml","Single nucleotide variants within enhancers--non-coding DNA elements that regulate transcription--often lead to aberrant gene activation and contribute to a wide range of genetic disorders (Claussnitzer et al. 2015; Doan et al. 2016; Turner et al. 2017; Yanchus et al. 2022; Lettice et al. 2008). The mechanism by which ectopic gene activation occurs through these gain-of-function enhancer mutations remains poorly understood. Using the ZRS, a benchmark disease-associated enhancer of Sonic hedgehog (Shh), as a model, we demonstrate that poised (i.e., accessible but inactive) chromatin sensitizes Shh to aberrant activation in anterior limb bud, leading to polydactyly. In the anterior limb cells of wild-type mice, Shh is inactive, but the ZRS is accessible and marked by enhancer-associated histone modifications. We demonstrate that this poising signature explains how over 20 independent rare variants within the ZRS cause Shh misexpression in the same anterior limb bud cell population, resulting in similar limb malformations, despite affecting binding sites for different activators and repressors. Disabling pioneer transcription factor binding to the ZRS suppresses its poised state in anterior cells, prevents aberrant activation of the ZRS by rare variants, and fully rescues limb malformations in variant knock-in mice. A thorough examination of other disease-associated enhancers with pathogenic gain-of-function variants revealed that they are all poised in tissues with ectopic activity. We use this poising signature to predict and validate in vivo ectopic forebrain activity of previously uncharacterized autism-associated non-coding variants. Our findings suggest that spatial enhancer poising, likely a byproduct of development, creates a susceptibility to non-coding mutations and offers a potential mechanistic explanation for the burden of disease-associated non-coding variants.","[{""name"":""Eunice Kennedy Shriver National Institute of Child Health and Human Development"",""id"":""https://ror.org/04byxyr05"",""id-type"":""ROR"",""award"":""R01HD115268;""}]","NA","bioRxiv",1754345412035
"The evolution of gene regulatory programs controlling gonadal development in primates","10.1101/2025.06.17.659946","biorxiv",37.45000000000002,0,0,0,37.45000000000002,"Trost, N.; Fallahshahroudi, A.; Sarropoulos, I.; Schneider, C.; Schmidt, J.; Mbengue, N.; Wolff, E.; Drummer, C.; Frömel, R.; Lisgo, S.; Murat, F.; Sepp, M.; Cardoso-Moreira, M.; Behr, R.; Kaessmann, H.","Nils Trost","Heidelberg University","2025-06-19","1","new results","cc_no","evolutionary biology","https://www.biorxiv.org/content/early/2025/06/19/2025.06.17.659946.source.xml","Sex-determining pathways produce dimorphic gonads (ovaries and testes), yet the gene regulatory programs governing gonadogenesis and their evolution in primates remain little explored. Here we report evolutionary analyses of transcriptome and chromatin accessibility data of male and female human, marmoset (New World monkey), and mouse gonadal cells spanning key prenatal stages. We find that the two primates and mouse share similar X chromosome expression dynamics, including X chromosome reactivation (XCR), and that in Klinefelter syndrome (XXY) testes, germ cells undergo female-like XCR and escape of X inactivation. New male-specific regulatory regions have emerged progressively during mammalian evolution, especially on the X following sex chromosome origination. Further analyses revealed that male-specific regulatory regions evolved faster than female-specific ones in both supporting and pre-meiotic germ cells. However, female meiotic germ cells show even higher rates of molecular evolution and exhibit a permissive chromatin state that facilitates the birth of new genes, thus resembling their adult spermatogenic counterparts. Finally, we traced both conserved and species-specific gene expression trajectories across the three mammals, uncovering candidate genes for disorders of sex development that are typically central to cell-type-specific regulatory networks. Together, our study unveils both ancestral mammalian and recently evolved gene regulatory programs that control human- and primate-specific aspects of gonadal development in both sexes.","[{""name"":""European Research Council"",""id"":""https://ror.org/0472cxd90"",""id-type"":""ROR"",""award"":""615253, OntoTransEvol;""},{""name"":""Deutsche Forschungsgemeinschaft"",""id"":""https://ror.org/018mejw64"",""id-type"":""ROR"",""award"":""SFB 873;INST 35/1503-1 FUGG;INST 35/1597-1 FUGG;""},{""name"":""Klaus Tschira Foundation"",""id"":""https://ror.org/052jep661"",""id-type"":""ROR"",""award"":""""},{""name"":""Joint MRC/Wellcome"",""id"":"""",""id-type"":""ROR"",""award"":""MR/R006237/1;""}]","NA","bioRxiv",1754345412035
"Gene regulatory network analysis of somatic embryogenesis identifies morphogenic genes that increase maize transformation frequency","10.1101/2025.06.22.659756","biorxiv",36.949999999999996,0,0,0,36.949999999999996,"Renema, J.; Luckicheva, S.; Verwaerde, I.; Aesaert, S.; Coussens, G.; De Block, J.; Grones, C.; Eekhout, T.; De Rybel, B.; Brew-Appiah, R. A. T.; Bagley, C. A.; Hoengenaert, L.; Vandepoele, K.; Pauwels, L.","Laurens Pauwels","Ghent University, Department of Biotechnology, 9000 Ghent, Belgium","2025-06-23","1","new results","cc_no","plant biology","https://www.biorxiv.org/content/early/2025/06/23/2025.06.22.659756.source.xml","Somatic embryogenesis allows a somatic plant cell to develop into an embryo, and potentially into a fertile plant. Transcription factors such as BABY BOOM can induce somatic embryogenesis when ectopically expressed and are widely used for aiding regeneration in tissue culture for transformation and gene editing of crops. Nevertheless, regeneration remains a bottleneck and alternative morphogenic genes are highly desired. Here, we co-expressed BABY BOOM and WUSCHEL2 in zygotic maize (Zea mays L.) embryos and studied gene regulatory networks in induced somatic embryos at the single-cell level. By inferring cell-type-specific regulons, we prioritized candidate regulators and confirmed functionality of four transcription factors, bHLH48, EREB152, GRF4, and HB77, for enhanced maize transformation frequency, leading to fertile, transgenic plants. Interestingly, the basic helix-loop-helix and homeodomain-leucine zipper families had previously not been associated with induced somatic embryogenesis. Our work will contribute to more efficient transformation, much needed to deliver on the promise of gene editing for agriculture.","[{""name"":""Industrieel Onderzoeksfonds"",""id"":"""",""id-type"":""ROR"",""award"":""F2020/IOF-StarTT/151; IOF.PRO.2021.0017;""}]","NA","bioRxiv",1754345412035
