"title","doi","altmetric_jid","score","X1d","X3d","X1w","X1m","authors","author_corresponding","author_corresponding_institution","date","version","type","license","category","jatsxml","abstract","published","server","upupdate_time"
"Training deep learning models on personalized genomic sequences improves variant effect prediction","10.1101/2024.10.15.618510","biorxiv",14.049999999999999,1.7,8.299999999999999,14.049999999999999,14.049999999999999,"He, A. Y.; Palamuttam, N. P.; Danko, C. G.","Charles G Danko","Cornell University","2024-10-18","1","new results","cc_by","bioinformatics","https://www.biorxiv.org/content/early/2024/10/18/2024.10.15.618510.source.xml","Sequence-to-function models have broad applications in interpreting the molecular impact of genetic variation, yet have been criticized for poor performance in this task. Here we show that training models on functional genomic data with matched personal genomes improves their performance at variant effect prediction. Variant effect representations are retained even when transfer learning models to unseen cellular contexts and experimental readouts. Our results have implications for interpreting trait-associated genetic variation.","NA","biorxiv",1729634990535
"Bullying and Early Brain Development: A Longitudinal Structural Magnetic Resonance Imaging Study from Adolescence to Early Adulthood","10.1101/2024.09.11.611600","biorxiv",16.35,0,8,10.5,10.5,"Connaughton, M.; Mitchell, O.; Cullen, E.; O'Connor, M.; Banaschewski, T.; Barker, G.; Bokde, A. L.; Bruhl, R.; Desrivieres, S.; Flor, H.; Garavan, H.; Gowland, P. A.; Grigis, A. A.; Heinz, A.; Lemaitre, H.; Martinot, J.-L.; Martinot, M.-L. P.; Artiges, E.; Nees, F.; Papadopoulos Orfanos, D.; Poustka, L.; Smolka, M. N.; Hohmann, S.; Holz, N. E.; Vaidya, N.; Walter, H.; Schumann, G.; Whelan, R.; Roddy, D.","Darren Roddy","Department of Psychiatry, Royal College of Surgeons, Ireland","2024-09-13","1","new results","cc_by_nc_nd","neuroscience","https://www.biorxiv.org/content/early/2024/09/13/2024.09.11.611600.source.xml","To explore this, we conducted the largest structural MRI analysis to date (n=2094, including 1009 females), across three time points from the IMAGEN study, tracking region-specific brain volume trajectories from adolescence to early adulthood using a data-driven approach. Generally, experienced bullying showed increased subcortical volumes in the putamen ({beta}=0.12), caudate ({beta}=0.06), accumbens ({beta}=0.06), amygdala ({beta}=0.07), hippocampus ({beta}=0.06), paired with decreased cerebellar ({beta}=-0.10), entorhinal, ({beta}=-0.12), and insula ({beta}=-0.11) volumes. Females exhibited more volumetric changes in emotional processing areas whereas males had more changes in motor and sensory regions. These findings point to widespread associations between bullying victimization and brain development, offering a potential neurobiological framework to explain the emotional and behavioral difficulties observed. Importantly, this study emphasizes the need for a sex-sensitive approach in future research and interventions related to bullying.","NA","biorxiv",1729634990535
"Parasitic-plant parasite utilizes flowering pathways at unconventional stages to form stem-derived galls","10.1101/2024.10.17.618901","biorxiv",11.75,3.1,7.8,11.75,11.75,"Bessho-Uehara, K.; Udandarao, N. J.; Yamashita, Y.; Ushima, R.; Tsuchida, T.","Kanako Bessho-Uehara","Tohoku Daigaku - Aobayama Campus","2024-10-18","1","new results","cc_no","plant biology","https://www.biorxiv.org/content/early/2024/10/18/2024.10.17.618901.source.xml","Galls induced by various organisms exhibit diverse morphological and physiological characteristics, involving complex plant-insect interactions. Most transcriptome analyses to date have focused on leaf-derived galls. To better understand gall formation mechanisms, we investigated stem-derived galls induced by the weevil Smicronyx madaranus on the parasitic plant Cuscuta campestris at gene expression, cellular, and physiological levels. RNA-seq across four developmental stages identified differentially expressed genes and associated gene ontology terms. Consistent with histological observations, genes related to cell division and the cell cycle were upregulated early but decreased as the gall matured. Similar to leaf-derived galls, we found high expression of PLETHORA and meristem-related homeobox genes in early gall development, suggesting that stem cell induction and maintenance are involved in various gall types. Like leaf- derived galls, the expression of genes related to floral organ development increased through the gall development. However, their expression patterns were dramatically different: downstream genes in the flowering pathway were highly expressed at the initial gall stage, whereas upstream genes were highly expressed later. This suggests that the weevil might activate the flowering pathway at unconventional stages, potentially rerouting the typical flowering cascade to influence gall development. Unlike the decrease in photosynthesis-related genes in leaf-derived galls, we observed an increase in these genes in galls formed on the stem of the holoparasitic plant. Shading experiments confirmed that photosynthesis is crucial for both gall growth and the weevil. This study highlights how gall-inducers can co-opt host resources and genetic pathways, offering new insights into the complexity of plant-insect interactions.","NA","biorxiv",1729634990535
"An integrative spatial multi-omic workflow for unified analysis of tumor tissue","10.1101/2024.10.15.618574","biorxiv",7.449999999999999,2,7.199999999999999,7.449999999999999,7.449999999999999,"Kriel, J.; Moffet, J. J.; Lu, T.; Fatunla, O. E.; Narayana, V. K.; Valkovic, A.; Maluenda, A.; McConville, M. J.; Tsui, E.; Whittle, J. R.; Best, S. A.; Freytag, S.","Saskia Freytag","The Walter and Eliza Hall Institute of Medical Research","2024-10-18","1","new results","cc_by_nc","bioinformatics","https://www.biorxiv.org/content/early/2024/10/18/2024.10.15.618574.source.xml","Combining molecular profiling with imaging techniques has advanced the field of spatial biology, offering new insights into complex biological processes. Focusing on diffuse IDH-mutated low-grade glioma, this study presents a workflow for Spatial Multi-omics Integration, SMINT, specifically combining spatial transcriptomics and spatial metabolomics. Our workflow incorporates both existing and custom-developed computational tools to enable cell segmentation and registration of spatial coordinates from both modalities to a common coordinate framework. During our investigation of cell segmentation strategies, we found that nuclei-only segmentation, while containing only 40% of segmented cell transcripts, enables accurate cell type annotation, but does not account for multinucleated cells. Our integrative workflow including cell-morphology segmentation identified distinct cellular neighborhoods at the infiltrating edge of gliomas, which were enriched in multinucleated and oligodendrocyte-lineage tumor cells, that may drive tumor invasion into the normal cortical layers of the brain.

HighlightsO_LIAlignment and integrated analysis of spatial transcriptomic and metabolomic data
C_LIO_LINuclei-only and cell-morphology segmentations are concordant for cell annotation
C_LIO_LISpatially distinct regions are conserved in transcriptomic and metabolomic datasets
C_LIO_LIMulti-omic exploration of glioma leading edge identifies novel biological features
C_LI","NA","biorxiv",1729634990535
"A novel PhoPQ-potentiated mechanism of colistin resistance impairs membrane integrity in Pseudomonas aeruginosa","10.1101/2024.10.15.618514","biorxiv",7.199999999999999,2.35,6.949999999999999,7.199999999999999,7.199999999999999,"Hsieh, Y.-Y. P.; O'Keefe, I. P.; Sun, W.; Wang, Z.; Yang, H.; Vu, L. M.; Ernst, R. K.; Dandekar, A. A.; Malik, H. S.","Yu-Ying Phoebe Hsieh","Fred Hutchinson Cancer Center","2024-10-16","1","new results","cc_by_nc_nd","microbiology","https://www.biorxiv.org/content/early/2024/10/16/2024.10.15.618514.source.xml","Polymicrobial communities are often recalcitrant to antibiotic treatment because interactions between different microbes can dramatically alter their responses and susceptibility to antimicrobials. However, the mechanisms of evolving antimicrobial resistance in such polymicrobial environments are poorly understood. We previously reported that Mg2+ depletion caused by the fungus Candida albicans can enable Pseudomonas aeruginosa to acquire significant resistance to colistin, a last-resort antibiotic targeting bacterial membrane. Here, we dissect the genetic and biochemical basis of this increased colistin resistance. We show that P. aeruginosa cells can acquire colistin resistance using three distinct evolutionary trajectories involving mutations in genes involved in lipid A biosynthesis, lipid A modifications that are dependent on low Mg2+, and a putative Mg2+ transporter, PA4824. These mutations confer colistin resistance by altering acyl chains, hydroxylation, and aminoarabinose modification of lipid A moieties on the bacterial outer membrane. In all cases, enhanced colistin resistance initially depends on the low Mg2+-responsive PhoPQ pathway, which potentiates the evolution of resistance mutations and lipid A modifications that do not occur without Mg2+ depletion. However, the PhoPQ pathway is not required to maintain high colistin resistance in all cases. In most cases, the genetic and biochemical changes associated with these novel forms of colistin resistance also impair bacterial membrane integrity, leading to fitness costs. Our findings provide molecular insights into how nutritional competition drives a novel antibiotic resistance mechanism and its ensuing fitness tradeoffs.","NA","biorxiv",1729634990535
"sv-channels: filtering genomic deletions using one-dimensional convolutional neural networks","10.1101/2024.10.17.618894","biorxiv",6.85,3.25,6.85,6.85,6.85,"Santuari, L.; Georgievska, S.; Kuzniar, A.; Pedersen, B. S.; Shneider, C.; Mehrem, S.; Ridder, L.; Kloosterman, W. P.; de Ridder, J.","Jeroen de Ridder","Center for Molecular Medicine, University Medical Center Utrecht, Universiteitsweg 100, 3584 CG Utrecht, The Netherlands","2024-10-20","1","new results","cc_by_nc_nd","bioinformatics","https://www.biorxiv.org/content/early/2024/10/20/2024.10.17.618894.source.xml","Structural variant (SV) detection in human genomes using short-read sequencing data is hindered by false positives, arising from sequencing and mapping artifacts that mimic genuine SV signals. Despite advances, state-of-the-art SV callers like GRIDSS and Manta exhibit trade-offs between precision and recall, with GRIDSS offering the highest precision and Manta excelling in recall. To address these limitations, we introduce sv-channels, a novel deep learning model designed to improve the precision of SV detection by leveraging read information at call sites. Our method effectively reduces false positives in Manta's deletion callsets, achieving precision that surpasses GRIDSS while maintaining a recall rate comparable to Manta. This represents a significant improvement in SV detection, leveraging Manta's high recall through deep learning and paving the way for more accurate genomic analyses. The sv-channels codebase is openly accessible on GitHub at https://github.com/GooglingTheCancerGenome/sv-channels enabling further research and application in the field.","NA","biorxiv",1729634990535
"Charting the landscape of cytoskeletal diversity in microbial eukaryotes","10.1101/2024.10.18.618984","biorxiv",8.65,1.85,6.8,8.65,8.65,"Mikus, F.; Ramos, A. R.; Shah, H.; Olivetta, M.; Borgers, S.; Hellgoth, J.; Saint-Donat, C.; Araujo, M.; Bhickta, C.; Cherek, P.; Bilbao, J.; Txurruka, E.; Leisch, N.; Schwab, Y.; Husnik, F.; Seoane, S.; Probert, I.; Guichard, P.; Hamel, V.; Dey, G.; Dudin, O.","Omaya Dudin","University of Geneva, Department of Biochemistry, Faculty of Sciences, Geneva, Switzerland.","2024-10-18","1","new results","cc_by","cell biology","https://www.biorxiv.org/content/early/2024/10/18/2024.10.18.618984.source.xml","Microbial eukaryotes are small and often resistant to standard labelling and imaging techniques, and therefore remain understudied - despite their critical ecological importance - with the exception of a few established models. Here, we use Ultrastructure Expansion Microscopy (U-ExM) to carry out high-resolution volumetric imaging of over 200 cultured planktonic eukaryotes across major lineages. By combining U-ExM with pan- and specific immuno-labelling, we reveal novel microtubule and centrin-containing elements and assign molecular identities to enigmatic cytoskeletal structures observed previously only by electron microscopy. Our investigation represents the first systematic survey of the extensive cytoskeletal diversity on display across the eukaryotic tree, including the major species groups of dinoflagellates, haptophytes, ciliates, euglenids, cryptomonads, and green algae. Our U-ExM approach extends to mixed environmental samples, paving the way for environmental cell biology at ultrastructural resolution and unprecedented scale, a crucial step towards understanding and protecting complex ecosystems in the face of biodiversity loss.","NA","biorxiv",1729634990535
"Metabolic interplay drives population cycles in a cross-feeding microbial community","10.1101/2024.10.14.618235","biorxiv",16.7,0,6.8,16.7,16.7,"Ross, T.; Klausmeier, C. A.; Venturelli, O.","Ophelia Venturelli","Duke University","2024-10-17","1","new results","cc_by_nc_nd","systems biology","https://www.biorxiv.org/content/early/2024/10/17/2024.10.14.618235.source.xml","Population cycles are prevalent in ecosystems and play key roles in determining their functions1,2. While multiple mechanisms have been theoretically shown to generate population cycles3-6, there are limited examples of mutualisms driving self-sustained oscillations. Using an engineered microbial community that cross-feeds essential amino acids, we experimentally demonstrate cycles in strain abundance that are robust across environmental conditions. A nonlinear dynamical model that incorporates the experimentally observed cross-inhibition of amino acid production recapitulates the population cycles. The model shows that the cycles represent internally generated relaxation oscillations, which emerge when fast resource dynamics with positive feedback drive slow changes in strain abundance. Our findings highlight the critical role of resource dynamics and feedback in shaping population cycles in microbial communities and have implications for biotechnology.","NA","biorxiv",1729634990535
"Paused Polymerase synergises with transcription factors and RNA to enhance the transcriptional potential of promoters","10.1101/2024.10.18.618990","biorxiv",6.949999999999999,2.2,6.699999999999999,6.949999999999999,6.949999999999999,"Mann, R.; Soota, D.; Das, A.; Podh, N. K.; Mehta, G.; Notani, D.","Dimple Notani","NATIONAL CENTRE FOR BIOLOGICAL SCIENCES, BANGALORE, 560065, INDIA","2024-10-19","1","new results","cc_by_nc","molecular biology","https://www.biorxiv.org/content/early/2024/10/19/2024.10.18.618990.source.xml","Regulated pausing of RNA polymerase II (Pol II) is essential for enabling rapid and coordinated transcriptional responses to signalling cues. Pausing also contributes to the formation of nucleosome-free regions with the help of chromatin remodellers. However, if these nucleosome-free regions engage with transcription factors to stimulate the transcription potential of paused promoters is not known. In this study, we demonstrate that ligand-induced estrogen receptor-alpha (ERalpha) binding is stabilized at Pol II-paused sites. This stabilization results from an increased dwell time of ERalpha on chromatin, as revealed by single molecule tracking (SMT) experiments. Notably, short chromatin-associated RNAs generated by the paused Pol II contribute to enhancing ERalpha binding at paused promoters. We also observe that pausing increases histone H3K27 acetylation (H3K27ac) levels, which primes paused promoters for robust transcriptional activation upon release. Collectively, these findings suggest that paused Pol II plays a central role in enhancing transcription factor binding through an RNA-dependent mechanism. This, in turn, results in a more vigorous transcriptional response following pausing release, thus contributing to the fine-tuning of ERalpha-mediated gene regulation.","NA","biorxiv",1729634990535
"An Extensive Atlas of Proteome and Phosphoproteome Turnover Across Mouse Tissues and Brain Regions","10.1101/2024.10.15.618303","biorxiv",20.35,0,6.6,20.35,20.35,"Li, W.; Dasgupta, A.; Yang, K.; Wang, S.; Hemandhar-Kumar, N.; Yarbro, J. M.; Hu, Z.; Salovska, B.; Fornasiero, E. F.; Peng, J.; Liu, Y.","Yansheng Liu","Yale University","2024-10-17","1","new results","cc_by_nc_nd","systems biology","https://www.biorxiv.org/content/early/2024/10/17/2024.10.15.618303.source.xml","Understanding how proteins in different mammalian tissues are regulated is central to biology. Protein abundance, turnover, and post-translational modifications like phosphorylation, are key factors that determine tissue-specific proteome properties. However, these properties are challenging to study across tissues and remain poorly understood. Here, we present Turnover-PPT, a comprehensive resource mapping the abundance and lifetime of 11,000 proteins and 40,000 phosphosites across eight mouse tissues and various brain regions, using advanced proteomics and stable isotope labeling. We revealed tissue-specific short- and long-lived proteins, strong correlations between interacting protein lifetimes, and distinct impacts of phosphorylation on protein turnover. Notably, we discovered that peroxisomes are regulated by protein turnover across tissues, and that phosphorylation regulates the stability of neurodegeneration-related proteins, such as Tau and -synuclein. Thus, Turnover-PPT provides new fundamental insights into protein stability, tissue dynamic proteotypes, and the role of protein phosphorylation, and is accessible via an interactive web-based portal at https://yslproteomics.shinyapps.io/tissuePPT.","NA","biorxiv",1729634990535
"Multi-ancestry GWAS of Long COVID identifiesimmune-related loci and etiological links to chronic fatigue syndrome, fibromyalgia and depression","10.1101/2024.10.07.24315052","medrxiv",506.88000000000136,0.25,4.85,47.58,506.88000000000136,"Chaudhary, N. S.; Weldon, C. H.; Nandakumar, P.; 23andMe Research Team,  ; Holmes, M. V.; Aslibekyan, S.","Stella Aslibekyan","23andMe Inc.","2024-10-09","1","PUBLISHAHEADOFPRINT","cc_no","genetic and genomic medicine","https://www.medrxiv.org/content/early/2024/10/09/2024.10.07.24315052.source.xml","The etiology of Long COVID is poorly understood despite its estimated global burden of 65 million cases. There exists a paucity of genetic studies that can shed light on potential mechanisms leading to Long COVID. Using consented and genotyped data from 23andMe adult research participants, we conducted the largest multi-ancestry meta-analysis of genome-wide association studies of Long COVID across European (42,899 cases, 94,721 controls), Latinx (8,631 cases, 20,351 controls), and African-American (2,234 cases, 5,596 controls) genetic ancestry groups. GWAS of Long COVID identified three genome-wide significant loci (HLA-DQA1-HLA-DQB, ABO, BPTF-KPAN2-C17orf58). Functional analysis of these genes points to underlying immune and thrombo-inflammatory mechanisms. We present evidence of shared genetic architecture (genetic correlation p-value < 0.001) of Long COVID with thirteen phenotypes of similar symptomatology or pathophysiology. We identified potential causal roles from liability to chronic fatigue (Mendelian randomization OR=1.59, 95% CI[1.51,1.66]), fibromyalgia (OR=1.54, 95% CI[1.49,1.60]), and depression (OR=1.53, 95% CI[1.46,1.61]) with Long COVID, which replicated in the COVID-19 Host Genetics Initiative data, and which are unlikely to originate from collider bias. These findings can help identify populations vulnerable to Long COVID and inform future therapeutic approaches.","NA","medrxiv",1729634990535
"A shared code for perceiving and imagining objects in human ventral temporal cortex","10.1101/2024.10.05.616828","biorxiv",52.50000000000002,0,2.1,42.000000000000014,52.50000000000002,"Wadia, V. S.; Reed, C. M.; Chung, J. M.; Bateman, L. M.; Mamelak, A. N.; Rutishauser, U.; Tsao, D. Y.","Doris Y Tsao","Department of Neuroscience, Helen Wills Neuroscience Institute, University of California, Berkeley, CA, USA; Howard Hughes Medical Institute, Berkeley, CA, USA","2024-10-06","2","new results","cc_no","neuroscience","https://www.biorxiv.org/content/early/2024/10/06/2024.10.05.616828.source.xml","Mental imagery is a remarkable phenomenon that allows us to remember previous experiences and imagine new ones. Animal studies have yielded rich insight into mechanisms for visual perception, but the neural mechanisms for visual imagery remain poorly understood. Here, we first determined that [~]80% of visually responsive single neurons in human ventral temporal cortex (VTC) used a distributed axis code to represent objects. We then used that code to reconstruct objects and generate maximally effective synthetic stimuli. Finally, we recorded responses from the same neural population while subjects imagined specific objects and found that [~]40% of axis-tuned VTC neurons recapitulated the visual code. Our findings reveal that visual imagery is supported by reactivation of the same neurons involved in perception, providing single neuron evidence for existence of a generative model in human VTC.

One Sentence SummarySingle neurons in human temporal cortex use feature axes to encode objects, and imagery reactivates this code.","NA","biorxiv",1729634990536
"Attentive graph neural network models for the prediction of blood-brain barrier permeability","10.1101/2024.10.12.617907","biorxiv",38,1,1.5,38,38,"Collins, J. W.; Ebrahimkhani, M.; Ramirez, D.; Abedi, M.; Philippe-Venec, L.; Cole, B. M.; Moore, B.; Nwankwo, J. O.","Jennifer O. Nwankwo","1910 Genetics","2024-10-17","4","new results","cc_no","pharmacology and toxicology","https://www.biorxiv.org/content/early/2024/10/17/2024.10.12.617907.source.xml","The blood brain barrier has (BBB) unique endothelial cells and tight junctions selectively regulate passage of molecules to the central nervous system (CNS) to prevent pathogen entry and maintain neural homeostasis. Various neurological conditions and neurodegenerative diseases benefit from small molecules capable of BBB penetration (BBBP) to elicit a therapeutic effect. Predicting BBBP often involves in silico assessment of molecular properties such as lipophilicity (logP) and polar surface area (PSA) using the CNS multiparameter optimization (MPO) method. This study curated an open-source dataset to benchmark rigorously machine learning (ML) and neural network (NN) models with each other and with MPO for predicting BBBP. Our analysis demonstrated that AI models, especially attentive NNs using stereochemical features, significantly outperform MPO in predicting BBBP. An attentive graph neural network (GNN), we refer to as CANDID-CNS, achieved a 0.23-0.26 higher AUROC score than MPO on full test sets, and a 0.17-0.19 higher score on stereoisomers filtered subsets. Regarding stereoisomers that differ in BBBP, which MPO cannot distinguish, attentive GNNs correctly classify these with AURPC, AUROC, and MCC metrics comparable to or better than those of MPO on less difficult test molecules. These findings suggest that integrating attentive GNN models into pharmaceutical drug discovery processes can substantially improve prediction rates, and thereby reduce the timeline, cost, and increase probability of success of designing brain penetrant therapeutics for the treatment of a wide variety of neurological and neurodegenerative diseases.","NA","biorxiv",1729634990536
