"title","doi","altmetric_jid","score","X1d","X3d","X1w","X1m","authors","author_corresponding","author_corresponding_institution","date","version","type","license","category","jatsxml","abstract","published","server","upupdate_time"
"Isolation of phages infecting the zoonotic pathogen Streptococcus suis reveals novel structural and genomic characteristics","10.1101/2025.01.07.631744","biorxiv",7.1,5.6,7.1,7.1,7.1,"Osei, E. K.; O'Hea, R.; Cambillau, C.; Athalye, A.; Hille, F.; Franz, C. M. A. P.; O'Doherty, A.; Wilson, M.; Murray, G. G. R.; Weinert, L. A.; Manzanilla, E. G.; Mahony, J.; Kenny, J.","John Kenny","Teagasc","2025-01-08","1","new results","cc_by_nc_nd","microbiology","https://www.biorxiv.org/content/early/2025/01/08/2025.01.07.631744.source.xml","Bacteriophage research has experienced a renaissance in recent years, owing to their therapeutic potential and versatility in biotechnology, particularly in combating antibiotic resistant-bacteria along the farm-to-fork continuum. However, certain pathogens remain underexplored as targets for phage therapy, including the zoonotic pathogen Streptococcus suis which causes infections in pigs and humans. Despite global efforts, the genome of only one infective S. suis phage has been described. Here, we report the isolation of two phages that infect S. suis: Bonnie and Clyde. The phages infect 58% of 100 S. suis strains tested, including representatives of seven different serotypes and thirteen known sequence types from diverse geographical origins. Clyde suppressed bacterial growth in vitro within two multi-strain mixes designed to simulate a polyclonal S. suis infection. Both phages demonstrated stability across various temperatures and pH levels, highlighting their potential to withstand storage conditions and maintain viability in delivery formulations. Genome comparisons revealed that neither phage shares significant nucleotide identity with any cultivated phages in the NCBI database and thereby represent novel species belonging to two distinct novel genera. This study is the first to investigate the adhesion devices of S. suis infecting phages. Structure prediction and analysis of adhesion devices with AlphaFold2 revealed two distinct lineages of S. suis phages: Streptococcus thermophilus-like (Bonnie) and S. suis-like (Clyde). The structural similarities between the adhesion devices of Bonnie and S. thermophilus phages, despite the lack of nucleotide similarity and differing ecological niches, suggest a common ancestor or convergent evolution, highlighting evolutionary links between pathogenic and non-pathogenic streptococcal species. These findings provide valuable insights into the genetic and phenotypic characteristics of phages that can infect S. suis, providing new data for the therapeutic application of phages in a One Health context.","NA","biorxiv",1736633251837
"Deciphering the zebrafish hepatic duct heterogeneity and cell plasticity using lineage tracing and single-cell transcriptomics","10.1101/2025.01.09.631719","biorxiv",9.899999999999999,5.55,9.899999999999999,9.899999999999999,9.899999999999999,"Mi, J.; Ren, L.; Liu, K.-C.; Butto, L.; Colquhoun, D.; Andersson, O.","Olov Andersson","Uppsala University & Karolinska Institutet","2025-01-09","1","new results","cc_by","developmental biology","https://www.biorxiv.org/content/early/2025/01/09/2025.01.09.631719.source.xml","Despite the livers recognized regenerative potential, the role of the hepatic ductal cells (a.k.a. biliary epithelial cells), its heterogeneity, and functionality remain incompletely understood in this process. This study provides a comprehensive examination of the molecular and cellular mechanisms underpinning liver ductal development and liver regeneration in zebrafish, with a spotlight on the functional roles of her family genes in these processes. Using state-of-the-art knock-in zebrafish models and single-cell transcriptomics we reveal the differential expression patterns of the different her genes, of which her2, her6, and her9, were identified as specific molecular signatures for distinguishing different ductal cell types with unique morphology and spatial distribution. Particularly, her9 serves as a pan-ductal marker and shows responsiveness to the synergistic effect of Notch and BMP signaling. By analyzing multiple single-cell RNA-seq datasets, we identify numerous ductal markers which are functional proteins for ductal integrity, and most notably CRISPR mutagenesis demonstrates that her9 is essential for hepatocyte recovery. Using multiple transgenic and knock-in zebrafish lines and genetic fate mapping, we provide a detailed characterization of the ductal remodeling process under development and extreme loss of intra-hepatic duct, highlighting the remarkable ductal cell plasticity. Single-cell transcriptomics of lineage-traced her9-expressing liver ducts in static and regenerative states uncover distinct cell clusters with unique molecular signatures and morphology, reflecting the livers regenerative dynamics and highlight relevant key biological processes that could be leveraged to expedite liver regeneration.","NA","biorxiv",1736633251837
"Dioecy in a wind-pollinated herb explained by disruptive selection on sex allocation","10.1101/2025.01.07.631798","biorxiv",5.5,5.5,5.5,5.5,5.5,"Chen, K.-H.; Pannell, J. R.","Kai-Hsiu Chen","University of Lausanne","2025-01-10","1","new results","cc_by_nc","evolutionary biology","https://www.biorxiv.org/content/early/2025/01/10/2025.01.07.631798.source.xml","The evolution of dioecy from hermaphroditism is widely thought to be a response to disruptive selection favouring males and females, driven by advantages of inbreeding avoidance, sexual specialisation, or both. However, it has hitherto been difficult to uncouple the importance of these two advantages of dioecy. Here, we estimate the selfing rate and fitness gain curves with and without inbreeding depression in wind-pollinated Mercurialis annua, based on variation in sex allocation among hermaphrodites that evolved from dioecy following the experimental removal of males. Because males had been removed, we could rule out any important contribution to disruptive selection due to advantages of sexual specialisation, allowing us to focus in inbreeding effects. Our results confirm a tradeoff between male and female allocation in M. annua, as assumed in sex-allocation theory. The individual selfing rates increased with male allocation, greatly altering the female and male fitness gain curves under strong inbreeding depression. There was strong disruptive selection on sex allocation due to its interaction with the mating system. Taken together, our study demonstrates that inbreeding avoidance on its own can lead to disruptive selection on sex allocation and thus the selection and maintenance of dioecy under wind pollination.","NA","biorxiv",1736633251837
"Impaired oxidative phosphorylation drives primary tumor escape and metastasis","10.1101/2025.01.08.631936","biorxiv",11.099999999999998,5.4,11.099999999999998,11.099999999999998,11.099999999999998,"Arner, E. N.; Jennings, E. Q.; Crooks, D. R.; Ricketts, C. J.; Wolf, M. M.; Cottam, M. A.; Fisher-Gupta, E. L.; Lang, M.; Maio, N.; Shibata, Y.; Krystofiak, E. N.; Vlach, L. M.; Hatem, Z.; Blatt, A. M.; Heintzman, D. R.; Sewell, A. E.; Hathaway, E. S.; Steiner, K. K.; Ye, X.; Schaefer, S.; Bacigalupa, Z. A.; Linehan, M.; Beckermann, K. E.; Mason, F. M.; Idrees, K.; Rathmell, W. K.; Rathmell, J. C.","Jeffrey C. Rathmell","Vanderbilt University Medical Center","2025-01-09","1","new results","cc_no","cancer biology","https://www.biorxiv.org/content/early/2025/01/09/2025.01.08.631936.source.xml","Metastasis causes most cancer deaths and reflects transitions from primary tumor escape to seeding and growth at metastatic sites. Epithelial-to-mesenchymal transition (EMT) is important early in metastasis to enable cancer cells to detach from neighboring cells, become migratory, and escape the primary tumor. While different phases of metastasis expose cells to variable nutrient environments and demands, the metabolic requirements and plasticity of each step are uncertain. Here we show that EMT and primary tumor escape are stimulated by disrupted oxidative metabolism. Using Renal Cell Carcinoma (RCC) patient samples, we identified the mitochondrial electron transport inhibitor NDUFA4L2 as upregulated in cells undergoing EMT. Deletion of NDUFA4L2 enhanced oxidative metabolism and prevented EMT and metastasis while NDUFA4L2 overexpression enhanced these processes. Mechanistically, NDUFA4L2 suppressed oxidative phosphorylation and caused citric acid cycle intermediates to accumulate, which modified chromatin accessibility of EMT-related loci to drive primary tumor escape. The effect of impaired mitochondrial metabolism to drive EMT appeared general, as renal cell carcinoma patient tumors driven by fumarate hydratase mutations with disrupted oxidative phosphorylation were highly metastatic and also had robust EMT. These findings highlight the importance of dynamic shifts in metabolism for cell migration and metastasis, with mitochondrial impairment driving early phases of this process. Understanding mitochondrial dynamics may have important implications in both basic and translational efforts to prevent cancer deaths.","NA","biorxiv",1736633251837
"Epithelial to Mesenchymal Transition in the Endometrium Mediated by HOXA10 drives Embryo Implantation","10.1101/2025.01.10.631632","biorxiv",5.2,5.2,5.2,5.2,5.2,"Ashary, N. S.; Suresh, S.; Bhide, A.; Shayamal, S.; N, P.; Mishra, A.; A, A.; Hansda, S.; BV, H.; Jolly, M. K.; Modi, D.","Deepak Modi","ICMR-National Institute for Research in Reproductive and Child Health","2025-01-10","1","new results","cc_no","developmental biology","https://www.biorxiv.org/content/early/2025/01/10/2025.01.10.631632.source.xml","Embryo implantation requires breaching the endometrial luminal epithelium (LE) to facilitate invasion. In this study, we report that during implantation, endometrial LE cells undergo partial epithelial-to-mesenchymal transition (pEMT) specifically at the implantation sites. This pEMT in the LE is critical, as the in vivo knockdown of the EMT transcription factor Twist2 inhibits embryo implantation. Furthermore, we observed a reduction in the expression of the transcription factor HOXA10 in LE cells at the implantation sites. Interestingly, LE cells from HOXA10-hypomorphic mice and human endometrial epithelial cells (RL95-2) with HOXA10 knockdown (HOXA10KD) also undergo pEMT and acquire a migratory phenotype in vitro, suggesting that the loss of HOXA10 drives pEMT in the endometrial epithelium. Transcriptome analysis of HOXA10KD cells revealed a higher pEMT score and differential expression of genes associated with cell migration and TGF-{beta} signaling pathways. We also identified the genome-wide occupancy sites of HOXA10 in human endometrial epithelial cells, uncovering 1,246 genes whose promoters are occupied by HOXA10 and are dysregulated in HOXA10KD cells. Functionally, these HOXA10 target genes fall into two broad categories: those involved in epithelial functions and those associated with mesenchymal functions. Collectively, our findings suggest that HOXA10 directly regulates genes to maintain endometrial cells in an epithelial state. Its loss activates mesenchymal genes while maintaining or inducing a distinct subset of epithelial genes, resulting in a pEMT phenotype. In summary, our study establishes pEMT in the LE as a critical step and reveals that the loss of HOXA10 triggers this process, enabling embryo implantation.","NA","biorxiv",1736633251837
"Investigating The Potential of Division of Labour in Synthetic Bacterial Communities for the Production of Violacein","10.1101/2025.01.07.631562","biorxiv",5.2,5.2,5.2,5.2,5.2,"Mehta, H.; Jimenez, J. I.; Ledesma-Amaro, R.; Stan, G.-B. V.","Guy-Bart V Stan","Imperial College London","2025-01-10","1","new results","cc_by_nc_nd","bioengineering","https://www.biorxiv.org/content/early/2025/01/10/2025.01.07.631562.source.xml","With advancements in synthetic biology and metabolic engineering, microorganisms can now be engineered to perform increasingly complex functions, which may be limited by the resources available in individual cells. Division of labour in synthetic microbial communities offers a promising approach to enhance metabolic efficiency and resilience in bioproduction. By distributing complex metabolic pathways across multiple subpopulations, the resource competition and metabolic burden imposed on an individual cell is reduced, potentially enabling more efficient production of target compounds. Violacein is a high-value pigment with anti-tumour properties that exemplifies such a challenge due to its complex bioproduction pathway, imposing a significant metabolic burden on host cells. In this study we investigated the benefits of division of labour for violacein production by splitting the violacein bioproduction pathway between two subpopulations of Escherichia coli based synthetic communities. We tested several pathway splitting strategies and reported that splitting the pathway into two subpopulations expressing VioABE and VioDC at a final composition of 60:40 yields a 2.5 fold increase in violacein production as compared to a monoculture. We demonstrated that the coculture outperforms the monoculture when both subpopulations exhibit similar metabolic burden levels, resulting in comparable growth rates, and when both subpopulations are present in sufficiently high proportions.","NA","biorxiv",1736633251837
"Monocarboxylate transporter 2 is required for the maintenance of myelin and axonal integrity by oligodendrocytes","10.1101/2025.01.10.632306","biorxiv",4.95,4.95,4.95,4.95,4.95,"Izagirre-Urizar, L.; Mora-Huerta, L.; Soler-Saez, I.; Morales-Gallel, R.; Ulloa-Navas, M. J.; Chara, J.-C.; Calovi, S.; Deboux, C. J.; Merino-Cacho, L.; Domercq, M.; Zugaza, J.-L.; Pellerin, L.; Garcia-Garcia, F.; Garcia-Verdugo, J. M.; Matute, C.; Nait Oumesmar, B.; Tepavcevic, V.","Vanja Tepavcevic","Cavanilles Institute of Biodiversity and Evolutionary Biology, University of Valencia","2025-01-10","1","new results","cc_by_nc_nd","neuroscience","https://www.biorxiv.org/content/early/2025/01/10/2025.01.10.632306.source.xml","Neurodegenerative pathologies including multiple sclerosis (MS) are consistently associated with energy deficit in the central nervous system (CNS). This might directly impact myelinating oligodendrocytes as these are particularly vulnerable to metabolic insults. Importantly, oligodendroglial dysfunction and myelin alterations occur in most, if not all neurodegenerative diseases, and are associated with axonal pathology/loss. Thus, elucidating metabolic mechanisms required for oligodendroglial myelin maintenance and axonal support might be crucial to identify therapeutic targets to achieve neuroprotection. While monocarboxylates are important energy fuels for the CNS, their role in myelinating oligodendrocyte function remains unclear. Here we show that, just like neurons, myelinating oligodendrocytes express high affinity monocarboxylate transporter 2 (MCT2) both in mice and humans, which is downregulated in progressive MS. While deletion of MCT2 in mouse oligodendrocytes did not affect the survival of these cells, it resulted in downregulation of lipid synthesis-associated enzymes and failure of myelin maintenance. Moreover, axonal upregulation of lactate dehydrogenase A concomitant with axonal damage was observed but could be alleviated by ketogenic diet. We conclude that oligodendroglial MCT2 is required for myelin maintenance and axonal support, which becomes altered in progressive MS, but may be compensated for by specific metabolic therapies.","NA","biorxiv",1736633251837
"Upstream open reading frame translation enhances immunogenic peptide presentation in mitotically arrested cancer cells","10.1101/2025.01.08.631915","biorxiv",5.8999999999999995,4.8999999999999995,5.8999999999999995,5.8999999999999995,5.8999999999999995,"Kowar, A.; Becker, J. P.; Del Pizzo, R.; Tang, Z.; Champagne, J.; Koerner, P.-R.; Navarro, J. M.; Tilghman, F. M.; Sakeer, H.; Riemer, A. B.; Agami, R.; Loayza-Puch, F.","Fabricio Loayza-Puch","Translational Control and Metabolism, German Cancer Research Center (DKFZ), Heidelberg, Germany.","2025-01-09","1","new results","cc_by_nc_nd","cancer biology","https://www.biorxiv.org/content/early/2025/01/09/2025.01.08.631915.source.xml","Mitosis is a critical phase of the cell cycle and a vulnerable point where cancer cells can be effectively disrupted, leading to cell death and inhibition of tumor growth. However, challenges such as drug resistance remain significant in clinical applications. During mitosis, mRNA translation is generally downregulated, while non-canonical translation of specific transcripts proceeds. Here, we demonstrate that mitotic cancer cells redistribute ribosomes toward the 5 untranslated region (5 UTR) and the start of the coding sequence (CDS), enhancing the translation of thousands of upstream open reading frames (uORFs) and upstream overlapping open reading frames (uoORFs). This mitotic induction of uORF/uoORF enriches the presentation of immunopeptides at the surface of cancer cells following treatment with mitotic inhibitors. Functional assays indicate the potential of such neoepitopes to provoke cancer-cell killing by T cells. Altogether, our findings highlight the therapeutic potential of targeting uORF/uoORF-derived neoepitopes in combination with mitotic inhibitors to enhance immune recognition and tumor cell elimination.","NA","biorxiv",1736633251837
"Design of novel synthetic promoters to tune gene expression in T cells","10.1101/2025.01.09.632034","biorxiv",4.7,4.7,4.7,4.7,4.7,"Bonfa, G.; Martino, G.; Sellitto, A.; Rinaldi, A.; Tedeschi, F.; Caliendo, F.; Melchiorri, L.; Perna, D.; Starkey, F.; Nikolados, E.; Menolascina, F.; Siciliano, V.","Velia Siciliano","Istituto Italiano di Tecnologia - IIT","2025-01-09","1","new results","cc_no","synthetic biology","https://www.biorxiv.org/content/early/2025/01/09/2025.01.09.632034.source.xml","Transcriptional control of transgene expression can be linked to dynamic changes in cellular states if this is accompanied by differential expression of transcription factors (TFs). Synthetic promoters (SPs) designed to respond to the desired TFs can provide this regulation with compactness, specificity, and orthogonality. T cells display differentially expressed TFs according to the functional state. In solid tumors, the highly immunosuppressive TME and the chronic exposure to antigens lead to a progression of T cells from a functional to a dysfunctional state known as exhaustion (Tex), in which their power against cancer cells is strongly compromised. Importantly, this transition is accompanied by a marked increase of several TFs, among other factors, that drive targeted genetic programs. Strategies to detect and mitigate Tex are extremely needed. Here, we design SPs that respond to TFs differentially expressed in activated and exhausted T cells to enable new classifiers of the functional/dysfunctional states. We developed a library of over 80 SPs responsive to 7 TFs. The SPs showed broad strength of activation of reporter genes or immunomodulatory molecules in HEK293 and Jurkat T cell lines. Moreover, using a transfer learning strategy we show SPs strength predictability. By combining SPs responding to different TFs, we created Boolean logic gates and implemented a feed-forward design that was previously shown to reduce noise in the OFF-state. Finally, as proof of principle, we demonstrate the dynamic activation of the NR4A2-responsive SP according to the T cell state in primary human CD8+ T cells. Collectively we present a sensing platform that provides a versatile tool to study and monitor the dynamic changes occurring in T cells. In perspective the biosensors coupled to therapeutic genes can be used to reprogram the TME and reinvigorate the T cell anti-tumoral functionality, preventing or reverting the exhausted phenotype.","NA","biorxiv",1736633251837
"Context-dependent translation inhibition as a novel oncology therapeutic modality","10.1101/2025.01.09.632223","biorxiv",5.7,4.7,5.7,5.7,5.7,"Diamond, P. D.; Sauer, P. V.; Holm, M.; Swanson-Swett, C. J.; Ferguson, L.; Bratset, N. M.; Wienker, G. W.; Sim, J. S.; Adams, H. K.; Kenner, L.; Meyers, M.; Gygi, D.; Könst, Z. A.; Bahmanyar, S. S.; Hamann, L. G.; Schuller, A. P.","Anthony P. Schuller","Interdict Bio, 201 Haskins Way, Suite 507, South San Francisco, CA 94080","2025-01-09","1","new results","cc_by_nc_nd","cancer biology","https://www.biorxiv.org/content/early/2025/01/09/2025.01.09.632223.source.xml","Inhibitors of protein synthesis, including anisomycin, homoharringtonine, and other natural products bind in the peptidyl-transferase center (PTC) of the eukaryotic ribosome to inhibit translation. Recent work has demonstrated that some PTC-binding antibiotics act in a sequence-selective manner, inhibiting translation elongation at specific amino acids while the polypeptide is engaged in the PTC. However, this phenomenon has yet to be documented for compounds that inhibit translation by the human ribosome. Here we use structure-based design to guide synthesis of molecules called interdictors that bind to the human ribosome PTC and act in a context-selective manner to inhibit translation elongation. Using ribosome profiling, in combination with in vitro biochemistry and cryo-electron microscopy, we characterize the context selectivity of unique analogues and observe their preferred interactions with nascent chain residues with complementary properties. Furthermore, we present a structure for an interdictor bound to a portion of the MYC protein at [~] 1.9 [A] resolution and identify resulting structural rearrangements in both the nascent chain and ribosomal RNA. In cells, we document how these compounds differentially impact the ribotoxic stress response pathway which monitors ribosome collisions and can trigger apoptosis. Finally, we confirm their tumor growth inhibition activity after oral dosing in cell line derived xenografts in mice using the MDA-MB-231 model for triple-negative breast cancer. Together, our data establish sequence-selective inhibition of translation as a novel small-molecule therapeutic modality for historically difficult to address cancers by targeting translation of oncogenic dependency factors in the human ribosome PTC.","NA","biorxiv",1736633251837
"Rational Design and Optimization of a Potent IDO1 Proteolysis Targeting Chimera (PROTAC)","10.1101/2025.01.07.631731","biorxiv",5.300000000000001,4.550000000000001,5.300000000000001,5.300000000000001,5.300000000000001,"Monsen, P. J.; Bommi, P. V.; Grigorescu, A. A.; Lauing, K. L.; Mao, Y.; Berardi, P.; Zhai, L.; Ojo, O.; Penco-Campillo, M.; Koch, T.; Egozi, M.; Jha, S. V.; Dunne, S. F.; Jiang, H.; Song, G.; Zhang, F.; Kregel, S.; Vaziri-Gohar, A.; Fanning, S.; Sanchez-Gomez, P.; Allen, J. M.; Yamini, B.; Lukas, R. V.; Wainwright, D. A.; Schiltz, G. E.","Gary E. Schiltz","Northwestern University","2025-01-08","1","new results","cc_no","biochemistry","https://www.biorxiv.org/content/early/2025/01/08/2025.01.07.631731.source.xml","Indoleamine 2,3-dioxygenase 1 (IDO1) is a potently immunosuppressive protein that inhibits antitumor immunity through both tryptophan metabolism and non-enzymatic functions. Pharmacological therapies targeting IDO1 enzyme activity have generally failed to improve the overall survival of patients with cancer. Developing new therapeutic agents that are capable of neutralizing both enzyme-and non-enzyme-derived immunosuppressive IDO1 effects is therefore of high interest. We previously described the development of a novel Proteolysis Targeting Chimera (PROTAC), NU223612, that degrades IDO1 in cultured human glioblastoma (GBM) cells, as well as in well-established brain tumors, in vivo. In this study, we rationally optimized the composition, rigidity, and linker orientation of the PROTAC structure to create NU227326, which degrades IDO1 with a DC50 of 5 nM in human GBM cells. Mechanistic studies showed that IDO1 degradation occurred through the ubiquitin-proteasome system and was sustained for at least 2 days, supporting NU227326 as a highly potent IDO1 PROTAC suitable for further studies in GBM and other human cancers.","NA","biorxiv",1736633251837
"Protein and genomic language models chart a vast landscape of antiphage defenses","10.1101/2025.01.08.631966","biorxiv",58.95000000000004,4.25,58.95000000000004,58.95000000000004,58.95000000000004,"Mordret, E.; Herve, A.; Vaysset, H.; Clabby, T.; Tesson, F.; Shomar, H.; Lavenir, R.; Cury, J.; Bernheim, A.","Aude Bernheim","Institut Pasteur","2025-01-08","1","new results","cc_by_nc","microbiology","https://www.biorxiv.org/content/early/2025/01/08/2025.01.08.631966.source.xml","The bacterial pangenome encodes an immense array of antiphage systems, yet much of their diversity remains uncharted. In this study, we developed language models to predict novel antiphage proteins in two ways: first via fine-tuning ESM2, a protein language model capable of detecting distant homology to known defense proteins, second via a genomic language model with ALBERT architecture which predicts defensive function based on genomic context. We demonstrate that applying these approaches to Actinomycetota - a phylum largely unexplored for antiphage defenses, can accurately predict previously unknown functional defense mechanisms, leading to the discovery and experimental validation of six defense systems with novel antiphage proteins. Analysis of over 30,000 bacterial genomes predicted more than 45,000 uncharacterized protein families potentially involved in antiphage defense, underscoring the vast, untapped diversity of these systems.","NA","biorxiv",1736633251837
