"title","doi","altmetric_jid","score","X1d","X3d","X1w","X1m","authors","author_corresponding","author_corresponding_institution","date","version","type","license","category","jatsxml","abstract","funder","published","server","upupdate_time"
"Distributed control circuits across a brain-and-cord connectome","10.1101/2025.07.31.667571","biorxiv",64.95000000000005,24.90000000000001,64.95000000000005,64.95000000000005,64.95000000000005,"Bates, A. S.; Phelps, J. S.; Kim, M.; Yang, H. H.; Matsliah, A.; Ajabi, Z.; Perlman, E.; Delgado, K. M.; Osman, M. A. M.; Salmon, C. K.; Gager, J.; Silverman, B.; Renauld, S.; Collie, M. F.; Fan, J.; Pacheco, D. A.; Zhao, Y.; Patel, J.; Zhang, W.; Serratosa Capdevilla, L.; Roberts, R. J.; Munnelly, E. J.; Griggs, N.; Langley, H.; Moya-Llamas, B.; Maloney, R. T.; Yu, S.-c.; Sterling, A. R.; Sorek, M.; Kruk, K.; Serafetinidis, N.; Dhawan, S.; Stuerner, T.; Klemm, F.; Brooks, P.; Lesser, E.; Jones, J. M.; Pierce-Lundgren, S. E.; Lee, S.-Y.; Luo, Y.; Cook, A. P.; McKim, T. H.; Kophs, E. C.; Falt, ","Wei-Chung Allen Lee","F.M. Kirby Neurobiology Center, Boston Children\'s Hospital, Harvard Medical School, Boston, MA, USA; Department of Neurobiology, Harvard Medical School, Boston","2025-08-02","2","new results","cc_by","neuroscience","https://www.biorxiv.org/content/early/2025/08/02/2025.07.31.667571.source.xml","Just as genomes revolutionized molecular genetics, connectomes (maps of neurons and synapses) are transforming neuroscience. To date, the only species with complete connectomes are worms1-3 and squirts4 (103-104 synapses). By contrast, the fruit fly is more complex (108 synaptic connections), with a brain that supports learning and spatial memory5,6 and an intricate ventral nerve cord analogous to the vertebrate spinal cord7-11. Here we report the first adult fly connectome that unites the brain and ventral nerve cord, and we leverage this resource to investigate principles of neural control. We show that effector cells (motor neurons, endocrine cells and efferent neurons targeting the viscera) are primarily influenced by local sensory cells in the same body part, forming local feedback loops. These local loops are linked by long-range circuits involving ascending and descending neurons organized into behavior-centric modules. Single ascending and descending neurons are often positioned to influence the voluntary movements of multiple body parts, together with endocrine cells or visceral organs that support those movements. Brain regions involved in learning and navigation supervise these circuits. These results reveal an architecture that is distributed, parallelized and embodied (tightly connected to effectors), reminiscent of distributed control architectures in engineered systems12,13.","[{""name"":""National Institutes of Health"",""id"":""https://ror.org/01cwqze88"",""id-type"":""ROR"",""award"":""R01NS121874;RF1MH117808;U24NS126935;RF1MH117815;U19NS118246;K99NS129759;R00NS117657;R01NS102333;RF1NS128785;UM1NS132253;U24NS139927;RF1MH128840;R01NS121911;U01NS131438;T32GM144273;""},{""name"":""Wellcome Trust"",""id"":""https://ror.org/029chgv08"",""id-type"":""ROR"",""award"":""222782/Z/21/Z;""},{""name"":""Richard and Susan Smith Family Foundation"",""id"":""https://ror.org/05j95n956"",""id-type"":""ROR"",""award"":""Smith Family Odyssey Award;""},{""name"":""Howard Hughes Medical Institute"",""id"":""https://ror.org/006w34k90"",""id-type"":""ROR"",""award"":""PJ100000343;GT15790;HHMI Investigator;""},{""name"":""New York Stem Cell Foundation"",""id"":""https://ror.org/03n2a3p06"",""id-type"":""ROR"",""award"":""Robertson Neuroscience Investigator Award;""},{""name"":""Deutsche Forschungsgemeinschaft"",""id"":""https://ror.org/018mejw64"",""id-type"":""ROR"",""award"":""ZA1296/1-1;EXC2151-390873048;PA787/7-3;PA787/9-3;""},{""name"":""NV INBRE"",""id"":"""",""id-type"":""ROR"",""award"":""GM103440;""},{""name"":""National Science Foundation"",""id"":""https://ror.org/021nxhr62"",""id-type"":""ROR"",""award"":""2127379;2014862;""},{""name"":""Japan Society for the Promotion of Science"",""id"":""https://ror.org/00hhkn466"",""id-type"":""ROR"",""award"":""KAKENHI 25K00370;""},{""name"":""Japan Science and Technology Agency"",""id"":""https://ror.org/00097mb19"",""id-type"":""ROR"",""award"":""ASPIRE JPMJAP2302;CRONOS JPMJCS24K2;""},{""name"":""Max Planck Society"",""id"":""https://ror.org/01hhn8329"",""id-type"":""ROR"",""award"":""""},{""name"":""Shanahan Family Foundation"",""id"":"""",""id-type"":""ROR"",""award"":""""},{""name"":""Kempner Institute for the Study of Natural and Artificial Intelligence"",""id"":"""",""id-type"":""ROR"",""award"":""""},{""name"":""Alice and Joseph Brooks Fund"",""id"":"""",""id-type"":""ROR"",""award"":""""}]","NA","bioRxiv",1754345412035
"Signals of consistent genetic diversity decline are not yet measurable in global meta-analysis","10.1101/2025.08.01.663988","biorxiv",10.799999999999999,10.799999999999999,10.799999999999999,10.799999999999999,10.799999999999999,"Exposito-Alonso, M.","Moises Exposito-Alonso","University of California Berkeley, Howard Hughes Medical Institute","2025-08-04","1","new results","cc_by","ecology","https://www.biorxiv.org/content/early/2025/08/04/2025.08.01.663988.source.xml","Genetic diversity within species must be conserved as the basis for evolutionary adaptive capacity. To inform new global conservation policy, Shaw et al.1 conducted a meta-analysis of temporal genetic diversity data for over 600 wild species spanning a median of 7 years, reporting significant overall diversity loss of effect size g = -0.1. My re-analysis translating this effect to percentage change finds no robust statistical support for consistent decline, with overall changes near zero: from -1% to +1% diversity change depending on the averaging method. When testing each species individually, roughly half increased and half decreased in diversity. While genetic diversity is expected to decline following population losses, evolutionary theory predicts such declines substantially lag behind population reductions, and thus should not be measurable on average at the timescales in Shaw's data, except in dramatically collapsing species. However, conservation policy should not wait for consistently measurable genetic diversity loss--to avoid future lagging losses, we must protect populations now.","NA","NA","bioRxiv",1754345412035
"Ubiquitous predictive processing in the spectral domain of sensory cortex","10.1101/2025.07.31.667946","biorxiv",10,4.5,10,10,10,"Sennesh, E. Z.; Westerberg, J. A.; Spencer-Smith, J.; Bastos, A. M.","Andre M Bastos","Vanderbilt University","2025-08-01","1","new results","cc_no","neuroscience","https://www.biorxiv.org/content/early/2025/08/01/2025.07.31.667946.source.xml","The appearance at the anatomical level of a canonical laminar microcircuit suggests that each six-layer column of granular cortex may mediate a canonical computation. Hypotheses for such computations include predictive coding, predictive routing, efficient coding, and others. However, single-neuron recordings capture only the individual elements of the hypothesized laminar microcircuit, while local field potentials (LFPs) from a laminar probe offer insight into the broader population activity. Through the Allen Institutes OpenScope Brain Observatory, data in mice performing a visual oddball task during multi-area laminar recording was used to test predictive processing hypotheses in the spectral domain. Histological labeling of the cortical laminae enabled a fine-grained examination of their roles in the task, and frequency bands capturing both feedforward and feedback effects were analyzed. {gamma}-band local-field potential (LFP) oscillations conveyed feedforward prediction errors in lower sensory areas of cortex; /{beta}-band oscillations weakened in unpredictable conditions compared to predictable ones; and {theta}-band oscillations additionally signalled slower, longer-scale temporal prediction errors. In combination with the previous findings, predictive routing explains these experiments where neither ubiquitous predictive coding nor feedforward adaptation can.

SignificanceCortical columns robustly signal perceptual features through the firing rates of spiking neurons. In accordance with this rate coding, predictive processing theories hypothesized that neuronal firing rates ubiquitously signal surprise. However, a recent large-scale study of spike rates did not support this conjecture. An alternate model, predictive routing, suggests that neuronal oscillations rather than spike rates could encode surprise. These neuronal oscillations, which can affect the timing but not rate of spiking, formed coherent {gamma} rhythms which consistently signaled both simpler and more complex forms of surprise in mouse visual cortex. Together with the findings on spike-rates in the same experiment, our findings suggest that cortical circuits encode surprise in the rhythmic timing of spikes rather than in their rate.","[{""name"":""NATIONAL INSTITUTE OF MENTAL HEALTH (NIMH)"",""id"":"""",""id-type"":""ROR"",""award"":""""},{""name"":""National Science Foundation"",""id"":""https://ror.org/021nxhr62"",""id-type"":""ROR"",""award"":""2339210;""},{""name"":""International Human Frontier Science Program Organization (HFSPO)"",""id"":"""",""id-type"":""ROR"",""award"":""LT0001/2023-L;""},{""name"":""Dutch Research Council"",""id"":""https://ror.org/04jsz6e67"",""id-type"":""ROR"",""award"":""VI.Veni.232.110;""}]","NA","bioRxiv",1754345412035
"Genomics of sable (Martes zibellina) x pine marten (Martes martes) hybridization","10.1101/2025.08.01.668050","biorxiv",2.2,2.2,2.2,2.2,2.2,"Tomarovsky, A. A.; Totikov, A. A.; Bulyonkova, T. M.; Perelman, P. L.; Abramov, A. V.; Serdyukova, N. A.; Yakupova, A. R.; Prokopov, D.; Beklemisheva, V. R.; Sinding, M.-H. S.; Davletshina, G.; Pobedintseva, M.; Krasheninnikova, K.; Foerster, D. W.; Mukhacheva, A. S.; Mironova, A.; Sidorov, M.; Nie, W.; Wang, J.; Romanenko, S. A.; Proskuryakova, A. A.; Ferguson-Smith, M.; Yang, F.; Cherkasov, N.; Balanovskaya, E.; Gilbert, M. T. P.; Okhlopkov, I. M.; Zhuk, A.; Graphodatsky, A. S.; Powell, R.; Koepfli, K.-P.; Kliver, S.","Andrey A. Tomarovsky","Laboratory of Diversity and Evolution of Genomes, Institute of Molecular and Cellular Biology SB RAS, 8/2 Acad. Lavrentiev ave., Novosibirsk, 630090, Russia","2025-08-02","1","new results","cc_by","genomics","https://www.biorxiv.org/content/early/2025/08/02/2025.08.01.668050.source.xml","The sable (Martes zibellina) and pine marten (Martes martes) are two Palearctic mustelids with long-recognized hybrids (kidases), whose fertility was controversial for years. Early genetic studies confirmed hybrids beyond F1, but details remained unclear due to low-resolution methods. Both species were hunted for centuries, but anthropogenic pressures during the 20th-century caused severe bottlenecks in the sable followed by hunting bans and large-scale reintroduction programs across much of its range, including the sympatric zone, potentially affecting hybridization. We resequenced 30 individuals from most of the sables range and Eastern part of pine martens. Among samples, we found a broad spectrum of hybrid types with mosaic recombinant chromosomes that confirm hybrid fertility and indicate crossover is not suppressed in kidases. This necessitates re-evaluation of previous research, as we detected notable discrepancies between STR-based ancestry and whole-genome analysis. In pine martens, we revealed mitochondrial DNA introgression from sables, indicating displacement of native pine marten mitochondrial sequences. Pine marten heterozygosity is relatively low (~0.5-0.6 hetSNPs/kbp) while sable diversity (~1.5-1.8 hetSNPs/kbp) is unexpectedly high for a species with its demographic history, likely reflecting successful reintroduction programs. We dated species divergence at 1.52 (CI: 1.05-2.06) Mya and identified candidate genes associated with ecological, morphological, and dietary differences, as well as hybrid fertility issues. This study is the first to elucidate marten hybridization at the whole-genome level, opening new research directions for understanding hybridization among Holarctic martens, the genetic consequences of reintroduction programs, and comparative adaptomics.","[{""name"":""Sierra Pacific Industries"",""id"":"""",""id-type"":""ROR"",""award"":""""},{""name"":""Carlsbergfondet Research Infrastructure Grant"",""id"":"""",""id-type"":""ROR"",""award"":""CF22-0680;""},{""name"":""Danish National Research Foundation"",""id"":""https://ror.org/00znyv691"",""id-type"":""ROR"",""award"":""DNRF143;""},{""name"":""The Ministry of Science and Higher Education of the Russian Federation"",""id"":"""",""id-type"":""ROR"",""award"":""125012800908-0;""},{""name"":""St. Petersburg State University"",""id"":"""",""id-type"":""ROR"",""award"":""125021902561-6;""}]","NA","bioRxiv",1754345412035
"What does it take to learn the rules of RNA base pairing? A lot less than you may think","10.1101/2025.07.31.668042","biorxiv",4.9,1.85,4.9,4.9,4.9,"Pratap, J. S.; Krueger, R. K.; Rivas, E.","Elena Rivas","Harvard University","2025-08-02","1","new results","cc_by","bioinformatics","https://www.biorxiv.org/content/early/2025/08/02/2025.07.31.668042.source.xml","Amidst the fast-developing trend of RNA large language models with millions of parameters, we asked what would be the minimum required to rediscover the rules of RNA canonical base pairing, mainly the Watson-Crick-Franklin A:U, G:C and the wobble G:U base pairs (the secondary structure). Here, we conclude that it does not require much at all. It does not require knowing secondary structures; it does not require aligning the sequences; and it does not require many parameters. We selected a probabilistic model of palindromes (a stochastic context-free grammar or SCFG) with a total of just 21 parameters. Using standard deep learning techniques, we estimate its parameters by implementing the generative process in an automatic differentiation (autodiff) framework and applying stochastic gradient descent (SGD). We define and minimize a loss function that does not use any structural or alignment information. Trained on as few as fifty RNA sequences, the rules of RNA base pairing emerge after only a few iterations of SGD. Crucially, the sole inputs are RNA sequences. When optimizing for sequences corresponding to structured RNAs, SGD also yields the rules of RNA base-pair aggregation into helices. Trained on shuffled sequences, the system optimizes by avoiding base pairing altogether. Trained on messenger RNAs, it reveals interactions that are different from those of structural RNAs, and specific to each mRNA. Our results show that the emergence of canonical base-pairing can be attributed to sequence-level signals that are robust and detectable even without labeled structures or alignments, and with very few parameters. Autodiff algorithms for probabilistic models, such as, but not restricted to SCFGs, have significant potential as they allow these models to be incorporated into end- to-end RNA deep learning methods for discerning transcripts of different functionalities.","[{""name"":""National Institutes of Health"",""id"":""https://ror.org/01cwqze88"",""id-type"":""ROR"",""award"":""R01-GM144423;""},{""name"":""National Science Foundation"",""id"":""https://ror.org/021nxhr62"",""id-type"":""ROR"",""award"":""UWSC13223;""}]","NA","bioRxiv",1754345412035
"Pan-cancer prediction of tumor immune activation and response to immune checkpoint blockade from tumor transcriptomics and histopathology","10.1101/2025.06.27.661875","biorxiv",22.050000000000004,0.85,0.85,0.85,2.55,"Mukherjee, S.; Patiyal, S.; Pal, L. R.; Chang, T.; Biswas, S.; Dhruba, S. R.; Stemmer, A.; Singh, A.; Yousefi-Rad, A.; Chen, T.-H.; Wang, B.; Marino, D.; Shon, W.; Yuan, Y.; Faries, M.; Hamid, O.; Reckamp, K.; Waissengrin, B.; Ornelas, B.; Chu, P.-Y.; Boudjadi, S.; Ley, L.; Akbulut, D.; Ahmar, N. E.; Signoretti, S.; Braun, D. A.; Joo, H.; Kim, H.; Osipov, A.; Figlin, R. A.; Bar, J.; Barshack, I.; Day, C.-P.; Sargsyan, K.; Apolo, A. B.; Aldape, K.; Yang, M.-H.; Atkins, M. B.; Ronai, Z. A.; Hoang, D.-T.; Ruppin, E.","Eytan Ruppin","Cancer Data Science Laboratory, Center for Cancer Research, National Cancer Institute, National Institutes of Health, Bethesda, MD, USA","2025-06-30","2","new results","cc_by_nc","cancer biology","https://www.biorxiv.org/content/early/2025/06/30/2025.06.27.661875.source.xml","Accurately predicting which patients will respond to immune checkpoint blockade (ICB) remains a major challenge. Here, we present TIME_ACT, an unsupervised 66-gene transcriptomic signature of tumor immune activation derived from TCGA melanoma data. First, TIME_ACT scores accurately identify tumors with activated immune microenvironments across cancer types. Analysis of spatial features of the tumor microenvironment revealed that TIME_ACT-high regions exhibit dense lymphocyte infiltration near tumor cells, indicating localized immune activation. Second, in 15 anti-PD1 transcriptomic cohorts spanning six cancer types, TIME_ACT outperforms 22 established signatures and methods, achieving a mean AUC of 0.76 and a clinically meaningful mean odds ratio of 6.11. Thirdly, TIME_ACT scores can be accurately inferred from tumor histopathology slides. Finally, slide-inferred TIME_ACT scores predict ICB response across eight unseen cohorts, achieving a mean AUC of 0.72 and a mean odds ratio of 5.02. These findings establish TIME_ACT as a robust, pan-cancer, and low-cost predictor of ICB response.","NA","NA","bioRxiv",1754345412035
"Cuttlefish interact with multimodal 'arm wave sign' displays","10.1101/2025.04.13.648584","biorxiv",573.5500000000001,0,7,7,7,"Cohen Bodenes, S.; Neri, P.","Sophie Cohen Bodenes","Washington University School of Medicine, Saint Louis, USA","2025-05-05","3","new results","cc_by_nc_nd","animal behavior and cognition","https://www.biorxiv.org/content/early/2025/05/05/2025.04.13.648584.source.xml","In addition to the well-known extraordinary changes in visual appearance they can generate at the level of their mantle, cuttle-fish can produce various body configurations combining chromatic, postural, and locomotion patterns, both for camouflaging and communication. We introduce a previously undescribed communication display in two cuttlefish species: Sepia officinalis and Sepia bandensis. The four ""arm wave signs"" are stereotyped arm movements consisting of long-lasting, expressive, and repeated sequences of undulations of the arms, which can be combined and expressed following specific patterns. Using non-invasive behavioral experiments, we tested the hypothesis that they represent multimodal communication displays. To assess the role of visual cues, we recorded videos of animals signing and played them back to individual cuttlefish participants. When seeing the movies, cuttlefish waved back at the display. Most importantly, they were more likely to wave back when the movie was in upright (original) configuration as opposed to flipped upside-down, similar to the manner in which humans perceive faces and other socially relevant displays. In addition to their visually striking display, arm wave signs produce mechanical waves in the water, prompting us to explore the possibility that they may also be perceived via mechanoreception. Using playback experiments similar to those adopted in vision, we obtained preliminary evidence to support this hypothesis, indicating that arm wave signs may represent multimodal signals involving vision and mechanoreception. Our new result on communication with arm wave signs opens up novel possibilities for understanding vibration-mediated communication through the lateral line and/or the statocysts in a cephalopod species as an example of convergent evolution with vertebrates.","[{""name"":""PSL Research University"",""id"":""https://ror.org/013cjyk83"",""id-type"":""ROR"",""award"":""""},{""name"":""L'Oréal (France)"",""id"":"""",""id-type"":""ROR"",""award"":""""}]","NA","bioRxiv",1754345412035
"Principles of ribosome-associated protein quality control during the synthesis of CFTR","10.1101/2025.07.11.664365","biorxiv",7.8999999999999995,0,6.8999999999999995,6.8999999999999995,7.8999999999999995,"Oldfield, T. J.; Renn, R.; Trentini, D. B.","Débora Broch Trentini","University of Cologne, Faculty of Medicine, University Hospital of Cologne, Center for Molecular Medicine Cologne (CMMC), Cologne Excellence Cluster Cellular St","2025-07-16","1","new results","cc_by_nc_nd","biochemistry","https://www.biorxiv.org/content/early/2025/07/16/2025.07.11.664365.source.xml","Prolonged translational arrests caused by defective mRNAs activate the ribosome-associated protein quality control (RQC) pathway, which marks harmful incomplete proteins for degradation. Multipass transmembrane proteins have increased propensity to be targeted by the RQC, raising the question of whether problems in transmembrane domain insertion and assembly can also cause RQC-eliciting translational arrests. Here, we investigate RQC-mediated quality control of CFTR, a large transmembrane protein mutated in cystic fibrosis. Reporter assays show that although a sizeable fraction of nascent CFTR expressed in HEK293 cells arrests during translation and activates the RQC, multiple interventions compromising CFTR folding and membrane insertion do not exacerbate this response. CFTR translation abortion was also largely unaffected by regulators of translation kinetics such as codon usage, the ribosome collision sensor GCN1, and the SRP ER targeting complex. We propose that the RQC can be triggered by the inherent difficulties in synthesizing transmembrane segments, resulting from their inappropriate interaction with the protein synthesis machinery. Our study uncovers a novel physiological role for the RQC and points to new therapeutic targets for cystic fibrosis.","[{""name"":""Fritz Thyssen Foundation"",""id"":""https://ror.org/00f3sc705"",""id-type"":""ROR"",""award"":""10.22.2.029MN;""},{""name"":""Deutsche Forschungsgemeinschaft"",""id"":""https://ror.org/018mejw64"",""id-type"":""ROR"",""award"":""540625656;CRC1678 project number 520471345;""},{""name"":""Center for Molecular Medicine Cologne"",""id"":"""",""id-type"":""ROR"",""award"":""JRG-05 and CAP-33;""},{""name"":""Köln Fortune Program, Faculty of Medicine, University of Cologne"",""id"":"""",""id-type"":""ROR"",""award"":""376/2021;""}]","NA","bioRxiv",1754345412035
"Surveillance on California dairy farms reveals multiple sources of H5N1 transmission","10.1101/2025.07.31.666798","biorxiv",5,0,5,5,5,"Campbell, A. J.; Shephard, M.; Paulos, A. P.; Pauly, M.; Vu, M.; Stenkamp-Strahm, C.; Bushfield, K.; Hunter-Binns, B.; Sablon, O.; Bendall, E. E.; Fitzimmons, W. J.; Brizuela, K.; Quirk, G.; Kumar, N.; McCluskey, B.; Shetty, N.; Marr, L. C.; Guthmiller, J.; Abernathy, K.; Lauring, A. S.; Melody, B. T.; Wolfe, M.; Lombard, J.; Lakdawala, S. S.","Seema S Lakdawala","Department of Microbiology and Immunology, Emory University School of Medicine, Atlanta, GA","2025-08-02","2","new results","cc_by_nc","microbiology","https://www.biorxiv.org/content/early/2025/08/02/2025.07.31.666798.source.xml","Transmission routes of highly pathogenic H5N1 between cows or to humans remain unclear due to limited data from affected dairy farms. We performed extensive air, farm wastewater, and milk sampling on 14 H5N1 positive dairy farms across two different California regions. Virus was detected in the air in milking parlors and from exhaled breath of cows. Infectious H5N1 virus was detected in the air and water streams; sequence analysis revealed viral variants on a farm in these locations. Longitudinal analysis of milk from the individual quarters of cows revealed a high prevalence of subclinical H5N1 positive cows and a heterogeneous distribution of infected quarters that maintained a consistent pattern over time. Our data highlight potential modes of H5N1 transmission on dairy farms.","NA","NA","bioRxiv",1754345412035
